seasonType,eventId,commentaryOrder,playId,clockDisplayValue,commentaryText,updateDateTime
12826,715993,0,44056984,12',Myziane Maolida (Al Kholood) Goal at 12',2024-10-26 13:53:28
12826,715993,1,44056986,16',Aymeric Laporte (Al Nassr) Goal at 16',2024-10-26 13:53:28
12826,715993,2,44056988,24',Anderson Talisca (Al Nassr) Goal at 24',2024-10-26 13:53:28
12826,715993,3,44056989,28',Myziane Maolida (Al Kholood) Goal at 28',2024-10-26 13:53:28
12826,715993,4,44056996,35',Mohammed Al-Fatil (Al Nassr) Substitution at 35',2024-10-26 13:53:28
12826,715993,5,44057028,45',Wesley Ribeiro (Al Nassr) Substitution at 45',2024-10-26 13:53:28
12826,715993,6,44057038,45',Sultan Al Shehri (Al Kholood) Substitution at 45',2024-10-26 13:53:28
12826,715993,7,44057039,45',Marcelo Brozovic (Al Nassr) Substitution at 45',2024-10-26 13:53:28
12826,715993,8,44057092,61',Nawaf Boushal (Al Nassr) Substitution at 61',2024-10-26 13:53:28
12826,715993,9,44057109,64',Hammam Al-Hammami (Al Kholood) Substitution at 64',2024-10-26 13:53:28
12826,715993,10,44057149,68',Jackson Muleka (Al Kholood) Yellow Card at 68',2024-10-26 13:53:28
12826,715993,11,44057175,71',Jackson Muleka (Al Kholood) Goal at 71',2024-10-26 13:53:28
12826,715993,12,44057189,73',Marcelo Brozovic (Al Nassr) Yellow Card at 73',2024-10-26 13:53:28
12826,715993,13,44057190,74',Salem Al Najdi (Al Nassr) Substitution at 74',2024-10-26 13:53:28
12826,715993,14,44057191,74',Sultan Al Shehri (Al Kholood) Yellow Card at 74',2024-10-26 13:53:28
12826,715993,15,44057227,78',Abdullah Al Hawsawi (Al Kholood) Substitution at 78',2024-10-26 13:53:28
12826,715993,16,44057249,83',Abdullah Al-Khaibari (Al Nassr) Yellow Card at 83',2024-10-26 13:53:28
12826,715993,17,44057273,90'+1',Muhammad Sawan (Al Kholood) Substitution at 91',2024-10-26 13:53:28
12826,715993,18,44057283,90'+5',Anderson Talisca (Al Nassr) Penalty - Scored at 95',2024-10-26 13:53:28
12826,715993,19,44077491,90'+8',Marcelo Grohe (Al Kholood) Yellow Card at 98',2024-11-19 18:40:05
12826,715994,0,44110590,39',Abdullah Al-Salim (Al Khaleej) Goal at 39',2024-11-02 14:41:56
12826,715994,1,44110592,45'+3',Dimitrios Kourbelis (Al Khaleej) Goal at 48',2024-11-02 14:41:56
12826,715994,2,44110593,45'+5',Saleh Al-Jamaan (Al Raed) Yellow Card at 50',2024-11-02 14:41:56
12826,715994,3,44110594,45'+5',Dimitrios Kourbelis (Al Khaleej) Yellow Card at 50',2024-11-02 14:41:56
12826,715994,4,44110597,45',Yahya Sunbul (Al Raed) Substitution at 45',2024-11-02 14:41:56
12826,715994,5,44110599,59',Abdullah Al-Salim (Al Khaleej) Yellow Card at 59',2024-11-02 14:41:56
12826,715994,6,44110602,67',Nawaf Sahli (Al Raed) Substitution at 67',2024-11-02 14:41:56
12826,715994,7,44110603,67',Khaled Al Samiri (Al Khaleej) Substitution at 67',2024-11-02 14:41:56
12826,715994,8,44110604,72',Saeed Al Hamsal (Al Khaleej) Yellow Card at 72',2024-11-02 14:41:56
12826,715994,9,44110605,75',Abdullah Al-Salim (Al Khaleej) Goal at 75',2024-11-02 14:41:56
12826,715994,10,44110606,76',Waheb Saleh (Al Khaleej) Substitution at 76',2024-11-02 14:41:56
12826,715994,11,44110608,81',Omar Ahmed Shami (Al Raed) Substitution at 81',2024-11-02 14:41:56
12826,715994,12,44110609,81',Raid Al-Ghamdi (Al Raed) Substitution at 81',2024-11-02 14:41:56
12826,715994,13,44110612,89',Murad Al Hawsawi (Al Khaleej) Substitution at 89',2024-11-02 14:41:56
12826,715994,14,44110613,89',Hisham Al Dubais (Al Khaleej) Substitution at 89',2024-11-02 14:41:56
12826,715994,15,44110614,89',Mohammed Al Abdullah (Al Khaleej) Substitution at 89',2024-11-02 14:41:56
12826,715994,16,44110615,90'+1',Hisham Al Dubais (Al Khaleej) Goal at 91',2024-11-02 14:41:56
12826,715994,17,44110619,90'+5',Anas Al Zahrani (Al Raed) Substitution at 95',2024-11-02 14:41:56
12826,715994,18,44110620,90'+6',Murad Al Hawsawi (Al Khaleej) Yellow Card at 96',2024-11-02 14:41:56
12826,715995,0,44122879,12',Gastón Álvarez Suarez (Al Qadsiah) Goal at 12',2024-11-03 13:43:13
12826,715995,1,44122894,14',Meshal Sibyani (Al Ettifaq) Yellow Card at 14',2024-11-02 21:21:05
12826,715995,2,44123471,45'+3',Julián Quiñones (Al Qadsiah) Goal at 48',2024-11-02 21:21:05
12826,715995,3,44124186,62',João Costa (Al Ettifaq) Substitution at 62',2024-11-02 21:21:05
12826,715995,4,44124264,66',Mohammed Qassem Al-Nakhli (Al Qadsiah) Substitution at 66',2024-11-02 21:21:05
12826,715995,5,44124401,73',Ali Abdullah Hazzazi (Al Qadsiah) Substitution at 73',2024-11-02 21:21:05
12826,715995,6,44124452,75',Gastón Álvarez (Al Qadsiah) Yellow Card at 75',2024-11-02 21:21:05
12826,715995,7,44124486,77',Abdullah Radif (Al Ettifaq) Substitution at 77',2024-11-02 21:21:05
12826,715995,8,44124505,79',Julián Quiñones (Al Qadsiah) Yellow Card at 79',2024-11-02 21:21:05
12826,715995,9,44124620,85',Abdulelah Al-Malki (Al Ettifaq) Yellow Card at 85',2024-11-03 13:43:13
12826,715995,10,44124621,86',Abdulaziz Saud Al Aliwa (Al Ettifaq) Substitution at 86',2024-11-03 13:43:13
12826,715995,11,44124622,86',Seko Fofana (Al Ettifaq) Substitution at 86',2024-11-03 13:43:13
12826,715995,12,44124687,90'+3',Haitham Asiri (Al Qadsiah) Substitution at 93',2024-11-03 13:43:13
12826,715995,13,44124688,90'+3',Abdulaziz Al Othman (Al Qadsiah) Substitution at 93',2024-11-03 13:43:13
12826,715995,14,44124692,90'+6',Abdullah Madu (Al Ettifaq) Yellow Card at 96',2024-11-03 13:43:13
12826,715995,15,44125231,90'+6',Nacho  (Al Qadsiah) Yellow Card at 96',2024-11-03 13:43:13
12826,715996,0,44110648,1',Anderson Talisca (Al Nassr) Goal at 1',2024-11-02 14:41:56
12826,715996,1,44110686,20',Marcelo Brozovic (Al Nassr) Yellow Card at 20',2024-11-02 14:41:56
12826,715996,2,44110738,43',Sadio Mané (Al Nassr) Yellow Card at 43',2024-11-02 14:41:56
12826,715996,3,44110748,45'+1',Cristiano Ronaldo (Al Nassr) Yellow Card at 46',2024-11-02 14:41:56
12826,715996,4,44110796,52',Abdullah Al-Khaibari (Al Nassr) Yellow Card at 52',2024-11-02 14:41:56
12826,715996,5,44110815,57',Malcom  (Al Hilal) Yellow Card at 57',2024-11-02 14:41:56
12826,715996,6,44110816,58',Marcos Leonardo  (Al Hilal) Substitution at 58',2024-11-02 14:41:56
12826,715996,7,44110827,60',Mohamed Kanno (Al Hilal) Yellow Card at 60',2024-11-02 14:41:56
12826,715996,8,44110828,61',Ali Al-Hassan (Al Nassr) Substitution at 61',2024-11-02 14:41:56
12826,715996,9,44110882,77',Sergej Milinkovic-Savic (Al Hilal) Goal at 77',2024-11-02 14:41:56
12826,715996,10,44110903,79',Nasser Al-Dawsari (Al Hilal) Substitution at 79',2024-11-02 14:41:56
12826,715996,11,44110915,82',Ali Al-Bulayhi (Al Hilal) Yellow Card at 82',2024-11-02 14:41:56
12826,715996,12,44110931,83',Mohammed Maran (Al Nassr) Substitution at 83',2024-11-02 14:41:56
12826,715996,13,44110932,83',Aiman Yahya (Al Nassr) Substitution at 83',2024-11-02 14:41:56
12826,715996,14,44110933,83',Ali Lajami (Al Nassr) Substitution at 83',2024-11-02 14:41:56
12826,715996,15,44110934,84',Otávio  (Al Nassr) Yellow Card at 84',2024-11-02 14:41:56
12826,715996,16,44110992,90'+2',Hamad Altuhayfan (Al Hilal) Substitution at 92',2024-11-02 14:41:56
12826,715996,17,44110993,90'+3',Moteb Alharbi (Al Hilal) Substitution at 93',2024-11-02 14:41:56
12826,715996,18,44111014,90'+4',Nasser Al-Dawsari (Al Hilal) Yellow Card at 94',2024-11-02 14:41:56
12826,715997,0,44106648,30',Abdulmalek Al Shammary (Al Orobah) Substitution at 30',2024-11-01 05:26:28
12826,715997,1,44106653,45'+5',Ibrahima Koné (Al Okhdood) Penalty - Scored at 50',2024-11-01 05:26:28
12826,715997,2,44106660,45',Mohammed Al Jahif (Al Okhdood) Substitution at 45',2024-11-01 05:26:28
12826,715997,3,44106667,56',Fawaz Al-Torais (Al Orobah) Substitution at 56',2024-11-01 05:26:28
12826,715997,4,44106668,56',Mohammed Al-Saiari (Al Orobah) Substitution at 56',2024-11-01 05:26:28
12826,715997,5,44106670,64',Christian Bassogog (Al Okhdood) Goal at 64',2024-11-01 05:26:28
12826,715997,6,44106675,77',Saleh Al Abbas (Al Okhdood) Substitution at 77',2024-11-01 05:26:28
12826,715997,7,44106676,78',Hamed Al-Maqati (Al Orobah) Substitution at 78',2024-11-01 05:26:28
12826,715997,8,44106677,78',Brad Young (Al Orobah) Substitution at 78',2024-11-01 05:26:28
12826,715997,9,44106678,81',Saeed Al-Rabiei (Al Okhdood) Goal at 81',2024-11-01 05:26:28
12826,715997,10,44106680,83',Christian Bassogog (Al Okhdood) Goal at 83',2024-11-01 05:26:28
12826,715997,11,44106681,86',Hussain Al Zabdani (Al Okhdood) Substitution at 86',2024-11-01 05:26:28
12826,715997,12,44106682,86',Abdulaziz Al Hatila (Al Okhdood) Substitution at 86',2024-11-01 05:26:28
12826,715997,13,44106683,89',Mohammed Al Saeed (Al Okhdood) Substitution at 89',2024-11-01 05:26:28
12826,715998,0,44117659,41',Vinicius Rangel Da Silva (Al Fayha) Yellow Card at 41',2024-11-02 21:21:05
12826,715998,1,44117897,45'+2',Mukhir Al Rashidi (Al Fayha) Yellow Card at 47',2024-11-02 21:21:05
12826,715998,2,44117898,45'+4',Khalid Al-Khabi (Al Fayha) Goal at 49',2024-11-02 21:21:05
12826,715998,3,44118645,45',Abdullah Safoud Alemzi (Al Fateh) Substitution at 45',2024-11-02 21:21:05
12826,715998,4,44119008,54',Lucas Zelarayán (Al Fateh) Goal at 54',2024-11-02 21:21:05
12826,715998,5,44119148,60',Abdi Faris (Al Fayha) Yellow Card at 60',2024-11-02 21:21:05
12826,715998,6,44119502,70',Alejandro Pozuelo (Al Fayha) Substitution at 70',2024-11-02 21:21:05
12826,715998,7,44119503,70',Nawaf Al-Harthi (Al Fayha) Substitution at 70',2024-11-02 21:21:05
12826,715998,8,44119551,73',Nouh Al-Mousa (Al Fateh) Substitution at 73',2024-11-02 21:21:05
12826,715998,9,44120005,82',Abdulhadi Al-Harajin (Al Fayha) Substitution at 82',2024-11-02 21:21:05
12826,715998,10,44120249,86',Saad Al-Shurafa (Al Fateh) Substitution at 86',2024-11-02 21:21:05
12826,715998,11,44120250,86',Othman Ramzi Jasim Al Othman (Al Fateh) Substitution at 86',2024-11-02 21:21:05
12826,715999,0,44117542,18',Myziane Maolida (Al Kholood) Goal at 18',2024-11-02 21:21:05
12826,715999,1,44118019,32',Musa Barrow (Al Taawoun) Goal at 32',2024-11-02 21:21:05
12826,715999,2,44119599,55',Farhah Al Shamrani (Al Kholood) Yellow Card at 55',2024-11-02 21:21:05
12826,715999,3,44119928,60',Abdulrahman Al Safari (Al Kholood) Yellow Card at 60',2024-11-02 21:21:05
12826,715999,4,44120009,63',Hammam Al-Hammami (Al Kholood) Substitution at 63',2024-11-02 21:21:05
12826,715999,5,44120127,65',Awn Al-Saluli (Al Taawoun) Substitution at 65',2024-11-02 21:21:05
12826,715999,6,44120128,65',Sultan Mandash (Al Taawoun) Substitution at 65',2024-11-02 21:21:05
12826,715999,7,44120519,74',Sultan Al Shehri (Al Kholood) Substitution at 74',2024-11-02 21:21:05
12826,715999,8,44120793,80',Hammam Al-Hammami (Al Kholood) Yellow Card at 80',2024-11-02 21:21:05
12826,715999,9,44120870,81',Hatan Bahbri (Al Taawoun) Substitution at 81',2024-11-02 21:21:05
12826,715999,10,44120871,81',Abdulfattah Adam (Al Taawoun) Substitution at 81',2024-11-02 21:21:05
12826,715999,11,44121112,87',Waleed Al-Ahmed (Al Taawoun) Substitution at 87',2024-11-02 21:21:05
12826,715999,12,44121202,89',Abdullah Al Hawsawi (Al Kholood) Substitution at 89',2024-11-02 21:21:05
12826,715999,13,44121516,90'+4',Awn Al-Saluli (Al Taawoun) Yellow Card at 94',2024-11-02 21:21:05
12826,716000,0,44110591,5',Nicolae Stanciu (Damac) Yellow Card at 5',2024-11-02 14:41:56
12826,716000,1,44110595,17',Tariq Mohammed (Damac) Yellow Card at 17',2024-11-02 14:41:56
12826,716000,2,44110596,23',Bernard Mensah (Al Riyadh) Goal at 23',2024-11-02 14:41:56
12826,716000,3,44110598,42',Habib Diallo (Damac) Goal at 42',2024-11-02 14:41:56
12826,716000,4,44110601,45'+2',Marzouq Tambakti (Al Riyadh) Yellow Card at 47',2024-11-02 14:41:56
12826,716000,5,44110607,46',Ahmad Asiri (Al Riyadh) Yellow Card at 46',2024-11-02 14:41:56
12826,716000,6,44110616,60',Hussain Ali Alnwaiqi (Al Riyadh) Substitution at 60',2024-11-02 14:41:56
12826,716000,7,44110617,60',Mohamed Konaté (Al Riyadh) Substitution at 60',2024-11-02 14:41:56
12826,716000,8,44110618,61',Dhari Al Anazi (Damac) Yellow Card at 61',2024-11-02 14:41:56
12826,716000,9,44110621,68',Faïz Selemani (Al Riyadh) Goal at 68',2024-11-02 14:41:56
12826,716000,10,44110622,77',Meshari Al Nemer (Damac) Substitution at 77',2024-11-02 14:41:56
12826,716000,11,44110623,82',Faisal Al Sibyani (Damac) Substitution at 82',2024-11-02 14:41:56
12826,716000,12,44110624,82',Hazzaa Al Ghamdi (Damac) Substitution at 82',2024-11-02 14:41:56
12826,716000,13,44110625,82',Mohammed Alkhaibari (Damac) Substitution at 82',2024-11-02 14:41:56
12826,716000,14,44110626,88',Yahya Alshehri (Al Riyadh) Substitution at 88',2024-11-02 14:41:56
12826,716000,15,44110627,90'+1',Georges-Kévin N'Koudou (Damac) Penalty - Scored at 91',2024-11-02 14:41:56
12826,716001,0,44106960,42',Saleh Al-Shehri (Al Ittihad) Goal at 42',2024-11-01 05:26:28
12826,716001,1,44107153,50',Abdulelah Al-Amri (Al Ittihad) Yellow Card at 50',2024-11-01 05:26:28
12826,716001,2,44107259,64',Ali Alasmari (Al Ahli) Yellow Card at 64',2024-11-01 05:26:28
12826,716001,3,44107305,69',Ziyad Aljohani (Al Ahli) Substitution at 69',2024-11-01 05:26:28
12826,716001,4,44107333,73',Hassan Kadesh (Al Ittihad) Substitution at 73',2024-11-01 05:26:28
12826,716001,5,44107400,82',Roberto Firmino (Al Ahli) Substitution at 82',2024-11-01 05:26:28
12826,716001,6,44107420,86',Abdulrahman Al-Obud (Al Ittihad) Substitution at 86',2024-11-01 05:26:28
12826,716001,7,44107461,90'+2',Ibañez  (Al Ahli) Yellow Card at 92',2024-11-01 05:26:28
12826,716001,8,44107470,90'+4',Franck Kessié (Al Ahli) Yellow Card at 94',2024-11-01 05:26:28
12826,716001,9,44107494,90'+9',Sumaihan Al-Nabet (Al Ahli) Substitution at 99',2024-11-01 05:26:28
12826,716001,10,44107565,90'+14',Abdulaziz Al-Bishi (Al Ittihad) Substitution at 104',2024-11-01 05:26:28
12826,716002,0,44106638,35',Cristian Guanca (Al Shabab) Goal at 35',2024-11-01 05:26:28
12826,716002,1,44106639,38',Hussain Al-Sabiyani (Al Shabab) Yellow Card at 38',2024-11-01 05:26:28
12826,716002,2,44106650,45',Majed Kanabah (Al Shabab) Substitution at 45',2024-11-01 05:26:28
12826,716002,3,44106651,45',Mohammed Al Thani (Al Shabab) Substitution at 45',2024-11-01 05:26:28
12826,716002,4,44106654,52',Abderrazak Hamdallah (Al Shabab) Goal at 52',2024-11-01 05:26:28
12826,716002,5,44106655,61',Musab Al-Juwayr (Al Shabab) Goal at 61',2024-11-01 05:26:28
12826,716002,6,44106656,64',Mohammed Essa Harbush (Al Shabab) Substitution at 64',2024-11-01 05:26:28
12826,716002,7,44106657,65',Yahya Naji (Al Wehda) Substitution at 65',2024-11-01 05:26:28
12826,716002,8,44106658,65',Abdulaziz Noor (Al Wehda) Substitution at 65',2024-11-01 05:26:28
12826,716002,9,44106659,65',Ala Al Hajji (Al Wehda) Substitution at 65',2024-11-01 05:26:28
12826,716002,10,44106661,75',Youssef Amyn (Al Wehda) Shot Off Target at 75',2024-11-01 05:26:28
12826,716002,11,44106662,78',Majed Kanabah (Al Shabab) Yellow Card at 78',2024-11-01 05:26:28
12826,716002,12,44106663,80',Ali Makki (Al Wehda) Substitution at 80',2024-11-01 05:26:28
12826,716002,13,44106664,80',Saad Al Qahtani (Al Wehda) Substitution at 80',2024-11-01 05:26:28
12826,716002,14,44106665,80',Majed Abdullah (Al Shabab) Substitution at 80',2024-11-01 05:26:28
12826,716002,15,44106666,81',Majed Abdullah (Al Shabab) Yellow Card at 81',2024-11-01 05:26:28
12826,716002,16,44106671,88',Younis Alshanqity (Al Shabab) Substitution at 88',2024-11-01 05:26:28
12826,716002,17,44106672,90'+1',Juninho Bacuna (Al Wehda) Penalty - Scored at 91',2024-11-01 05:26:28
12826,716002,18,44106674,90'+11',Younis Alshanqity (Al Shabab) Red Card at 101',2024-11-01 05:26:28
12826,716003,0,44160364,4',Turki Al-Ammar (Al Qadsiah) Goal at 4',2024-11-08 06:19:10
12826,716003,1,44160430,29',Mohammed Al Baqawi (Al Fayha) Yellow Card at 29',2024-11-08 06:19:10
12826,716003,2,44160435,31',Nahitan Nández (Al Qadsiah) Yellow Card at 31',2024-11-08 06:19:10
12826,716003,3,44160464,44',Pierre-Emerick Aubameyang (Al Qadsiah) Penalty - Scored at 44',2024-11-08 06:19:10
12826,716003,4,44160470,45'+1',Gojko Cimirot (Al Fayha) Yellow Card at 46',2024-11-08 06:19:10
12826,716003,5,44160522,58',Chris Smalling (Al Fayha) Yellow Card at 58',2024-11-08 06:19:10
12826,716003,6,44160529,60',Vinicius Rangel Da Silva (Al Fayha) Substitution at 60',2024-11-08 06:19:10
12826,716003,7,44160543,68',Aldry Contreras (Al Fayha) Substitution at 68',2024-11-08 06:19:10
12826,716003,8,44160544,68',Alejandro Pozuelo (Al Fayha) Substitution at 68',2024-11-08 06:19:10
12826,716003,9,44160547,70',Mohammed Qassem Al-Nakhli (Al Qadsiah) Substitution at 70',2024-11-08 06:19:10
12826,716003,10,44160548,70',Ali Abdullah Hazzazi (Al Qadsiah) Substitution at 70',2024-11-08 06:19:10
12826,716003,11,44160559,75',Ali Abdullah Hazzazi (Al Qadsiah) Yellow Card at 75',2024-11-08 06:19:10
12826,716003,12,44160560,76',Alejandro Pozuelo (Al Fayha) Yellow Card at 76',2024-11-08 06:19:10
12826,716003,13,44160579,80',Abdulhadi Al-Harajin (Al Fayha) Substitution at 80',2024-11-08 06:19:10
12826,716003,14,44160580,81',Ali Al Hussain (Al Fayha) Substitution at 81',2024-11-08 06:19:10
12826,716003,15,44160594,87',Hussain Al-Qahtani (Al Qadsiah) Substitution at 87',2024-11-08 06:19:10
12826,716003,16,44160599,90',Ali Al Hussain (Al Fayha) Yellow Card at 90',2024-11-08 06:19:10
12826,716003,17,44160605,90'+1',Abdulaziz Al Othman (Al Qadsiah) Substitution at 91',2024-11-08 06:19:10
12826,716003,18,44160615,90'+5',Otabek Shukurov (Al Fayha) Yellow Card at 95',2024-11-08 06:19:10
12826,716004,0,44171167,15',Mohammed Al Aqel (Al Riyadh) Substitution at 15',2024-11-09 06:18:45
12826,716004,1,44171194,38',Ibrahim Bayesh (Al Riyadh) Yellow Card at 38',2024-11-09 06:18:45
12826,716004,2,44171195,41',Sadio Mané (Al Nassr) Goal at 41',2024-11-09 06:18:45
12826,716004,3,44171204,45',Yahya Alshehri (Al Riyadh) Substitution at 45',2024-11-09 06:18:45
12826,716004,4,44171211,51',Abdulelah Al Khaibari (Al Riyadh) Yellow Card at 51',2024-11-09 06:18:45
12826,716004,5,44171421,64',Ângelo Gabriel  (Al Nassr) Substitution at 64',2024-11-09 06:18:45
12826,716004,6,44171422,64',Abdullah Al-Khaibari (Al Nassr) Substitution at 64',2024-11-09 06:18:45
12826,716004,7,44171630,79',Rayan Al Bloushi (Al Riyadh) Substitution at 79',2024-11-09 06:18:45
12826,716004,8,44171638,89',Salem Al Najdi (Al Nassr) Substitution at 89',2024-11-09 06:18:45
12826,716004,9,44171639,90',Saad Haqawi (Al Nassr) Substitution at 90',2024-11-09 06:18:45
12826,716004,10,44171640,90'+1',Saad Haqawi (Al Nassr) Yellow Card at 91',2024-11-09 06:18:45
12826,716005,0,44180935,13',Damion Lowe (Al Okhdood) Yellow Card at 13',2024-11-10 06:23:00
12826,716005,1,44181215,32',Ibrahima (Al Okhdood) Yellow Card at 32',2024-11-10 06:23:00
12826,716005,2,44181903,63',Sultan Al Farhan (Al Taawoun) Substitution at 63',2024-11-10 06:23:00
12826,716005,3,44181924,65',Sultan Mandash (Al Taawoun) Substitution at 65',2024-11-10 06:23:00
12826,716005,4,44182094,78',Abdulfattah Adam (Al Taawoun) Substitution at 78',2024-11-10 06:23:00
12826,716005,5,44182223,88',Mohammed Al Jahif (Al Okhdood) Substitution at 88',2024-11-10 06:23:00
12826,716005,6,44182239,89',Flávio  (Al Taawoun) Yellow Card at 89',2024-11-10 06:23:00
12826,716005,7,44182285,90'+3',Musa Barrow (Al Taawoun) Goal at 93',2024-11-10 06:23:00
12826,716005,8,44182325,90'+5',Petros  (Al Okhdood) Yellow Card at 95',2024-11-10 06:23:00
12826,716005,9,44182326,90'+5',Saeed Al-Rabiei (Al Okhdood) Yellow Card at 95',2024-11-10 06:23:00
12826,716005,10,44182327,90'+6',Saleh Al Abbas (Al Okhdood) Substitution at 96',2024-11-11 06:21:07
12826,716005,11,44182349,90'+6',Abdulfattah Adam (Al Taawoun) Yellow Card at 96',2024-11-11 06:21:07
12826,716006,0,44171117,28',Saad Yaslam Balobaid (Al Ahli) Yellow Card at 28',2024-11-10 06:23:00
12826,716006,1,44171121,41',Merih Demiral (Al Ahli) Substitution at 41',2024-11-09 06:18:45
12826,716006,2,44171122,41',Mehdi Abeid (Al Raed) Yellow Card at 41',2024-11-09 06:18:45
12826,716006,3,44171124,45'+3',Zakaria Al Hawsawi (Al Raed) Yellow Card at 48',2024-11-09 06:18:45
12826,716006,4,44171143,45',Yahya Sunbul (Al Raed) Substitution at 45',2024-11-09 06:18:45
12826,716006,5,44171148,53',Khalid Mohammed Al Subaie (Al Raed) Substitution at 53',2024-11-09 06:18:45
12826,716006,6,44171149,55',Gabri Veiga (Al Ahli) Goal at 55',2024-11-09 06:18:45
12826,716006,7,44171153,63',Mohammad Al-Dawsari (Al Raed) Yellow Card at 63',2024-11-09 06:18:45
12826,716006,8,44171161,67',Franck Kessié (Al Ahli) Yellow Card at 67',2024-11-09 06:18:45
12826,716006,9,44171162,78',Ali Alasmari (Al Ahli) Substitution at 78',2024-11-09 06:18:45
12826,716006,10,44171163,78',Ivan Toney (Al Ahli) Substitution at 78',2024-11-09 06:18:45
12826,716006,11,44171164,78',Abdullah Al-Amar (Al Ahli) Substitution at 78',2024-11-09 06:18:45
12826,716006,12,44171168,89',Nawaf Sahli (Al Raed) Substitution at 89',2024-11-09 06:18:45
12826,716006,13,44171169,89',Thamer Al Khaibri (Al Raed) Substitution at 89',2024-11-09 06:18:45
12826,716006,14,44171170,90',Fahad Alrashidi (Al Ahli) Substitution at 90',2024-11-09 06:18:45
12826,716006,15,44171171,90'+2',Ziyad Aljohani (Al Ahli) Yellow Card at 92',2024-11-09 06:18:45
12826,716006,16,44171174,90'+4',Ali Alasmari (Al Ahli) Goal at 94',2024-11-09 06:18:45
12826,716006,17,44171177,90'+8',Ali Majrashi (Al Ahli) Yellow Card at 98',2024-11-09 06:18:45
12826,716007,0,44160624,25',Saleh Al-Shehri (Al Ittihad) Goal at 25',2024-11-08 06:19:10
12826,716007,1,44160726,45'+4',Danilo Pereira (Al Ittihad) Substitution at 49',2024-11-08 06:19:10
12826,716007,2,44161589,52',Steven Bergwijn (Al Ittihad) Penalty - Scored at 52',2024-11-08 06:19:10
12826,716007,3,44162150,71',Karlo Muhar (Al Orobah) Substitution at 71',2024-11-08 06:19:10
12826,716007,4,44162158,74',Hamed Alghamdi (Al Ittihad) Substitution at 74',2024-11-08 06:19:10
12826,716007,5,44162159,74',Hassan Kadesh (Al Ittihad) Substitution at 74',2024-11-08 06:19:10
12826,716007,6,44162241,84',Hamed Alghamdi (Al Ittihad) Yellow Card at 84',2024-11-08 06:19:10
12826,716007,7,44162313,86',Brad Young (Al Orobah) Substitution at 86',2024-11-08 06:19:10
12826,716007,8,44162474,90'+2',Abdulrahman Al-Obud (Al Ittihad) Substitution at 92',2024-11-08 06:19:10
12826,716007,9,44162574,90'+5',Hamed Al-Maqati (Al Orobah) Substitution at 95',2024-11-08 06:19:10
12826,716008,0,44160585,57',Mohammed Essa Harbush (Al Shabab) Substitution at 57',2024-11-08 06:19:10
12826,716008,1,44160586,58',Abderrazak Hamdallah (Al Shabab) Penalty - Scored at 58',2024-11-08 06:19:10
12826,716008,2,44160612,66',Mohammed Essa Harbush (Al Shabab) Yellow Card at 66',2024-11-08 06:19:10
12826,716008,3,44160616,75',Abderrazak Hamdallah (Al Shabab) Goal at 75',2024-11-08 06:19:10
12826,716008,4,44160617,86',Daniel Podence (Al Shabab) Substitution at 86',2024-11-08 06:19:10
12826,716008,5,44160618,89',Bassem Al-Arini (Al Kholood) Substitution at 89',2024-11-08 06:19:10
12826,716008,6,44160619,89',Sultan Al Shehri (Al Kholood) Substitution at 89',2024-11-08 06:19:10
12826,716008,7,44160620,90'+2',Mohammed Al Shwirekh (Al Shabab) Substitution at 92',2024-11-08 06:19:10
12826,716008,8,44160621,90'+3',Hassan Al-Asmari (Al Kholood) Substitution at 93',2024-11-08 06:19:10
12826,716009,0,44171099,22',Madallah Al-Olayan (Al Ettifaq) Yellow Card at 22',2024-11-09 06:18:45
12826,716009,1,44171101,24',João Cancelo (Al Hilal) Yellow Card at 24',2024-11-09 06:18:45
12826,716009,2,44171110,45'+2',Aleksandar Mitrovic (Al Hilal) Goal at 47',2024-11-09 06:18:45
12826,716009,3,44171111,45'+3',Abdulelah Al-Malki (Al Ettifaq) Yellow Card at 48',2024-11-09 06:18:45
12826,716009,4,44171118,45',João Costa (Al Ettifaq) Substitution at 45',2024-11-09 06:18:45
12826,716009,5,44171120,50',Nasser Al-Dawsari (Al Hilal) Yellow Card at 50',2024-11-09 06:18:45
12826,716009,6,44171123,53',Álvaro Medrán (Al Ettifaq) Substitution at 53',2024-11-09 06:18:45
12826,716009,7,44171125,72',Abdullah Al-Hamddan (Al Hilal) Substitution at 72',2024-11-09 06:18:45
12826,716009,8,44171126,72',Mohamed Kanno (Al Hilal) Substitution at 72',2024-11-09 06:18:45
12826,716009,9,44171139,74',Meshal Sibyani (Al Ettifaq) Yellow Card at 74',2024-11-09 06:18:45
12826,716009,10,44171141,78',Mohammed Al-Qahtani (Al Hilal) Substitution at 78',2024-11-09 06:18:45
12826,716009,11,44171142,78',Mohammed Yousef (Al Ettifaq) Substitution at 78',2024-11-09 06:18:45
12826,716009,12,44171144,81',Malcom  (Al Hilal) Goal at 81',2024-11-09 06:18:45
12826,716009,13,44171145,82',Vitinho  (Al Ettifaq) Substitution at 82',2024-11-09 06:18:45
12826,716009,14,44171146,82',Abdullah Radif (Al Ettifaq) Substitution at 82',2024-11-09 06:18:45
12826,716009,15,44171150,90'+4',Vitinho  (Al Ettifaq) Penalty - Scored at 94',2024-11-09 06:18:45
12826,716009,16,44171151,90'+6',Mohammed Al-Qahtani (Al Hilal) Goal at 96',2024-11-09 06:18:45
12826,716009,17,44171154,90'+8',Hamad Altuhayfan (Al Hilal) Substitution at 98',2024-11-09 06:18:45
12826,716009,18,44171155,90'+8',Moteb Alharbi (Al Hilal) Substitution at 98',2024-11-09 06:18:45
12826,716009,19,44171156,90'+8',Abdullah Radif (Al Ettifaq) Red Card at 98',2024-11-09 06:18:45
12826,716010,0,44186328,11',Saeed Baattia (Al Fateh) Yellow Card at 11',2024-11-11 06:21:07
12826,716010,1,44176641,25',Dimitrios Kourbelis (Al Khaleej) Yellow Card at 25',2024-11-11 06:21:07
12826,716010,2,44176722,31',Sofiane Bendebka (Al Fateh) Yellow Card at 31',2024-11-11 06:21:07
12826,716010,3,44177749,45',Mourad Batna (Al Fateh) Substitution at 45',2024-11-11 06:21:07
12826,716010,4,44177826,47',Mohammed Khubrani (Al Khaleej) Yellow Card at 47',2024-11-11 06:21:07
12826,716010,5,44178182,55',Abdullah Al-Salim (Al Khaleej) Goal at 55',2024-11-11 06:21:07
12826,716010,6,44178183,56',Nouh Al-Mousa (Al Fateh) Substitution at 56',2024-11-11 06:21:07
12826,716010,7,44178223,59',Suhayb Alzaid (Al Fateh) Substitution at 59',2024-11-11 06:21:07
12826,716010,8,44178361,66',Waheb Saleh (Al Khaleej) Substitution at 66',2024-11-11 06:21:07
12826,716010,9,44178362,66',Khaled Al Samiri (Al Khaleej) Substitution at 66',2024-11-11 06:21:07
12826,716010,10,44178475,72',Marcel Tisserand (Al Khaleej) Yellow Card at 72',2024-11-11 06:21:07
