seasonType,eventId,commentaryOrder,playId,clockDisplayValue,commentaryText,updateDateTime
13548,747052,18,45806857,84',Rayan Ghrieb (1. FC Magdeburg) Yellow Card at 84',2025-09-01 05:11:18
13548,747052,19,45806890,87',Philipp Ziereis (SpVgg Greuther Fürth) Yellow Card at 87',2025-09-01 05:11:18
13548,747052,20,45806911,89',Andi Hoti (1. FC Magdeburg) Substitution at 89',2025-09-01 05:11:18
13548,747052,21,45806912,90',Falko Michel (1. FC Magdeburg) Substitution at 90',2025-09-01 05:11:18
13548,747052,22,45806928,90'+1',Jannick Dehm (SpVgg Greuther Fürth) Yellow Card at 91',2025-09-01 05:11:18
13548,747052,23,45806943,90'+1',Noah Konig (SpVgg Greuther Fürth) Substitution at 91',2025-09-01 05:11:18
13548,747052,24,45806955,90'+3',Noah Pesch (1. FC Magdeburg) Goal at 93',2025-09-01 05:11:18
13548,747052,25,45807001,90'+8',Marco John (SpVgg Greuther Fürth) Goal at 98',2025-09-01 05:11:18
13548,747052,26,45807017,90'+10',Felix Klaus (SpVgg Greuther Fürth) Yellow Card at 100',2025-09-01 05:11:18
13548,747053,0,45782744,29',Semir Telalovic (1. FC Nürnberg) Yellow Card at 29',2025-08-30 05:04:44
13548,747053,1,45782782,43',Felix Götze (SC Paderborn 07) Yellow Card at 43',2025-08-30 05:04:44
13548,747053,2,45782796,45'+4',Luis Engelns (SC Paderborn 07) Yellow Card at 49',2025-08-30 05:04:44
13548,747053,3,45782834,45',Mickaël Biron (1. FC Nürnberg) Substitution at 45',2025-08-30 05:04:44
13548,747053,4,45782882,60',Marcel Hoffmeier (SC Paderborn 07) Yellow Card at 60',2025-08-30 05:04:44
13548,747053,5,45782891,63',Lucas Copado (SC Paderborn 07) Substitution at 63',2025-08-30 05:04:44
13548,747053,6,45782897,63',Sebastian Klaas (SC Paderborn 07) Substitution at 63',2025-08-30 05:04:44
13548,747053,7,45782909,67',Nick Batzner (SC Paderborn 07) Substitution at 67',2025-08-30 05:04:44
13548,747053,8,45782910,67',Sven Michel (SC Paderborn 07) Substitution at 67',2025-08-30 05:04:44
13548,747053,9,45782915,70',Fabio Gruber (1. FC Nürnberg) Yellow Card at 70',2025-08-30 05:04:44
13548,747053,10,45782934,72',Julian Justvan (1. FC Nürnberg) Yellow Card at 72',2025-08-30 05:04:44
13548,747053,11,45782954,76',Artem Stepanov (1. FC Nürnberg) Substitution at 76',2025-08-30 05:04:44
13548,747053,12,45783029,84',Sven Michel (SC Paderborn 07) Yellow Card at 84',2025-08-30 05:04:44
13548,747053,13,45783232,90'+3',Marco Wörner (SC Paderborn 07) Substitution at 93',2025-08-30 05:04:44
13548,747053,14,45783238,90'+5',Tom Baack (1. FC Nürnberg) Substitution at 95',2025-08-30 05:04:44
13548,747054,0,45788824,11',Joel Grodowski (Arminia Bielefeld) Yellow Card at 11',2025-08-31 05:08:09
13548,747054,1,45788825,14',Christian Conteh (TSV Eintracht Braunschweig) Yellow Card at 14',2025-08-31 05:08:09
13548,747054,2,45788839,28',Robin Heusser (TSV Eintracht Braunschweig) Yellow Card at 28',2025-08-31 05:08:09
13548,747054,3,45788865,34',Benjamin Boakye (Arminia Bielefeld) Yellow Card at 34',2025-08-31 05:08:09
13548,747054,4,45788932,40',Fabio Kaufmann (TSV Eintracht Braunschweig) Substitution at 40',2025-08-31 05:08:09
13548,747054,5,45789137,45',Isaiah Young (Arminia Bielefeld) Substitution at 45',2025-08-31 05:08:09
13548,747054,6,45789217,51',Levente Szabo (TSV Eintracht Braunschweig) Substitution at 51',2025-08-31 05:08:09
13548,747054,7,45789283,61',Arne Sicker (Arminia Bielefeld) Substitution at 61',2025-08-31 05:08:09
13548,747054,8,45789300,64',Christian Conteh (TSV Eintracht Braunschweig) Goal at 64',2025-08-31 05:08:09
13548,747054,9,45789310,69',Salomon Patrick Amougou Nkoa (TSV Eintracht Braunschweig) Substitution at 69',2025-08-31 05:08:09
13548,747054,10,45789312,69',Leon Bell (TSV Eintracht Braunschweig) Substitution at 69',2025-08-31 05:08:09
13548,747054,11,45789313,69',Sebastian Polter (TSV Eintracht Braunschweig) Substitution at 69',2025-08-31 05:08:09
13548,747054,12,45789388,81',Florian Micheler (Arminia Bielefeld) Substitution at 81',2025-08-31 05:08:09
13548,747054,13,45789407,81',Vincent Ocansey (Arminia Bielefeld) Substitution at 81',2025-08-31 05:08:09
13548,747054,14,45789443,86',Leon Bell (TSV Eintracht Braunschweig) Yellow Card at 86',2025-08-31 05:08:09
13548,747054,15,45789459,89',Isaiah Young (Arminia Bielefeld) Goal at 89',2025-08-31 05:08:09
13548,747054,16,45789515,90'+7',Joel Felix (Arminia Bielefeld) Substitution at 97',2025-09-01 05:11:18
13548,747054,17,45789541,90'+9',Florian Micheler (Arminia Bielefeld) Yellow Card at 99',2025-08-31 05:08:09
13548,747055,0,45797746,33',Florent Muslija (Fortuna Düsseldorf) Yellow Card at 33',2025-08-31 05:08:09
13548,747055,1,45797807,36',Christoph Kobald (Karlsruher SC) Yellow Card at 36',2025-08-31 05:08:09
13548,747055,2,45798361,45',Sotiris Alexandropoulos (Fortuna Düsseldorf) Substitution at 45',2025-08-31 05:08:09
13548,747055,3,45798438,45',Zan Celar (Fortuna Düsseldorf) Substitution at 45',2025-08-31 05:08:09
13548,747055,4,45798941,73',Philipp Förster (Karlsruher SC) Substitution at 73',2025-08-31 05:08:09
13548,747055,5,45798942,73',Dzenis Burnic (Karlsruher SC) Substitution at 73',2025-08-31 05:08:09
13548,747055,6,45799031,78',Moritz Heyer (Fortuna Düsseldorf) Substitution at 78',2025-08-31 05:08:09
13548,747055,7,45799110,81',Shio Fukuda (Karlsruher SC) Substitution at 81',2025-08-31 05:08:09
13548,747055,8,45799126,81',Marcel Beifus (Karlsruher SC) Substitution at 81',2025-08-31 05:08:09
13548,747055,9,45799193,84',Christian Rasmussen (Fortuna Düsseldorf) Substitution at 84',2025-08-31 05:08:09
13548,747055,10,45799408,90'+3',Hans Christian Bernat (Karlsruher SC) Yellow Card at 93',2025-08-31 05:08:09
13548,747055,11,45799511,90'+6',David Herold (Karlsruher SC) Yellow Card at 96',2025-08-31 05:08:09
13548,747055,12,45799512,90'+7',Jordy de Wijs (Fortuna Düsseldorf) Substitution at 97',2025-08-31 05:08:09
13548,747056,0,45782554,5',Younes Ebnoutalib (SV 07 Elversberg) Goal at 5',2025-08-30 05:04:44
13548,747056,1,45782586,17',Leon Jensen (Hertha Berlin) Yellow Card at 17',2025-08-30 05:04:44
13548,747056,2,45782766,38',Linus Gechter (Hertha Berlin) Yellow Card at 38',2025-08-30 05:04:44
13548,747056,3,45782803,45',Sebastian Gronning (Hertha Berlin) Substitution at 45',2025-08-30 05:04:44
13548,747056,4,45782807,45',Kennet Eichhorn (Hertha Berlin) Substitution at 45',2025-08-30 05:04:44
13548,747056,5,45782861,59',Younes Ebnoutalib (SV 07 Elversberg) Goal at 59',2025-08-30 05:04:44
13548,747056,6,45782890,62',Lasse Günther (SV 07 Elversberg) Yellow Card at 62',2025-08-31 05:08:09
13548,747056,7,45782878,63',Felix Keidel (SV 07 Elversberg) Substitution at 63',2025-08-31 05:08:09
13548,747056,8,45782900,67',Amara Conde (SV 07 Elversberg) Yellow Card at 67',2025-08-31 05:08:09
13548,747056,9,45782901,68',Marten Winkler (Hertha Berlin) Substitution at 68',2025-08-31 05:08:09
13548,747056,10,45782907,71',Nicholas Mickelson (SV 07 Elversberg) Substitution at 71',2025-08-31 05:08:09
13548,747056,11,45782908,71',Carlo Sickinger (SV 07 Elversberg) Substitution at 71',2025-08-31 05:08:09
13548,747056,12,45782939,77',Linus Gechter (Hertha Berlin) Red Card at 77',2025-08-31 05:08:09
13548,747056,13,45782947,78',Tim Hoffmann (Hertha Berlin) Substitution at 78',2025-08-31 05:08:09
13548,747056,14,45782961,78',Janne Berner (Hertha Berlin) Substitution at 78',2025-08-31 05:08:09
13548,747056,15,45782983,83',Jason Ceka (SV 07 Elversberg) Substitution at 83',2025-08-31 05:08:09
13548,747056,16,45782984,83',Frederik Schmahl (SV 07 Elversberg) Substitution at 83',2025-08-31 05:08:09
13548,747056,17,45782994,84',Toni Leistner (Hertha Berlin) Yellow Card at 84',2025-08-31 05:08:09
13548,747056,18,45783002,84',Janne Berner (Hertha Berlin) Yellow Card at 84',2025-08-31 05:08:09
13548,747056,19,45783032,87',Deyovaiso Zeefuik (Hertha Berlin) Yellow Card at 87',2025-08-31 05:08:09
13548,747057,0,45788831,21',Phil Harres (Holstein Kiel) Goal at 21',2025-08-31 05:08:09
13548,747057,1,45788930,38',Magnus Knudsen (Holstein Kiel) Yellow Card at 38',2025-08-31 05:08:09
13548,747057,2,45789112,45',Kasper Davidsen (Holstein Kiel) Substitution at 45',2025-08-31 05:08:09
13548,747057,3,45789125,46',Jonas Therkelsen (Holstein Kiel) Yellow Card at 46',2025-08-31 05:08:09
13548,747057,4,45789259,60',Daisuke Yokota (Hannover 96) Substitution at 60',2025-08-31 05:08:09
13548,747057,5,45789260,60',Benjamin Kallman (Hannover 96) Substitution at 60',2025-08-31 05:08:09
13548,747057,6,45789261,61',Waniss Taibi (Hannover 96) Substitution at 61',2025-08-31 05:08:09
13548,747057,7,45789264,62',Virgil Ghita (Hannover 96) Goal at 62',2025-08-31 05:08:09
13548,747057,8,45789265,63',Adrian Kapralik (Holstein Kiel) Substitution at 63',2025-08-31 05:08:09
13548,747057,9,45789299,69',Benjamin Kallman (Hannover 96) Goal at 69',2025-08-31 05:08:09
13548,747057,10,45789306,70',Niklas Niehoff (Holstein Kiel) Substitution at 70',2025-08-31 05:08:09
13548,747057,11,45789307,70',Marcus Müller (Holstein Kiel) Substitution at 70',2025-08-31 05:08:09
13548,747057,12,45789322,76',Ime Okon (Hannover 96) Yellow Card at 76',2025-08-31 05:08:09
13548,747057,13,45789330,77',Hendry Blank (Hannover 96) Substitution at 77',2025-08-31 05:08:09
13548,747057,14,45789344,80',Maurice Neubauer (Hannover 96) Yellow Card at 80',2025-08-31 05:08:09
13548,747057,15,45789345,80',Boris Tomiak (Hannover 96) Yellow Card at 80',2025-08-31 05:08:09
13548,747057,16,45789351,80',Stefan Schwab (Holstein Kiel) Substitution at 80',2025-08-31 05:08:09
13548,747057,17,45789381,85',Franz Roggow (Hannover 96) Substitution at 85',2025-08-31 05:08:09
13548,747058,0,45806293,3',Finn Porath (Schalke 04) Yellow Card at 3',2025-09-01 05:11:18
13548,747058,1,45806537,45',Felipe Sanchez (Schalke 04) Substitution at 45',2025-09-01 05:11:18
13548,747058,2,45806544,45',Christopher Antwi-Adjei (Schalke 04) Substitution at 45',2025-09-01 05:11:18
13548,747058,3,45806630,65',Stefan Kutschke (Dynamo Dresden) Substitution at 65',2025-09-01 05:11:18
13548,747058,4,45806637,65',Dominik Kother (Dynamo Dresden) Substitution at 65',2025-09-01 05:11:18
13548,747058,5,45806642,66',Soufian El-Faouzi (Schalke 04) Yellow Card at 66',2025-09-01 05:11:18
13548,747058,6,45806665,70',Adrian Gantenbein (Schalke 04) Substitution at 70',2025-09-01 05:11:18
13548,747058,7,45806666,70',Bryan Lasme (Schalke 04) Substitution at 70',2025-09-01 05:11:18
13548,747058,8,45806713,75',Felipe Sanchez (Schalke 04) Yellow Card at 75',2025-09-01 05:11:18
13548,747058,9,45806715,76',Max Grüger (Schalke 04) Substitution at 76',2025-09-01 05:11:18
13548,747058,10,45806767,80',Luca Herrmann (Dynamo Dresden) Substitution at 80',2025-09-01 05:11:18
13548,747058,11,45806768,80',Tony Menzel (Dynamo Dresden) Substitution at 80',2025-09-01 05:11:18
13548,747058,12,45806822,82',Luca Herrmann (Dynamo Dresden) Yellow Card at 82',2025-09-01 05:11:18
13548,747058,13,45806809,84',Kenan Karaman (Schalke 04) Penalty - Scored at 84',2025-09-01 05:11:18
13548,747058,14,45806864,86',Aljaz Casar (Dynamo Dresden) Substitution at 86',2025-09-01 05:11:18
13548,747058,15,45806960,90'+4',Timo Becker (Schalke 04) Yellow Card at 94',2025-09-01 05:11:18
13548,747059,0,45788836,27',Joshua Mees (Preußen Münster) Goal at 27',2025-08-31 05:08:09
13548,747059,1,45788848,31',Leandro Morgalla (VfL Bochum) Yellow Card at 31',2025-08-31 05:08:09
13548,747059,2,45788980,43',Philipp Hofmann (VfL Bochum) Goal at 43',2025-08-31 05:08:09
13548,747059,3,45789172,47',Jano Horst (Preußen Münster) Yellow Card at 47',2025-08-31 05:08:09
13548,747059,4,45789194,49',Joshua Mees (Preußen Münster) Goal at 49',2025-08-31 05:08:09
13548,747059,5,45789241,54',Cajetan Lenz (VfL Bochum) Yellow Card at 54',2025-08-31 05:08:09
13548,747059,6,45789263,58',Mathis Claricia (VfL Bochum) Substitution at 58',2025-08-31 05:08:09
13548,747059,7,45789271,58',Noah Loosli (VfL Bochum) Substitution at 58',2025-08-31 05:08:09
13548,747059,8,45789272,58',Ibrahima Sissoko (VfL Bochum) Substitution at 58',2025-09-02 05:11:26
13548,747059,9,45789292,63',Lars Lokotsch (Preußen Münster) Substitution at 63',2025-08-31 05:08:09
13548,747059,10,45789301,66',Marvin Schulz (Preußen Münster) Yellow Card at 66',2025-08-31 05:08:09
13548,747059,11,45789308,67',Marco Meyerhöfer (Preußen Münster) Substitution at 67',2025-08-31 05:08:09
13548,747059,12,45789309,67',Mikkel Kirkeskov (Preußen Münster) Substitution at 67',2025-08-31 05:08:09
13548,747059,13,45789337,75',Jorrit Hendrix (Preußen Münster) Yellow Card at 75',2025-08-31 05:08:09
13548,747059,14,45789348,76',Owono-Darnell Keumo (VfL Bochum) Substitution at 76',2025-08-31 05:08:09
13548,747059,15,45789369,79',Romario Rösch (VfL Bochum) Substitution at 79',2025-08-31 05:08:09
13548,747059,16,45789370,80',Simon Scherder (Preußen Münster) Substitution at 80',2025-08-31 05:08:09
13548,747059,17,45789428,83',Ibrahima Sissoko (VfL Bochum) Yellow Card at 83',2025-09-02 05:11:26
13548,747060,0,45862179,6',Marcus Mathiesen (1. FC Magdeburg) Yellow Card at 6',2025-09-13 05:17:27
13548,747060,1,45862240,52',Mael Corboz (Arminia Bielefeld) Goal at 52',2025-09-13 05:17:27
13548,747060,2,45862266,62',Joel Grodowski (Arminia Bielefeld) Goal at 62',2025-09-13 05:17:27
13548,747060,3,45862288,69',Eldin Dzogovic (1. FC Magdeburg) Yellow Card at 69',2025-09-13 05:17:27
13548,747060,4,45862296,73',Laurin Ulrich (1. FC Magdeburg) Substitution at 73',2025-09-13 05:17:27
13548,747060,5,45862302,73',Max Geschwill (1. FC Magdeburg) Substitution at 73',2025-09-13 05:17:27
13548,747060,6,45862303,73',Philipp Hercher (1. FC Magdeburg) Substitution at 73',2025-09-13 05:17:27
13548,747060,7,45862304,74',Alex Ahl-Holmström (1. FC Magdeburg) Substitution at 74',2025-09-16 05:15:58
13548,747060,8,45862314,79',Arne Sicker (Arminia Bielefeld) Substitution at 79',2025-09-13 05:17:27
13548,747060,9,45862320,79',Sam Schreck (Arminia Bielefeld) Substitution at 79',2025-09-13 05:17:27
13548,747060,10,45862337,85',Marvin Mehlem (Arminia Bielefeld) Yellow Card at 85',2025-09-13 05:17:27
13548,747060,11,45862344,87',Andi Hoti (1. FC Magdeburg) Substitution at 87',2025-09-13 05:17:27
13548,747060,12,45862345,89',Julian Kania (Arminia Bielefeld) Substitution at 89',2025-09-13 05:17:27
13548,747060,13,45862352,89',Joel Felix (Arminia Bielefeld) Substitution at 89',2025-09-16 05:15:58
13548,747060,14,45862360,90'+3',Vincent Ocansey (Arminia Bielefeld) Substitution at 93',2025-09-13 05:17:27
13548,747061,0,45866845,6',Alexander Bernhardsson (Holstein Kiel) Goal at 6',2025-09-14 05:28:00
13548,747061,1,45867342,61',Steven Skrzybski (Holstein Kiel) Yellow Card at 61',2025-09-14 05:28:00
13548,747061,2,45867365,64',Janik Bachmann (Schalke 04) Substitution at 64',2025-09-14 05:28:00
13548,747061,3,45867366,64',Adrian Gantenbein (Schalke 04) Substitution at 64',2025-09-14 05:28:00
13548,747061,4,45867367,64',Phil Harres (Holstein Kiel) Substitution at 64',2025-09-14 05:28:00
13548,747061,5,45867368,65',Lasse Rosenboom (Holstein Kiel) Substitution at 65',2025-09-14 05:28:00
13548,747061,6,45867375,68',Bryan Lasme (Schalke 04) Substitution at 68',2025-09-14 05:28:00
13548,747061,7,45867390,73',Jonas Therkelsen (Holstein Kiel) Substitution at 73',2025-09-14 05:28:00
13548,747061,8,45867423,78',Christopher Antwi-Adjei (Schalke 04) Substitution at 78',2025-09-14 05:28:00
13548,747061,9,45867424,78',Hasan Kurucay (Schalke 04) Substitution at 78',2025-09-14 05:28:00
13548,747061,10,45867475,83',Marko Ivezic (Holstein Kiel) Substitution at 83',2025-09-14 05:28:00
13548,747061,11,45867496,83',Robert Wagner (Holstein Kiel) Substitution at 83',2025-09-14 05:28:00
13548,747061,12,45867539,87',Carl Johansson (Holstein Kiel) Yellow Card at 87',2025-09-14 05:28:00
13548,747061,13,45867676,90'+7',David Zec (Holstein Kiel) Yellow Card at 97',2025-09-14 05:28:00
13548,747062,0,45876643,34',Marten Winkler (Hertha Berlin) Yellow Card at 34',2025-09-14 05:28:00
13548,747062,1,45877435,45',Husseyn Chakroun (Hannover 96) Substitution at 45',2025-09-14 05:28:00
13548,747062,2,45877509,51',Marten Winkler (Hertha Berlin) Goal at 51',2025-09-14 05:28:00
13548,747062,3,45877552,54',Julian Eitscberger (Hertha Berlin) Yellow Card at 54',2025-09-14 05:28:00
13548,747062,4,45877635,56',Noël Aséko (Hannover 96) Yellow Card at 56',2025-09-14 05:28:00
13548,747062,5,45877738,62',Daisuke Yokota (Hannover 96) Substitution at 62',2025-09-14 05:28:00
13548,747062,6,45877739,62',Benjamin Kallman (Hannover 96) Substitution at 62',2025-09-14 05:28:00
13548,747062,7,45877776,62',Kolja Oudenne (Hannover 96) Substitution at 62',2025-09-14 05:28:00
13548,747062,8,45877837,66',Boris Tomiak (Hannover 96) Yellow Card at 66',2025-09-14 05:28:00
13548,747062,9,45877860,68',Dawid Kownacki (Hertha Berlin) Goal at 68',2025-09-14 05:28:00
13548,747062,10,45877870,69',Waniss Taibi (Hannover 96) Substitution at 69',2025-09-14 05:28:00
13548,747062,11,45877894,72',Sebastian Gronning (Hertha Berlin) Substitution at 72',2025-09-14 05:28:00
13548,747062,12,45877902,72',Kevin Sessa (Hertha Berlin) Substitution at 72',2025-09-14 05:28:00
13548,747062,13,45878057,82',Kennet Eichhorn (Hertha Berlin) Yellow Card at 82',2025-09-14 05:28:00
13548,747062,14,45878147,84',Toni Leistner (Hertha Berlin) Yellow Card at 84',2025-09-14 05:28:00
13548,747062,15,45878176,87',Jan-Luca Schuler (Hertha Berlin) Substitution at 87',2025-09-14 05:28:00
13548,747062,16,45878190,87',Maurice Krattenmacher (Hertha Berlin) Substitution at 87',2025-09-14 05:28:00
13548,747062,17,45878231,88',Kevin Sessa (Hertha Berlin) Yellow Card at 88',2025-09-14 05:28:00
13548,747062,18,45878270,89',Boris Lum (Hertha Berlin) Substitution at 89',2025-09-14 05:28:00
13548,747062,19,45878321,90'+2',Jan-Luca Schuler (Hertha Berlin) Goal at 92',2025-09-14 05:28:00
13548,747063,0,45867012,44',Fabian Schleusener (Karlsruher SC) Goal at 44',2025-09-14 05:28:00
13548,747063,1,45867061,45'+4',Henri Koudossou (1. FC Nürnberg) Goal at 49',2025-09-14 05:28:00
13548,747063,2,45867335,57',Adriano Grimaldi (1. FC Nürnberg) Substitution at 57',2025-09-14 05:28:00
13548,747063,3,45867363,62',Marcel Beifus (Karlsruher SC) Substitution at 62',2025-09-14 05:28:00
13548,747063,4,45867364,62',Dzenis Burnic (Karlsruher SC) Substitution at 62',2025-09-14 05:28:00
13548,747063,5,45867394,73',Philipp Förster (Karlsruher SC) Substitution at 73',2025-09-14 05:28:00
13548,747063,6,45867395,73',Shio Fukuda (Karlsruher SC) Substitution at 73',2025-09-14 05:28:00
13548,747063,7,45867407,75',Marvin Wanitzek (Karlsruher SC) Goal at 75',2025-09-14 05:28:00
13548,747063,8,45867479,81',Adam Markhiev (1. FC Nürnberg) Substitution at 81',2025-09-14 05:28:00
13548,747063,9,45867480,81',Semir Telalovic (1. FC Nürnberg) Substitution at 81',2025-09-14 05:28:00
13548,747063,10,45867502,83',Berkay Yilmaz (1. FC Nürnberg) Yellow Card at 83',2025-09-14 05:28:00
13548,747063,11,45867514,83',Dzenis Burnic (Karlsruher SC) Yellow Card at 83',2025-09-14 05:28:00
13548,747063,12,45867905,90'+4',Hans Christian Bernat (Karlsruher SC) Yellow Card at 94',2025-09-14 05:28:00
13548,747064,0,45862182,20',Philipp Hofmann (VfL Bochum) Yellow Card at 20',2025-09-13 05:17:27
13548,747064,1,45862221,45',Erhan Masovic (VfL Bochum) Substitution at 45',2025-09-13 05:17:27
13548,747064,2,45862244,53',Cajetan Lenz (VfL Bochum) Yellow Card at 53',2025-09-13 05:17:27
13548,747064,3,45862253,58',Romario Rösch (VfL Bochum) Yellow Card at 58',2025-09-13 05:17:27
13548,747064,4,45862284,68',Gerrit Holtmann (VfL Bochum) Yellow Card at 68',2025-09-13 05:17:27
13548,747064,5,45862285,69',Sebastian Klaas (SC Paderborn 07) Substitution at 69',2025-09-13 05:17:27
13548,747064,6,45862286,69',Lucas Copado (SC Paderborn 07) Substitution at 69',2025-09-13 05:17:27
13548,747064,7,45862287,69',Sven Michel (SC Paderborn 07) Substitution at 69',2025-09-13 05:17:27
13548,747064,8,45862301,75',Ibrahima Sissoko (VfL Bochum) Substitution at 75',2025-09-14 05:28:00
13548,747064,9,45862309,75',Michael Obafemi (VfL Bochum) Substitution at 75',2025-09-13 05:17:27
13548,747064,10,45862325,82',Daniel Hulsenbusch (VfL Bochum) Substitution at 82',2025-09-13 05:17:27
13548,747064,11,45862334,85',Ruben Müller (SC Paderborn 07) Substitution at 85',2025-09-13 05:17:27
13548,747064,12,45862335,85',Stefano Marino (SC Paderborn 07) Substitution at 85',2025-09-13 05:17:27
13548,747064,13,45862338,86',Felix Passlack (VfL Bochum) Substitution at 86',2025-09-13 05:17:27
13548,747064,14,45862349,89',Ruben Müller (SC Paderborn 07) Yellow Card at 89',2025-09-13 05:17:27
13548,747064,15,45862353,90',Lucas Copado (SC Paderborn 07) Goal at 90',2025-09-13 05:17:27
13548,747065,0,45887895,19',Simon Scherder (Preußen Münster) Goal at 19',2025-09-15 05:16:59
13548,747065,1,45887971,30',Paul Jaeckel (Preußen Münster) Yellow Card at 30',2025-09-15 05:16:59
13548,747065,2,45887995,33',Kenneth Schmidt (Fortuna Düsseldorf) Yellow Card at 33',2025-09-15 05:16:59
13548,747065,3,45888374,55',Charalampos Makridis (Preußen Münster) Substitution at 55',2025-09-15 05:16:59
13548,747065,4,45888434,60',Christian Rasmussen (Fortuna Düsseldorf) Substitution at 60',2025-09-15 05:16:59
13548,747065,5,45888461,64',Cedric Itten (Fortuna Düsseldorf) Goal at 64',2025-09-15 05:16:59
13548,747065,6,45888473,65',Jorrit Hendrix (Preußen Münster) Yellow Card at 65',2025-09-15 05:16:59
13548,747065,7,45888502,69',Jano Horst (Preußen Münster) Yellow Card at 69',2025-09-15 05:16:59
13548,747065,8,45888527,72',Florent Muslija (Fortuna Düsseldorf) Penalty - Scored at 72',2025-09-15 05:16:59
13548,747065,9,45888559,74',Yassine Bouchama (Preußen Münster) Substitution at 74',2025-09-15 05:16:59
13548,747065,10,45888574,74',Oscar Wilhelmsson (Preußen Münster) Substitution at 74',2025-09-15 05:16:59
13548,747065,11,45888643,80',Niko Koulis (Preußen Münster) Substitution at 80',2025-09-15 05:16:59
13548,747065,12,45888656,80',Sotiris Alexandropoulos (Fortuna Düsseldorf) Substitution at 80',2025-09-15 05:16:59
13548,747065,13,45888685,80',Zidan Sertdemir (Preußen Münster) Substitution at 80',2025-09-15 05:16:59
13548,747065,14,45888660,81',Danny Schmidt (Fortuna Düsseldorf) Substitution at 81',2025-09-15 05:16:59
13548,747065,15,45888747,85',Christian Rasmussen (Fortuna Düsseldorf) Yellow Card at 85',2025-09-15 05:16:59
13548,747065,16,45888783,87',Emmanuel Iyoha (Fortuna Düsseldorf) Substitution at 87',2025-09-15 05:16:59
13548,747066,0,45887810,3',Christoph Daferner (Dynamo Dresden) Goal at 3',2025-09-15 05:16:59
13548,747066,1,45887842,9',Vinko Sapina (Dynamo Dresden) Yellow Card at 9',2025-09-15 05:16:59
13548,747066,2,45887850,9',Younes Ebnoutalib (SV 07 Elversberg) Goal at 9',2025-09-15 05:16:59
13548,747066,3,45887896,17',Lukas Boeder (Dynamo Dresden) Yellow Card at 17',2025-09-15 05:16:59
13548,747066,4,45887999,32',Dominik Kother (Dynamo Dresden) Substitution at 32',2025-09-15 05:16:59
13548,747066,5,45888076,39',Jakob Lemmer (Dynamo Dresden) Goal at 39',2025-09-15 05:16:59
13548,747066,6,45888504,63',Aljaz Casar (Dynamo Dresden) Substitution at 63',2025-09-15 05:16:59
13548,747066,7,45888505,63',Lars Bünning (Dynamo Dresden) Substitution at 63',2025-09-15 05:16:59
13548,747066,8,45888506,63',Nicholas Mickelson (SV 07 Elversberg) Substitution at 63',2025-09-15 05:16:59
13548,747066,9,45888507,63',Felix Keidel (SV 07 Elversberg) Substitution at 63',2025-09-15 05:16:59
13548,747066,10,45888592,70',Nils Froling (Dynamo Dresden) Substitution at 70',2025-09-15 05:16:59
13548,747066,11,45888601,70',Stefan Kutschke (Dynamo Dresden) Substitution at 70',2025-09-15 05:16:59
13548,747066,12,45888716,76',Jason Ceka (SV 07 Elversberg) Substitution at 76',2025-09-15 05:16:59
13548,747066,13,45888717,76',Frederik Schmahl (SV 07 Elversberg) Substitution at 76',2025-09-15 05:16:59
13548,747066,14,45888941,89',Luca Schnellbacher (SV 07 Elversberg) Substitution at 89',2025-09-15 05:16:59
13548,747066,15,45888959,90'+2',Younes Ebnoutalib (SV 07 Elversberg) Goal at 92',2025-09-15 05:16:59
13548,747066,16,45888989,90'+4',Lars Bünning (Dynamo Dresden) Yellow Card at 94',2025-09-15 05:16:59
13548,747066,17,45889024,90'+5',Stefan Kutschke (Dynamo Dresden) Yellow Card at 95',2025-09-15 05:16:59
13548,747067,0,45866867,21',Mehmet Can Aydin (TSV Eintracht Braunschweig) Goal at 21',2025-09-14 05:28:00
13548,747067,1,45867271,49',Fraser Hornby (SV Darmstadt 98) Yellow Card at 49',2025-09-14 05:28:00
13548,747067,2,45867333,58',Isac Lidberg (SV Darmstadt 98) Yellow Card at 58',2025-09-14 05:28:00
13548,747067,3,45867351,62',Isac Lidberg (SV Darmstadt 98) Goal at 62',2025-09-14 05:28:00
13548,747067,4,45867371,66',Leon Bell (TSV Eintracht Braunschweig) Substitution at 66',2025-09-14 05:28:00
13548,747067,5,45867389,72',Yosuke Furukawa (SV Darmstadt 98) Substitution at 72',2025-09-14 05:28:00
13548,747067,6,45867393,73',Levente Szabo (TSV Eintracht Braunschweig) Substitution at 73',2025-09-14 05:28:00
13548,747067,7,45867485,83',Sebastian Polter (TSV Eintracht Braunschweig) Substitution at 83',2025-09-14 05:28:00
13548,747067,8,45867508,84',Fabio Kaufmann (TSV Eintracht Braunschweig) Substitution at 84',2025-09-14 05:28:00
13548,747067,9,45867509,84',Matej Maglica (SV Darmstadt 98) Substitution at 84',2025-09-14 05:28:00
13548,747067,10,45867510,84',Merveille Papela (SV Darmstadt 98) Substitution at 84',2025-09-14 05:28:00
13548,747067,11,45867517,85',Sven Kohler (TSV Eintracht Braunschweig) Red Card at 85',2025-09-14 05:28:00
13548,747067,12,45867530,86',Matej Maglica (SV Darmstadt 98) Goal at 86',2025-09-14 05:28:00
13548,747067,13,45890226,88',Leon Bell (TSV Eintracht Braunschweig) Yellow Card at 88',2025-09-15 05:16:59
13548,747067,14,45867619,90'+3',Fabian Holland (SV Darmstadt 98) Substitution at 93',2025-09-15 05:16:59
13548,747067,15,45867620,90'+3',Fynn-Luca Lakenmacher (SV Darmstadt 98) Substitution at 93',2025-09-15 05:16:59
13548,747068,0,45887792,1',Noah Konig (SpVgg Greuther Fürth) Red Card at 1',2025-09-15 05:16:59
13548,747068,1,45887809,6',Paul Joly (Kaiserslautern) Yellow Card at 6',2025-09-15 05:16:59
