seasonType,eventId,commentaryOrder,playId,clockDisplayValue,commentaryText,updateDateTime
13514,756763,34,45957195,31',"Attempt missed. Alessandro Zanoli (Udinese) right footed shot from the centre of the box is close, but misses to the left. Assisted by Hassane Kamara.",2025-09-24 05:13:55
13514,756763,35,45966726,31',Aljosa Vasic (Palermo) wins a free kick in the defensive half.,2025-09-25 05:17:44
13514,756763,36,45966726,31',Foul by Matteo Palma (Udinese).,2025-09-25 05:17:44
13514,756763,37,45966729,33',"Corner, Palermo. Conceded by Hassane Kamara.",2025-09-25 05:17:44
13514,756763,38,45966730,35',Foul by Davide Veroli (Palermo).,2025-09-25 05:17:44
13514,756763,39,45966730,35',Nicolò Zaniolo (Udinese) wins a free kick in the defensive half.,2025-09-25 05:17:44
13514,756763,40,-1,36',"Corner, Udinese. Conceded by Samuel Giovane.",2025-09-24 05:13:55
13514,756763,41,45966734,37',Foul by Christian Kabasele (Udinese).,2025-09-25 05:17:44
13514,756763,42,45966734,37',Giacomo Corona (Palermo) wins a free kick in the attacking half.,2025-09-25 05:17:44
13514,756763,43,45957411,37',Christian Kabasele (Udinese) is shown the yellow card for a bad foul.,2025-09-24 05:13:55
13514,756763,44,45966737,38',Attempt saved. Davide Veroli (Palermo) header from the centre of the box is saved in the top centre of the goal by Razvan Sava (Udinese).,2025-09-25 05:17:44
13514,756763,45,45957421,41',"Goal! Udinese 1, Palermo 0. Nicolò Zaniolo (Udinese) left footed shot from outside the box to the bottom left corner. Assisted by Alessandro Zanoli.",2025-09-24 05:13:55
13514,756763,46,45966744,44',Attempt saved. Adam Buksa (Udinese) right footed shot from the centre of the box is saved in the bottom right corner by Jesse Joronen (Palermo). Assisted by Jakub Piotrowski.,2025-09-25 05:17:44
13514,756763,47,45966747,45',Attempt saved. Adam Buksa (Udinese) left footed shot from the right side of the six yard box is saved in the bottom right corner by Jesse Joronen (Palermo). Assisted by Jakub Piotrowski with a cross.,2025-09-25 05:17:44
13514,756763,48,45957443,45',"Goal! Udinese 2, Palermo 0. Lennon Miller (Udinese) header from the centre of the box to the bottom left corner.",2025-09-24 05:13:55
13514,756763,49,-1,45'+1',Fourth official has announced 1 minutes of added time.,2025-09-24 05:13:55
13514,756763,50,45957468,45'+1',"First Half ends, Udinese 2, Palermo 0.",2025-09-24 05:13:55
13514,756763,51,45957534,45',"Second Half begins Udinese 2, Palermo 0.",2025-09-24 05:13:55
13514,756763,52,45957525,45',"Substitution, Palermo. Antonio Palumbo replaces Jérémy Le Douaron.",2025-09-24 05:13:55
13514,756763,53,45957519,45',"Substitution, Palermo. Filippo Ranocchia replaces Emmanuel Gyasi.",2025-09-24 05:13:55
13514,756763,54,45957526,45',"Substitution, Palermo. Tommaso Augello replaces Niccolò Pierozzi.",2025-09-24 05:13:55
13514,756763,55,45966751,46',Foul by Aljosa Vasic (Palermo).,2025-09-25 05:17:44
13514,756763,56,45966751,46',Jakub Piotrowski (Udinese) wins a free kick in the defensive half.,2025-09-25 05:17:44
13514,756763,57,45966755,48',Foul by Filippo Ranocchia (Palermo).,2025-09-25 05:17:44
13514,756763,58,45966755,48',Lennon Miller (Udinese) wins a free kick in the defensive half.,2025-09-25 05:17:44
13514,756763,59,45966758,49',Foul by Filippo Ranocchia (Palermo).,2025-09-25 05:17:44
13514,756763,60,45966758,49',Jakub Piotrowski (Udinese) wins a free kick on the right wing.,2025-09-25 05:17:44
13514,756763,61,45966763,52',Christian Kabasele (Udinese) wins a free kick in the defensive half.,2025-09-25 05:17:44
13514,756763,62,45966763,52',Foul by Aljosa Vasic (Palermo).,2025-09-25 05:17:44
13514,756763,63,-1,52',Delay in match because of an injury Adam Buksa (Udinese).,2025-09-24 05:13:55
13514,756763,64,-1,52',Delay in match because of an injury Patryk Peda (Palermo).,2025-09-24 05:13:55
13514,756763,65,-1,56',Delay over. They are ready to continue.,2025-09-24 05:13:55
13514,756763,66,45966765,56',Foul by Claudio Gomes (Palermo).,2025-09-25 05:17:44
13514,756763,67,45966765,56',Lennon Miller (Udinese) wins a free kick in the attacking half.,2025-09-25 05:17:44
13514,756763,68,45957613,59',"Substitution, Palermo. Matteo Brunori replaces Samuel Giovane.",2025-09-26 05:20:00
13514,756763,69,45966769,59',Attempt saved. Hassane Kamara (Udinese) left footed shot from the centre of the box is saved in the bottom left corner by Jesse Joronen (Palermo).,2025-09-25 05:17:44
13514,756763,70,45957623,61',Attempt missed. Nicolò Zaniolo (Udinese) left footed shot from outside the box is too high.,2025-09-24 05:13:55
13514,756763,71,-1,64',Delay in match because of an injury Filippo Ranocchia (Palermo).,2025-09-24 05:13:55
13514,756763,72,45957640,65',"Substitution, Udinese. Thomas Kristensen replaces Christian Kabasele.",2025-09-24 05:13:55
13514,756763,73,45957641,65',"Substitution, Udinese. Keinan Davis replaces Adam Buksa.",2025-09-24 05:13:55
13514,756763,74,-1,65',Delay over. They are ready to continue.,2025-09-24 05:13:55
13514,756763,75,45957642,65',"Substitution, Palermo. Jacopo Segre replaces Filippo Ranocchia because of an injury.",2025-09-24 05:13:55
13514,756763,76,45966774,67',Attempt saved. Jakub Piotrowski (Udinese) right footed shot from the right side of the box is saved in the bottom right corner by Jesse Joronen (Palermo). Assisted by Keinan Davis.,2025-09-26 05:20:00
13514,756763,77,-1,67',"Corner, Udinese. Conceded by Jesse Joronen.",2025-09-24 05:13:55
13514,756763,78,45966778,69',Attempt blocked. Keinan Davis (Udinese) left footed shot from the right side of the box is blocked. Assisted by Jakub Piotrowski.,2025-09-25 05:17:44
13514,756763,79,-1,69',"Corner, Udinese. Conceded by Tommaso Augello.",2025-09-24 05:13:55
13514,756763,80,45966780,69',Aljosa Vasic (Palermo) wins a free kick in the defensive half.,2025-09-25 05:17:44
13514,756763,81,45966780,69',Foul by Lennon Miller (Udinese).,2025-09-25 05:17:44
13514,756763,82,45957653,70',"Substitution, Udinese. Jurgen Ekkelenkamp replaces Lennon Miller.",2025-09-24 05:13:55
13514,756763,83,45957654,70',"Substitution, Udinese. Idrissa Gueye replaces Nicolò Zaniolo.",2025-09-24 05:13:55
13514,756763,84,45966785,72',Attempt saved. Jakub Piotrowski (Udinese) right footed shot from the centre of the box is saved in the centre of the goal by Jesse Joronen (Palermo). Assisted by Keinan Davis.,2025-09-25 05:17:44
13514,756763,85,45966788,73',Foul by Alessandro Zanoli (Udinese).,2025-09-25 05:17:44
13514,756763,86,45966788,73',Matteo Brunori (Palermo) wins a free kick on the left wing.,2025-09-25 05:17:44
13514,756763,87,-1,75',Delay in match because of an injury Aljosa Vasic (Palermo).,2025-09-24 05:13:55
13514,756763,88,-1,77',Delay over. They are ready to continue.,2025-09-24 05:13:55
13514,756763,89,45966792,78',Foul by Jurgen Ekkelenkamp (Udinese).,2025-09-25 05:17:44
13514,756763,90,45966792,78',Jacopo Segre (Palermo) wins a free kick in the attacking half.,2025-09-25 05:17:44
13514,756763,91,45966796,80',Foul by Jurgen Ekkelenkamp (Udinese).,2025-09-25 05:17:44
13514,756763,92,45966796,80',Patryk Peda (Palermo) wins a free kick in the defensive half.,2025-09-25 05:17:44
13514,756763,93,45957695,81',"Substitution, Udinese. Sandi Lovric replaces Jesper Karlström.",2025-09-24 05:13:55
13514,756763,94,45966800,84',Foul by Jacopo Segre (Palermo).,2025-09-25 05:17:44
13514,756763,95,45966800,84',Jurgen Ekkelenkamp (Udinese) wins a free kick in the defensive half.,2025-09-25 05:17:44
13514,756763,96,-1,84',Delay in match because of an injury Jurgen Ekkelenkamp (Udinese).,2025-09-24 05:13:55
13514,756763,97,-1,85',Delay over. They are ready to continue.,2025-09-24 05:13:55
13514,756763,98,45966802,87',Foul by Aljosa Vasic (Palermo).,2025-09-25 05:17:44
13514,756763,99,45966802,87',Sandi Lovric (Udinese) wins a free kick in the defensive half.,2025-09-25 05:17:44
13514,756763,100,45966806,88',Attempt saved. Jakub Piotrowski (Udinese) right footed shot from outside the box is saved in the bottom right corner by Jesse Joronen (Palermo). Assisted by Hassane Kamara.,2025-09-25 05:17:44
13514,756763,101,45966807,89',Foul by Jakub Piotrowski (Udinese).,2025-09-25 05:17:44
13514,756763,102,45966807,89',Patryk Peda (Palermo) wins a free kick in the defensive half.,2025-09-25 05:17:44
13514,756763,103,45966810,90',"Offside, Palermo. Matteo Brunori is caught offside.",2025-09-25 05:17:44
13514,756763,104,-1,90',Fourth official has announced 7 minutes of added time.,2025-09-24 05:13:55
13514,756763,105,45966812,90'+1',Foul by Matteo Palma (Udinese).,2025-09-25 05:17:44
13514,756763,106,45966812,90'+1',Matteo Brunori (Palermo) wins a free kick in the defensive half.,2025-09-25 05:17:44
13514,756763,107,45966814,90'+1',Claudio Gomes (Palermo) wins a free kick in the attacking half.,2025-09-25 05:17:44
13514,756763,108,45966814,90'+1',Foul by Jurgen Ekkelenkamp (Udinese).,2025-09-25 05:17:44
13514,756763,109,45966816,90'+2',Attempt blocked. Matteo Brunori (Palermo) right footed shot from outside the box is blocked.,2025-09-25 05:17:44
13514,756763,110,-1,90'+2',"Corner, Palermo. Conceded by Alessandro Zanoli.",2025-09-24 05:13:55
13514,756763,111,45966819,90'+2',"Corner, Palermo. Conceded by Hassane Kamara.",2025-09-25 05:17:44
13514,756763,112,-1,90'+3',"Corner, Palermo. Conceded by Hassane Kamara.",2025-09-24 05:13:55
13514,756763,113,45957804,90'+3',"Goal! Udinese 2, Palermo 1. Patryk Peda (Palermo) header from the centre of the box to the bottom left corner. Assisted by Tommaso Augello with a cross following a corner.",2025-09-24 05:13:55
13514,756763,114,45957816,90'+4',"Attempt missed. Giacomo Corona (Palermo) right footed shot from the centre of the box is close, but misses the top left corner. Assisted by Matteo Brunori with a cross.",2025-09-24 05:13:55
13514,756763,115,45966823,90'+5',Attempt blocked. Claudio Gomes (Palermo) right footed shot from the left side of the box is blocked. Assisted by Matteo Brunori.,2025-09-25 05:17:44
13514,756763,116,45966825,90'+6',Handball by Claudio Gomes (Palermo).,2025-09-25 05:17:44
13514,756763,117,-1,90'+7',"Corner, Palermo. Conceded by Jurgen Ekkelenkamp.",2025-09-24 05:13:55
13514,756763,118,-1,90'+8',"Second Half ends, Udinese 2, Palermo 1.",2025-09-24 05:13:55
13514,756763,119,-1,,"Match ends, Udinese 2, Palermo 1.",2025-09-24 05:13:55
13514,756764,0,-1,,Lineups are announced and players are warming up.,2025-09-25 05:17:44
13514,756764,1,-1,,First Half begins.,2025-09-25 05:17:44
13514,756764,2,-1,4',Christian Comotto (Spezia) wins a free kick in the defensive half.,2025-09-25 05:17:44
13514,756764,3,-1,4',Foul by Enrico Delprato (Parma).,2025-09-25 05:17:44
13514,756764,4,-1,6',Foul by Oliver Sørensen (Parma).,2025-09-25 05:17:44
13514,756764,5,-1,6',Ádám Nagy (Spezia) wins a free kick in the defensive half.,2025-09-25 05:17:44
13514,756764,6,-1,8',Foul by Andrea Cistana (Spezia).,2025-09-25 05:17:44
13514,756764,7,-1,8',Mateo Pellegrino (Parma) wins a free kick on the right wing.,2025-09-25 05:17:44
13514,756764,8,-1,16',Fellipe Jack Ozilio Moreira Pacheco (Spezia) wins a free kick in the defensive half.,2025-09-25 05:17:44
13514,756764,9,-1,16',Foul by Mateo Pellegrino (Parma).,2025-09-25 05:17:44
13514,756764,10,-1,21',Adrian Benedyczak (Parma) wins a free kick in the defensive half.,2025-09-25 05:17:44
13514,756764,11,-1,21',Foul by Fellipe Jack Ozilio Moreira Pacheco (Spezia).,2025-09-25 05:17:44
13514,756764,12,-1,22',"Offside, Parma. Mateo Pellegrino is caught offside.",2025-09-25 05:17:44
13514,756764,13,-1,25',Attempt blocked. Abdoulaye Ndiaye (Parma) left footed shot from outside the box is blocked. Assisted by Nahuel Estévez.,2025-09-25 05:17:44
13514,756764,14,-1,25',"Corner, Parma. Conceded by Francesco Cassata.",2025-09-25 05:17:44
13514,756764,15,45965103,26',"Goal! Parma 1, Spezia 0. Sascha Britschgi (Parma) right footed shot from outside the box to the bottom right corner following a corner.",2025-09-25 05:17:44
13514,756764,16,45965496,28',Attempt blocked. Sascha Britschgi (Parma) left footed shot from outside the box is blocked. Assisted by Enrico Delprato.,2025-09-25 05:17:44
13514,756764,17,-1,28',Attempt blocked. Mateo Pellegrino (Parma) left footed shot from the centre of the box is blocked.,2025-09-25 05:17:44
13514,756764,18,-1,29',Foul by Andrea Cistana (Spezia).,2025-09-25 05:17:44
13514,756764,19,-1,29',Mateo Pellegrino (Parma) wins a free kick in the attacking half.,2025-09-25 05:17:44
13514,756764,20,-1,30',Sascha Britschgi (Parma) wins a free kick on the right wing.,2025-09-25 05:17:44
13514,756764,21,-1,30',Foul by Giuseppe Aurelio (Spezia).,2025-09-25 05:17:44
13514,756764,22,-1,31',Attempt saved. Adrian Benedyczak (Parma) header from the centre of the box is saved in the top left corner by Mouhamadou Sarr (Spezia). Assisted by Nahuel Estévez with a cross.,2025-09-25 05:17:44
13514,756764,23,45965484,31',"Corner, Parma. Conceded by Mouhamadou Sarr.",2025-09-25 05:17:44
13514,756764,24,-1,34',Foul by Christian Ordóñez (Parma).,2025-09-25 05:17:44
13514,756764,25,-1,34',Francesco Cassata (Spezia) wins a free kick in the attacking half.,2025-09-25 05:17:44
13514,756764,26,-1,35',Foul by Fellipe Jack Ozilio Moreira Pacheco (Spezia).,2025-09-25 05:17:44
13514,756764,27,-1,35',Mateo Pellegrino (Parma) wins a free kick on the right wing.,2025-09-25 05:17:44
13514,756764,28,45965123,36',Fellipe Jack Ozilio Moreira Pacheco (Spezia) is shown the yellow card for a bad foul.,2025-09-25 05:17:44
13514,756764,29,-1,39',Attempt blocked. Luca Vignali (Spezia) right footed shot from outside the box is blocked.,2025-09-25 05:17:44
13514,756764,30,45965485,39',"Corner, Spezia. Conceded by Oliver Sørensen.",2025-09-25 05:17:44
13514,756764,31,-1,42',Attempt saved. Nahuel Estévez (Parma) right footed shot from outside the box is saved in the centre of the goal by Mouhamadou Sarr (Spezia).,2025-09-25 05:17:44
13514,756764,32,-1,42',"Corner, Parma. Conceded by Mouhamadou Sarr.",2025-09-25 05:17:44
13514,756764,33,45965133,44',"Goal! Parma 1, Spezia 1. Giuseppe Aurelio (Spezia) left footed shot from the centre of the box to the bottom left corner. Assisted by Luca Vignali.",2025-09-25 05:17:44
13514,756764,34,-1,45',"Corner, Parma. Conceded by Giuseppe Aurelio.",2025-09-25 05:17:44
13514,756764,35,45965142,45',Attempt missed. Sascha Britschgi (Parma) left footed shot from outside the box misses to the right following a corner.,2025-09-25 05:17:44
13514,756764,36,-1,45',Fourth official has announced 1 minutes of added time.,2025-09-25 05:17:44
13514,756764,37,-1,45'+1',Attempt saved. Abdoulaye Ndiaye (Parma) left footed shot from the centre of the box is saved in the top left corner by Mouhamadou Sarr (Spezia). Assisted by Sascha Britschgi.,2025-09-25 05:17:44
13514,756764,38,45965140,45'+1',"Goal! Parma 2, Spezia 1. Mateo Pellegrino (Parma) header from the centre of the box to the bottom right corner. Assisted by Adrian Benedyczak following a corner.",2025-09-25 05:17:44
13514,756764,39,-1,45'+3',"First Half ends, Parma 2, Spezia 1.",2025-09-25 05:17:44
13514,756764,40,45965165,45',"Second Half begins Parma 2, Spezia 1.",2025-09-25 05:17:44
13514,756764,41,45965164,45',"Substitution, Parma. Alessandro Circati replaces Enrico Delprato.",2025-09-25 05:17:44
13514,756764,42,45965158,45',"Substitution, Parma. Elia Plicco replaces Oliver Sørensen.",2025-09-25 05:17:44
13514,756764,43,-1,47',Handball by Mateo Pellegrino (Parma).,2025-09-25 05:17:44
13514,756764,44,-1,50',Andrea Cistana (Spezia) wins a free kick in the defensive half.,2025-09-25 05:17:44
13514,756764,45,-1,50',Foul by Nahuel Estévez (Parma).,2025-09-25 05:17:44
13514,756764,46,-1,50',Christian Comotto (Spezia) wins a free kick in the defensive half.,2025-09-25 05:17:44
13514,756764,47,-1,50',Foul by Alessandro Circati (Parma).,2025-09-25 05:17:44
13514,756764,48,45965546,52',Attempt saved. Mateo Pellegrino (Parma) left footed shot from a difficult angle on the left is saved in the bottom left corner by Mouhamadou Sarr (Spezia). Assisted by Mathias Løvik.,2025-09-25 05:17:44
13514,756764,49,-1,54',Foul by Christian Ordóñez (Parma).,2025-09-25 05:17:44
13514,756764,50,-1,54',Vanja Vlahovic (Spezia) wins a free kick in the attacking half.,2025-09-25 05:17:44
13514,756764,51,45965195,57',"Substitution, Spezia. Gianluca Lapadula replaces Gabriele Artistico.",2025-09-25 05:17:44
13514,756764,52,45965196,57',"Substitution, Spezia. Rachid Kouda replaces Francesco Cassata.",2025-09-25 05:17:44
13514,756764,53,-1,59',Attempt blocked. Gianluca Lapadula (Spezia) header from the centre of the box is blocked. Assisted by Ádám Nagy.,2025-09-25 05:17:44
13514,756764,54,-1,60',Foul by Elia Plicco (Parma).,2025-09-25 05:17:44
13514,756764,55,-1,60',Rachid Kouda (Spezia) wins a free kick on the right wing.,2025-09-25 05:17:44
13514,756764,56,45965488,61',"Corner, Spezia. Conceded by Mariano Troilo.",2025-09-25 05:17:44
13514,756764,57,-1,62',Attempt saved. Gianluca Lapadula (Spezia) left footed shot from the right side of the box is saved in the top centre of the goal by Zion Suzuki (Parma). Assisted by Rachid Kouda with a headed pass.,2025-09-25 05:17:44
13514,756764,58,-1,63',Foul by Adrian Benedyczak (Parma).,2025-09-25 05:17:44
13514,756764,59,-1,63',Rachid Kouda (Spezia) wins a free kick in the attacking half.,2025-09-25 05:17:44
13514,756764,60,-1,64',Attempt blocked. Gianluca Lapadula (Spezia) left footed shot from outside the box is blocked.,2025-09-25 05:17:44
13514,756764,61,-1,64',Christian Comotto (Spezia) wins a free kick on the left wing.,2025-09-25 05:17:44
13514,756764,62,-1,64',Foul by Sascha Britschgi (Parma).,2025-09-25 05:17:44
13514,756764,63,45965489,65',"Corner, Spezia. Conceded by Zion Suzuki.",2025-09-25 05:17:44
13514,756764,64,-1,67',Attempt saved. Christian Comotto (Spezia) header from the centre of the box is saved in the centre of the goal by Zion Suzuki (Parma). Assisted by Andrea Cistana with a cross.,2025-09-25 05:17:44
13514,756764,65,-1,69',Foul by Mariano Troilo (Parma).,2025-09-25 05:17:44
13514,756764,66,-1,69',Gianluca Lapadula (Spezia) wins a free kick on the left wing.,2025-09-25 05:17:44
13514,756764,67,45965227,70',"Substitution, Spezia. Pietro Beruatto replaces Giuseppe Aurelio.",2025-09-25 05:17:44
13514,756764,68,45965229,70',"Substitution, Spezia. Antonio Candela replaces Luca Vignali.",2025-09-25 05:17:44
13514,756764,69,45965228,70',"Substitution, Parma. Mandela Keita replaces Nahuel Estévez.",2025-09-25 05:17:44
13514,756764,70,-1,71',"Offside, Spezia. Gianluca Lapadula is caught offside.",2025-09-25 05:17:44
13514,756764,71,45965234,71',Attempt missed. Mateo Pellegrino (Parma) right footed shot from the centre of the box misses to the right. Assisted by Adrian Benedyczak with a cross.,2025-09-25 05:17:44
13514,756764,72,-1,73',Foul by Abdoulaye Ndiaye (Parma).,2025-09-25 05:17:44
13514,756764,73,-1,73',Gianluca Lapadula (Spezia) wins a free kick in the attacking half.,2025-09-25 05:17:44
13514,756764,74,45965240,73',"Substitution, Parma. Patrick Cutrone replaces Adrian Benedyczak.",2025-09-25 05:17:44
13514,756764,75,-1,75',Attempt saved. Vanja Vlahovic (Spezia) left footed shot from the centre of the box is saved in the centre of the goal by Zion Suzuki (Parma).,2025-09-25 05:17:44
13514,756764,76,-1,76',Antonio Candela (Spezia) wins a free kick on the right wing.,2025-09-25 05:17:44
13514,756764,77,-1,76',Foul by Elia Plicco (Parma).,2025-09-25 05:17:44
13514,756764,78,45965261,76',Elia Plicco (Parma) is shown the red card.,2025-09-25 05:17:44
13514,756764,79,-1,79',Foul by Christian Comotto (Spezia).,2025-09-25 05:17:44
13514,756764,80,-1,79',Sascha Britschgi (Parma) wins a free kick in the defensive half.,2025-09-25 05:17:44
13514,756764,81,45965270,80',"Substitution, Spezia. Edoardo Soleri replaces Matteo Onofri.",2025-09-25 05:17:44
13514,756764,82,45965271,80',"Substitution, Parma. Adrián Bernabé replaces Mateo Pellegrino.",2025-09-25 05:17:44
13514,756764,83,-1,81',Attempt saved. Adrián Bernabé (Parma) left footed shot from outside the box is saved in the centre of the goal by Mouhamadou Sarr (Spezia).,2025-09-25 05:17:44
13514,756764,84,45965278,82',Attempt missed. Christian Comotto (Spezia) right footed shot from outside the box misses to the left.,2025-09-25 05:17:44
13514,756764,85,45965279,82',"Goal! Parma 2, Spezia 2. Gianluca Lapadula (Spezia) left footed shot from the centre of the box to the bottom right corner. Assisted by Christian Comotto.",2025-09-25 05:17:44
13514,756764,86,-1,84',Foul by Vanja Vlahovic (Spezia).,2025-09-25 05:17:44
13514,756764,87,-1,84',Mariano Troilo (Parma) wins a free kick in the defensive half.,2025-09-25 05:17:44
13514,756764,88,-1,85',Foul by Mathias Løvik (Parma).,2025-09-25 05:17:44
13514,756764,89,-1,85',Rachid Kouda (Spezia) wins a free kick on the right wing.,2025-09-25 05:17:44
13514,756764,90,-1,86',Foul by Pietro Beruatto (Spezia).,2025-09-25 05:17:44
13514,756764,91,-1,86',Patrick Cutrone (Parma) wins a free kick on the right wing.,2025-09-25 05:17:44
13514,756764,92,45965298,86',Attempt missed. Christian Ordóñez (Parma) left footed shot from outside the box is too high. Assisted by Patrick Cutrone following a set piece situation.,2025-09-25 05:17:44
13514,756764,93,45965322,88',Attempt missed. Edoardo Soleri (Spezia) header from the centre of the box misses to the left. Assisted by Antonio Candela with a cross.,2025-09-25 05:17:44
13514,756764,94,-1,88',Adrián Bernabé (Parma) wins a free kick in the defensive half.,2025-09-25 05:17:44
13514,756764,95,-1,88',Foul by Pietro Beruatto (Spezia).,2025-09-25 05:17:44
13514,756764,96,45965593,89',Attempt saved. Patrick Cutrone (Parma) left footed shot from outside the box is saved in the bottom right corner by Mouhamadou Sarr (Spezia). Assisted by Adrián Bernabé.,2025-09-25 05:17:44
13514,756764,97,-1,90',Fourth official has announced 4 minutes of added time.,2025-09-25 05:17:44
13514,756764,98,-1,90'+1',Edoardo Soleri (Spezia) wins a free kick in the attacking half.,2025-09-25 05:17:44
13514,756764,99,-1,90'+1',Foul by Mariano Troilo (Parma).,2025-09-25 05:17:44
13514,756764,100,-1,90'+4',Foul by Sascha Britschgi (Parma).,2025-09-25 05:17:44
13514,756764,101,-1,90'+4',Gianluca Lapadula (Spezia) wins a free kick in the defensive half.,2025-09-25 05:17:44
13514,756764,102,-1,90'+5',"Second Half ends, Parma 2, Spezia 2.",2025-09-25 05:17:44
13514,756764,103,-1,90',"Penalty Shootout begins Parma 2, Spezia 2.",2025-09-25 05:17:44
13514,756764,104,45965407,91',Penalty saved. Edoardo Soleri (Spezia) right footed shot saved in the bottom left corner by Zion Suzuki (Parma).,2025-09-25 05:17:44
13514,756764,105,45965412,92',"Goal! Parma 2(1), Spezia 2. Patrick Cutrone (Parma) converts the penalty with a right footed shot to the bottom right corner.",2025-09-25 05:17:44
13514,756764,106,45965419,93',"Goal! Parma 2(1), Spezia 2(1). Rachid Kouda (Spezia) converts the penalty with a right footed shot to the centre of the goal.",2025-09-25 05:17:44
13514,756764,107,45965428,94',"Goal! Parma 2(2), Spezia 2(1). Abdoulaye Ndiaye (Parma) converts the penalty with a left footed shot to the bottom right corner.",2025-09-25 05:17:44
13514,756764,108,45965437,94',"Goal! Parma 2(2), Spezia 2(2). Vanja Vlahovic (Spezia) converts the penalty with a right footed shot to the high centre of the goal.",2025-09-25 05:17:44
13514,756764,109,45965447,95',"Goal! Parma 2(3), Spezia 2(2). Adrián Bernabé (Parma) converts the penalty with a left footed shot to the high centre of the goal.",2025-09-25 05:17:44
13514,756764,110,45965451,96',Penalty missed. Gianluca Lapadula (Spezia) left footed shot is just a bit too high.,2025-09-25 05:17:44
13514,756764,111,45965470,97',Penalty saved. Alessandro Circati (Parma) right footed shot saved in the bottom right corner by Mouhamadou Sarr (Spezia).,2025-09-25 05:17:44
13514,756764,112,45965477,98',"Goal! Parma 2(3), Spezia 2(3). Fellipe Jack Ozilio Moreira Pacheco (Spezia) converts the penalty with a left footed shot to the bottom left corner.",2025-09-25 05:17:44
13514,756764,113,45965481,98',"Goal! Parma 2(4), Spezia 2(3). Christian Ordóñez (Parma) converts the penalty with a right footed shot to the top left corner.",2025-09-25 05:17:44
13514,756764,114,-1,99',"Penalty Shootout ends, Parma 2(4), Spezia 2(3).",2025-09-25 05:17:44
13514,756764,115,-1,,"Match ends, Parma 2(4), Spezia 2(3).",2025-09-25 05:17:44
13514,756765,0,-1,,Lineups are announced and players are warming up.,2025-09-26 05:20:00
13514,756765,1,45977194,,First Half begins.,2025-09-26 05:20:00
13514,756765,2,45977208,1',Attempt missed. Cesare Casadei (Torino) right footed shot from outside the box misses to the left. Assisted by Ché Adams.,2025-09-28 05:17:47
13514,756765,3,45985600,4',"Offside, Torino. Alieu Njie is caught offside.",2025-09-28 05:17:47
13514,756765,4,45985602,5',Foul by Ali Dembélé (Torino).,2025-09-28 05:17:47
13514,756765,5,45985602,5',Gabriele Piccinini (Pisa) wins a free kick in the defensive half.,2025-09-28 05:17:47
13514,756765,6,45977327,8',"Attempt missed. Cesare Casadei (Torino) header from the centre of the box is close, but misses to the left. Assisted by Marcus Pedersen with a cross.",2025-09-26 05:20:00
13514,756765,7,-1,9',"Corner, Torino. Conceded by Jeremy Kandje Mbambi.",2025-09-26 05:20:00
13514,756765,8,45977354,9',"Goal! Torino 1, Pisa 0. Cesare Casadei (Torino) header from the centre of the box to the bottom right corner. Assisted by Cyril Ngonge with a cross following a corner.",2025-09-26 05:20:00
13514,756765,9,45985609,11',Foul by Niels Nkounkou (Torino).,2025-09-28 05:17:47
13514,756765,10,45985609,11',Isak Vural (Pisa) wins a free kick in the defensive half.,2025-09-28 05:17:47
13514,756765,11,45985611,12',Alieu Njie (Torino) wins a free kick in the defensive half.,2025-09-28 05:17:47
13514,756765,12,45985611,12',Foul by Simone Canestrelli (Pisa).,2025-09-28 05:17:47
13514,756765,13,45980091,13',"Corner, Torino. Conceded by Simone Canestrelli.",2025-09-26 05:20:00
