seasonType,eventId,commentaryOrder,playId,clockDisplayValue,commentaryText,updateDateTime
13496,742336,0,45558388,38',Djenario Daniels (Kilmarnock) Goal at 38',2025-08-03 04:42:14
13496,742336,1,45558389,42',David Watson (Kilmarnock) Goal at 42',2025-08-03 04:42:14
13496,742336,2,45558661,45',Zak Rudden (Livingston) Substitution at 45',2025-08-03 04:42:14
13496,742336,3,45558759,49',Adam Montgomery (Livingston) Yellow Card at 49',2025-08-03 04:42:14
13496,742336,4,45559005,61',Bruce Anderson (Kilmarnock) Substitution at 61',2025-08-03 04:42:14
13496,742336,5,45559119,65',George Stanger (Kilmarnock) Red Card at 65',2025-08-03 04:42:14
13496,742336,6,45559140,66',Robbie Muirhead (Livingston) Penalty - Scored at 66',2025-08-03 04:42:14
13496,742336,7,45559215,68',Rory McKenzie (Kilmarnock) Substitution at 68',2025-08-03 04:42:14
13496,742336,8,45559284,72',Lewis Smith (Livingston) Substitution at 72',2025-08-03 04:42:14
13496,742336,9,45559331,73',Brad Lyons (Kilmarnock) Yellow Card at 73',2025-08-03 04:42:14
13496,742336,10,45559432,77',Stevie May (Livingston) Substitution at 77',2025-08-03 04:42:14
13496,742336,11,45559573,81',Bruce Anderson (Kilmarnock) Yellow Card at 81',2025-08-03 04:42:14
13496,742336,12,45559574,82',Jeremy Bokila (Livingston) Substitution at 82',2025-08-03 04:42:14
13496,742336,13,45559626,85',Dominic Thompson (Kilmarnock) Substitution at 85',2025-08-03 04:42:14
13496,742336,14,45559675,86',Scott Pittman (Livingston) Goal at 86',2025-08-03 04:42:14
13496,742336,15,45559732,89',Daniel Finlayson (Livingston) Yellow Card at 89',2025-08-03 04:42:14
13496,742337,0,45560396,14',James Tavernier (Rangers) Goal at 14',2025-08-03 04:42:14
13496,742337,1,45560863,60',Elliot Watt (Motherwell) Yellow Card at 60',2025-08-03 04:42:14
13496,742337,2,45560875,63',Cyriel Dessers (Rangers) Substitution at 63',2025-08-03 04:42:14
13496,742337,3,45560876,63',Lyall Cameron (Rangers) Substitution at 63',2025-08-03 04:42:14
13496,742337,4,45560881,64',Lyall Cameron (Rangers) Yellow Card at 64',2025-08-03 04:42:14
13496,742337,5,45560910,71',Stephen O'Donnell (Motherwell) Substitution at 71',2025-08-03 04:42:14
13496,742337,6,45560913,73',Nedim Bajrami (Rangers) Substitution at 73',2025-08-03 04:42:14
13496,742337,7,45560914,73',Connor Barron (Rangers) Substitution at 73',2025-08-03 04:42:14
13496,742337,8,45560922,79',Ibrahim Sa'Id (Motherwell) Substitution at 79',2025-08-03 04:42:14
13496,742337,9,45560927,83',Oscar Cortés (Rangers) Substitution at 83',2025-08-03 04:42:14
13496,742337,10,45560932,84',Kieran Dowell (Rangers) Yellow Card at 84',2025-08-03 04:42:14
13496,742337,11,45560937,87',Emmanuel Longelo (Motherwell) Goal at 87',2025-08-03 04:42:14
13496,742337,12,45560950,90',Max Aarons (Rangers) Yellow Card at 90',2025-08-03 04:42:14
13496,742337,13,45560956,90'+1',Kofi Balmer (Motherwell) Substitution at 91',2025-08-03 04:42:14
13496,742337,14,45560957,90'+1',Tom Sparrow (Motherwell) Substitution at 91',2025-08-03 04:42:14
13496,742337,15,45560960,90'+2',James Tavernier (Rangers) Yellow Card at 92',2025-08-03 04:42:14
13496,742338,0,45566817,40',Max Watters (Dundee United) Goal at 40',2025-08-05 04:49:26
13496,742338,1,45566915,49',Zachary Sapsford (Dundee United) Yellow Card at 49',2025-08-05 04:49:26
13496,742338,2,45566917,50',Dylan Tait (Falkirk) Goal at 50',2025-08-05 04:49:26
13496,742338,3,45566925,56',Keelan Adams (Falkirk) Yellow Card at 56',2025-08-05 04:49:26
13496,742338,4,45566926,58',Ross Maciver (Falkirk) Substitution at 58',2025-08-05 04:49:26
13496,742338,5,45566927,58',Aidan Nesbitt (Falkirk) Substitution at 58',2025-08-05 04:49:26
13496,742338,6,45566932,62',Krisztián Keresztes (Dundee United) Yellow Card at 62',2025-08-05 04:49:26
13496,742338,7,45566937,65',Owen Stirton (Dundee United) Substitution at 65',2025-08-05 04:49:26
13496,742338,8,45566939,67',Iurie Iovu (Dundee United) Yellow Card at 67',2025-08-05 04:49:26
13496,742338,9,45566940,71',Ivan Dolcek (Dundee United) Goal at 71',2025-08-05 04:49:26
13496,742338,10,45566943,73',Ethan Ross (Falkirk) Goal at 73',2025-08-05 04:49:26
13496,742338,11,45566946,74',Isaac Pappoe (Dundee United) Yellow Card at 74',2025-08-05 04:49:26
13496,742338,12,45566947,75',Alfredo Agyeman (Falkirk) Substitution at 75',2025-08-05 04:49:26
13496,742338,13,45566952,79',Henry Cartwright (Falkirk) Substitution at 79',2025-08-05 04:49:26
13496,742338,14,45566956,83',Miller Thomson (Dundee United) Substitution at 83',2025-08-05 04:49:26
13496,742338,15,45566962,90'+2',Kai Fotheringham (Dundee United) Substitution at 92',2025-08-05 04:49:26
13496,742338,16,45566964,90'+7',Vicko Sevelj (Dundee United) Yellow Card at 97',2025-08-05 04:49:26
13496,742339,0,45566936,20',Finlay Robertson (Dundee) Yellow Card at 20',2025-08-04 04:47:36
13496,742339,1,45566941,28',Kieron Bowie (Hibernian) Goal at 28',2025-08-04 04:47:36
13496,742339,2,45566948,31',Kieron Bowie (Hibernian) Goal at 31',2025-08-04 04:47:36
13496,742339,3,45566953,36',Finlay Robertson (Dundee) Goal at 36',2025-08-04 04:47:36
13496,742339,4,45566976,57',Jamie McGrath (Hibernian) Substitution at 57',2025-08-04 04:47:36
13496,742339,5,45566977,57',Josh Campbell (Hibernian) Substitution at 57',2025-08-04 04:47:36
13496,742339,6,45566978,60',Clark Robertson (Dundee) Yellow Card at 60',2025-08-04 04:47:36
13496,742339,7,45566990,71',Ethan Ingram (Dundee) Yellow Card at 71',2025-08-04 04:47:36
13496,742339,8,45567004,80',Élie Youan (Hibernian) Substitution at 80',2025-08-04 04:47:36
13496,742339,9,45567005,80',Alasana Manneh (Hibernian) Substitution at 80',2025-08-04 04:47:36
13496,742339,10,45567006,80',Aaron Donnelly (Dundee) Substitution at 80',2025-08-04 04:47:36
13496,742339,11,45567007,80',Drey Wright (Dundee) Substitution at 80',2025-08-04 04:47:36
13496,742339,12,45567008,80',Tony Yogane (Dundee) Substitution at 80',2025-08-04 04:47:36
13496,742339,13,45567175,85',Alasana Manneh (Hibernian) Yellow Card at 85',2025-08-04 04:47:36
13496,742339,14,45567176,85',Cesar Garza (Dundee) Substitution at 85',2025-08-04 04:47:36
13496,742340,0,45567428,44',Roland Idowu (St Mirren) Yellow Card at 44',2025-08-04 04:47:36
13496,742340,1,45567477,45',Jonah Ayunga (St Mirren) Substitution at 45',2025-08-04 04:47:36
13496,742340,2,45567524,59',James Forrest (Celtic) Substitution at 59',2025-08-04 04:47:36
13496,742340,3,45567539,64',Adam Idah (Celtic) Yellow Card at 64',2025-08-04 04:47:36
13496,742340,4,45567547,65',Auston Trusty (Celtic) Substitution at 65',2025-08-04 04:47:36
13496,742340,5,45567582,78',Johnny Kenny (Celtic) Substitution at 78',2025-08-04 04:47:36
13496,742340,6,45567583,78',Luke McCowan (Celtic) Substitution at 78',2025-08-04 04:47:36
13496,742340,7,45567584,78',Arne Engels (Celtic) Substitution at 78',2025-08-04 04:47:36
13496,742340,8,45567585,79',Evan Mooney (St Mirren) Substitution at 79',2025-08-04 04:47:36
13496,742340,9,45567592,79',Oisin Smyth (St Mirren) Substitution at 79',2025-08-04 04:47:36
13496,742340,10,45567593,79',Tunmise Sobowale (St Mirren) Substitution at 79',2025-08-04 04:47:36
13496,742340,11,45567610,87',Luke McCowan (Celtic) Goal at 87',2025-08-04 04:47:36
13496,742340,12,45567616,89',Arne Engels (Celtic) Yellow Card at 89',2025-08-04 04:47:36
13496,742340,13,45567625,90'+1',Malik Dijksteel (St Mirren) Substitution at 91',2025-08-04 04:47:36
13496,742341,0,45575036,11',Graeme Shinnie (Aberdeen) Own Goal at 11',2025-08-05 04:49:26
13496,742341,1,45575056,19',Frankie Kent (Heart of Midlothian) Yellow Card at 19',2025-08-05 04:49:26
13496,742341,2,45575352,54',Craig Halkett (Heart of Midlothian) Yellow Card at 54',2025-08-05 04:49:26
13496,742341,3,45575369,60',Adil Aouchiche (Aberdeen) Yellow Card at 60',2025-08-05 04:49:26
13496,742341,4,45575376,61',Cameron Devlin (Heart of Midlothian) Yellow Card at 61',2025-08-05 04:49:26
13496,742341,5,45575378,62',Dante Polvara (Aberdeen) Substitution at 62',2025-08-05 04:49:26
13496,742341,6,45575381,62',Fletcher Boyd (Aberdeen) Substitution at 62',2025-08-05 04:49:26
13496,742341,7,45575388,69',Shayden Morris (Aberdeen) Substitution at 69',2025-08-05 04:49:26
13496,742341,8,45575390,70',Michael Steinwender (Heart of Midlothian) Substitution at 70',2025-08-05 04:49:26
13496,742341,9,45575391,70',Alexandros Kyziridis (Heart of Midlothian) Substitution at 70',2025-08-05 04:49:26
13496,742341,10,45575392,70',Alan Forrest (Heart of Midlothian) Substitution at 70',2025-08-05 04:49:26
13496,742341,11,45575393,71',James Wilson (Heart of Midlothian) Substitution at 71',2025-08-05 04:49:26
13496,742341,12,45575396,73',Stuart Findlay (Heart of Midlothian) Goal at 73',2025-08-05 04:49:26
13496,742341,13,45575747,78',Nicolas Milanovic (Aberdeen) Yellow Card at 78',2025-08-05 04:49:26
13496,742341,14,45575765,80',Ester Sokler (Aberdeen) Substitution at 80',2025-08-07 04:51:18
13496,742341,15,45575766,81',Nicky Devlin (Aberdeen) Substitution at 81',2025-08-05 04:49:26
13496,742341,16,45575952,90'+1',Tómas Magnússon (Heart of Midlothian) Substitution at 91',2025-08-05 04:49:26
13496,742342,0,45611173,19',Lawrence Shankland (Heart of Midlothian) Penalty - Scored at 19',2025-08-11 04:43:25
13496,742342,1,45611190,22',Ivan Dolcek (Dundee United) Goal at 22',2025-08-11 04:43:25
13496,742342,2,45611257,31',Harry Milne (Heart of Midlothian) Yellow Card at 31',2025-08-11 04:43:25
13496,742342,3,45611445,41',Ivan Dolcek (Dundee United) Goal at 41',2025-08-11 04:43:25
13496,742342,4,45611464,43',Krisztián Keresztes (Dundee United) Yellow Card at 43',2025-08-11 04:43:25
13496,742342,5,45611564,45',Michael Steinwender (Heart of Midlothian) Substitution at 45',2025-08-11 04:43:25
13496,742342,6,45611579,45',Alexandros Kyziridis (Heart of Midlothian) Substitution at 45',2025-08-11 04:43:25
13496,742342,7,45611632,50',Panutche Camara (Dundee United) Yellow Card at 50',2025-08-11 04:43:25
13496,742342,8,45611801,58',Stuart Findlay (Heart of Midlothian) Goal at 58',2025-08-11 04:43:25
13496,742342,9,45611827,63',Sabah Kerjota (Heart of Midlothian) Substitution at 63',2025-08-11 04:43:25
13496,742342,10,45611840,66',Amar Ahmed (Dundee United) Substitution at 66',2025-08-11 04:43:25
13496,742342,11,45611847,66',Kai Fotheringham (Dundee United) Substitution at 66',2025-08-11 04:43:25
13496,742342,12,45611920,77',Stephen Kingsley (Heart of Midlothian) Substitution at 77',2025-08-11 04:43:25
13496,742342,13,45611989,83',Cláudio Braga (Heart of Midlothian) Yellow Card at 83',2025-08-11 04:43:25
13496,742342,14,45611990,84',James Wilson (Heart of Midlothian) Substitution at 84',2025-08-11 04:43:25
13496,742342,15,45612008,86',Vicko Sevelj (Dundee United) Yellow Card at 86',2025-08-11 04:43:25
13496,742342,16,45612079,90'+2',Alexandros Kyziridis (Heart of Midlothian) Yellow Card at 92',2025-08-11 04:43:25
13496,742342,17,45612101,90'+4',Stuart Findlay (Heart of Midlothian) Goal at 94',2025-08-11 04:43:25
13496,742342,18,45612115,90'+4',Stuart Findlay (Heart of Midlothian) Yellow Card at 94',2025-08-11 04:43:25
13496,742343,0,45611115,11',Lewis Mayo (Kilmarnock) Yellow Card at 11',2025-08-11 04:43:25
13496,742343,1,45611177,20',Rocky Bushiri (Hibernian) Goal at 20',2025-08-11 04:43:25
13496,742343,2,45611242,27',Élie Youan (Hibernian) Goal at 27',2025-08-11 04:43:25
13496,742343,3,45611465,45',Liam Polworth (Kilmarnock) Goal at 45',2025-08-11 04:43:25
13496,742343,4,45611622,48',Ben Brannan (Kilmarnock) Goal at 48',2025-08-11 04:43:25
13496,742343,5,45611800,57',Jamie Brandon (Kilmarnock) Yellow Card at 57',2025-08-11 04:43:25
13496,742343,6,45611802,59',Jack Iredale (Hibernian) Substitution at 59',2025-08-11 04:43:25
13496,742343,7,45611809,59',Martin Boyle (Hibernian) Substitution at 59',2025-08-11 04:43:25
13496,742343,8,45611810,59',Christopher Cadden (Hibernian) Substitution at 59',2025-08-11 04:43:25
13496,742343,9,45611829,63',Greg Kiltie (Kilmarnock) Substitution at 63',2025-08-11 04:43:25
13496,742343,10,45611862,68',Dominic Thompson (Kilmarnock) Substitution at 68',2025-08-11 04:43:25
13496,742343,11,45611894,73',Josh Mulligan (Hibernian) Yellow Card at 73',2025-08-11 04:43:25
13496,742343,12,45611960,82',Josh Campbell (Hibernian) Substitution at 82',2025-08-11 04:43:25
13496,742343,13,45611971,82',Bruce Anderson (Kilmarnock) Substitution at 82',2025-08-11 04:43:25
13496,742343,14,45612068,90'+1',Thibault Klidje (Hibernian) Substitution at 91',2025-08-11 04:43:25
13496,742344,0,45597513,4',Graham Carey (Livingston) Yellow Card at 4',2025-08-10 04:46:51
13496,742344,1,45597700,14',Shane Blaney (Livingston) Substitution at 14',2025-08-10 04:46:51
13496,742344,2,45597777,18',Scott Pittman (Livingston) Goal at 18',2025-08-10 04:46:51
13496,742344,3,45597934,26',Alfredo Agyeman (Falkirk) Substitution at 26',2025-08-10 04:46:51
13496,742344,4,45598344,37',Mohamad Sylla (Livingston) Substitution at 37',2025-08-10 04:46:51
13496,742344,5,45598504,44',Robbie Muirhead (Livingston) Yellow Card at 44',2025-08-10 04:46:51
13496,742344,6,45598589,45'+3',Lewis Smith (Livingston) Goal at 48',2025-08-10 04:46:51
13496,742344,7,45598797,45',Sean Mackie (Falkirk) Substitution at 45',2025-08-10 04:46:51
13496,742344,8,45598829,45',Brian Graham (Falkirk) Substitution at 45',2025-08-10 04:46:51
13496,742344,9,45598857,45',Cristian Montano (Livingston) Substitution at 45',2025-08-10 04:46:51
13496,742344,10,45598937,50',Liam Henderson (Falkirk) Yellow Card at 50',2025-08-10 04:46:51
13496,742344,11,45599082,55',Robbie Muirhead (Livingston) Penalty - Saved at 55',2025-08-10 04:46:51
13496,742344,12,45599270,59',Brad Spencer (Falkirk) Yellow Card at 59',2025-08-10 04:46:51
13496,742344,13,45599479,67',Jeremy Bokila (Livingston) Substitution at 67',2025-08-10 04:46:51
13496,742344,14,45599510,67',Tete Yengi (Livingston) Substitution at 67',2025-08-10 04:46:51
13496,742344,15,45599553,67',Henry Cartwright (Falkirk) Substitution at 67',2025-08-10 04:46:51
13496,742344,16,45599720,74',Ross Maciver (Falkirk) Goal at 74',2025-08-10 04:46:51
13496,742344,17,45599773,76',Scott Arfield (Falkirk) Substitution at 76',2025-08-10 04:46:51
13496,742344,18,45599927,78',Cristian Montano (Livingston) Yellow Card at 78',2025-08-13 04:48:06
13496,742344,19,45600165,84',Jeremy Bokila (Livingston) Yellow Card at 84',2025-08-10 04:46:51
13496,742344,20,45600247,88',Jeremy Bokila (Livingston) Goal at 88',2025-08-10 04:46:51
13496,742345,0,45597905,25',Alexander Gogic (St Mirren) Yellow Card at 25',2025-08-10 04:46:51
13496,742345,1,45598463,42',Tom Sparrow (Motherwell) Substitution at 42',2025-08-10 04:46:51
13496,742345,2,45598581,45'+2',Jayden Richardson (St Mirren) Yellow Card at 47',2025-08-10 04:46:51
13496,742345,3,45598703,45',Evan Mooney (St Mirren) Substitution at 45',2025-08-10 04:46:51
13496,742345,4,45598709,45',Tunmise Sobowale (St Mirren) Substitution at 45',2025-08-10 04:46:51
13496,742345,5,45599251,63',Marcus Fraser (St Mirren) Yellow Card at 63',2025-08-10 04:46:51
13496,742345,6,45599411,67',Jonah Ayunga (St Mirren) Substitution at 67',2025-08-10 04:46:51
13496,742345,7,45599412,67',Conor McMenamin (St Mirren) Substitution at 67',2025-08-10 04:46:51
13496,742345,8,45599413,67',Richard King (St Mirren) Substitution at 67',2025-08-10 04:46:51
13496,742345,9,45599488,71',Apostolos Stamatelopoulos (Motherwell) Substitution at 71',2025-08-10 04:46:51
13496,742345,10,45599521,72',Keanu Baccus (St Mirren) Yellow Card at 72',2025-08-10 04:46:51
13496,742345,11,45600005,86',Killian Phillips (St Mirren) Yellow Card at 86',2025-08-10 04:46:51
13496,742345,12,45600064,86',Luca Ross (Motherwell) Substitution at 86',2025-08-10 04:46:51
13496,742345,13,45600192,86',Paul McGinn (Motherwell) Yellow Card at 86',2025-08-10 04:46:51
13496,742346,0,45601488,51',Ryan Astley (Dundee) Goal at 51',2025-08-10 04:46:51
13496,742346,1,45601502,54',Oliver Antman (Rangers) Yellow Card at 54',2025-08-10 04:46:51
13496,742346,2,45601523,56',Nicolas Raskin (Rangers) Substitution at 56',2025-08-10 04:46:51
13496,742346,3,45601524,56',Kieran Dowell (Rangers) Substitution at 56',2025-08-10 04:46:51
13496,742346,4,45601598,59',Nasser Djiga (Rangers) Red Card at 59',2025-08-10 04:46:51
13496,742346,5,45601637,64',James Tavernier (Rangers) Substitution at 64',2025-08-10 04:46:51
13496,742346,6,45601645,64',Danilo (Rangers) Substitution at 64',2025-08-10 04:46:51
13496,742346,7,45601686,67',Tony Yogane (Dundee) Substitution at 67',2025-08-10 04:46:51
13496,742346,8,45601775,77',Findlay Curtis (Rangers) Substitution at 77',2025-08-10 04:46:51
13496,742346,9,45601828,83',Emile Acauah (Dundee) Substitution at 83',2025-08-10 04:46:51
13496,742346,10,45601848,86',Finlay Robertson (Dundee) Yellow Card at 86',2025-08-10 04:46:51
13496,742346,11,45601878,90'+2',James Tavernier (Rangers) Penalty - Scored at 92',2025-08-10 04:46:51
13496,742346,12,45601890,90'+3',Aaron Donnelly (Dundee) Substitution at 93',2025-08-10 04:46:51
13496,742346,13,45601891,90'+3',Billy Koumetio (Dundee) Substitution at 93',2025-08-10 04:46:51
13496,742346,14,45601926,90'+6',Cyriel Dessers (Rangers) Yellow Card at 96',2025-08-10 04:46:51
13496,742347,0,45610311,27',Benjamin Nygren (Celtic) Goal at 27',2025-08-11 04:43:25
13496,742347,1,45610460,51',Sivert Heltne Nilsen (Aberdeen) Yellow Card at 51',2025-08-11 04:43:25
13496,742347,2,45610479,55',Ester Sokler (Aberdeen) Substitution at 55',2025-08-11 04:43:25
13496,742347,3,45610497,61',Liam Scales (Celtic) Yellow Card at 61',2025-08-11 04:43:25
13496,742347,4,45610524,66',Reo Hatate (Celtic) Goal at 66',2025-08-11 04:43:25
13496,742347,5,45610533,66',Shin Yamada (Celtic) Substitution at 66',2025-08-11 04:43:25
13496,742347,6,45610534,67',Auston Trusty (Celtic) Substitution at 67',2025-08-11 04:43:25
13496,742347,7,45610535,67',Leighton Clarkson (Aberdeen) Substitution at 67',2025-08-11 04:43:25
13496,742347,8,45610600,73',Shayden Morris (Aberdeen) Substitution at 73',2025-08-11 04:43:25
13496,742347,9,45610601,73',Dante Polvara (Aberdeen) Substitution at 73',2025-08-11 04:43:25
13496,742347,10,45610602,73',Fletcher Boyd (Aberdeen) Substitution at 73',2025-08-11 04:43:25
13496,742347,11,45610613,74',Reo Hatate (Celtic) Yellow Card at 74',2025-08-11 04:43:25
13496,742347,12,45610614,74',Callum McGregor (Celtic) Yellow Card at 74',2025-08-11 04:43:25
13496,742347,13,45610641,78',Arne Engels (Celtic) Substitution at 78',2025-08-11 04:43:25
13496,742347,14,45610642,78',Luke McCowan (Celtic) Substitution at 78',2025-08-11 04:43:25
13496,742347,15,45610724,88',Anthony Ralston (Celtic) Substitution at 88',2025-08-11 04:43:25
13496,742347,16,45610745,90'+2',Nicky Devlin (Aberdeen) Yellow Card at 92',2025-08-11 04:43:25
13496,742348,0,45730784,29',Stevie May (Livingston) Substitution at 29',2025-08-24 04:58:03
13496,742348,1,45731901,47',Benjamin Nygren (Celtic) Goal at 47',2025-08-24 04:58:03
13496,742348,2,45732383,58',Callum McGregor (Celtic) Substitution at 58',2025-08-24 04:58:03
13496,742348,3,45732384,58',James Forrest (Celtic) Substitution at 58',2025-08-24 04:58:03
13496,742348,4,45732385,58',Daizen Maeda (Celtic) Substitution at 58',2025-08-24 04:58:03
13496,742348,5,45732769,66',Connor Mclennan (Livingston) Substitution at 66',2025-08-24 04:58:03
13496,742348,6,45732848,66',Tete Yengi (Livingston) Substitution at 66',2025-08-24 04:58:03
13496,742348,7,45732962,69',Johnny Kenny (Celtic) Substitution at 69',2025-08-24 04:58:03
13496,742348,8,45733035,71',Benjamin Nygren (Celtic) Goal at 71',2025-08-24 04:58:03
13496,742348,9,45733141,74',Lewis Smith (Livingston) Substitution at 74',2025-08-24 04:58:03
13496,742348,10,45733193,75',Stevie May (Livingston) Yellow Card at 75',2025-08-24 04:58:03
13496,742348,11,45733243,76',Johnny Kenny (Celtic) Goal at 76',2025-08-24 04:58:03
13496,742348,12,45733355,79',Colby Donovan (Celtic) Substitution at 79',2025-08-24 04:58:03
13496,742349,0,45958929,37',Zachary Sapsford (Dundee United) Yellow Card at 37',2025-09-24 05:13:55
13496,742349,1,45959095,45',Ivan Dolcek (Dundee United) Goal at 45',2025-09-24 05:13:55
13496,742349,2,45959540,45',Jack Milne (Aberdeen) Substitution at 45',2025-09-24 05:13:55
13496,742349,3,45959720,50',Bert Esselink (Dundee United) Goal at 50',2025-09-24 05:13:55
13496,742349,4,45960324,67',Kusini Yengi (Aberdeen) Substitution at 67',2025-09-24 05:13:55
13496,742349,5,45960325,67',Kenan Bilalovic (Aberdeen) Substitution at 67',2025-09-24 05:13:55
13496,742349,6,45960326,67',Adil Aouchiche (Aberdeen) Substitution at 67',2025-09-24 05:13:55
13496,742349,7,45960548,74',Craig Sibbald (Dundee United) Substitution at 74',2025-09-24 05:13:55
13496,742349,8,45960638,77',Nikolaj Moller (Dundee United) Substitution at 77',2025-09-24 05:13:55
13496,742349,9,45960811,83',Julius Eskesen (Dundee United) Substitution at 83',2025-09-24 05:13:55
13496,742349,10,45960812,83',Dario Naamo (Dundee United) Substitution at 83',2025-09-24 05:13:55
13496,742349,11,45960844,86',Topi Keskinen (Aberdeen) Substitution at 86',2025-09-24 05:13:55
13496,742349,12,45960998,90'+2',Vicko Sevelj (Dundee United) Yellow Card at 92',2025-09-24 05:13:55
13496,742349,13,45961072,90'+5',Kusini Yengi (Aberdeen) Yellow Card at 95',2025-09-24 05:13:55
13496,742350,0,45958726,30',Martin Boyle (Hibernian) Penalty - Scored at 30',2025-09-24 05:13:55
13496,742350,1,45958983,41',Kieron Bowie (Hibernian) Yellow Card at 41',2025-09-24 05:13:55
13496,742350,2,45958997,42',Jamie McGrath (Hibernian) Goal at 42',2025-09-24 05:13:55
13496,742350,3,45959082,45'+1',Ross Maciver (Falkirk) Goal at 46',2025-09-24 05:13:55
13496,742350,4,45959938,59',Thibault Klidje (Hibernian) Substitution at 59',2025-09-24 05:13:55
13496,742350,5,45960076,64',Liam Henderson (Falkirk) Goal at 64',2025-09-24 05:13:55
13496,742350,6,45960299,69',Brad Spencer (Falkirk) Yellow Card at 69',2025-09-24 05:13:55
13496,742350,7,45960501,74',Scott Arfield (Falkirk) Substitution at 74',2025-09-24 05:13:55
13496,742350,8,45960502,74',Alfredo Agyeman (Falkirk) Substitution at 74',2025-09-24 05:13:55
13496,742350,9,45960503,74',Brian Graham (Falkirk) Substitution at 74',2025-09-26 05:20:00
13496,742350,10,46027589,74',Leon Mccann (Falkirk) Yellow Card at 74',2025-10-01 05:14:09
13496,742350,11,45960545,75',Miguel Chaiwa (Hibernian) Yellow Card at 75',2025-10-01 05:14:09
13496,742350,12,45960631,80',Junior Hoilett (Hibernian) Substitution at 80',2025-10-01 05:14:09
13496,742350,13,45960660,80',Christopher Cadden (Hibernian) Substitution at 80',2025-10-01 05:14:09
13496,742350,14,45960795,86',Josh Campbell (Hibernian) Substitution at 86',2025-10-01 05:14:09
13496,742350,15,45960829,86',Dylan Levitt (Hibernian) Substitution at 86',2025-10-01 05:14:09
13496,742350,16,45960830,87',Gary Oliver (Falkirk) Substitution at 87',2025-10-01 05:14:09
13496,742350,17,45960964,90'+2',Brian Graham (Falkirk) Yellow Card at 92',2025-10-01 05:14:09
13496,742351,0,45730624,21',Callum Slattery (Motherwell) Goal at 21',2025-08-24 04:58:03
13496,742351,1,45730679,24',Callum Slattery (Motherwell) Yellow Card at 24',2025-08-24 04:58:03
13496,742351,2,45730951,35',Craig Halkett (Heart of Midlothian) Yellow Card at 35',2025-08-24 04:58:03
13496,742351,3,45731242,45',Oisin McEntee (Heart of Midlothian) Yellow Card at 45',2025-08-24 04:58:03
13496,742351,4,45731562,45',Beni Baningime (Heart of Midlothian) Substitution at 45',2025-08-24 04:58:03
13496,742351,5,45731563,45',Cláudio Braga (Heart of Midlothian) Substitution at 45',2025-08-24 04:58:03
13496,742351,6,45731646,49',Tawanda Maswanhise (Motherwell) Goal at 49',2025-08-24 04:58:03
13496,742351,7,45732018,58',Harry Milne (Heart of Midlothian) Yellow Card at 58',2025-08-24 04:58:03
13496,742351,8,45732204,62',Emmanuel Longelo (Motherwell) Goal at 62',2025-08-24 04:58:03
13496,742351,9,45732391,65',Harry Milne (Heart of Midlothian) Goal at 65',2025-08-24 04:58:03
13496,742351,10,45732538,68',Blair Spittal (Heart of Midlothian) Substitution at 68',2025-08-24 04:58:03
13496,742351,11,45732588,69',Callum Hendry (Motherwell) Substitution at 69',2025-08-24 04:58:03
13496,742351,12,45732596,70',Ibrahim Sa'Id (Motherwell) Substitution at 70',2025-08-24 04:58:03
13496,742351,13,45732731,72',Frankie Kent (Heart of Midlothian) Substitution at 72',2025-08-24 04:58:03
13496,742351,14,45732899,74',Cláudio Braga (Heart of Midlothian) Goal at 74',2025-08-24 04:58:03
13496,742351,15,45732993,78',Callum Hendry (Motherwell) Yellow Card at 78',2025-08-24 04:58:03
13496,742351,16,45733082,80',Detlef Esapa Osong (Motherwell) Substitution at 80',2025-08-24 04:58:03
13496,742351,17,45733177,82',Alexandros Kyziridis (Heart of Midlothian) Substitution at 82',2025-08-24 04:58:03
13496,742351,18,45733231,83',Cláudio Braga (Heart of Midlothian) Goal at 83',2025-08-24 04:58:03
13496,742351,19,45733575,90'+2',Andy Halliday (Motherwell) Substitution at 92',2025-08-24 04:58:03
13496,742352,0,45730680,24',Simon Murray (Dundee) Yellow Card at 24',2025-08-24 04:58:03
13496,742352,1,45730716,25',Brad Lyons (Kilmarnock) Yellow Card at 25',2025-08-24 04:58:03
13496,742352,2,45732394,63',Tony Yogane (Dundee) Substitution at 63',2025-08-24 04:58:03
13496,742352,3,45732456,63',Bruce Anderson (Kilmarnock) Substitution at 63',2025-08-24 04:58:03
13496,742352,4,45732743,69',Callum Jones (Dundee) Yellow Card at 69',2025-08-24 04:58:03
13496,742352,5,45732905,72',Clark Robertson (Dundee) Yellow Card at 72',2025-08-24 04:58:03
13496,742352,6,45732906,73',Djenario Daniels (Kilmarnock) Substitution at 73',2025-08-26 05:05:37
13496,742352,7,45732963,73',Cesar Garza (Dundee) Substitution at 73',2025-08-24 04:58:03
13496,742352,8,45732964,73',Billy Koumetio (Dundee) Substitution at 73',2025-08-24 04:58:03
13496,742352,9,45733077,77',Dominic Thompson (Kilmarnock) Substitution at 77',2025-08-24 04:58:03
13496,742352,10,45733172,78',Ashley Hay (Dundee) Substitution at 78',2025-08-24 04:58:03
13496,742352,11,45733173,78',Cameron Congreve (Dundee) Substitution at 78',2025-08-24 04:58:03
13496,742352,12,45733441,85',David Watson (Kilmarnock) Yellow Card at 85',2025-08-24 04:58:03
