seasonType,eventId,commentaryOrder,playId,clockDisplayValue,commentaryText,updateDateTime
12826,716063,7,44551010,90'+4',Ahmed Yousef Al Julaydan (Al Fateh) Substitution at 94',2025-01-23 05:39:04
12826,716063,8,44551011,90'+4',Mohammed Al-Konaideri (Al Fateh) Substitution at 94',2025-01-23 05:39:04
12826,716063,9,44551018,90'+7',Faisal Al Sibyani (Damac) Yellow Card at 97',2025-01-23 05:39:04
12826,716063,10,44551032,90'+9',Amar Al Dohaim (Al Fateh) Yellow Card at 99',2025-01-23 05:39:04
12826,716063,11,44551057,90'+20',Naif Masoud (Al Fateh) Substitution at 110',2025-01-23 05:39:04
12826,716063,12,44551058,90'+20',Mourad Batna (Al Fateh) Penalty - Scored at 110',2025-01-23 05:39:04
12826,716064,0,44544555,23',Moussa Dembélé (Al Ettifaq) Yellow Card at 23',2025-01-21 05:34:05
12826,716064,1,44544559,30',Gabri Veiga (Al Ahli) Goal at 30',2025-01-21 05:34:05
12826,716064,2,44544567,42',Riyad Mahrez (Al Ahli) Yellow Card at 42',2025-01-21 05:34:05
12826,716064,3,44544569,45'+1',Abdullah Radif (Al Ettifaq) Yellow Card at 46',2025-01-21 05:34:05
12826,716064,4,44544582,63',Roberto Firmino (Al Ahli) Goal at 63',2025-01-21 05:34:05
12826,716064,5,44544583,69',João Costa (Al Ettifaq) Substitution at 69',2025-01-21 05:34:05
12826,716064,6,44544588,76',Mohammed Yousef (Al Ettifaq) Yellow Card at 76',2025-01-21 05:34:05
12826,716064,7,44544590,78',Mohammed Al-Majhad (Al Ahli) Substitution at 78',2025-01-21 05:34:05
12826,716064,8,44544591,79',Feras Al-Brikan (Al Ahli) Substitution at 79',2025-01-21 05:34:05
12826,716064,9,44544785,89',Fahad Alrashidi (Al Ahli) Substitution at 89',2025-01-21 05:34:05
12826,716064,10,44544786,90',Abdulaziz Saud Al Aliwa (Al Ettifaq) Substitution at 90',2025-01-21 05:34:05
12826,716064,11,44544787,90'+1',Georginio Wijnaldum (Al Ettifaq) Goal at 91',2025-01-21 05:34:05
12826,716064,12,44544788,90'+3',João Costa (Al Ettifaq) Yellow Card at 93',2025-01-21 05:34:05
12826,716064,13,44544789,90'+6',Fahad Alrashidi (Al Ahli) Yellow Card at 96',2025-01-21 05:34:05
12826,716065,0,44544508,48',Chris Smalling (Al Fayha) Yellow Card at 48',2025-01-21 05:34:05
12826,716065,1,44544513,53',Alejandro Pozuelo (Al Fayha) Goal at 53',2025-01-21 05:34:05
12826,716065,2,44544515,60',Mansor Faiez Al-Beshe (Al Fayha) Yellow Card at 60',2025-01-21 05:34:05
12826,716065,3,44544523,74',Gojko Cimirot (Al Fayha) Substitution at 74',2025-01-21 05:34:05
12826,716065,4,44544526,76',Otabek Shukurov (Al Fayha) Yellow Card at 76',2025-01-21 05:34:05
12826,716065,5,44544530,82',Bassem Al-Arini (Al Kholood) Substitution at 82',2025-01-21 05:34:05
12826,716065,6,44544531,82',Sultan Al Shehri (Al Kholood) Substitution at 82',2025-01-21 05:34:05
12826,716065,7,44544536,88',Nawaf Al-Harthi (Al Fayha) Substitution at 88',2025-01-21 05:34:05
12826,716065,8,44544545,90'+5',Henry Onyekuru (Al Fayha) Substitution at 95',2025-01-21 05:34:05
12826,716066,0,44577878,4',Ivan Toney (Al Ahli) Goal at 4',2025-01-28 15:11:25
12826,716066,1,44578447,45'+4',Ali Majrashi (Al Ahli) Yellow Card at 49',2025-01-28 15:11:25
12826,716066,2,44578735,45',Mohamed Konaté (Al Riyadh) Substitution at 45',2025-01-28 15:11:25
12826,716066,3,44578806,49',Merih Demiral (Al Ahli) Yellow Card at 49',2025-01-28 15:11:25
12826,716066,4,44578835,50',Yahya Alshehri (Al Riyadh) Yellow Card at 50',2025-01-28 15:11:25
12826,716066,5,44579017,60',Ziyad Aljohani (Al Ahli) Goal at 60',2025-01-28 15:11:25
12826,716066,6,44579068,62',Abdulelah Al Khaibari (Al Riyadh) Substitution at 62',2025-01-28 15:11:25
12826,716066,7,44579069,62',Faïz Selemani (Al Riyadh) Substitution at 62',2025-01-28 15:11:25
12826,716066,8,44579070,63',Roberto Firmino (Al Ahli) Goal at 63',2025-01-28 15:11:25
12826,716066,9,44579204,72',Ivan Toney (Al Ahli) Penalty - Scored at 72',2025-01-28 15:11:25
12826,716066,10,44579261,74',Abdulkarim Darisi (Al Ahli) Substitution at 74',2025-01-28 15:11:25
12826,716066,11,44579262,74',Feras Al-Brikan (Al Ahli) Substitution at 74',2025-01-28 15:11:25
12826,716066,12,44579263,75',Rayan Al Bloushi (Al Riyadh) Substitution at 75',2025-01-28 15:11:25
12826,716066,13,44579360,83',Nawaf Al-Abid (Al Riyadh) Substitution at 83',2025-01-28 15:11:25
12826,716066,14,44579418,86',Mohammed Al-Majhad (Al Ahli) Substitution at 86',2025-01-28 15:11:25
12826,716066,15,44579419,86',Abdullah Al-Amar (Al Ahli) Substitution at 86',2025-01-28 15:11:25
12826,716066,16,44579420,87',Mohammed Sulaiman (Al Ahli) Substitution at 87',2025-01-28 15:11:25
12826,716066,17,44579421,88',Riyad Mahrez (Al Ahli) Goal at 88',2025-01-28 15:11:25
12826,716067,0,44569675,5',Mohamed Al Makahasi (Al Wehda) Yellow Card at 5',2025-01-26 05:42:44
12826,716067,1,44569869,23',Abdullah Khateeb (Al Ettifaq) Substitution at 23',2025-01-26 05:42:44
12826,716067,2,44569921,31',Ali Al Salem (Al Wehda) Goal at 31',2025-01-26 05:42:44
12826,716067,3,44570406,45',Juninho Bacuna (Al Wehda) Substitution at 45',2025-01-26 05:42:44
12826,716067,4,44570560,57',Radhi Al-Otaibi (Al Ettifaq) Substitution at 57',2025-01-26 05:42:44
12826,716067,5,44570561,57',Josen Escobar (Al Ettifaq) Substitution at 57',2025-01-26 05:42:44
12826,716067,6,44570640,67',Youssef Amyn (Al Wehda) Yellow Card at 67',2025-01-26 05:42:44
12826,716067,7,44570757,78',Waleed Bakhashwain (Al Wehda) Substitution at 78',2025-01-26 05:42:44
12826,716067,8,44570758,78',Ali Makki (Al Wehda) Substitution at 78',2025-01-26 05:42:44
12826,716067,9,44570759,79',Moussa Dembélé (Al Ettifaq) Goal at 79',2025-01-26 05:42:44
12826,716067,10,44570830,85',Youssef Amyn (Al Wehda) Goal at 85',2025-01-26 05:42:44
12826,716067,11,44570864,87',Ali Makki (Al Wehda) Yellow Card at 87',2025-01-26 05:42:44
12826,716067,12,44570894,90',Saad Al Qahtani (Al Wehda) Substitution at 90',2025-01-26 05:42:44
12826,716067,13,44570917,90'+2',Majed Dawran (Al Ettifaq) Substitution at 92',2025-01-26 05:42:44
12826,716067,14,44570918,90'+2',Ahmed Bamasud (Al Ettifaq) Substitution at 92',2025-01-26 05:42:44
12826,716067,15,44570919,90'+3',Abdullah Madu (Al Ettifaq) Goal at 93',2025-01-26 05:42:44
12826,716068,0,44584747,2',Pierre-Emerick Aubameyang (Al Qadsiah) Goal at 2',2025-01-28 15:11:25
12826,716068,1,44584758,18',Hassan Al-Tambakti (Al Hilal) Yellow Card at 18',2025-01-28 15:11:25
12826,716068,2,44584762,31',Nahitan Nández (Al Qadsiah) Yellow Card at 31',2025-01-28 15:11:25
12826,716068,3,44584782,38',Moteb Alharbi (Al Hilal) Substitution at 38',2025-01-28 15:11:25
12826,716068,4,44584863,50',Marcos Leonardo (Al Hilal) Goal at 50',2025-01-28 15:11:25
12826,716068,5,44584888,65',Ali Al-Bulayhi (Al Hilal) Yellow Card at 65',2025-01-28 15:11:25
12826,716068,6,44584890,71',Mohammed Qassem Al-Nakhli (Al Qadsiah) Substitution at 71',2025-01-28 15:11:25
12826,716068,7,44584891,71',Ali Abdullah Hazzazi (Al Qadsiah) Substitution at 71',2025-01-28 15:11:25
12826,716068,8,44584920,81',Hussain Al-Qahtani (Al Qadsiah) Substitution at 81',2025-01-28 15:11:25
12826,716068,9,44584921,82',Nasser Al-Dawsari (Al Hilal) Substitution at 82',2025-01-28 15:11:25
12826,716068,10,44584946,90'+1',Mohamed Kanno (Al Hilal) Substitution at 91',2025-01-28 15:11:25
12826,716068,11,44584947,90'+1',Khalifah Al-Dawsari (Al Hilal) Substitution at 91',2025-01-28 15:11:25
12826,716068,12,44584952,90'+3',Pierre-Emerick Aubameyang (Al Qadsiah) Goal at 93',2025-01-28 15:11:25
12826,716069,0,44564407,16',Aliou Dieng (Al Kholood) Yellow Card at 16',2025-01-26 05:42:44
12826,716069,1,44564528,25',Amir Sayoud (Al Raed) Goal at 25',2025-01-26 05:42:44
12826,716069,2,44564626,33',Mehdi Abeid (Al Raed) Yellow Card at 33',2025-01-26 05:42:44
12826,716069,3,44564869,45'+7',Zakaria Al Hawsawi (Al Raed) Yellow Card at 52',2025-01-26 05:42:44
12826,716069,4,44565574,61',Muhammad Sawan (Al Kholood) Goal at 61',2025-01-26 05:42:44
12826,716069,5,44565878,72',Raid Al-Ghamdi (Al Raed) Substitution at 72',2025-01-26 05:42:44
12826,716069,6,44566332,84',Abdulfattah Asiri (Al Kholood) Substitution at 84',2025-01-26 05:42:44
12826,716069,7,44566440,87',Aliou Dieng (Al Kholood) Goal at 87',2025-01-26 05:42:44
12826,716069,8,44566515,88',Hammam Al-Hammami (Al Kholood) Yellow Card at 88',2025-01-26 05:42:44
12826,716069,9,44566653,90'+1',Farhah Al Shamrani (Al Kholood) Substitution at 91',2025-01-26 05:42:44
12826,716069,10,44566654,90'+1',Moses Turay (Al Raed) Substitution at 91',2025-01-26 05:42:44
12826,716069,11,44576714,90'+6',Khalid Al Subaie (Al Raed) Yellow Card at 96',2025-01-28 15:11:25
12826,716069,12,44566861,90'+7',Abdulrahman Al Safari (Al Kholood) Substitution at 97',2025-01-28 15:11:25
12826,716069,13,44566862,90'+7',Sultan Al Shehri (Al Kholood) Substitution at 97',2025-01-28 15:11:25
12826,716069,14,44566866,90'+8',Farhah Al Shamrani (Al Kholood) Yellow Card at 98',2025-01-28 15:11:25
12826,716070,0,44579565,41',Marwane Saadane (Al Fateh) Own Goal at 41',2025-01-28 15:11:25
12826,716070,1,44580089,55',Cristiano Ronaldo (Al Nassr) Yellow Card at 55',2025-01-28 15:11:25
12826,716070,2,44580108,56',Marwane Saadane (Al Fateh) Yellow Card at 56',2025-01-28 15:11:25
12826,716070,3,44580109,57',Mohamed Simakan (Al Nassr) Goal at 57',2025-01-28 15:11:25
12826,716070,4,44580135,59',Ali Al-Hassan (Al Nassr) Substitution at 59',2025-01-28 15:11:25
12826,716070,5,44580159,61',Saeed Baattia (Al Fateh) Yellow Card at 61',2025-01-28 15:11:25
12826,716070,6,44580249,71',Mohamed Sbai (Al Fateh) Substitution at 71',2025-01-28 15:11:25
12826,716070,7,44580250,72',Mourad Batna (Al Fateh) Goal at 72',2025-01-28 15:11:25
12826,716070,8,44580304,75',Abdulmajeed Al-Sulaiheem (Al Nassr) Substitution at 75',2025-01-28 15:11:25
12826,716070,9,44580305,75',Saad Haqawi (Al Nassr) Substitution at 75',2025-01-28 15:11:25
12826,716070,10,44580390,85',Mohammed Al-Konaideri (Al Fateh) Substitution at 85',2025-01-28 15:11:25
12826,716070,11,44580391,85',Ahmed Yousef Al Julaydan (Al Fateh) Substitution at 85',2025-01-28 15:11:25
12826,716070,12,44580392,85',Alfehaid Salah (Al Fateh) Substitution at 85',2025-01-28 15:11:25
12826,716070,13,44580393,86',Ali Al Masoud (Al Fateh) Substitution at 86',2025-01-28 15:11:25
12826,716070,14,44580406,87',Cristiano Ronaldo (Al Nassr) Goal at 87',2025-01-28 15:11:25
12826,716070,15,44580453,90'+2',Salem Al Najdi (Al Nassr) Substitution at 92',2025-01-28 15:11:25
12826,716070,16,44580454,90'+2',Abdulrahman Ghareeb (Al Nassr) Substitution at 92',2025-01-28 15:11:25
12826,716071,0,44578234,45'+3',Fábio Martins (Al Khaleej) Yellow Card at 48',2025-01-28 15:11:25
12826,716071,1,44578500,45',Ali Al Shaafi (Al Khaleej) Substitution at 45',2025-01-28 15:11:25
12826,716071,2,44578863,66',Waheb Saleh (Al Khaleej) Goal at 66',2025-01-28 15:11:25
12826,716071,3,44578921,68',Mohammed Al Abdullah (Al Khaleej) Substitution at 68',2025-01-28 15:11:25
12826,716071,4,44578922,68',Mohamed Sherif (Al Khaleej) Substitution at 68',2025-01-28 15:11:25
12826,716071,5,44578939,69',Mohamed Sherif (Al Khaleej) Goal at 69',2025-01-28 15:11:25
12826,716071,6,44579043,75',Knowledge Musona (Al Okhdood) Substitution at 75',2025-01-28 15:11:25
12826,716071,7,44579044,75',Saleh Al-Harthi (Al Okhdood) Substitution at 75',2025-01-28 15:11:25
12826,716071,8,44579071,76',Diego Ferreira (Al Okhdood) Substitution at 76',2025-01-28 15:11:25
12826,716071,9,44579216,83',Awad Khamis (Al Okhdood) Yellow Card at 83',2025-01-28 15:11:25
12826,716071,10,44579217,84',Hussain Al Zabdani (Al Okhdood) Substitution at 84',2025-01-28 15:11:25
12826,716071,11,44579218,84',Abdulaziz Al Hatila (Al Okhdood) Substitution at 84',2025-01-28 15:11:25
12826,716071,12,44579230,87',Bandar Al Mutairi (Al Khaleej) Substitution at 87',2025-01-28 15:11:25
12826,716071,13,44579282,90'+1',Khaled Al Samiri (Al Khaleej) Yellow Card at 91',2025-01-28 15:11:25
12826,716071,14,44579328,90'+5',Khaled Al Samiri (Al Khaleej) Own Goal at 95',2025-01-28 15:11:25
12826,716071,15,44579330,90'+6',Petros (Al Okhdood) Yellow Card at 96',2025-01-28 15:11:25
12826,716071,16,44579345,90'+7',Saleh Al-Harthi (Al Okhdood) Yellow Card at 97',2025-01-28 15:11:25
12826,716071,17,44579369,90'+8',Abdullah Al Fahad (Al Khaleej) Substitution at 98',2025-01-28 15:11:25
12826,716072,0,44584697,17',Georges-Kévin N'Koudou (Damac) Goal at 17',2025-01-28 15:11:25
12826,716072,1,44584699,34',Abdulrahman Al-Obud (Al Ittihad) Yellow Card at 34',2025-01-28 15:11:25
12826,716072,2,44584700,43',Dhari Al Anazi (Damac) Yellow Card at 43',2025-01-28 15:11:25
12826,716072,3,44584701,45'+4',Karim Benzema (Al Ittihad) Goal at 49',2025-01-28 15:11:25
12826,716072,4,44584710,63',Moussa Diaby (Al Ittihad) Substitution at 63',2025-01-28 15:11:25
12826,716072,5,44584711,63',Fawaz Al Saqour (Al Ittihad) Substitution at 63',2025-01-28 15:11:25
12826,716072,6,44584712,65',Tariq Mohammed (Damac) Substitution at 65',2025-01-28 15:11:25
12826,716072,7,44584716,76',Houssem Aouar (Al Ittihad) Yellow Card at 76',2025-01-28 15:11:25
12826,716072,8,44584720,77',Noor Al Rashidi (Damac) Substitution at 77',2025-01-28 15:11:25
12826,716072,9,44584721,78',Meshari Al Nemer (Damac) Substitution at 78',2025-01-28 15:11:25
12826,716072,10,44584722,79',Abdelkader Bedrane (Damac) Yellow Card at 79',2025-01-28 15:11:25
12826,716072,11,44584723,81',Ayman Fallatah (Damac) Substitution at 81',2025-01-28 15:11:25
12826,716072,12,44584724,87',Georges-Kévin N'Koudou (Damac) Yellow Card at 87',2025-01-28 15:11:25
12826,716072,13,44584725,90'+1',Florin Nita (Damac) Yellow Card at 91',2025-01-28 15:11:25
12826,716072,14,44584727,90'+3',Ramzi Solan (Damac) Yellow Card at 93',2025-01-28 15:11:25
12826,716072,15,44584728,90'+4',Georges-Kévin N'Koudou (Damac) Goal at 94',2025-01-28 15:11:25
12826,716073,0,44584717,34',Abderrazak Hamdallah (Al Shabab) Goal at 34',2025-01-28 15:11:25
12826,716073,1,44584726,45'+1',Mohammed Al Baqawi (Al Fayha) Yellow Card at 46',2025-01-28 15:11:25
12826,716073,2,44584736,51',Renzo López (Al Fayha) Yellow Card at 51',2025-01-28 15:11:25
12826,716073,3,44584739,57',Renzo López (Al Fayha) Goal at 57',2025-01-28 15:11:25
12826,716073,4,44584740,63',Nawaf Al Saadi (Al Shabab) Substitution at 63',2025-01-28 15:11:25
12826,716073,5,44584744,79',Majed Kanabah (Al Shabab) Substitution at 79',2025-01-28 15:11:25
12826,716073,6,44584748,90'+1',Giacomo Bonaventura (Al Shabab) Yellow Card at 91',2025-01-28 15:11:25
12826,716073,7,44584750,90'+6',Abderrazak Hamdallah (Al Shabab) Penalty - Scored at 96',2025-01-28 15:11:25
12826,716073,8,44584751,90'+6',Alejandro Pozuelo (Al Fayha) Yellow Card at 96',2025-01-28 15:11:25
12826,716073,9,44584754,90'+6',Orlando Mosquera (Al Fayha) Yellow Card at 96',2025-01-28 15:11:25
12826,716073,10,44584752,90'+8',Majed Abdullah (Al Shabab) Substitution at 98',2025-01-28 15:11:25
12826,716073,11,44584753,90'+8',Mohammed Essa Harbush (Al Shabab) Substitution at 98',2025-01-28 15:11:25
12826,716073,12,44584755,90'+10',Sami Al Khaibari (Al Fayha) Yellow Card at 100',2025-01-28 15:11:25
12826,716074,0,44577706,19',Lucas Chávez (Al Taawoun) Substitution at 19',2025-01-28 15:11:25
12826,716074,1,44578395,50',Waleed Al-Ahmed (Al Taawoun) Red Card at 50',2025-01-28 15:11:25
12826,716074,2,44578453,53',Renne Rivas (Al Taawoun) Substitution at 53',2025-01-28 15:11:25
12826,716074,3,44578720,70',Hamed Al-Maqati (Al Orobah) Yellow Card at 70',2025-01-28 15:11:25
12826,716074,4,44578775,73',Mohammed Al Qarni (Al Orobah) Substitution at 73',2025-01-28 15:11:25
12826,716074,5,44578830,76',Abdulfattah Adam (Al Taawoun) Substitution at 76',2025-01-28 15:11:25
12826,716074,6,44579114,90'+1',Mohammed Al Qarni (Al Orobah) Yellow Card at 91',2025-01-28 15:11:25
12826,716074,7,44579158,90'+3',Omar Al-Somah (Al Orobah) Yellow Card at 93',2025-01-28 15:11:25
12826,716075,0,44602927,33',Abdulelah Al-Malki (Al Ettifaq) Yellow Card at 33',2025-02-01 14:52:43
12826,716075,1,44602928,35',Georginio Wijnaldum (Al Ettifaq) Goal at 35',2025-02-01 14:52:43
12826,716075,2,44602931,40',Abderrazak Hamdallah (Al Shabab) Goal at 40',2025-02-01 14:52:43
12826,716075,3,44602933,43',João Costa (Al Ettifaq) Goal at 43',2025-02-01 14:52:43
12826,716075,4,44602940,45',Mukhtar Ali (Al Ettifaq) Substitution at 45',2025-02-01 14:52:43
12826,716075,5,44602941,45',Nawaf Al Saadi (Al Shabab) Substitution at 45',2025-02-01 14:52:43
12826,716075,6,44602953,63',Karl Toko Ekambi (Al Ettifaq) Substitution at 63',2025-02-01 14:52:43
12826,716075,7,44602956,68',Mukhtar Ali (Al Ettifaq) Yellow Card at 68',2025-02-01 14:52:43
12826,716075,8,44602963,75',Abderrazak Hamdallah (Al Shabab) Penalty - Missed at 75',2025-02-01 14:52:43
12826,716075,9,44602970,81',Radhi Al-Otaibi (Al Ettifaq) Substitution at 81',2025-02-01 14:52:43
12826,716075,10,44602972,84',Josen Escobar (Al Ettifaq) Substitution at 84',2025-02-01 14:52:43
12826,716075,11,44602973,84',Abdullah Radif (Al Ettifaq) Substitution at 84',2025-02-01 14:52:43
12826,716075,12,44602983,87',Hisham Al Dubais (Al Shabab) Substitution at 87',2025-02-01 14:52:43
12826,716075,13,44603002,90'+11',Georginio Wijnaldum (Al Ettifaq) Goal at 101',2025-02-01 14:52:43
12826,716076,0,44598095,2',Ângelo Gabriel (Al Nassr) Yellow Card at 2',2025-02-01 14:52:43
12826,716076,1,44598100,35',Cristiano Ronaldo (Al Nassr) Goal at 35',2025-01-31 14:50:56
12826,716076,2,44598101,44',Marcelo Brozovic (Al Nassr) Yellow Card at 44',2025-01-31 14:50:56
12826,716076,3,44598102,45'+2',Mehdi Abeid (Al Raed) Yellow Card at 47',2025-01-31 14:50:56
12826,716076,4,44598103,45'+4',Mubarak Abdul Rahman Al Rajeh (Al Raed) Yellow Card at 49',2025-01-31 14:50:56
12826,716076,5,44598104,47',Nawaf Boushal (Al Nassr) Goal at 47',2025-01-31 14:50:56
12826,716076,6,44598105,51',Mohammed Al-Fatil (Al Nassr) Substitution at 51',2025-01-31 14:50:56
12826,716076,7,44598106,65',Mathias Normann (Al Raed) Substitution at 65',2025-01-31 14:50:56
12826,716076,8,44598107,65',Yahya Sunbul (Al Raed) Substitution at 65',2025-01-31 14:50:56
12826,716076,9,44598108,69',Sultan Al-Ghannam (Al Nassr) Yellow Card at 69',2025-01-31 14:50:56
12826,716076,10,44598109,73',Raid Al-Ghamdi (Al Raed) Substitution at 73',2025-01-31 14:50:56
12826,716076,11,44598110,73',Khalid Al Subaie (Al Raed) Substitution at 73',2025-01-31 14:50:56
12826,716076,12,44598111,76',Amir Sayoud (Al Raed) Goal at 76',2025-01-31 14:50:56
12826,716076,13,44598112,77',Abdulmajeed Al-Sulaiheem (Al Nassr) Substitution at 77',2025-01-31 14:50:56
12826,716076,14,44598113,86',Aiman Yahya (Al Nassr) Substitution at 86',2025-01-31 14:50:56
12826,716076,15,44598114,86',Bento (Al Nassr) Yellow Card at 86',2025-02-01 14:52:43
12826,716076,16,44598115,87',Abdulmajeed Al-Sulaiheem (Al Nassr) Yellow Card at 87',2025-01-31 14:50:56
12826,716076,17,44598116,90'+5',Amir Sayoud (Al Raed) Yellow Card at 95',2025-01-31 14:50:56
12826,716076,18,44598117,90'+6',Nawaf Sahli (Al Raed) Substitution at 96',2025-01-31 14:50:56
12826,716076,19,44598118,90'+10',Ali Al-Hassan (Al Nassr) Yellow Card at 100',2025-01-31 14:50:56
12826,716077,0,44598031,9',Ziyad Aljohani (Al Ahli) Goal at 9',2025-01-30 14:51:00
12826,716077,1,44598032,16',Fahad Al Reshedi (Al Orobah) Yellow Card at 16',2025-01-30 14:51:00
12826,716077,2,44598055,61',Ziyad Aljohani (Al Ahli) Yellow Card at 61',2025-01-31 14:50:56
12826,716077,3,44598061,66',Saad Yaslam Balobaid (Al Ahli) Yellow Card at 66',2025-01-31 14:50:56
12826,716077,4,44598062,66',Nawaf Al Qamiri (Al Orobah) Substitution at 66',2025-01-31 14:50:56
12826,716077,5,44598067,74',Fawaz Al-Torais (Al Orobah) Substitution at 74',2025-01-31 14:50:56
12826,716077,6,44598068,75',Jóhann Gudmundsson (Al Orobah) Yellow Card at 75',2025-01-31 14:50:56
12826,716077,7,44598072,86',Mohammed Al-Majhad (Al Ahli) Substitution at 86',2025-01-31 14:50:56
12826,716077,8,44598073,87',Mohammed Al-Majhad (Al Ahli) Yellow Card at 87',2025-01-31 14:50:56
12826,716077,9,44598076,90'+6',Ivan Toney (Al Ahli) Penalty - Scored at 96',2025-01-31 14:50:56
12826,716077,10,44598077,90'+7',Fahad Alrashidi (Al Ahli) Substitution at 97',2025-01-31 14:50:56
12826,716077,11,44598078,90'+10',Matteo Dams (Al Ahli) Substitution at 100',2025-01-31 14:50:56
12826,716078,0,44606411,25',Georges-Kévin N'Koudou (Damac) Penalty - Saved at 25',2025-02-01 14:52:43
12826,716078,1,44606421,25',Georges-Kévin N'Koudou (Damac) Goal at 25',2025-02-01 14:52:43
12826,716078,2,44606625,42',Thomas Murg (Al Khaleej) Substitution at 42',2025-02-01 14:52:43
12826,716078,3,44606626,43',Thomas Murg (Al Khaleej) Goal at 43',2025-02-01 14:52:43
12826,716078,4,44606717,45'+3',Nicolae Stanciu (Damac) Yellow Card at 48',2025-02-01 14:52:43
12826,716078,5,44607124,50',Farouk Chafaï (Damac) Yellow Card at 50',2025-02-02 14:52:51
12826,716078,6,44607484,71',Mohamed Sherif (Al Khaleej) Substitution at 71',2025-02-02 14:52:51
12826,716078,7,44607785,79',Mohammed Alkhaibari (Damac) Yellow Card at 79',2025-02-02 14:52:51
12826,716078,8,44608002,85',Mohammed Al Abdullah (Al Khaleej) Substitution at 85',2025-02-02 14:52:51
12826,716078,9,44608003,85',Bandar Al Mutairi (Al Khaleej) Substitution at 85',2025-02-02 14:52:51
12826,716078,10,44608004,86',Hazzaa Al Ghamdi (Damac) Substitution at 86',2025-02-02 14:52:51
12826,716078,11,44608088,88',Tariq Mohammed (Damac) Substitution at 88',2025-02-02 14:52:51
12826,716078,12,44608089,88',Noor Al Rashidi (Damac) Substitution at 88',2025-02-02 14:52:51
12826,716078,13,44608124,90',Mohammed Al Abdullah (Al Khaleej) Yellow Card at 90',2025-02-02 14:52:51
12826,716078,14,44608371,90'+6',Hazzaa Al Ghamdi (Damac) Yellow Card at 96',2025-02-02 14:52:51
12826,716079,0,44598079,45'+1',Tozé (Al Riyadh) Yellow Card at 46',2025-02-01 14:52:43
12826,716079,1,44598083,45',Jawad El Yamiq (Al Wehda) Substitution at 45',2025-01-31 14:50:56
12826,716079,2,44598085,59',Waleed Bakhashwain (Al Wehda) Substitution at 59',2025-01-31 14:50:56
12826,716079,3,44598086,65',Abdullah Al-Oaisher (Al Wehda) Own Goal at 65',2025-01-31 14:50:56
12826,716079,4,44598088,76',Mohamed Konaté (Al Riyadh) Yellow Card at 76',2025-01-31 14:50:56
12826,716079,5,44598089,77',Yahya Alshehri (Al Riyadh) Substitution at 77',2025-01-31 14:50:56
12826,716079,6,44598090,78',Nawaf Al-Abid (Al Riyadh) Substitution at 78',2025-01-31 14:50:56
12826,716079,7,44598091,78',Nawaf Al Hawsawi (Al Riyadh) Substitution at 78',2025-01-31 14:50:56
12826,716079,8,44598092,81',Marzouq Tambakti (Al Riyadh) Yellow Card at 81',2025-01-31 14:50:56
12826,716079,9,44598093,81',Hussain Ahmed Al Issa (Al Wehda) Substitution at 81',2025-01-31 14:50:56
12826,716079,10,44598094,81',Juninho Bacuna (Al Wehda) Substitution at 81',2025-01-31 14:50:56
12826,716079,11,44598096,84',Nawaf Al-Abid (Al Riyadh) Yellow Card at 84',2025-01-31 14:50:56
12826,716079,12,44598098,90'+6',Suwailem Al Menhali (Al Riyadh) Substitution at 96',2025-01-31 14:50:56
12826,716080,0,44602877,4',Kaio (Al Hilal) Goal at 4',2025-02-01 14:52:43
12826,716080,1,44602892,26',Ibrahima Koné (Al Okhdood) Yellow Card at 26',2025-02-01 14:52:43
12826,716080,2,44602894,29',Saviour Godwin (Al Okhdood) Yellow Card at 29',2025-02-01 14:52:43
12826,716080,3,44602897,42',Mohanad Al Qaydhi (Al Okhdood) Substitution at 42',2025-02-01 14:52:43
12826,716080,4,44602898,43',Sergej Milinkovic-Savic (Al Hilal) Goal at 43',2025-02-01 14:52:43
12826,716080,5,44602899,44',Saeed Al-Rabiei (Al Okhdood) Yellow Card at 44',2025-02-01 14:52:43
12826,716080,6,44602900,45'+2',Marcos Leonardo (Al Hilal) Goal at 47',2025-02-01 14:52:43
12826,716080,7,44602903,45',Diego Ferreira (Al Okhdood) Substitution at 45',2025-02-01 14:52:43
12826,716080,8,44602904,45',Mohammed Al Jahif (Al Okhdood) Substitution at 45',2025-02-01 14:52:43
12826,716080,9,44602909,55',Marcos Leonardo (Al Hilal) Goal at 55',2025-02-01 14:52:43
12826,716080,10,44602914,66',Abdulaziz Al Hatila (Al Okhdood) Substitution at 66',2025-02-01 14:52:43
12826,716080,11,44602915,67',Nasser Al-Dawsari (Al Hilal) Substitution at 67',2025-02-01 14:52:43
12826,716080,12,44602919,83',Abdullah Al-Hamddan (Al Hilal) Substitution at 83',2025-02-01 14:52:43
12826,716080,13,44602920,83',Hamad Altuhayfan (Al Hilal) Substitution at 83',2025-02-01 14:52:43
12826,716080,14,44602921,85',Saleh Al Abbas (Al Okhdood) Substitution at 85',2025-02-01 14:52:43
12826,716080,15,44602922,87',Mohammed Al-Qahtani (Al Hilal) Substitution at 87',2025-02-01 14:52:43
12826,716080,16,44602923,88',Khalid Al-Ghannam (Al Hilal) Substitution at 88',2025-02-01 14:52:43
12826,716081,0,44602669,22',Andrei Girotto (Al Taawoun) Yellow Card at 22',2025-01-31 14:50:56
12826,716081,1,44602670,38',Chris Smalling (Al Fayha) Yellow Card at 38',2025-01-31 14:50:56
12826,716081,2,44602874,45',Vinicius Rangel Da Silva (Al Fayha) Substitution at 45',2025-02-01 14:52:43
12826,716081,3,44602875,62',Hatan Bahbri (Al Taawoun) Substitution at 62',2025-02-01 14:52:43
12826,716081,4,44602876,67',Malek Al Abdulmonam (Al Fayha) Substitution at 67',2025-02-01 14:52:43
12826,716081,5,44602880,77',Gojko Cimirot (Al Fayha) Substitution at 77',2025-02-01 14:52:43
12826,716081,6,44602881,77',Abdulfattah Adam (Al Taawoun) Substitution at 77',2025-02-01 14:52:43
12826,716081,7,44602882,77',Sultan Mandash (Al Taawoun) Substitution at 77',2025-02-01 14:52:43
12826,716081,8,44602888,89',Fashion Sakala (Al Fayha) Yellow Card at 89',2025-02-01 14:52:43
12826,716081,9,44602890,90'+2',Sultan Al Farhan (Al Taawoun) Substitution at 92',2025-02-01 14:52:43
12826,716081,10,44602891,90'+2',Mohammed Mahzari (Al Taawoun) Substitution at 92',2025-02-01 14:52:43
12826,716082,0,44607507,2',Julián Quiñones (Al Qadsiah) Goal at 2',2025-02-02 14:52:51
12826,716082,1,44609137,45',Hussain Al Zarie (Al Fateh) Yellow Card at 45',2025-02-02 14:52:51
12826,716082,2,44609700,45',Hussain Salem (Al Fateh) Substitution at 45',2025-02-02 14:52:51
12826,716082,3,44609701,45',Matheus Machado (Al Fateh) Substitution at 45',2025-02-02 14:52:51
12826,716082,4,44609753,47',Matheus Machado (Al Fateh) Goal at 47',2025-02-02 14:52:51
12826,716082,5,44611069,73',Hussain Al-Qahtani (Al Qadsiah) Substitution at 73',2025-02-02 14:52:51
