seasonType,eventId,commentaryOrder,playId,clockDisplayValue,commentaryText,updateDateTime
13515,744115,51,45706297,46',Simone Zanon (Carrarese) wins a free kick in the attacking half.,2025-08-20 04:56:38
13515,744115,52,-1,47',Attempt blocked. Emanuele Zuelli (Carrarese) right footed shot from the left side of the box is blocked.,2025-08-19 04:57:38
13515,744115,53,-1,47',"Corner,Carrarese. Conceded by Matteo Palma.",2025-08-19 04:57:38
13515,744115,54,45706304,49',Attempt blocked. Federico Accornero (Carrarese) left footed shot from the left side of the box is blocked. Assisted by Kleis Bozhanaj.,2025-08-20 04:56:38
13515,744115,55,-1,49',"Corner,Carrarese. Conceded by Oumar Solet.",2025-08-19 04:57:38
13515,744115,56,45706310,51',Foul by Fabio Abiuso (Carrarese).,2025-08-20 04:56:38
13515,744115,57,45706310,51',Jesper Karlström (Udinese) wins a free kick in the defensive half.,2025-08-20 04:56:38
13515,744115,58,45702993,52',Attempt missed. Iker Bravo (Udinese) right footed shot from outside the box is too high. Assisted by Jordan Zemura.,2025-08-19 04:57:38
13515,744115,59,-1,52',Foul by Jordan Zemura (Udinese).,2025-08-19 04:57:38
13515,744115,60,-1,52',Simone Zanon (Carrarese) wins a free kick in the defensive half.,2025-08-19 04:57:38
13515,744115,61,45706318,52',Attempt blocked. Keinan Davis (Udinese) left footed shot from the left side of the box is blocked. Assisted by Sandi Lovric.,2025-08-20 04:56:38
13515,744115,62,45706321,52',Attempt saved. Kingsley Ehizibue (Udinese) right footed shot from outside the box is saved in the bottom right corner by Marco Bleve (Carrarese). Assisted by Arthur Atta.,2025-08-20 04:56:38
13515,744115,63,45706322,53',Foul by Sandi Lovric (Udinese).,2025-08-20 04:56:38
13515,744115,64,45706322,53',Niccolò Belloni (Carrarese) wins a free kick in the defensive half.,2025-08-20 04:56:38
13515,744115,65,45703032,53',Attempt missed. Kleis Bozhanaj (Carrarese) right footed shot from outside the box is high and wide to the right. Assisted by Federico Accornero.,2025-08-19 04:57:38
13515,744115,66,45706324,55',Foul by Jordan Zemura (Udinese).,2025-08-20 04:56:38
13515,744115,67,45706324,55',Nicolás Schiavi (Carrarese) wins a free kick in the defensive half.,2025-08-20 04:56:38
13515,744115,68,45706329,57',"Offside, Udinese. Thomas Kristensen is caught offside.",2025-08-20 04:56:38
13515,744115,69,45703073,58',Attempt missed. Kleis Bozhanaj (Carrarese) right footed shot from the right side of the box misses to the left. Assisted by Federico Accornero.,2025-08-19 04:57:38
13515,744115,70,-1,59',Attempt blocked. Keinan Davis (Udinese) header from the centre of the box is blocked. Assisted by Sandi Lovric with a cross.,2025-08-19 04:57:38
13515,744115,71,45706334,59',Attempt blocked. Iker Bravo (Udinese) right footed shot from the centre of the box is blocked.,2025-08-20 04:56:38
13515,744115,72,-1,59',Attempt saved. Sandi Lovric (Udinese) right footed shot from the centre of the box is saved in the bottom right corner by Marco Bleve (Carrarese).,2025-08-19 04:57:38
13515,744115,73,45706336,59',Attempt saved. Arthur Atta (Udinese) left footed shot from the centre of the box is saved in the bottom right corner by Marco Bleve (Carrarese).,2025-08-20 04:56:38
13515,744115,74,45706338,59',Attempt saved. Iker Bravo (Udinese) right footed shot from the centre of the box is saved in the bottom left corner by Marco Bleve (Carrarese).,2025-08-20 04:56:38
13515,744115,75,45703082,59',"Goal! Udinese 2, Carrarese 0. Iker Bravo (Udinese) left footed shot from the centre of the box to the high centre of the goal.",2025-08-19 04:57:38
13515,744115,76,45706340,61',Foul by Jordan Zemura (Udinese).,2025-08-20 04:56:38
13515,744115,77,45706340,61',Simone Zanon (Carrarese) wins a free kick in the defensive half.,2025-08-20 04:56:38
13515,744115,78,45703099,61',Jordan Zemura (Udinese) is shown the yellow card.,2025-08-19 04:57:38
13515,744115,79,45703122,62',"Substitution, Carrarese. Filippo Distefano replaces Kleis Bozhanaj.",2025-08-19 04:57:38
13515,744115,80,45703123,62',"Substitution, Carrarese. Gabriele Parlanti replaces Nicolás Schiavi.",2025-08-19 04:57:38
13515,744115,81,45703124,62',"Substitution, Carrarese. Devid Eugene Bouah replaces Niccolò Belloni.",2025-08-19 04:57:38
13515,744115,82,-1,65',"Corner,Udinese. Conceded by Simone Zanon.",2025-08-19 04:57:38
13515,744115,83,45703149,66',"Substitution, Udinese. Vakoun Bayo replaces Keinan Davis.",2025-08-19 04:57:38
13515,744115,84,45703150,66',"Substitution, Udinese. Jakub Piotrowski replaces Sandi Lovric.",2025-08-19 04:57:38
13515,744115,85,45706343,66',Foul by Marco Imperiale (Carrarese).,2025-08-20 04:56:38
13515,744115,86,45706343,66',Kingsley Ehizibue (Udinese) wins a free kick in the attacking half.,2025-08-20 04:56:38
13515,744115,87,45706345,67',Attempt saved. Jordan Zemura (Udinese) left footed shot from outside the box is saved in the top centre of the goal by Marco Bleve (Carrarese).,2025-08-20 04:56:38
13515,744115,88,-1,67',"Corner,Udinese. Conceded by Marco Bleve.",2025-08-19 04:57:38
13515,744115,89,45706347,69',Foul by Julián Illanes (Carrarese).,2025-08-20 04:56:38
13515,744115,90,45706347,69',Vakoun Bayo (Udinese) wins a free kick in the attacking half.,2025-08-20 04:56:38
13515,744115,91,45703189,70',"Substitution, Carrarese. Filippo Melegoni replaces Fabio Abiuso.",2025-08-19 04:57:38
13515,744115,92,-1,70',Delay in match (Udinese).,2025-08-19 04:57:38
13515,744115,93,-1,71',Delay over. They are ready to continue.,2025-08-19 04:57:38
13515,744115,94,45706352,73',Foul by Gabriele Parlanti (Carrarese).,2025-08-20 04:56:38
13515,744115,95,45706352,73',Oumar Solet (Udinese) wins a free kick in the defensive half.,2025-08-20 04:56:38
13515,744115,96,45703243,76',"Substitution, Udinese. Simone Pafundi replaces Iker Bravo.",2025-08-19 04:57:38
13515,744115,97,45703248,76',"Substitution, Udinese. Saba Goglichidze replaces Matteo Palma.",2025-08-19 04:57:38
13515,744115,98,45706359,77',Attempt blocked. Simone Pafundi (Udinese) left footed shot from the left side of the box is blocked. Assisted by Arthur Atta.,2025-08-20 04:56:38
13515,744115,99,45706361,78',Attempt blocked. Simone Pafundi (Udinese) left footed shot from the centre of the box is blocked. Assisted by Jordan Zemura.,2025-08-20 04:56:38
13515,744115,100,45703295,79',Attempt missed. Simone Pafundi (Udinese) left footed shot from outside the box misses to the left. Assisted by Jakub Piotrowski.,2025-08-19 04:57:38
13515,744115,101,45703282,79',"Substitution, Carrarese. Fabio Ruggeri replaces Nicolò Calabrese.",2025-08-19 04:57:38
13515,744115,102,45703297,80',Attempt missed. Simone Zanon (Carrarese) right footed shot from the right side of the box misses to the left. Assisted by Filippo Melegoni.,2025-08-19 04:57:38
13515,744115,103,45706367,82',Attempt saved. Filippo Distefano (Carrarese) right footed shot from outside the box is saved in the centre of the goal by Razvan Sava (Udinese). Assisted by Filippo Melegoni.,2025-08-20 04:56:38
13515,744115,104,45706369,83',Attempt saved. Emanuele Zuelli (Carrarese) right footed shot from the centre of the box is saved in the bottom right corner by Razvan Sava (Udinese).,2025-08-20 04:56:38
13515,744115,105,45706371,83',Hand ball by Gabriele Parlanti (Carrarese).,2025-08-20 04:56:38
13515,744115,106,45706376,85',Foul by Devid Eugene Bouah (Carrarese).,2025-08-20 04:56:38
13515,744115,107,45706376,85',Simone Pafundi (Udinese) wins a free kick in the attacking half.,2025-08-20 04:56:38
13515,744115,108,45703373,87',"Substitution, Udinese. Oier Zarraga replaces Arthur Atta.",2025-08-19 04:57:38
13515,744115,109,-1,90',Fourth official has announced 3 minutes of added time.,2025-08-19 04:57:38
13515,744115,110,45706378,90'+1',Foul by Gabriele Parlanti (Carrarese).,2025-08-20 04:56:38
13515,744115,111,45706378,90'+1',Jesper Karlström (Udinese) wins a free kick in the defensive half.,2025-08-20 04:56:38
13515,744115,112,45706380,90'+1',"Offside, Udinese. Vakoun Bayo is caught offside.",2025-08-20 04:56:38
13515,744115,113,45703457,90'+3',"Second Half ends, Udinese 2, Carrarese 0.",2025-08-19 04:57:38
13515,744115,114,-1,,"Match ends, Udinese 2, Carrarese 0.",2025-08-19 04:57:38
13515,744116,0,-1,,Lineups are announced and players are warming up.,2025-08-19 04:57:38
13515,744116,1,45702537,,First Half begins.,2025-08-19 04:57:38
13515,744116,2,45706386,4',Foul by Daniel Tonoli (Modena).,2025-08-20 04:56:38
13515,744116,3,45706386,4',Nikola Vlasic (Torino) wins a free kick in the defensive half.,2025-08-20 04:56:38
13515,744116,4,45706388,4',"Offside, Modena. Ettore Gliozzi is caught offside.",2025-08-20 04:56:38
13515,744116,5,45706390,5',Bryant Nieling (Modena) wins a free kick in the defensive half.,2025-08-20 04:56:38
13515,744116,6,45706390,5',Foul by Cyril Ngonge (Torino).,2025-08-20 04:56:38
13515,744116,7,45706393,6',"Corner,Modena. Conceded by Adam Masina.",2025-08-20 04:56:38
13515,744116,8,45706394,10',Foul by Daniel Tonoli (Modena).,2025-08-20 04:56:38
13515,744116,9,45706394,10',Zakaria Aboukhlal (Torino) wins a free kick on the left wing.,2025-08-20 04:56:38
13515,744116,10,45706396,11',Ettore Gliozzi (Modena) wins a free kick in the defensive half.,2025-08-20 04:56:38
13515,744116,11,45706396,11',Foul by Adam Masina (Torino).,2025-08-20 04:56:38
13515,744116,12,45706398,12',Foul by Gvidas Gineitis (Torino).,2025-08-20 04:56:38
13515,744116,13,45706398,12',Simone Santoro (Modena) wins a free kick in the defensive half.,2025-08-20 04:56:38
13515,744116,14,-1,14',"Corner,Modena. Conceded by Cristiano Biraghi.",2025-08-19 04:57:38
13515,744116,15,45706402,14',Attempt blocked. Davide Adorni (Modena) header from the centre of the box is blocked. Assisted by Niklas Pyyhtiä with a cross.,2025-08-20 04:56:38
13515,744116,16,45706404,14',Attempt saved. Davide Adorni (Modena) right footed shot from the centre of the box is saved in the top right corner by Franco Israel (Torino).,2025-08-20 04:56:38
13515,744116,17,45706407,17',Attempt blocked. Ettore Gliozzi (Modena) right footed shot from outside the box is blocked. Assisted by Simone Santoro.,2025-08-20 04:56:38
13515,744116,18,45706409,17',Hand ball by Cyril Ngonge (Torino).,2025-08-20 04:56:38
13515,744116,19,45706411,18',Foul by Fabio Gerli (Modena).,2025-08-20 04:56:38
13515,744116,20,45706411,18',Nikola Vlasic (Torino) wins a free kick in the attacking half.,2025-08-20 04:56:38
13515,744116,21,45706414,19',Attempt blocked. Zakaria Aboukhlal (Torino) left footed shot from more than 35 yards is blocked. Assisted by Cristiano Biraghi.,2025-08-20 04:56:38
13515,744116,22,45702755,19',Attempt missed. Zakaria Aboukhlal (Torino) left footed shot from outside the box is too high. Assisted by Nikola Vlasic following a set piece situation.,2025-08-19 04:57:38
13515,744116,23,45706417,19',"Offside, Modena. Niklas Pyyhtiä is caught offside.",2025-08-20 04:56:38
13515,744116,24,45706421,22',"Corner,Torino. Conceded by Gady Beyuku.",2025-08-20 04:56:38
13515,744116,25,45702816,23',Attempt missed. Cesare Casadei (Torino) header from the centre of the box misses to the left. Assisted by Nikola Vlasic.,2025-08-19 04:57:38
13515,744116,26,45706425,25',Daniel Tonoli (Modena) wins a free kick in the defensive half.,2025-08-20 04:56:38
13515,744116,27,45706425,25',Foul by Zakaria Aboukhlal (Torino).,2025-08-20 04:56:38
13515,744116,28,-1,26',Delay in match (Torino).,2025-08-19 04:57:38
13515,744116,29,-1,28',Delay over. They are ready to continue.,2025-08-19 04:57:38
13515,744116,30,45706429,29',Daniel Tonoli (Modena) wins a free kick in the defensive half.,2025-08-20 04:56:38
13515,744116,31,45706429,29',Foul by Zakaria Aboukhlal (Torino).,2025-08-20 04:56:38
13515,744116,32,45706436,36',Attempt saved. Simone Santoro (Modena) right footed shot from the right side of the box is saved in the bottom right corner by Franco Israel (Torino). Assisted by Ettore Gliozzi.,2025-08-20 04:56:38
13515,744116,33,45706438,37',Ettore Gliozzi (Modena) wins a free kick in the attacking half.,2025-08-20 04:56:38
13515,744116,34,45706438,37',Foul by Adam Masina (Torino).,2025-08-20 04:56:38
13515,744116,35,45706442,39',Attempt saved. Simone Santoro (Modena) right footed shot from the right side of the box is saved in the top right corner by Franco Israel (Torino).,2025-08-20 04:56:38
13515,744116,36,45706443,39',"Corner,Modena. Conceded by Franco Israel.",2025-08-20 04:56:38
13515,744116,37,45706444,39',"Corner,Modena. Conceded by Cesare Casadei.",2025-08-20 04:56:38
13515,744116,38,45706445,40',"Corner,Modena. Conceded by Franco Israel.",2025-08-20 04:56:38
13515,744116,39,-1,41',"Corner,Modena. Conceded by Zakaria Aboukhlal.",2025-08-19 04:57:38
13515,744116,40,45706449,42',Cyril Ngonge (Torino) wins a free kick in the defensive half.,2025-08-20 04:56:38
13515,744116,41,45706449,42',Foul by Bryant Nieling (Modena).,2025-08-20 04:56:38
13515,744116,42,45703017,43',Fabio Gerli (Modena) hits the bar with a right footed shot from outside the box. Assisted by Francesco Zampano.,2025-08-19 04:57:38
13515,744116,43,45706452,44',Ettore Gliozzi (Modena) wins a free kick in the attacking half.,2025-08-20 04:56:38
13515,744116,44,45706452,44',Foul by Saúl Coco (Torino).,2025-08-20 04:56:38
13515,744116,45,45703035,45',Attempt missed. Bryant Nieling (Modena) left footed shot from outside the box is high and wide to the right from a direct free kick.,2025-08-19 04:57:38
13515,744116,46,-1,45',Fourth official has announced 3 minutes of added time.,2025-08-19 04:57:38
13515,744116,47,45706456,45'+1',Attempt saved. Gady Beyuku (Modena) left footed shot from the right side of the box is saved in the centre of the goal by Franco Israel (Torino). Assisted by Simone Santoro.,2025-08-20 04:56:38
13515,744116,48,45706457,45'+2',"Corner,Torino. Conceded by Davide Adorni.",2025-08-20 04:56:38
13515,744116,49,45703074,45'+3',"First Half ends, Torino 0, Modena 0.",2025-08-19 04:57:38
13515,744116,50,-1,45',"Second Half begins Torino 0, Modena 0.",2025-08-19 04:57:38
13515,744116,51,45703237,45',"Substitution, Torino. Emirhan Ilkhan replaces Zakaria Aboukhlal.",2025-08-19 04:57:38
13515,744116,52,45706459,46',Foul by Cesare Casadei (Torino).,2025-08-20 04:56:38
13515,744116,53,45706459,46',Francesco Zampano (Modena) wins a free kick on the left wing.,2025-08-20 04:56:38
13515,744116,54,45706462,47',Attempt blocked. Gady Beyuku (Modena) left footed shot from the centre of the box is blocked.,2025-08-20 04:56:38
13515,744116,55,45703286,47',Attempt missed. Grégoire Defrel (Modena) right footed shot from the centre of the box is high and wide to the right.,2025-08-19 04:57:38
13515,744116,56,45706465,48',Foul by Simone Santoro (Modena).,2025-08-20 04:56:38
13515,744116,57,45706465,48',Gvidas Gineitis (Torino) wins a free kick on the left wing.,2025-08-20 04:56:38
13515,744116,58,45706468,50',Adam Masina (Torino) wins a free kick on the left wing.,2025-08-20 04:56:38
13515,744116,59,45706468,50',Foul by Ettore Gliozzi (Modena).,2025-08-20 04:56:38
13515,744116,60,45706471,51',Attempt saved. Emirhan Ilkhan (Torino) right footed shot from outside the box is saved in the bottom left corner by Leandro Chichizola (Modena). Assisted by Gvidas Gineitis.,2025-08-20 04:56:38
13515,744116,61,45703328,51',"Goal! Torino 1, Modena 0. Nikola Vlasic (Torino) left footed shot from the centre of the box to the top left corner.",2025-08-19 04:57:38
13515,744116,62,-1,55',"Corner,Torino. Conceded by Francesco Zampano.",2025-08-19 04:57:38
13515,744116,63,45706476,56',Hand ball by Cyril Ngonge (Torino).,2025-08-20 04:56:38
13515,744116,64,45703391,57',Attempt missed. Niklas Pyyhtiä (Modena) left footed shot from the left side of the box is high and wide to the right. Assisted by Bryant Nieling.,2025-08-19 04:57:38
13515,744116,65,45706479,58',Foul by Grégoire Defrel (Modena).,2025-08-20 04:56:38
13515,744116,66,45706479,58',Saúl Coco (Torino) wins a free kick in the defensive half.,2025-08-20 04:56:38
13515,744116,67,45706481,58',Fabio Gerli (Modena) wins a free kick in the attacking half.,2025-08-20 04:56:38
13515,744116,68,45706481,58',Foul by Emirhan Ilkhan (Torino).,2025-08-20 04:56:38
13515,744116,69,45703414,59',Emirhan Ilkhan (Torino) is shown the yellow card for a bad foul.,2025-08-19 04:57:38
13515,744116,70,45703415,60',"Substitution, Torino. Giovanni Simeone replaces Ché Adams.",2025-08-19 04:57:38
13515,744116,71,45703434,60',"Substitution, Torino. Valentino Lazaro replaces Marcus Pedersen.",2025-08-19 04:57:38
13515,744116,72,45703507,66',"Substitution, Modena. Luca Magnino replaces Niklas Pyyhtiä.",2025-08-19 04:57:38
13515,744116,73,45703525,67',"Substitution, Modena. Pedro Mendes replaces Ettore Gliozzi.",2025-08-19 04:57:38
13515,744116,74,45703526,67',"Substitution, Modena. Francesco Di Mariano replaces Grégoire Defrel.",2025-08-19 04:57:38
13515,744116,75,45706488,67',Foul by Luca Magnino (Modena).,2025-08-20 04:56:38
13515,744116,76,45706488,67',Giovanni Simeone (Torino) wins a free kick on the left wing.,2025-08-20 04:56:38
13515,744116,77,45706492,70',Foul by Cyril Ngonge (Torino).,2025-08-20 04:56:38
13515,744116,78,45706492,70',Francesco Di Mariano (Modena) wins a free kick in the attacking half.,2025-08-20 04:56:38
13515,744116,79,45703549,70',Cyril Ngonge (Torino) is shown the yellow card.,2025-08-19 04:57:38
13515,744116,80,-1,72',Delay in match (Torino).,2025-08-19 04:57:38
13515,744116,81,45703593,74',"Substitution, Modena. Luca Zanimacchia replaces Francesco Zampano.",2025-08-19 04:57:38
13515,744116,82,-1,74',Delay over. They are ready to continue.,2025-08-19 04:57:38
13515,744116,83,45706498,77',Foul by Gady Beyuku (Modena).,2025-08-20 04:56:38
13515,744116,84,45706498,77',Gvidas Gineitis (Torino) wins a free kick in the defensive half.,2025-08-20 04:56:38
13515,744116,85,45706500,78',Foul by Saúl Coco (Torino).,2025-08-20 04:56:38
13515,744116,86,45706500,78',Francesco Di Mariano (Modena) wins a free kick in the defensive half.,2025-08-20 04:56:38
13515,744116,87,45703626,79',"Substitution, Modena. Yanis Massolin replaces Fabio Gerli.",2025-08-19 04:57:38
13515,744116,88,45703619,79',"Substitution, Torino. Tino Anjorin replaces Gvidas Gineitis.",2025-08-19 04:57:38
13515,744116,89,45706503,81',Foul by Tino Anjorin (Torino).,2025-08-20 04:56:38
13515,744116,90,45706503,81',Luca Magnino (Modena) wins a free kick in the defensive half.,2025-08-20 04:56:38
13515,744116,91,45703636,81',Tino Anjorin (Torino) is shown the yellow card for a bad foul.,2025-08-19 04:57:38
13515,744116,92,-1,82',Delay in match because of an injury Luca Magnino (Modena).,2025-08-19 04:57:38
13515,744116,93,-1,82',Delay over. They are ready to continue.,2025-08-19 04:57:38
13515,744116,94,45706508,84',Attempt saved. Giovanni Simeone (Torino) right footed shot from outside the box is saved in the bottom left corner by Leandro Chichizola (Modena). Assisted by Tino Anjorin.,2025-08-20 04:56:38
13515,744116,95,45706509,84',Daniel Tonoli (Modena) wins a free kick in the defensive half.,2025-08-20 04:56:38
13515,744116,96,45706509,84',Foul by Tino Anjorin (Torino).,2025-08-20 04:56:38
13515,744116,97,45706514,87',"Corner,Modena. Conceded by Saúl Coco.",2025-08-20 04:56:38
13515,744116,98,45703671,88',"Substitution, Torino. Duván Zapata replaces Cyril Ngonge.",2025-08-19 04:57:38
13515,744116,99,-1,90',Fourth official has announced 5 minutes of added time.,2025-08-19 04:57:38
13515,744116,100,45706518,90'+1',Daniel Tonoli (Modena) wins a free kick on the right wing.,2025-08-20 04:56:38
13515,744116,101,45706518,90'+1',Foul by Giovanni Simeone (Torino).,2025-08-20 04:56:38
13515,744116,102,45706521,90'+3',"Corner,Torino. Conceded by Bryant Nieling.",2025-08-20 04:56:38
13515,744116,103,45703695,90'+4',Attempt missed. Cesare Casadei (Torino) right footed shot from outside the box is high and wide to the right.,2025-08-19 04:57:38
13515,744116,104,45703696,90'+6',"Second Half ends, Torino 1, Modena 0.",2025-08-19 04:57:38
13515,744116,105,-1,,"Match ends, Torino 1, Modena 0.",2025-08-19 04:57:38
13516,744097,0,-1,,Lineups are announced and players are warming up.,2025-08-10 04:46:51
13516,744097,1,-1,,First Half begins.,2025-08-10 04:46:51
13516,744097,2,-1,16',"Goal! Virtus Entella 1, Ternana 0. Flavio Russo (Virtus Entella).",2025-08-10 04:46:51
13516,744097,3,-1,45',"First Half ends, Virtus Entella 1, Ternana 0.",2025-08-10 04:46:51
13516,744097,4,-1,45',"Second Half begins Virtus Entella 1, Ternana 0.",2025-08-10 04:46:51
13516,744097,5,-1,57',"Substitution, Ternana. Tiberio Bruti replaces Alessio Maestrelli.",2025-08-10 04:46:51
13516,744097,6,-1,57',"Substitution, Virtus Entella. Francesco Mezzoni replaces Antonio Boccadamo.",2025-08-10 04:46:51
13516,744097,7,-1,57',"Substitution, Virtus Entella. Marco Nichetti replaces Ahmad Benali.",2025-08-10 04:46:51
13516,744097,8,-1,57',"Substitution, Virtus Entella. Tommaso Fumagalli replaces Flavio Russo.",2025-08-10 04:46:51
13516,744097,9,-1,59',"Goal! Virtus Entella 2, Ternana 0. Andrea Franzoni (Virtus Entella).",2025-08-10 04:46:51
13516,744097,10,-1,64',"Substitution, Ternana. Alfredo Donnarumma replaces Alexis Ferrante.",2025-08-10 04:46:51
13516,744097,11,-1,64',"Substitution, Ternana. Marco Longoni replaces Marcelo Orellana.",2025-08-10 04:46:51
13516,744097,12,-1,70',"Goal! Virtus Entella 3, Ternana 0. Tommaso Fumagalli (Virtus Entella).",2025-08-10 04:46:51
13516,744097,13,-1,72',"Substitution, Virtus Entella. Marco Dalla Vecchia replaces Nermin Karic.",2025-08-10 04:46:51
13516,744097,14,-1,79',"Substitution, Virtus Entella. Davide Castelli replaces Bernat Guiu.",2025-08-10 04:46:51
13516,744097,15,-1,84',"Substitution, Ternana. Giulio Biondini replaces Bruno Martella.",2025-08-10 04:46:51
13516,744097,16,-1,84',"Substitution, Ternana. Mattia Turella replaces Alessandro Coltorti.",2025-08-10 04:46:51
13516,744097,17,-1,85',"Goal! Virtus Entella 4, Ternana 0. Stefano Di Mario (Virtus Entella).",2025-08-10 04:46:51
13516,744097,18,-1,90',"Second Half ends, Virtus Entella 4, Ternana 0.",2025-08-10 04:46:51
13516,744097,19,-1,,"Match ends, Virtus Entella 4, Ternana 0.",2025-08-10 04:46:51
13516,744098,0,-1,,Lineups are announced and players are warming up.,2025-08-11 04:43:25
13516,744098,1,-1,,First Half begins.,2025-08-11 04:43:25
13516,744098,2,-1,14',"Goal! Padova 0, Vicenza 1. Alessandro Capello (Vicenza).",2025-08-11 04:43:25
13516,744098,3,-1,20',Giuseppe Cuomo (Vicenza) is shown the yellow card.,2025-08-11 04:43:25
13516,744098,4,-1,31',Christian Pastina (Padova) is shown the yellow card.,2025-08-11 04:43:25
13516,744098,5,-1,44',Lorenzo Caferri (Vicenza) is shown the yellow card.,2025-08-11 04:43:25
13516,744098,6,-1,45',"First Half ends, Padova 0, Vicenza 1.",2025-08-11 04:43:25
13516,744098,7,-1,45',"Second Half begins Padova 0, Vicenza 1.",2025-08-11 04:43:25
13516,744098,8,-1,45',"Substitution, Padova. Lorenzo Villa replaces Christian Pastina.",2025-08-11 04:43:25
13516,744098,9,-1,46',"Goal! Padova 0, Vicenza 2. Lorenzo Caferri (Vicenza).",2025-08-11 04:43:25
13516,744098,10,-1,52',"Substitution, Padova. Daniele Baselli replaces Lorenzo Crisetig.",2025-08-11 04:43:25
13516,744098,11,-1,58',"Substitution, Padova. Cristian Buonaiuto replaces Alessandro Seghetti.",2025-08-11 04:43:25
13516,744098,12,-1,62',"Substitution, Padova. Antonio Barreca replaces Paolo Ghiglione.",2025-08-11 04:43:25
13516,744098,13,-1,62',"Substitution, Padova. Luca Di Maggio replaces Pietro Fusi.",2025-08-11 04:43:25
13516,744098,14,-1,66',"Substitution, Vicenza. David Stückler replaces Mattia Vitale.",2025-08-11 04:43:25
13516,744098,15,-1,66',"Substitution, Vicenza. Giulio Pellizzari replaces Alessandro Capello.",2025-08-11 04:43:25
13516,744098,16,-1,66',"Substitution, Vicenza. Nicola Rauti replaces Claudio Morra.",2025-08-11 04:43:25
13516,744098,17,-1,73',"Substitution, Vicenza. Francesco Benassai replaces Alessio Tribuzzi.",2025-08-11 04:43:25
13516,744098,18,-1,84',"Substitution, Vicenza. Armand Rada replaces Michele Cavion.",2025-08-11 04:43:25
13516,744098,19,-1,90',"Second Half ends, Padova 0, Vicenza 2.",2025-08-11 04:43:25
13516,744098,20,-1,,"Match ends, Padova 0, Vicenza 2.",2025-08-11 04:43:25
13516,744099,0,-1,,Lineups are announced and players are warming up.,2025-08-11 04:43:25
13516,744099,1,-1,,First Half begins.,2025-08-11 04:43:25
13516,744099,2,-1,10',Tommaso Cancellotti (Avellino) is shown the yellow card.,2025-08-11 04:43:25
13516,744099,3,-1,37',Luca Martinelli (Audace Cerignola) is shown the yellow card.,2025-08-11 04:43:25
13516,744099,4,-1,45',"First Half ends, Audace Cerignola 0, Avellino 0.",2025-08-11 04:43:25
13516,744099,5,-1,45',"Second Half begins Audace Cerignola 0, Avellino 0.",2025-08-11 04:43:25
13516,744099,6,-1,59',"Goal! Audace Cerignola 1, Avellino 0. Luigi Cuppone (Audace Cerignola).",2025-08-11 04:43:25
13516,744099,7,-1,67',"Substitution, Avellino. Gianmarco Todisco replaces Alessandro Milani.",2025-08-11 04:43:25
13516,744099,8,-1,67',"Substitution, Avellino. Roberto Insigne replaces Martin Palumbo.",2025-08-11 04:43:25
13516,744099,9,-1,69',"Substitution, Audace Cerignola. Alessandro Faggioli replaces Michele Emmausso.",2025-08-11 04:43:25
13516,744099,10,-1,75',"Substitution, Audace Cerignola. Riccardo Spaltro replaces Ludovico D'Orazio.",2025-08-11 04:43:25
13516,744099,11,-1,75',"Substitution, Audace Cerignola. Zak Ruggiero replaces Giuseppe Coccia.",2025-08-11 04:43:25
13516,744099,12,-1,76',Carmine Cretella (Audace Cerignola) is shown the yellow card.,2025-08-11 04:43:25
13516,744099,13,-1,76',"Substitution, Avellino. Giuseppe Panico replaces Facundo Lescano.",2025-08-11 04:43:25
13516,744099,14,-1,85',"Substitution, Audace Cerignola. Gabriele Ingrosso replaces Luca Russo.",2025-08-11 04:43:25
13516,744099,15,-1,85',"Substitution, Audace Cerignola. Miguel Ángel Maza replaces Luigi Cuppone.",2025-08-11 04:43:25
13516,744099,16,-1,85',"Substitution, Avellino. Lorenco Simic replaces Raffaele Russo.",2025-08-11 04:43:25
