seasonType,eventId,commentaryOrder,playId,clockDisplayValue,commentaryText,updateDateTime
12826,716153,7,45012470,67',Thamer Al Khaibri (Al Raed) Substitution at 67',2025-04-06 20:26:57
12826,716153,8,45012488,71',Murad Al Hawsawi (Al Khaleej) Goal at 71',2025-04-06 20:26:57
12826,716153,9,45012552,77',Kostas Fortounis (Al Khaleej) Yellow Card at 77',2025-04-06 20:26:57
12826,716153,10,45012597,82',Waheb Saleh (Al Khaleej) Substitution at 82',2025-04-06 20:26:57
12826,716153,11,45012598,82',Khaled Al Samiri (Al Khaleej) Substitution at 82',2025-04-06 20:26:57
12826,716153,12,45012599,83',Moses Turay (Al Raed) Substitution at 83',2025-04-07 11:20:25
12826,716153,13,45012600,84',Yahya Sunbul (Al Raed) Substitution at 84',2025-04-06 20:26:57
12826,716153,14,45012637,88',Mohamed Sherif (Al Khaleej) Substitution at 88',2025-04-06 20:26:57
12826,716153,15,45012691,90'+7',Kostas Fortounis (Al Khaleej) Goal at 97',2025-04-07 11:20:25
12826,716153,16,45012709,90'+10',Waheb Saleh (Al Khaleej) Yellow Card at 100',2025-04-06 20:46:08
12826,716154,0,44993385,6',Ahmad Asiri (Al Riyadh) Yellow Card at 6',2025-04-06 04:57:44
12826,716154,1,44995483,45',Mohamed Konaté (Al Riyadh) Substitution at 45',2025-04-06 04:57:44
12826,716154,2,44995942,56',Bernard Mensah (Al Riyadh) Yellow Card at 56',2025-04-06 04:57:44
12826,716154,3,44996658,70',Mohammed Al Aqel (Al Riyadh) Substitution at 70',2025-04-06 04:57:44
12826,716154,4,44996659,70',Rayan Al Bloushi (Al Riyadh) Substitution at 70',2025-04-06 04:57:44
12826,716154,5,44996660,71',Sanousi Al Hawsawi (Damac) Substitution at 71',2025-04-06 04:57:44
12826,716154,6,44996993,83',Dhari Al Anazi (Damac) Substitution at 83',2025-04-06 04:57:44
12826,716154,7,44997080,90',Hassan Abu Shararh (Damac) Substitution at 90',2025-04-06 04:57:44
12826,716154,8,44997112,90'+4',Dhari Al Anazi (Damac) Yellow Card at 94',2025-04-06 04:57:44
12826,716155,0,44986267,24',Saviour Godwin (Al Okhdood) Goal at 24',2025-04-05 08:47:55
12826,716155,1,44986300,45',Fahad Zubaidi (Al Orobah) Substitution at 45',2025-04-05 08:47:55
12826,716155,2,44986305,53',Damion Lowe (Al Okhdood) Yellow Card at 53',2025-04-05 08:47:55
12826,716155,3,44986332,68',Cristian Tello (Al Orobah) Substitution at 68',2025-04-05 08:47:55
12826,716155,4,44986343,75',Naif Asiri (Al Okhdood) Substitution at 75',2025-04-05 08:47:55
12826,716155,5,44986352,78',Ousmane Barry (Al Okhdood) Substitution at 78',2025-04-05 08:47:55
12826,716155,6,44986353,78',Karim Ashraf (Al Okhdood) Substitution at 78',2025-04-05 08:47:55
12826,716155,7,44986354,79',Cristian Tello (Al Orobah) Yellow Card at 79',2025-04-05 08:47:55
12826,716155,8,44986367,90'+6',Saud Salem (Al Okhdood) Substitution at 96',2025-04-05 08:47:55
12826,716155,9,44986368,90'+6',Mohammed Al Jahif (Al Okhdood) Substitution at 96',2025-04-05 08:47:55
12826,716156,0,45038270,43',João Costa (Al Ettifaq) Yellow Card at 43',2025-04-12 05:11:17
12826,716156,1,45038324,45'+5',Renan Lodi (Al Hilal) Yellow Card at 50',2025-04-12 05:11:17
12826,716156,2,45038325,45'+6',João Costa (Al Ettifaq) Goal at 51',2025-04-12 05:11:17
12826,716156,3,45038533,46',Abdulelah Al-Malki (Al Ettifaq) Yellow Card at 46',2025-04-12 05:11:17
12826,716156,4,45038625,52',Abdulbasit Hindi (Al Ettifaq) Substitution at 52',2025-04-12 05:11:17
12826,716156,5,45038626,52',Madallah Al-Olayan (Al Ettifaq) Substitution at 52',2025-04-12 05:11:17
12826,716156,6,45038672,57',Malcom  (Al Hilal) Goal at 57',2025-04-12 05:11:17
12826,716156,7,45038765,62',Kalidou Koulibaly (Al Hilal) Yellow Card at 62',2025-04-12 05:11:17
12826,716156,8,45038969,73',Yasser Al-Shahrani (Al Hilal) Substitution at 73',2025-04-12 05:11:17
12826,716156,9,45038970,73',Abdullah Al-Hamddan (Al Hilal) Substitution at 73',2025-04-12 05:11:17
12826,716156,10,45039075,81',Vitinho  (Al Ettifaq) Substitution at 81',2025-04-12 05:11:17
12826,716156,11,45039076,82',Vitinho  (Al Ettifaq) Yellow Card at 82',2025-04-12 05:11:17
12826,716156,12,45039221,90'+2',Abdullah Radif (Al Ettifaq) Substitution at 92',2025-04-12 05:11:17
12826,716157,0,45048083,33',Renzo López (Al Fayha) Goal at 33',2025-04-14 05:18:05
12826,716157,1,45048252,45'+2',Gabriel Vareta (Al Fayha) Yellow Card at 47',2025-04-14 05:18:05
12826,716157,2,45048446,45',Iker Almena (Al Qadsiah) Substitution at 45',2025-04-14 05:18:05
12826,716157,3,45048447,45',Abdulaziz Al Othman (Al Qadsiah) Substitution at 45',2025-04-14 05:18:05
12826,716157,4,45048618,58',Renzo López (Al Fayha) Goal at 58',2025-04-14 05:18:05
12826,716157,5,45048696,63',Ali Abdullah Hazzazi (Al Qadsiah) Substitution at 63',2025-04-14 05:18:05
12826,716157,6,45048808,77',Gojko Cimirot (Al Fayha) Substitution at 77',2025-04-14 05:18:05
12826,716157,7,45048868,80',Hussain Al-Qahtani (Al Qadsiah) Substitution at 80',2025-04-14 05:18:05
12826,716157,8,45048946,86',Khalid Al-Khabi (Al Fayha) Substitution at 86',2025-04-14 05:18:05
12826,716157,9,45049017,89',Mukhir Al Rashidi (Al Fayha) Substitution at 89',2025-04-14 05:18:05
12826,716157,10,45049035,90'+2',Julián Quiñones (Al Qadsiah) Penalty - Scored at 92',2025-04-14 05:18:05
12826,716158,0,45034061,25',N'Golo Kanté (Al Ittihad) Yellow Card at 25',2025-04-12 05:11:17
12826,716158,1,45034130,45'+7',Unai Hernandez (Al Ittihad) Goal at 52',2025-04-12 05:11:17
12826,716158,2,45034253,45'+9',Cristian Tello (Al Orobah) Yellow Card at 54',2025-04-12 05:11:17
12826,716158,3,45034265,50',Unai Hernandez (Al Ittihad) Yellow Card at 50',2025-04-12 05:11:17
12826,716158,4,45034353,56',Fawaz Al-Torais (Al Orobah) Substitution at 56',2025-04-12 05:11:17
12826,716158,5,45034398,60',Fawaz Al-Torais (Al Orobah) Yellow Card at 60',2025-04-12 05:11:17
12826,716158,6,45034458,66',Rafi Al-Ruwaili (Al Orobah) Yellow Card at 66',2025-04-12 05:11:17
12826,716158,7,45034612,80',Abdulmalek Al Shammary (Al Orobah) Substitution at 80',2025-04-12 05:11:17
12826,716158,8,45034613,80',Saleh Al-Shehri (Al Ittihad) Substitution at 80',2025-04-12 05:11:17
12826,716158,9,45034614,80',Abdulrahman Al-Obud (Al Ittihad) Substitution at 80',2025-04-12 05:11:17
12826,716158,10,45034615,80',Muhannad Al-Shanqiti (Al Ittihad) Substitution at 80',2025-04-12 05:11:17
12826,716158,11,45034638,84',Hamed Alghamdi (Al Ittihad) Substitution at 84',2025-04-12 05:11:17
12826,716158,12,45034649,87',Moussa Diaby (Al Ittihad) Yellow Card at 87',2025-04-12 05:11:17
12826,716158,13,45034650,88',Abdulrahman Al-Obud (Al Ittihad) Goal at 88',2025-04-12 05:11:17
12826,716158,14,45034652,90'+4',Osama Al Khalaf (Al Orobah) Substitution at 94',2025-04-12 05:11:17
12826,716159,0,45046872,4',Dimitrios Kourbelis (Al Khaleej) Goal at 4',2025-04-14 05:18:05
12826,716159,1,45047901,44',Matias Vargas (Al Fateh) Goal at 44',2025-04-14 05:18:05
12826,716159,2,45048219,45',Saeed Al Hamsal (Al Khaleej) Substitution at 45',2025-04-14 05:18:05
12826,716159,3,45048234,47',Mourad Batna (Al Fateh) Goal at 47',2025-04-14 05:18:05
12826,716159,4,45048271,50',Saeed Al Hamsal (Al Khaleej) Yellow Card at 50',2025-04-14 05:18:05
12826,716159,5,45048299,52',Mohamed Sbai (Al Fateh) Goal at 52',2025-04-14 05:18:05
12826,716159,6,45048437,65',Sofiane Bendebka (Al Fateh) Penalty - Scored at 65',2025-04-14 05:18:05
12826,716159,7,45048472,66',Mohammed Al Abdullah (Al Khaleej) Substitution at 66',2025-04-14 05:18:05
12826,716159,8,45048473,66',Mohamed Sherif (Al Khaleej) Substitution at 66',2025-04-14 05:18:05
12826,716159,9,45048474,66',Saeed Baattia (Al Fateh) Substitution at 66',2025-04-14 05:18:05
12826,716159,10,45048507,66',Bandar Al Mutairi (Al Khaleej) Substitution at 66',2025-04-14 05:18:05
12826,716159,11,45048475,67',Matheus Machado (Al Fateh) Substitution at 67',2025-04-14 05:18:05
12826,716159,12,45048519,71',Matias Vargas (Al Fateh) Goal at 71',2025-04-14 05:18:05
12826,716159,13,45048657,79',Abdullah Safoud Alemzi (Al Fateh) Substitution at 79',2025-04-14 05:18:05
12826,716159,14,45048658,79',Suhayb Alzaid (Al Fateh) Substitution at 79',2025-04-14 05:18:05
12826,716159,15,45048659,80',Hussain Al Zarie (Al Fateh) Yellow Card at 80',2025-04-14 05:18:05
12826,716159,16,45048731,87',Hussain Salem (Al Fateh) Yellow Card at 87',2025-04-14 05:18:05
12826,716159,17,45048732,87',Hussain Salem (Al Fateh) Substitution at 87',2025-04-14 05:18:05
12826,716159,18,45048733,88',Ali Abdoulraouf Alabdrabalnabi (Al Khaleej) Substitution at 88',2025-04-14 05:18:05
12826,716160,0,45049412,19',Jhon Durán (Al Nassr) Yellow Card at 19',2025-04-14 05:18:05
12826,716160,1,45049779,45'+2',Faïz Selemani (Al Riyadh) Goal at 47',2025-04-14 05:18:05
12826,716160,2,45050024,45',Mohammed Al Aqel (Al Riyadh) Substitution at 45',2025-04-14 05:18:05
12826,716160,3,45050025,45',Ângelo Gabriel  (Al Nassr) Substitution at 45',2025-04-14 05:18:05
12826,716160,4,45050026,45',Aymeric Laporte (Al Nassr) Substitution at 45',2025-04-14 05:18:05
12826,716160,5,45050087,45',Abdulmajeed Al-Sulaiheem (Al Nassr) Substitution at 45',2025-04-14 05:18:05
12826,716160,6,45050294,56',Cristiano Ronaldo (Al Nassr) Goal at 56',2025-04-14 05:18:05
12826,716160,7,45050363,59',Bernard Mensah (Al Riyadh) Yellow Card at 59',2025-04-14 05:18:05
12826,716160,8,45050458,64',Cristiano Ronaldo (Al Nassr) Goal at 64',2025-04-14 05:18:05
12826,716160,9,45050607,69',Enes Sali (Al Riyadh) Substitution at 69',2025-04-14 05:18:05
12826,716160,10,45050791,79',Talal Haji (Al Riyadh) Substitution at 79',2025-04-14 05:18:05
12826,716160,11,45050860,80',Abdulelah Al Khaibari (Al Riyadh) Yellow Card at 80',2025-04-14 05:18:05
12826,716160,12,45050861,82',Ibrahim Bayesh (Al Riyadh) Yellow Card at 82',2025-04-14 05:18:05
12826,716160,13,45050925,85',Abdullah Al-Khaibari (Al Nassr) Substitution at 85',2025-04-14 05:18:05
12826,716160,14,45050985,87',Ângelo Gabriel  (Al Nassr) Yellow Card at 87',2025-04-14 05:18:05
12826,716160,15,45051143,90'+4',Ahmad Asiri (Al Riyadh) Red Card at 94',2025-04-14 05:18:05
12826,716160,16,45051202,90'+11',Salem Al Najdi (Al Nassr) Substitution at 101',2025-04-14 05:18:05
12826,716160,17,45051203,90'+12',Marzouq Tambakti (Al Riyadh) Yellow Card at 102',2025-04-14 05:18:05
12826,716161,0,45038016,7',Christian Bassogog (Al Okhdood) Goal at 7',2025-04-12 05:11:17
12826,716161,1,45038025,24',Al Mufarrij (Al Taawoun) Yellow Card at 24',2025-04-12 05:11:17
12826,716161,2,45038036,45'+5',Sultan Al Farhan (Al Taawoun) Yellow Card at 50',2025-04-12 05:11:17
12826,716161,3,45038050,52',Faycal Fajr (Al Taawoun) Substitution at 52',2025-04-12 05:11:17
12826,716161,4,45038051,53',Faycal Fajr (Al Taawoun) Yellow Card at 53',2025-04-12 05:11:17
12826,716161,5,45038054,63',Saad Al Nasser (Al Taawoun) Substitution at 63',2025-04-12 05:11:17
12826,716161,6,45038055,63',Abdelhamid Sabiri (Al Taawoun) Substitution at 63',2025-04-12 05:11:17
12826,716161,7,45038056,63',Sultan Mandash (Al Taawoun) Substitution at 63',2025-04-12 05:11:17
12826,716161,8,45038062,72',Knowledge Musona (Al Okhdood) Substitution at 72',2025-04-12 05:11:17
12826,716161,9,45038067,73',Andrei Girotto (Al Taawoun) Substitution at 73',2025-04-12 05:11:17
12826,716161,10,45038071,77',Petros (Al Okhdood) Yellow Card at 77',2025-04-13 05:23:21
12826,716161,11,45038072,79',Sultan Mandash (Al Taawoun) Goal at 79',2025-04-12 05:11:17
12826,716161,12,45038078,84',Ousmane Barry (Al Okhdood) Substitution at 84',2025-04-12 05:11:17
12826,716161,13,45038088,90'+2',Abdulaziz Al Hatila (Al Okhdood) Substitution at 92',2025-04-12 05:11:17
12826,716161,14,45038089,90'+2',Mohammed Al Jahif (Al Okhdood) Substitution at 92',2025-04-12 05:11:17
12826,716162,0,45038026,22',Ali Majrashi (Al Ahli) Yellow Card at 22',2025-04-13 05:23:21
12826,716162,1,45038028,27',Hamad Al Jayzani (Al Raed) Yellow Card at 27',2025-04-13 05:23:21
12826,716162,2,45038030,28',Franck Kessié (Al Ahli) Penalty - Scored at 28',2025-04-13 05:23:21
12826,716162,3,45038038,45'+5',Mubarak Abdul Rahman Al Rajeh (Al Raed) Yellow Card at 50',2025-04-13 05:23:21
12826,716162,4,45038058,66',Gabri Veiga (Al Ahli) Goal at 66',2025-04-13 05:23:21
12826,716162,5,45038063,67',Mohammad Al-Dawsari (Al Raed) Substitution at 67',2025-04-13 05:23:21
12826,716162,6,45038064,67',Khalid Al Subaie (Al Raed) Substitution at 67',2025-04-13 05:23:21
12826,716162,7,45038069,72',Saleh Al-Jamaan (Al Raed) Substitution at 72',2025-04-13 05:23:21
12826,716162,8,45038073,74',Sumaihan Al-Nabet (Al Ahli) Substitution at 74',2025-04-13 05:23:21
12826,716162,9,45038081,82',Abdullah Al Yousif (Al Raed) Substitution at 82',2025-04-13 05:23:21
12826,716162,10,45038082,82',Thamer Al Khaibri (Al Raed) Substitution at 82',2025-04-13 05:23:21
12826,716162,11,45038086,85',Abdulkarim Darisi (Al Ahli) Substitution at 85',2025-04-13 05:23:21
12826,716162,12,45038087,86',Abdullah Al Yousif (Al Raed) Yellow Card at 86',2025-04-13 05:23:21
12826,716162,13,45038099,90'+2',Eid Al Muwallad (Al Ahli) Substitution at 92',2025-04-13 05:23:21
12826,716163,0,45033715,12',Cristian Guanca (Al Shabab) Goal at 12',2025-04-12 05:11:17
12826,716163,1,45033718,45'+4',Abderrazak Hamdallah (Al Shabab) Penalty - Scored at 49',2025-04-12 05:11:17
12826,716163,2,45033825,58',Farhah Al Shamrani (Al Kholood) Yellow Card at 58',2025-04-12 05:11:17
12826,716163,3,45033877,66',Hammam Al-Hammami (Al Kholood) Substitution at 66',2025-04-12 05:11:17
12826,716163,4,45033878,66',Abdulfattah Asiri (Al Kholood) Substitution at 66',2025-04-12 05:11:17
12826,716163,5,45033879,67',Leandrinho (Al Shabab) Substitution at 67',2025-04-12 05:11:17
12826,716163,6,45033906,77',Kebba Sowe (Al Kholood) Substitution at 77',2025-04-12 05:11:17
12826,716163,7,45033907,77',Abdulrahman Al Safari (Al Kholood) Substitution at 77',2025-04-12 05:11:17
12826,716163,8,45033912,84',Haroune Camara (Al Shabab) Substitution at 84',2025-04-12 05:11:17
12826,716163,9,45033913,84',Zaid Al Enezi (Al Kholood) Substitution at 84',2025-04-12 05:11:17
12826,716163,10,45033914,85',Nawaf Al Ghulaimish (Al Shabab) Substitution at 85',2025-04-12 05:11:17
12826,716163,11,45033918,87',Robert (Al Shabab) Yellow Card at 87',2025-04-12 05:11:17
12826,716163,12,45033947,90'+5',Hisham Al Dubais (Al Shabab) Substitution at 95',2025-04-12 05:11:17
12826,716163,13,45033948,90'+6',Nawaf Al Saadi (Al Shabab) Substitution at 96',2025-04-12 05:11:17
12826,716164,0,45033716,9',Abdelkader Bedrane (Damac) Yellow Card at 9',2025-04-12 05:11:17
12826,716164,1,45033717,35',Abdelkader Bedrane (Damac) Red Card at 35',2025-04-12 05:11:17
12826,716164,2,45033719,40',Abdulrahman Al-Obaid (Damac) Yellow Card at 40',2025-04-12 05:11:17
12826,716164,3,45033720,42',Mohammed Alkhaibari (Damac) Substitution at 42',2025-04-12 05:11:17
12826,716164,4,45033721,43',Jawad El Yamiq (Al Wehda) Yellow Card at 43',2025-04-12 05:11:17
12826,716164,5,45033816,52',Juninho Bacuna (Al Wehda) Goal at 52',2025-04-12 05:11:17
12826,716164,6,45033900,68',Dhari Al Anazi (Damac) Substitution at 68',2025-04-12 05:11:17
12826,716164,7,45033901,68',Faisal Al Sibyani (Damac) Substitution at 68',2025-04-12 05:11:17
12826,716164,8,45033908,74',Yahya Naji (Al Wehda) Substitution at 74',2025-04-12 05:11:17
12826,716164,9,45033909,79',Tarek Hamed (Damac) Substitution at 79',2025-04-12 05:11:17
12826,716164,10,45033910,80',Abdullah Almogren (Damac) Substitution at 80',2025-04-12 05:11:17
12826,716164,11,45033911,81',Saad Bguir (Al Wehda) Substitution at 81',2025-04-12 05:11:17
12826,716164,12,45033932,88',Alexandru Cretu (Al Wehda) Substitution at 88',2025-04-12 05:11:17
12826,716164,13,45033933,89',Ali Al Salem (Al Wehda) Substitution at 89',2025-04-12 05:11:17
12826,716164,14,45033969,90'+8',Waleed Bakhashwain (Al Wehda) Yellow Card at 98',2025-04-12 05:11:17
12826,716165,0,45090715,17',Ibañez (Al Ahli) Goal at 17',2025-04-20 15:49:37
12826,716165,1,45090745,27',Ziyad Aljohani (Al Ahli) Yellow Card at 27',2025-04-20 15:49:37
12826,716165,2,45090764,37',Ibañez (Al Ahli) Goal at 37',2025-04-20 15:49:37
12826,716165,3,45090782,43',Gabriel Vareta (Al Fayha) Yellow Card at 43',2025-04-20 15:49:37
12826,716165,4,45090801,45'+3',Ivan Toney (Al Ahli) Goal at 48',2025-04-20 15:49:37
12826,716165,5,45090850,45',Mukhir Al Rashidi (Al Fayha) Substitution at 45',2025-04-20 15:49:37
12826,716165,6,45090861,48',Orlando Mosquera (Al Fayha) Red Card at 48',2025-04-20 15:49:37
12826,716165,7,45090874,52',Abdulraouf Al Dakheel (Al Fayha) Substitution at 52',2025-04-20 15:49:37
12826,716165,8,45090925,62',Mohammed Al Baqawi (Al Fayha) Yellow Card at 62',2025-04-20 15:49:37
12826,716165,9,45090938,68',Ivan Toney (Al Ahli) Penalty - Scored at 68',2025-04-20 15:49:37
12826,716165,10,45090944,69',Sattam Al-Roqi (Al Fayha) Substitution at 69',2025-04-20 15:49:37
12826,716165,11,45090945,69',Ziyad Al Sahafi (Al Fayha) Substitution at 69',2025-04-20 15:49:37
12826,716165,12,45090971,69',Gojko Cimirot (Al Fayha) Substitution at 69',2025-04-20 15:49:37
12826,716165,13,45090946,70',Abdullah Al-Amar (Al Ahli) Substitution at 70',2025-04-20 15:49:37
12826,716165,14,45090947,70',Feras Al-Brikan (Al Ahli) Substitution at 70',2025-04-20 15:49:37
12826,716165,15,45090987,81',Sumaihan Al-Nabet (Al Ahli) Substitution at 81',2025-04-20 15:49:37
12826,716165,16,45090988,81',Rayane Hamidou (Al Ahli) Substitution at 81',2025-04-20 15:49:37
12826,716165,17,45090989,82',Riyad Mahrez (Al Ahli) Goal at 82',2025-04-20 15:49:37
12826,716165,18,45091011,86',Eid Al Muwallad (Al Ahli) Substitution at 86',2025-04-20 15:49:37
12826,716165,19,45091042,90'+3',Feras Al-Brikan (Al Ahli) Yellow Card at 93',2025-04-20 15:49:37
12826,716166,0,45083669,29',João Costa (Al Ettifaq) Yellow Card at 29',2025-04-20 15:49:37
12826,716166,1,45083671,39',Tozé  (Al Riyadh) Yellow Card at 39',2025-04-20 15:49:37
12826,716166,2,45083672,43',Jack Hendry (Al Ettifaq) Yellow Card at 43',2025-04-20 15:49:37
12826,716166,3,45083718,59',Vitinho  (Al Ettifaq) Penalty - Scored at 59',2025-04-20 15:49:37
12826,716166,4,45083722,61',Sekou Lega (Al Riyadh) Substitution at 61',2025-04-20 15:49:37
12826,716166,5,45083758,71',Vitinho  (Al Ettifaq) Yellow Card at 71',2025-04-20 15:49:37
12826,716166,6,45083791,76',Marzouq Tambakti (Al Riyadh) Yellow Card at 76',2025-04-20 15:49:37
12826,716166,7,45083804,81',Mukhtar Ali (Al Ettifaq) Substitution at 81',2025-04-20 15:49:37
12826,716166,8,45083849,88',Radhi Al-Otaibi (Al Ettifaq) Substitution at 88',2025-04-20 15:49:37
12826,716166,9,45083864,90'+1',Abdullah Radif (Al Ettifaq) Substitution at 91',2025-04-20 15:49:37
12826,716166,10,45083885,90'+5',Rayan Al Bloushi (Al Riyadh) Substitution at 95',2025-04-20 15:49:37
12826,716167,0,45083987,10',Mohamed Sbai (Al Fateh) Goal at 10',2025-04-18 05:00:38
12826,716167,1,45084036,24',Suhayb Alzaid (Al Fateh) Substitution at 24',2025-04-18 05:00:38
12826,716167,2,45084071,35',Mourad Batna (Al Fateh) Penalty - Missed at 35',2025-04-18 05:00:38
12826,716167,3,45084172,43',Marwane Saadane (Al Fateh) Yellow Card at 43',2025-04-18 05:00:38
12826,716167,4,45084073,44',Fabinho  (Al Ittihad) Penalty - Saved at 44',2025-04-18 05:00:38
12826,716167,5,45084439,68',Abdulrahman Al-Obud (Al Ittihad) Substitution at 68',2025-04-18 05:00:38
12826,716167,6,45084440,68',Muhannad Al-Shanqiti (Al Ittihad) Substitution at 68',2025-04-18 05:00:38
12826,716167,7,45084453,69',Matias Vargas (Al Fateh) Goal at 69',2025-04-18 05:00:38
12826,716167,8,45085374,71',Abdulelah Al-Amri (Al Ittihad) Yellow Card at 71',2025-04-18 05:00:38
12826,716167,9,45084544,78',Hussain Salem (Al Fateh) Substitution at 78',2025-04-18 05:00:38
12826,716167,10,45084543,79',Saeed Baattia (Al Fateh) Substitution at 79',2025-04-18 05:00:38
12826,716167,11,45084579,81',Saleh Al-Shehri (Al Ittihad) Substitution at 81',2025-04-18 05:00:38
12826,716167,12,45084612,90',Zaydou Youssef (Al Fateh) Yellow Card at 90',2025-04-18 05:00:38
12826,716167,13,45084613,90'+2',Hamed Alghamdi (Al Ittihad) Substitution at 92',2025-04-18 05:00:38
12826,716167,14,45084614,90'+2',Alfehaid Salah  (Al Fateh) Substitution at 92',2025-04-18 05:00:38
12826,716167,15,45084615,90'+2',Ali Al Masoud (Al Fateh) Substitution at 92',2025-04-18 05:00:38
12826,716168,0,45083670,26',Salem Al-Dawsari (Al Hilal) Goal at 26',2025-04-20 15:49:37
12826,716168,1,45083674,37',Sergej Milinkovic-Savic (Al Hilal) Yellow Card at 37',2025-04-20 15:49:37
12826,716168,2,45083740,49',Yasser Al-Shahrani (Al Hilal) Yellow Card at 49',2025-04-20 15:49:37
12826,716168,3,45083774,57',Saeed Al Hamsal (Al Khaleej) Yellow Card at 57',2025-04-20 15:49:37
12826,716168,4,45083817,64',João Cancelo (Al Hilal) Substitution at 64',2025-04-20 15:49:37
12826,716168,5,45083826,68',Mohamed Sherif (Al Khaleej) Substitution at 68',2025-04-20 15:49:37
12826,716168,6,45083862,73',Nasser Al-Dawsari (Al Hilal) Substitution at 73',2025-04-20 15:49:37
12826,716168,7,45083877,77',Abdullah Al Fahad (Al Khaleej) Substitution at 77',2025-04-20 15:49:37
12826,716168,8,45083878,78',Bandar Al Mutairi (Al Khaleej) Substitution at 78',2025-04-20 15:49:37
12826,716168,9,45083890,84',Waheb Saleh (Al Khaleej) Substitution at 84',2025-04-20 15:49:37
12826,716168,10,45083891,84',Salem Al-Dawsari (Al Hilal) Goal at 84',2025-04-20 15:49:37
12826,716168,11,45083892,86',Marcos Leonardo  (Al Hilal) Substitution at 86',2025-04-20 15:49:37
12826,716168,12,45083893,86',Mohamed Kanno (Al Hilal) Substitution at 86',2025-04-20 15:49:37
12826,716168,13,45083895,88',Aleksandar Mitrovic (Al Hilal) Goal at 88',2025-04-20 15:49:37
12826,716169,0,45090662,18',Georges-Kévin N'Koudou (Damac) Penalty - Scored at 18',2025-04-20 15:49:37
12826,716169,1,45090707,28',Hamdan Al Shamrani (Al Kholood) Yellow Card at 28',2025-04-20 15:49:37
12826,716169,2,45090721,33',Dhari Al Anazi (Damac) Yellow Card at 33',2025-04-20 15:49:37
12826,716169,3,45090746,45',Georges-Kévin N'Koudou (Damac) Penalty - Scored at 45',2025-04-20 15:49:37
12826,716169,4,45090834,51',Myziane Maolida (Al Kholood) Goal at 51',2025-04-20 15:49:37
12826,716169,5,45090848,54',Abdullah Al Hawsawi (Al Kholood) Yellow Card at 54',2025-04-20 15:49:37
12826,716169,6,45090851,58',Faisal Al Sibyani (Damac) Substitution at 58',2025-04-20 15:49:37
12826,716169,7,45090852,58',Abdulrahman Al-Obaid (Damac) Substitution at 58',2025-04-20 15:49:37
12826,716169,8,45090907,73',Nicolae Stanciu (Damac) Goal at 73',2025-04-20 15:49:37
12826,716169,9,45090923,75',Hammam Al-Hammami (Al Kholood) Substitution at 75',2025-04-20 15:49:37
12826,716169,10,45090954,86',Tarek Hamed (Damac) Substitution at 86',2025-04-20 15:49:37
12826,716169,11,45090955,86',Hazzaa Al Ghamdi (Damac) Substitution at 86',2025-04-20 15:49:37
12826,716169,12,45090985,90'+3',Meshari Al Nemer (Damac) Substitution at 93',2025-04-20 15:49:37
12826,716170,0,45098265,32',Hussain Al Shuwaish (Al Orobah) Yellow Card at 32',2025-04-20 15:49:37
12826,716170,1,45098420,45'+1',Karim El Berkaoui (Al Raed) Goal at 46',2025-04-20 15:49:37
12826,716170,2,45098693,49',Mehdi Abeid (Al Raed) Goal at 49',2025-04-20 15:49:37
12826,716170,3,45098726,54',Amir Sayoud (Al Raed) Goal at 54',2025-04-20 15:49:37
12826,716170,4,45098782,57',Yousri Bouzok (Al Raed) Goal at 57',2025-04-20 15:49:37
12826,716170,5,45098814,59',Brad Young (Al Orobah) Yellow Card at 59',2025-04-20 15:49:37
12826,716170,6,45098847,61',Ibrahim Al-Zubaidi (Al Orobah) Substitution at 61',2025-04-20 15:49:37
12826,716170,7,45098848,61',Fahad Zubaidi (Al Orobah) Substitution at 61',2025-04-20 15:49:37
12826,716170,8,45099005,72',Saleh Al-Jamaan (Al Raed) Substitution at 72',2025-04-20 15:49:37
12826,716170,9,45099006,72',Thamer Al Khaibri (Al Raed) Substitution at 72',2025-04-20 15:49:37
12826,716170,10,45099007,73',Mohammed Al Qarni (Al Orobah) Substitution at 73',2025-04-20 15:49:37
12826,716170,11,45099143,85',Osama Al Khalaf (Al Orobah) Substitution at 85',2025-04-20 15:49:37
12826,716170,12,45099144,85',Hamad Al Jayzani (Al Raed) Substitution at 85',2025-04-20 15:49:37
12826,716170,13,45099145,85',Abdullah Hazazi (Al Raed) Substitution at 85',2025-04-20 15:49:37
12826,716170,14,45099195,88',Yahya Sunbul (Al Raed) Substitution at 88',2025-04-20 15:49:37
12826,716171,0,45091119,25',Ezequiel Fernández (Al Qadsiah) Yellow Card at 25',2025-04-20 15:49:37
12826,716171,1,45091140,27',Nacho  (Al Qadsiah) Yellow Card at 27',2025-04-20 15:49:37
12826,716171,2,45091148,30',Sadio Mané (Al Nassr) Yellow Card at 30',2025-04-20 15:49:37
12826,716171,3,45091168,35',Turki Al-Ammar (Al Qadsiah) Goal at 35',2025-04-20 15:49:37
12826,716171,4,45091191,39',Nahitan Nández (Al Qadsiah) Yellow Card at 39',2025-04-20 15:49:37
12826,716171,5,45091341,45'+1',Sultan Al-Ghannam (Al Nassr) Yellow Card at 46',2025-04-20 15:49:37
12826,716171,6,45091396,53',Gastón Álvarez (Al Qadsiah) Yellow Card at 53',2025-04-20 15:49:37
12826,716171,7,45091433,57',Aiman Yahya (Al Nassr) Substitution at 57',2025-04-20 15:49:37
12826,716171,8,45091557,71',Ibrahim Mahnashi (Al Qadsiah) Substitution at 71',2025-04-20 15:49:37
12826,716171,9,45091583,75',Mohammed Abu Al Shamat (Al Qadsiah) Yellow Card at 75',2025-04-20 15:49:37
12826,716171,10,45091626,76',Turki Al-Ammar (Al Qadsiah) Yellow Card at 76',2025-04-20 15:49:37
12826,716171,11,45091648,78',Ali Abdullah Hazzazi (Al Qadsiah) Substitution at 78',2025-04-20 15:49:37
12826,716171,12,45091675,79',Salem Al Najdi (Al Nassr) Substitution at 79',2025-04-20 15:49:37
12826,716171,13,45091674,80',Nawaf Boushal (Al Nassr) Yellow Card at 80',2025-04-20 15:49:37
12826,716171,14,45091699,84',Sadio Mané (Al Nassr) Goal at 84',2025-04-20 15:49:37
12826,716171,15,45091729,87',Pierre-Emerick Aubameyang (Al Qadsiah) Goal at 87',2025-04-20 15:49:37
12826,716171,16,45091759,88',Ali Lajami (Al Nassr) Substitution at 88',2025-04-20 15:49:37
12826,716171,17,45091760,89',Abdullah Al-Khaibari (Al Nassr) Substitution at 89',2025-04-20 15:49:37
12826,716171,18,45091768,90'+1',Hussain Al-Qahtani (Al Qadsiah) Substitution at 91',2025-04-20 15:49:37
12826,716172,0,45083668,15',Petros  (Al Okhdood) Yellow Card at 15',2025-04-20 15:49:37
12826,716172,1,45083677,45'+3',Musab Al-Juwayr (Al Shabab) Yellow Card at 48',2025-04-20 15:49:37
