seasonType,eventId,commentaryOrder,playId,clockDisplayValue,commentaryText,updateDateTime
13515,744108,36,-1,40',Delay in match because of an injury Patryk Peda (Palermo).,2025-08-18 04:55:14
13515,744108,37,-1,41',Delay over. They are ready to continue.,2025-08-18 04:55:14
13515,744108,38,-1,43',Delay in match because of an injury Patryk Peda (Palermo).,2025-08-18 04:55:14
13515,744108,39,-1,43',Delay over. They are ready to continue.,2025-08-18 04:55:14
13515,744108,40,45672237,43',"Substitution, Palermo. Salim Diakité replaces Patryk Peda.",2025-08-18 04:55:14
13515,744108,41,-1,45',Foul by Federico Bonazzoli (Cremonese).,2025-08-18 04:55:14
13515,744108,42,-1,45',Salim Diakité (Palermo) wins a free kick on the right wing.,2025-08-18 04:55:14
13515,744108,43,-1,45'+1',Fourth official has announced 4 minutes of added time.,2025-08-18 04:55:14
13515,744108,44,-1,45'+1',Foul by Alberto Grassi (Cremonese).,2025-08-18 04:55:14
13515,744108,45,-1,45'+1',Jérémy Le Douaron (Palermo) wins a free kick on the left wing.,2025-08-18 04:55:14
13515,744108,46,-1,45'+3',Attempt saved. Emmanuel Gyasi (Palermo) right footed shot from the left side of the box is saved in the centre of the goal by Emil Audero (Cremonese). Assisted by Jacopo Segre.,2025-08-18 04:55:14
13515,744108,47,-1,45'+4',Foul by Niccolò Pierozzi (Palermo).,2025-08-18 04:55:14
13515,744108,48,-1,45'+4',Giuseppe Pezzella (Cremonese) wins a free kick in the defensive half.,2025-08-18 04:55:14
13515,744108,49,-1,45'+4',Attempt blocked. Federico Bonazzoli (Cremonese) right footed shot from the centre of the box is blocked. Assisted by Michele Collocolo.,2025-08-18 04:55:14
13515,744108,50,45672385,45'+5',"First Half ends, Cremonese 0, Palermo 0.",2025-08-18 04:55:14
13515,744108,51,45672844,45',"Second Half begins Cremonese 0, Palermo 0.",2025-08-18 04:55:14
13515,744108,52,45672846,47',Attempt missed. Filippo Terracciano (Cremonese) right footed shot from outside the box is too high.,2025-08-18 04:55:14
13515,744108,53,-1,51',Alessio Zerbin (Cremonese) wins a free kick in the defensive half.,2025-08-18 04:55:14
13515,744108,54,-1,51',Foul by Emmanuel Gyasi (Palermo).,2025-08-18 04:55:14
13515,744108,55,-1,51',"Corner,Cremonese. Conceded by Salim Diakité.",2025-08-18 04:55:14
13515,744108,56,-1,55',"Corner,Palermo. Conceded by Alberto Grassi.",2025-08-18 04:55:14
13515,744108,57,-1,57',"Offside, Cremonese. Jari Vandeputte is caught offside.",2025-08-18 04:55:14
13515,744108,58,45673070,59',"Substitution, Cremonese. Warren Bondo replaces Alberto Grassi.",2025-08-18 04:55:14
13515,744108,59,45673120,59',"Substitution, Cremonese. David Okereke replaces Manuel De Luca.",2025-08-18 04:55:14
13515,744108,60,45673121,59',"Substitution, Cremonese. Franco Vázquez replaces Federico Bonazzoli.",2025-08-18 04:55:14
13515,744108,61,-1,61',Foul by Alessio Zerbin (Cremonese).,2025-08-18 04:55:14
13515,744108,62,-1,61',Tommaso Augello (Palermo) wins a free kick in the defensive half.,2025-08-18 04:55:14
13515,744108,63,-1,63',Attempt blocked. Jérémy Le Douaron (Palermo) left footed shot from the centre of the box is blocked. Assisted by Pietro Ceccaroni.,2025-08-18 04:55:14
13515,744108,64,-1,63',Delay in match (Palermo).,2025-08-18 04:55:14
13515,744108,65,45673271,64',"Substitution, Palermo. Matteo Brunori replaces Joel Pohjanpalo.",2025-08-18 04:55:14
13515,744108,66,45673272,64',"Substitution, Palermo. Antonio Palumbo replaces Emmanuel Gyasi.",2025-08-18 04:55:14
13515,744108,67,-1,65',Delay over. They are ready to continue.,2025-08-18 04:55:14
13515,744108,68,45673281,66',"Attempt missed. Warren Bondo (Cremonese) right footed shot from outside the box is close, but misses to the left. Assisted by Jari Vandeputte.",2025-08-18 04:55:14
13515,744108,69,-1,67',Foul by Jacopo Segre (Palermo).,2025-08-18 04:55:14
13515,744108,70,-1,67',Warren Bondo (Cremonese) wins a free kick in the defensive half.,2025-08-18 04:55:14
13515,744108,71,-1,68',Delay in match (Palermo).,2025-08-18 04:55:14
13515,744108,72,-1,70',Delay over. They are ready to continue.,2025-08-18 04:55:14
13515,744108,73,-1,73',Foul by David Okereke (Cremonese).,2025-08-18 04:55:14
13515,744108,74,-1,73',Mattia Bani (Palermo) wins a free kick in the defensive half.,2025-08-18 04:55:14
13515,744108,75,45673648,73',"Substitution, Cremonese. Romano Floriani Mussolini replaces Alessio Zerbin.",2025-08-18 04:55:14
13515,744108,76,45673649,74',"Substitution, Palermo. Giacomo Corona replaces Jérémy Le Douaron.",2025-08-18 04:55:14
13515,744108,77,45673650,74',"Substitution, Palermo. Alexis Blin replaces Filippo Ranocchia.",2025-08-18 04:55:14
13515,744108,78,-1,75',Attempt blocked. Antonio Palumbo (Palermo) right footed shot from outside the box is blocked. Assisted by Niccolò Pierozzi.,2025-08-18 04:55:14
13515,744108,79,-1,75',"Corner,Cremonese. Conceded by Pietro Ceccaroni.",2025-08-18 04:55:14
13515,744108,80,45674371,75',"Corner,Cremonese. Conceded by Francesco Bardi.",2025-08-18 04:55:14
13515,744108,81,-1,77',Foul by Federico Baschirotto (Cremonese).,2025-08-18 04:55:14
13515,744108,82,-1,77',Giacomo Corona (Palermo) wins a free kick on the right wing.,2025-08-18 04:55:14
13515,744108,83,45673780,79',Attempt missed. Jacopo Segre (Palermo) right footed shot from the centre of the box misses to the left. Assisted by Tommaso Augello with a cross.,2025-08-18 04:55:14
13515,744108,84,-1,80',Foul by Antonio Palumbo (Palermo).,2025-08-18 04:55:14
13515,744108,85,-1,80',Matteo Bianchetti (Cremonese) wins a free kick in the defensive half.,2025-08-18 04:55:14
13515,744108,86,-1,80',"Offside, Palermo. Matteo Brunori is caught offside.",2025-08-18 04:55:14
13515,744108,87,45673858,83',"Substitution, Cremonese. Dennis Johnsen replaces Jari Vandeputte.",2025-08-18 04:55:14
13515,744108,88,-1,83',Foul by Niccolò Pierozzi (Palermo).,2025-08-18 04:55:14
13515,744108,89,-1,83',Warren Bondo (Cremonese) wins a free kick in the defensive half.,2025-08-18 04:55:14
13515,744108,90,-1,85',Dennis Johnsen (Cremonese) wins a free kick in the defensive half.,2025-08-18 04:55:14
13515,744108,91,-1,85',Foul by Salim Diakité (Palermo).,2025-08-18 04:55:14
13515,744108,92,45674372,87',"Corner,Cremonese. Conceded by Tommaso Augello.",2025-08-18 04:55:14
13515,744108,93,-1,89',Filippo Terracciano (Cremonese) wins a free kick in the defensive half.,2025-08-18 04:55:14
13515,744108,94,-1,89',Foul by Jacopo Segre (Palermo).,2025-08-18 04:55:14
13515,744108,95,-1,90',Foul by Filippo Terracciano (Cremonese).,2025-08-18 04:55:14
13515,744108,96,-1,90',Matteo Brunori (Palermo) wins a free kick in the defensive half.,2025-08-18 04:55:14
13515,744108,97,-1,90'+1',Fourth official has announced 5 minutes of added time.,2025-08-18 04:55:14
13515,744108,98,45674038,90'+3',Attempt missed. Filippo Terracciano (Cremonese) right footed shot from outside the box misses to the left. Assisted by Warren Bondo.,2025-08-18 04:55:14
13515,744108,99,-1,90'+4',Attempt saved. Giacomo Corona (Palermo) right footed shot from the centre of the box is saved in the centre of the goal by Emil Audero (Cremonese).,2025-08-18 04:55:14
13515,744108,100,-1,90'+5',Antonio Palumbo (Palermo) wins a free kick in the attacking half.,2025-08-18 04:55:14
13515,744108,101,-1,90'+5',Foul by Federico Baschirotto (Cremonese).,2025-08-18 04:55:14
13515,744108,102,45674108,90'+6',"Second Half ends, Cremonese 0, Palermo 0.",2025-08-18 04:55:14
13515,744108,103,-1,90',"Penalty Shootout begins Cremonese 0, Palermo 0.",2025-08-18 04:55:14
13515,744108,104,45674205,91',"Goal! Cremonese 0, Palermo 0(1). Matteo Brunori (Palermo) converts the penalty with a right footed shot to the bottom left corner.",2025-08-18 04:55:14
13515,744108,105,45674215,91',"Goal! Cremonese 0(1), Palermo 0(1). Warren Bondo (Cremonese) converts the penalty with a right footed shot to the bottom right corner.",2025-08-18 04:55:14
13515,744108,106,45674233,92',"Goal! Cremonese 0(1), Palermo 0(2). Antonio Palumbo (Palermo) converts the penalty with a left footed shot to the centre of the goal.",2025-08-18 04:55:14
13515,744108,107,45674237,93',"Goal! Cremonese 0(2), Palermo 0(2). Franco Vázquez (Cremonese) converts the penalty with a left footed shot to the bottom right corner.",2025-08-18 04:55:14
13515,744108,108,45674247,94',"Goal! Cremonese 0(2), Palermo 0(3). Giacomo Corona (Palermo) converts the penalty with a right footed shot to the top right corner.",2025-08-18 04:55:14
13515,744108,109,45674260,94',"Goal! Cremonese 0(3), Palermo 0(3). Romano Floriani Mussolini (Cremonese) converts the penalty with a right footed shot to the bottom right corner.",2025-08-18 04:55:14
13515,744108,110,45674267,95',"Goal! Cremonese 0(3), Palermo 0(4). Tommaso Augello (Palermo) converts the penalty with a left footed shot to the bottom right corner.",2025-08-18 04:55:14
13515,744108,111,45674283,95',"Goal! Cremonese 0(4), Palermo 0(4). Filippo Terracciano (Cremonese) converts the penalty with a right footed shot to the centre of the goal.",2025-08-18 04:55:14
13515,744108,112,45674294,96',"Goal! Cremonese 0(4), Palermo 0(5). Pietro Ceccaroni (Palermo) converts the penalty with a left footed shot to the bottom right corner.",2025-08-18 04:55:14
13515,744108,113,45674307,97',Penalty saved. Dennis Johnsen (Cremonese) right footed shot saved in the bottom right corner by Francesco Bardi (Palermo).,2025-08-18 04:55:14
13515,744108,114,45674363,97',"Penalty Shootout ends, Cremonese 0(4), Palermo 0(5).",2025-08-18 04:55:14
13515,744108,115,-1,,"Match ends, Cremonese 0(4), Palermo 0(5).",2025-08-18 04:55:14
13515,744109,0,-1,,Lineups are announced and players are warming up.,2025-08-18 04:55:14
13515,744109,1,-1,,First Half begins.,2025-08-18 04:55:14
13515,744109,2,45699893,1',Foul by Andrea Colpani (Monza).,2025-08-19 04:57:38
13515,744109,3,45699893,1',Kevin Barcella (Frosinone) wins a free kick on the left wing.,2025-08-19 04:57:38
13515,744109,4,45699897,3',Foul by Leonardo Colombo (Monza).,2025-08-19 04:57:38
13515,744109,5,45699897,3',Giacomo Calò (Frosinone) wins a free kick in the defensive half.,2025-08-19 04:57:38
13515,744109,6,45699899,3',Foul by Kevin Barcella (Frosinone).,2025-08-19 04:57:38
13515,744109,7,45699899,3',Matteo Pessina (Monza) wins a free kick in the defensive half.,2025-08-19 04:57:38
13515,744109,8,45699901,4',Foul by Armando Izzo (Monza).,2025-08-19 04:57:38
13515,744109,9,45699901,4',Ilias Koutsoupias (Frosinone) wins a free kick on the right wing.,2025-08-19 04:57:38
13515,744109,10,45687928,4',Armando Izzo (Monza) is shown the yellow card for a bad foul.,2025-08-18 04:55:14
13515,744109,11,45699903,5',"Corner,Frosinone. Conceded by Patrick Ciurria.",2025-08-19 04:57:38
13515,744109,12,-1,6',"Corner,Frosinone. Conceded by Samuele Birindelli.",2025-08-18 04:55:14
13515,744109,13,-1,6',"Corner,Frosinone. Conceded by Samuele Birindelli.",2025-08-18 04:55:14
13515,744109,14,45699906,7',Edoardo Masciangelo (Frosinone) wins a free kick in the defensive half.,2025-08-19 04:57:38
13515,744109,15,45699906,7',Foul by Patrick Ciurria (Monza).,2025-08-19 04:57:38
13515,744109,16,45699910,12',Foul by Armando Izzo (Monza).,2025-08-19 04:57:38
13515,744109,17,45699910,12',Ilias Koutsoupias (Frosinone) wins a free kick in the attacking half.,2025-08-19 04:57:38
13515,744109,18,45699911,13',Attempt blocked. Giacomo Calò (Frosinone) right footed shot from outside the box is blocked.,2025-08-19 04:57:38
13515,744109,19,45699913,13',"Offside, Frosinone. Ilario Monterisi is caught offside.",2025-08-19 04:57:38
13515,744109,20,45699915,16',Foul by Gianluca Caprari (Monza).,2025-08-19 04:57:38
13515,744109,21,45699915,16',Giacomo Calò (Frosinone) wins a free kick in the defensive half.,2025-08-19 04:57:38
13515,744109,22,45699917,16',"Offside, Frosinone. Ilias Koutsoupias is caught offside.",2025-08-19 04:57:38
13515,744109,23,45699919,17',Dany Mota (Monza) wins a free kick in the defensive half.,2025-08-19 04:57:38
13515,744109,24,45699919,17',Foul by Ilario Monterisi (Frosinone).,2025-08-19 04:57:38
13515,744109,25,45699923,18',"Corner,Frosinone. Conceded by Armando Izzo.",2025-08-19 04:57:38
13515,744109,26,45699924,20',Anthony Oyono (Frosinone) wins a free kick in the attacking half.,2025-08-19 04:57:38
13515,744109,27,45699924,20',Foul by Lorenzo Lucchesi (Monza).,2025-08-19 04:57:38
13515,744109,28,45688276,21',"Attempt missed. Riccardo Marchizza (Frosinone) left footed shot from outside the box is close, but misses to the right. Assisted by Giacomo Calò following a set piece situation.",2025-08-18 04:55:14
13515,744109,29,45688306,22',Attempt missed. Leonardo Colombo (Monza) right footed shot from outside the box misses to the right. Assisted by Gianluca Caprari.,2025-08-18 04:55:14
13515,744109,30,45699928,25',"Offside, Monza. Samuele Birindelli is caught offside.",2025-08-19 04:57:38
13515,744109,31,-1,25',Delay in match (Monza).,2025-08-18 04:55:14
13515,744109,32,-1,28',Delay over. They are ready to continue.,2025-08-18 04:55:14
13515,744109,33,45699933,30',Arvid Brorsson (Monza) wins a free kick in the defensive half.,2025-08-19 04:57:38
13515,744109,34,45699933,30',Foul by Riccardo Marchizza (Frosinone).,2025-08-19 04:57:38
13515,744109,35,45699936,32',Anthony Oyono (Frosinone) wins a free kick in the attacking half.,2025-08-19 04:57:38
13515,744109,36,45699936,32',Foul by Leonardo Colombo (Monza).,2025-08-19 04:57:38
13515,744109,37,45688634,35',Attempt missed. Matteo Pessina (Monza) left footed shot from outside the box misses to the right. Assisted by Gianluca Caprari.,2025-08-18 04:55:14
13515,744109,38,45699950,40',Attempt saved. Andrea Colpani (Monza) left footed shot from outside the box is saved in the bottom left corner by Alen Sherri (Frosinone). Assisted by Patrick Ciurria with a headed pass.,2025-08-19 04:57:38
13515,744109,39,45699952,42',Foul by Arvid Brorsson (Monza).,2025-08-19 04:57:38
13515,744109,40,45699952,42',Giacomo Calò (Frosinone) wins a free kick in the defensive half.,2025-08-19 04:57:38
13515,744109,41,45699954,43',Foul by Anthony Oyono (Frosinone).,2025-08-19 04:57:38
13515,744109,42,45699954,43',Lorenzo Lucchesi (Monza) wins a free kick in the defensive half.,2025-08-19 04:57:38
13515,744109,43,45699956,44',"Offside, Monza. Patrick Ciurria is caught offside.",2025-08-19 04:57:38
13515,744109,44,-1,45'+1',Fourth official has announced 2 minutes of added time.,2025-08-18 04:55:14
13515,744109,45,45699959,45'+1',Foul by Kevin Barcella (Frosinone).,2025-08-19 04:57:38
13515,744109,46,45699959,45'+1',Lorenzo Lucchesi (Monza) wins a free kick on the left wing.,2025-08-19 04:57:38
13515,744109,47,-1,45'+3',"First Half ends, Monza 0, Frosinone 0.",2025-08-18 04:55:14
13515,744109,48,-1,45',"Second Half begins Monza 0, Frosinone 0.",2025-08-18 04:55:14
13515,744109,49,45689559,45',"Substitution, Monza. Nicolas Galazzi replaces Gianluca Caprari.",2025-08-18 04:55:14
13515,744109,50,45699961,47',"Corner,Frosinone. Conceded by Samuele Birindelli.",2025-08-19 04:57:38
13515,744109,51,-1,49',Delay in match because of an injury Ilario Monterisi (Frosinone).,2025-08-18 04:55:14
13515,744109,52,-1,51',Delay over. They are ready to continue.,2025-08-18 04:55:14
13515,744109,53,45699964,51',Andrea Colpani (Monza) wins a free kick on the right wing.,2025-08-19 04:57:38
13515,744109,54,45699964,51',Foul by Edoardo Masciangelo (Frosinone).,2025-08-19 04:57:38
13515,744109,55,45689818,56',"Substitution, Monza. Pedro Obiang replaces Leonardo Colombo.",2025-08-18 04:55:14
13515,744109,56,45689837,56',"Substitution, Monza. Paulo Azzi replaces Arvid Brorsson.",2025-08-18 04:55:14
13515,744109,57,45699969,57',Andrea Colpani (Monza) wins a free kick on the right wing.,2025-08-19 04:57:38
13515,744109,58,45699969,57',Foul by Kevin Barcella (Frosinone).,2025-08-19 04:57:38
13515,744109,59,45699971,58',Foul by Andrea Colpani (Monza).,2025-08-19 04:57:38
13515,744109,60,45699971,58',Ilias Koutsoupias (Frosinone) wins a free kick in the defensive half.,2025-08-19 04:57:38
13515,744109,61,45689906,59',"Substitution, Frosinone. Giorgi Kvernadze replaces Antonio Raimondo.",2025-08-18 04:55:14
13515,744109,62,45689907,59',"Substitution, Frosinone. Francesco Gelli replaces Kevin Barcella.",2025-08-18 04:55:14
13515,744109,63,45699980,64',Foul by Andrea Colpani (Monza).,2025-08-19 04:57:38
13515,744109,64,45699980,64',Ilario Monterisi (Frosinone) wins a free kick in the defensive half.,2025-08-19 04:57:38
13515,744109,65,45690036,65',"Substitution, Monza. Silvere Ganvoula replaces Andrea Colpani.",2025-08-18 04:55:14
13515,744109,66,45690065,67',"Attempt missed. Farès Ghedjemis (Frosinone) left footed shot from the right side of the box is close, but misses the top left corner. Assisted by Giacomo Calò.",2025-08-18 04:55:14
13515,744109,67,45699985,69',Foul by Ilario Monterisi (Frosinone).,2025-08-19 04:57:38
13515,744109,68,45699985,69',Nicolas Galazzi (Monza) wins a free kick in the defensive half.,2025-08-19 04:57:38
13515,744109,69,-1,70',Delay in match (Monza).,2025-08-18 04:55:14
13515,744109,70,-1,72',Delay over. They are ready to continue.,2025-08-18 04:55:14
13515,744109,71,45690176,74',Attempt missed. Dany Mota (Monza) right footed shot from outside the box misses to the left. Assisted by Patrick Ciurria.,2025-08-18 04:55:14
13515,744109,72,45690212,74',"Substitution, Frosinone. Gabriele Bracaglia replaces Edoardo Masciangelo.",2025-08-18 04:55:14
13515,744109,73,45690213,75',"Substitution, Frosinone. Massimo Zilli replaces Farès Ghedjemis.",2025-08-18 04:55:14
13515,744109,74,45699988,75',Foul by Gabriele Bracaglia (Frosinone).,2025-08-19 04:57:38
13515,744109,75,45699988,75',Patrick Ciurria (Monza) wins a free kick on the right wing.,2025-08-19 04:57:38
13515,744109,76,45699990,77',Foul by Gabriele Bracaglia (Frosinone).,2025-08-19 04:57:38
13515,744109,77,45699990,77',Patrick Ciurria (Monza) wins a free kick on the right wing.,2025-08-19 04:57:38
13515,744109,78,45690304,77',"Attempt missed. Paulo Azzi (Monza) right footed shot from outside the box is close, but misses to the left. Assisted by Pedro Obiang.",2025-08-18 04:55:14
13515,744109,79,45699996,79',Attempt blocked. Patrick Ciurria (Monza) left footed shot from the right side of the box is blocked. Assisted by Silvere Ganvoula.,2025-08-19 04:57:38
13515,744109,80,45690368,79',Attempt missed. Paulo Azzi (Monza) right footed shot from the centre of the box misses to the right.,2025-08-18 04:55:14
13515,744109,81,-1,79',"Corner,Monza. Conceded by Gabriele Bracaglia.",2025-08-18 04:55:14
13515,744109,82,-1,80',Delay in match because of an injury Alen Sherri (Frosinone).,2025-08-18 04:55:14
13515,744109,83,-1,83',Delay over. They are ready to continue.,2025-08-18 04:55:14
13515,744109,84,45690411,83',"Substitution, Frosinone. Lorenzo Palmisani replaces Alen Sherri because of an injury.",2025-08-18 04:55:14
13515,744109,85,45690495,86',Nicolas Galazzi (Monza) hits the left post with a left footed shot from the right side of the box. Assisted by Patrick Ciurria.,2025-08-18 04:55:14
13515,744109,86,-1,86',"Corner,Monza. Conceded by Gabriele Bracaglia.",2025-08-18 04:55:14
13515,744109,87,45700003,87',Armando Izzo (Monza) wins a free kick in the defensive half.,2025-08-19 04:57:38
13515,744109,88,45700003,87',Foul by Massimo Zilli (Frosinone).,2025-08-19 04:57:38
13515,744109,89,45690528,87',Massimo Zilli (Frosinone) is shown the yellow card for a bad foul.,2025-08-18 04:55:14
13515,744109,90,45700009,88',"Corner,Frosinone. Conceded by Samuele Birindelli.",2025-08-19 04:57:38
13515,744109,91,45690557,89',"Substitution, Monza. Luca Ravanelli replaces Samuele Birindelli because of an injury.",2025-08-18 04:55:14
13515,744109,92,45690558,89',"Attempt missed. Ilario Monterisi (Frosinone) header from the centre of the box is close, but misses to the right. Assisted by Riccardo Marchizza with a cross following a corner.",2025-08-18 04:55:14
13515,744109,93,45690675,90',Attempt missed. Paulo Azzi (Monza) right footed shot from the left side of the box misses to the left. Assisted by Patrick Ciurria with a cross.,2025-08-18 04:55:14
13515,744109,94,-1,90'+1',Fourth official has announced 9 minutes of added time.,2025-08-18 04:55:14
13515,744109,95,45700026,90'+1',Attempt saved. Silvere Ganvoula (Monza) right footed shot from a difficult angle on the right is saved in the top centre of the goal by Lorenzo Palmisani (Frosinone). Assisted by Nicolas Galazzi.,2025-08-19 04:57:38
13515,744109,96,45690634,90'+2',"Goal! Monza 0, Frosinone 1. Giorgi Kvernadze (Frosinone) right footed shot from the centre of the box to the centre of the goal. Assisted by Francesco Gelli.",2025-08-18 04:55:14
13515,744109,97,45700031,90'+5',"Offside, Monza. Dany Mota is caught offside.",2025-08-19 04:57:38
13515,744109,98,45700036,90'+6',Foul by Riccardo Marchizza (Frosinone).,2025-08-19 04:57:38
13515,744109,99,45700036,90'+6',Patrick Ciurria (Monza) wins a free kick in the defensive half.,2025-08-19 04:57:38
13515,744109,100,45700049,90'+8',Foul by Silvere Ganvoula (Monza).,2025-08-19 04:57:38
13515,744109,101,45700049,90'+8',Ilario Monterisi (Frosinone) wins a free kick in the defensive half.,2025-08-19 04:57:38
13515,744109,102,45700051,90'+10',VAR Decision: Card upgraded Silvere Ganvoula (Monza).,2025-08-19 04:57:38
13515,744109,103,45690789,90'+10',Silvere Ganvoula (Monza) is shown the red card for violent conduct.,2025-08-18 04:55:14
13515,744109,104,45700056,90'+11',Dany Mota (Monza) wins a free kick in the defensive half.,2025-08-19 04:57:38
13515,744109,105,45700056,90'+11',Foul by Ilario Monterisi (Frosinone).,2025-08-19 04:57:38
13515,744109,106,45700063,90'+13',Foul by Pedro Obiang (Monza).,2025-08-19 04:57:38
13515,744109,107,45700063,90'+13',Giacomo Calò (Frosinone) wins a free kick in the defensive half.,2025-08-19 04:57:38
13515,744109,108,45690855,90'+14',Attempt missed. Lorenzo Lucchesi (Monza) left footed shot from the centre of the box is too high.,2025-08-18 04:55:14
13515,744109,109,-1,90'+15',"Second Half ends, Monza 0, Frosinone 1.",2025-08-18 04:55:14
13515,744109,110,-1,,"Match ends, Monza 0, Frosinone 1.",2025-08-18 04:55:14
13515,744110,0,-1,,Lineups are announced and players are warming up.,2025-08-18 04:55:14
13515,744110,1,45688499,,First Half begins.,2025-08-18 04:55:14
13515,744110,2,45699094,5',Foul by Alessandro Circati (Parma).,2025-08-19 04:57:38
13515,744110,3,45699094,5',Lorenzo Sgarbi (Pescara) wins a free kick in the defensive half.,2025-08-19 04:57:38
13515,744110,4,45699096,5',Attempt saved. Emanuele Valeri (Parma) right footed shot from the centre of the box is saved in the bottom left corner by Sebastiano Desplanches (Pescara).,2025-08-19 04:57:38
13515,744110,5,-1,5',"Corner,Parma. Conceded by Sebastiano Desplanches.",2025-08-18 04:55:14
13515,744110,6,45699100,6',Attempt saved. Mateo Pellegrino (Parma) right footed shot from the centre of the box is saved in the bottom right corner by Sebastiano Desplanches (Pescara).,2025-08-19 04:57:38
13515,744110,7,45699104,7',Attempt saved. Mateo Pellegrino (Parma) left footed shot from the left side of the box is saved in the top left corner by Sebastiano Desplanches (Pescara). Assisted by Pontus Almqvist.,2025-08-19 04:57:38
13515,744110,8,45699105,8',Foul by Lorenzo Sgarbi (Pescara).,2025-08-19 04:57:38
13515,744110,9,45699105,8',Lautaro Valenti (Parma) wins a free kick in the defensive half.,2025-08-19 04:57:38
13515,744110,10,45699107,8',"Offside, Pescara. Lorenzo Sgarbi is caught offside.",2025-08-19 04:57:38
13515,744110,11,45699110,10',Foul by Adrián Bernabé (Parma).,2025-08-19 04:57:38
13515,744110,12,45699110,10',Giacomo Olzer (Pescara) wins a free kick in the defensive half.,2025-08-19 04:57:38
13515,744110,13,-1,12',Delay in match because of an injury Gaetano Letizia (Pescara).,2025-08-18 04:55:14
13515,744110,14,-1,12',Delay over. They are ready to continue.,2025-08-18 04:55:14
13515,744110,15,45688844,15',Attempt missed. Christian Ordóñez (Parma) right footed shot from the left side of the box misses to the right.,2025-08-18 04:55:14
13515,744110,16,45699116,15',Foul by Adrián Bernabé (Parma).,2025-08-19 04:57:38
13515,744110,17,45699116,15',Giacomo Olzer (Pescara) wins a free kick in the defensive half.,2025-08-19 04:57:38
13515,744110,18,45699124,21',Foul by Leonardo Graziani (Pescara).,2025-08-19 04:57:38
13515,744110,19,45699124,21',Pontus Almqvist (Parma) wins a free kick on the right wing.,2025-08-19 04:57:38
13515,744110,20,45699127,21',Foul by Matteo Dagasso (Pescara).,2025-08-19 04:57:38
13515,744110,21,45699127,21',Mateo Pellegrino (Parma) wins a free kick in the attacking half.,2025-08-19 04:57:38
13515,744110,22,-1,23',"Corner,Parma. Conceded by Davide Merola.",2025-08-18 04:55:14
13515,744110,23,45689114,24',"Attempt missed. Alessandro Circati (Parma) header from the right side of the six yard box is close, but misses to the right. Assisted by Christian Ordóñez with a cross following a corner.",2025-08-18 04:55:14
13515,744110,24,45699131,25',Alessandro Circati (Parma) wins a free kick in the defensive half.,2025-08-19 04:57:38
13515,744110,25,45699131,25',Foul by Lorenzo Sgarbi (Pescara).,2025-08-19 04:57:38
13515,744110,26,45699133,26',Foul by Mandela Keita (Parma).,2025-08-19 04:57:38
13515,744110,27,45699133,26',Giacomo Olzer (Pescara) wins a free kick in the defensive half.,2025-08-19 04:57:38
13515,744110,28,45689137,26',Mandela Keita (Parma) is shown the yellow card for a bad foul.,2025-08-18 04:55:14
13515,744110,29,-1,26',Delay in match (Parma).,2025-08-18 04:55:14
13515,744110,30,-1,28',Delay over. They are ready to continue.,2025-08-18 04:55:14
13515,744110,31,45699135,29',"Offside, Pescara. Davide Merola is caught offside.",2025-08-19 04:57:38
13515,744110,32,45699137,30',"Offside, Parma. Mathias Løvik is caught offside.",2025-08-19 04:57:38
13515,744110,33,45699141,32',"Offside, Parma. Emanuele Valeri is caught offside.",2025-08-19 04:57:38
