seasonType,eventId,playOrder,playId,typeId,text,shortText,period,clockValue,clockDisplayValue,teamId,scoringPlay,shootout,wallclock,goalPositionX,goalPositionY,fieldpositionX,fieldPositionY,fieldPosition2X,fieldPosition2Y,athleteId,participant,updateDateTime
13451,738501,9,45385996,76,Dehmaine Assoumani (France U20) Substitution at 62',Dehmaine Assoumani Substitution,2,3720,62',12062,0,0,1980-01-01,0.0,0.0,0.0,0.0,0.0,0.0,363129.0,Dehmaine Assoumani,2025-06-14 05:26:25
13451,738501,9,45385996,76,Dehmaine Assoumani (France U20) Substitution at 62',Dehmaine Assoumani Substitution,2,3720,62',12062,0,0,1980-01-01,0.0,0.0,0.0,0.0,0.0,0.0,362974.0,Mayssam Benama,2025-06-14 05:26:25
13451,738501,10,45385997,76,Juan Uribe (Mexico U20) Substitution at 65',Juan Uribe Substitution,2,3900,65',5172,0,0,1980-01-01,0.0,0.0,0.0,0.0,0.0,0.0,178850.0,Juan Uribe,2025-06-14 05:26:25
13451,738501,11,45385998,76,Tahiel Jiménez (Mexico U20) Substitution at 65',Tahiel Jiménez Substitution,2,3900,65',5172,0,0,1980-01-01,0.0,0.0,0.0,0.0,0.0,0.0,376557.0,Tahiel Jiménez,2025-06-14 05:26:25
13451,738501,12,45385999,76,Aladji Bamba (France U20) Substitution at 65',Aladji Bamba Substitution,2,3900,65',12062,0,0,1980-01-01,0.0,0.0,0.0,0.0,0.0,0.0,396630.0,Aladji Bamba,2025-06-14 05:26:25
13451,738501,12,45385999,76,Aladji Bamba (France U20) Substitution at 65',Aladji Bamba Substitution,2,3900,65',12062,0,0,1980-01-01,0.0,0.0,0.0,0.0,0.0,0.0,365932.0,Rabby Nzingoula,2025-06-14 05:26:25
13451,738501,11,45385998,76,Tahiel Jiménez (Mexico U20) Substitution at 65',Tahiel Jiménez Substitution,2,3900,65',5172,0,0,1980-01-01,0.0,0.0,0.0,0.0,0.0,0.0,398704.0,Oswaldo Virgen,2025-06-14 05:26:25
13451,738501,10,45385997,76,Juan Uribe (Mexico U20) Substitution at 65',Juan Uribe Substitution,2,3900,65',5172,0,0,1980-01-01,0.0,0.0,0.0,0.0,0.0,0.0,380171.0,Diego Sánchez,2025-06-14 05:26:25
13451,738501,13,45386000,70,Steve Ngoura (France U20) Goal at 67',Steve Ngoura Goal,2,4020,67',12062,0,0,1980-01-01,0.0,0.0,0.0,0.0,0.0,0.0,346520.0,Steve Ngoura,2025-06-14 05:26:25
13451,738501,14,45386001,76,Amaury Morales (Mexico U20) Substitution at 70',Amaury Morales Substitution,2,4200,70',5172,0,0,1980-01-01,0.0,0.0,0.0,0.0,0.0,0.0,365830.0,Amaury Morales,2025-06-14 05:26:25
13451,738501,14,45386001,76,Amaury Morales (Mexico U20) Substitution at 70',Amaury Morales Substitution,2,4200,70',5172,0,0,1980-01-01,0.0,0.0,0.0,0.0,0.0,0.0,364682.0,César Bustos,2025-06-14 05:26:25
13451,738501,15,45386002,76,Omar Moreno (Mexico U20) Substitution at 78',Omar Moreno Substitution,2,4680,78',5172,0,0,1980-01-01,0.0,0.0,0.0,0.0,0.0,0.0,357211.0,Omar Moreno,2025-06-14 05:26:25
13451,738501,15,45386002,76,Omar Moreno (Mexico U20) Substitution at 78',Omar Moreno Substitution,2,4680,78',5172,0,0,1980-01-01,0.0,0.0,0.0,0.0,0.0,0.0,361264.0,Jonathan Padilla,2025-06-14 05:26:25
13451,738501,16,45386003,76,Killian Prouchet (France U20) Substitution at 83',Killian Prouchet Substitution,2,4980,83',12062,0,0,1980-01-01,0.0,0.0,0.0,0.0,0.0,0.0,377595.0,Killian Prouchet,2025-06-14 05:26:25
13451,738501,16,45386003,76,Killian Prouchet (France U20) Substitution at 83',Killian Prouchet Substitution,2,4980,83',12062,0,0,1980-01-01,0.0,0.0,0.0,0.0,0.0,0.0,346520.0,Steve Ngoura,2025-06-14 05:26:25
13451,738501,17,45386004,94,Lucas Michel (France U20) Yellow Card at 84',Lucas Michel Yellow Card,2,5040,84',12062,0,0,1980-01-01,0.0,0.0,0.0,0.0,0.0,0.0,356651.0,Lucas Michel,2025-06-14 05:26:25
13451,738501,18,45386005,94,Cesar Garza (Mexico U20) Yellow Card at 88',Cesar Garza Yellow Card,2,5280,88',5172,0,0,1980-01-01,0.0,0.0,0.0,0.0,0.0,0.0,375061.0,Cesar Garza,2025-06-14 05:26:25
13451,738501,19,45386006,70,Dehmaine Assoumani (France U20) Goal at 89',Dehmaine Assoumani Goal,2,5340,89',12062,0,0,1980-01-01,0.0,0.0,0.0,0.0,0.0,0.0,363129.0,Dehmaine Assoumani,2025-06-14 05:26:25
13451,738501,20,45386007,94,Tahiel Jiménez (Mexico U20) Yellow Card at 93',Tahiel Jiménez Yellow Card,2,5400,90'+3',5172,0,0,1980-01-01,0.0,0.0,0.0,0.0,0.0,0.0,376557.0,Tahiel Jiménez,2025-06-14 05:26:25
13367,739301,1,45392257,94,Luis Navarrete (Mexico U20) Yellow Card at 16',Luis Navarrete Yellow Card,1,960,16',5172,0,0,1980-01-01,0.0,0.0,0.0,0.0,0.0,0.0,128179.0,Luis Navarrete,2025-06-16 05:09:05
13367,739301,2,45392258,76,Diego Sánchez (Mexico U20) Substitution at 24',Diego Sánchez Substitution,1,1440,24',5172,0,0,1980-01-01,0.0,0.0,0.0,0.0,0.0,0.0,380171.0,Diego Sánchez,2025-06-16 05:09:05
13367,739301,2,45392258,76,Diego Sánchez (Mexico U20) Substitution at 24',Diego Sánchez Substitution,1,1440,24',5172,0,0,1980-01-01,0.0,0.0,0.0,0.0,0.0,0.0,178850.0,Juan Uribe,2025-06-16 05:09:05
13367,739301,3,45392259,94,Diego Ochoa (Mexico U20) Yellow Card at 35',Diego Ochoa Yellow Card,1,2100,35',5172,0,0,1980-01-01,0.0,0.0,0.0,0.0,0.0,0.0,372152.0,Diego Ochoa,2025-06-16 05:09:05
13367,739301,4,45392260,94,Tahiel Jiménez (Mexico U20) Yellow Card at 37',Tahiel Jiménez Yellow Card,1,2220,37',5172,0,0,1980-01-01,0.0,0.0,0.0,0.0,0.0,0.0,376557.0,Tahiel Jiménez,2025-06-16 05:09:05
13367,739301,5,45392261,94,Villads Nielsen (Denmark U20) Yellow Card at 37',Villads Nielsen Yellow Card,1,2220,37',130879,0,0,1980-01-01,0.0,0.0,0.0,0.0,0.0,0.0,387380.0,Villads Nielsen,2025-06-16 05:09:05
13367,739301,6,45392262,70,Alexander Lyng (Denmark U20) Goal at 40',Alexander Lyng Goal,1,2400,40',130879,0,0,1980-01-01,0.0,0.0,0.0,0.0,0.0,0.0,364126.0,Alexander Lyng,2025-06-16 05:09:05
13367,739301,7,45392263,70,Diego Sánchez (Mexico U20) Goal at 44',Diego Sánchez Goal,1,2640,44',5172,0,0,1980-01-01,0.0,0.0,0.0,0.0,0.0,0.0,380171.0,Diego Sánchez,2025-06-16 05:09:05
13367,739301,8,45392264,94,Lauge Sandgrav (Denmark U20) Yellow Card at 46',Lauge Sandgrav Yellow Card,1,2700,45'+1',130879,0,0,1980-01-01,0.0,0.0,0.0,0.0,0.0,0.0,312022.0,Lauge Sandgrav,2025-06-16 05:09:05
13367,739301,9,45392279,94,Bernardo Parra (Mexico U20) Yellow Card at 47',Bernardo Parra Yellow Card,2,2820,47',5172,0,0,1980-01-01,0.0,0.0,0.0,0.0,0.0,0.0,362417.0,Bernardo Parra,2025-06-16 05:09:05
13367,739301,10,45392280,94,Diego Sánchez (Mexico U20) Yellow Card at 55',Diego Sánchez Yellow Card,2,3300,55',5172,0,0,1980-01-01,0.0,0.0,0.0,0.0,0.0,0.0,380171.0,Diego Sánchez,2025-06-16 05:09:05
13367,739301,11,45392281,76,Pontus Andy Texel (Denmark U20) Substitution at 59',Pontus Andy Texel Substitution,2,3540,59',130879,0,0,1980-01-01,0.0,0.0,0.0,0.0,0.0,0.0,343957.0,Pontus Andy Texel,2025-06-16 05:09:05
13367,739301,11,45392281,76,Pontus Andy Texel (Denmark U20) Substitution at 59',Pontus Andy Texel Substitution,2,3540,59',130879,0,0,1980-01-01,0.0,0.0,0.0,0.0,0.0,0.0,347458.0,Kaare Barslund,2025-06-16 05:09:05
13367,739301,12,45392282,76,Jakob Nielsen (Denmark U20) Substitution at 62',Jakob Nielsen Substitution,2,3720,62',130879,0,0,1980-01-01,0.0,0.0,0.0,0.0,0.0,0.0,351245.0,Jakob Nielsen,2025-06-16 05:09:05
13367,739301,12,45392282,76,Jakob Nielsen (Denmark U20) Substitution at 62',Jakob Nielsen Substitution,2,3720,62',130879,0,0,1980-01-01,0.0,0.0,0.0,0.0,0.0,0.0,360259.0,Sabil Hansen,2025-06-16 05:09:05
13367,739301,13,45392298,76,César Bustos (Mexico U20) Substitution at 71',César Bustos Substitution,2,4260,71',5172,0,0,1980-01-01,0.0,0.0,0.0,0.0,0.0,0.0,364682.0,César Bustos,2025-06-16 05:09:05
13367,739301,14,45392299,76,Oswaldo Virgen (Mexico U20) Substitution at 71',Oswaldo Virgen Substitution,2,4260,71',5172,0,0,1980-01-01,0.0,0.0,0.0,0.0,0.0,0.0,398704.0,Oswaldo Virgen,2025-06-16 05:09:05
13367,739301,13,45392298,76,César Bustos (Mexico U20) Substitution at 71',César Bustos Substitution,2,4260,71',5172,0,0,1980-01-01,0.0,0.0,0.0,0.0,0.0,0.0,365830.0,Amaury Morales,2025-06-16 05:09:05
13367,739301,14,45392299,76,Oswaldo Virgen (Mexico U20) Substitution at 71',Oswaldo Virgen Substitution,2,4260,71',5172,0,0,1980-01-01,0.0,0.0,0.0,0.0,0.0,0.0,386920.0,Ángel Rico,2025-06-16 05:09:05
13367,739301,15,45392300,76,Heriberto De Jesus (Mexico U20) Substitution at 80',Heriberto De Jesus Substitution,2,4800,80',5172,0,0,1980-01-01,0.0,0.0,0.0,0.0,0.0,0.0,329916.0,Heriberto De Jesus,2025-06-16 05:09:05
13367,739301,16,45392301,76,William Clem (Denmark U20) Substitution at 80',William Clem Substitution,2,4800,80',130879,0,0,1980-01-01,0.0,0.0,0.0,0.0,0.0,0.0,332428.0,William Clem,2025-06-16 05:09:05
13367,739301,15,45392300,76,Heriberto De Jesus (Mexico U20) Substitution at 80',Heriberto De Jesus Substitution,2,4800,80',5172,0,0,1980-01-01,0.0,0.0,0.0,0.0,0.0,0.0,357211.0,Omar Moreno,2025-06-16 05:09:05
13367,739301,16,45392301,76,William Clem (Denmark U20) Substitution at 80',William Clem Substitution,2,4800,80',130879,0,0,1980-01-01,0.0,0.0,0.0,0.0,0.0,0.0,312022.0,Lauge Sandgrav,2025-06-16 05:09:05
13367,739301,17,45392302,76,Michael Opoku (Denmark U20) Substitution at 81',Michael Opoku Substitution,2,4860,81',130879,0,0,1980-01-01,0.0,0.0,0.0,0.0,0.0,0.0,380656.0,Michael Opoku,2025-06-16 05:09:05
13367,739301,18,45392303,76,Karol Velázquez (Mexico U20) Substitution at 81',Karol Velázquez Substitution,2,4860,81',5172,0,0,1980-01-01,0.0,0.0,0.0,0.0,0.0,0.0,364722.0,Karol Velázquez,2025-06-16 05:09:05
13367,739301,17,45392302,76,Michael Opoku (Denmark U20) Substitution at 81',Michael Opoku Substitution,2,4860,81',130879,0,0,1980-01-01,0.0,0.0,0.0,0.0,0.0,0.0,366229.0,Emil Schlichting,2025-06-16 05:09:05
13367,739301,18,45392303,76,Karol Velázquez (Mexico U20) Substitution at 81',Karol Velázquez Substitution,2,4860,81',5172,0,0,1980-01-01,0.0,0.0,0.0,0.0,0.0,0.0,128179.0,Luis Navarrete,2025-06-16 05:09:05
13367,739301,19,45392304,97,Bernardo Parra (Mexico U20) Own Goal at 82',Bernardo Parra Own Goal,2,4920,82',130879,0,0,1980-01-01,0.0,0.0,0.0,0.0,0.0,0.0,,Bernardo Parra,2025-06-16 05:09:05
13366,739302,1,45392358,70,Dehmaine Assoumani (France U20) Goal at 1',Dehmaine Assoumani Goal,1,60,1',12062,0,0,1980-01-01,0.0,0.0,0.0,0.0,0.0,0.0,363129.0,Dehmaine Assoumani,2025-06-16 05:09:05
13366,739302,2,45392456,98,Steve Ngoura (France U20) Penalty - Scored at 44',Steve Ngoura Penalty - Scored,1,2640,44',12062,0,0,1980-01-01,0.0,0.0,0.0,0.0,0.0,0.0,346520.0,Steve Ngoura,2025-06-16 05:09:05
13366,739302,3,45392478,76,Lucas Michel (France U20) Substitution at 45',Lucas Michel Substitution,2,2700,45',12062,0,0,1980-01-01,0.0,0.0,0.0,0.0,0.0,0.0,356651.0,Lucas Michel,2025-06-16 05:09:05
13366,739302,4,45392480,76,Tidiam Gomis (France U20) Substitution at 45',Tidiam Gomis Substitution,2,2700,45',12062,0,0,1980-01-01,0.0,0.0,0.0,0.0,0.0,0.0,366911.0,Tidiam Gomis,2025-06-16 05:09:05
13366,739302,5,45392481,76,Rakan Al Ghamdi (Saudi Arabia U23) Substitution at 45',Rakan Al Ghamdi Substitution,2,2700,45',20950,0,0,1980-01-01,0.0,0.0,0.0,0.0,0.0,0.0,404665.0,Rakan Al Ghamdi,2025-06-16 05:09:05
13366,739302,6,45392482,76,Abdulaziz Saud Al Aliwa (Saudi Arabia U23) Substitution at 45',Abdulaziz Saud Al Aliwa Substitu,2,2700,45',20950,0,0,1980-01-01,0.0,0.0,0.0,0.0,0.0,0.0,341460.0,Abdulaziz Saud Al Aliwa,2025-06-16 05:09:05
13366,739302,7,45392484,76,Mohammed Yousef (Saudi Arabia U23) Substitution at 45',Mohammed Yousef Substitution,2,2700,45',20950,0,0,1980-01-01,0.0,0.0,0.0,0.0,0.0,0.0,367660.0,Mohammed Yousef,2025-06-16 05:09:05
13366,739302,3,45392478,76,Lucas Michel (France U20) Substitution at 45',Lucas Michel Substitution,2,2700,45',12062,0,0,1980-01-01,0.0,0.0,0.0,0.0,0.0,0.0,388558.0,Louis Leroux,2025-06-16 05:09:05
13366,739302,4,45392480,76,Tidiam Gomis (France U20) Substitution at 45',Tidiam Gomis Substitution,2,2700,45',12062,0,0,1980-01-01,0.0,0.0,0.0,0.0,0.0,0.0,396630.0,Aladji Bamba,2025-06-16 05:09:05
13366,739302,5,45392481,76,Rakan Al Ghamdi (Saudi Arabia U23) Substitution at 45',Rakan Al Ghamdi Substitution,2,2700,45',20950,0,0,1980-01-01,0.0,0.0,0.0,0.0,0.0,0.0,367653.0,Abbas Al Hassan,2025-06-16 05:09:05
13366,739302,6,45392482,76,Abdulaziz Saud Al Aliwa (Saudi Arabia U23) Substitution at 45',Abdulaziz Saud Al Aliwa Substitu,2,2700,45',20950,0,0,1980-01-01,0.0,0.0,0.0,0.0,0.0,0.0,384809.0,Zaid Al Enezi,2025-06-16 05:09:05
13366,739302,7,45392484,76,Mohammed Yousef (Saudi Arabia U23) Substitution at 45',Mohammed Yousef Substitution,2,2700,45',20950,0,0,1980-01-01,0.0,0.0,0.0,0.0,0.0,0.0,341469.0,Mohammed Ali Barnawi,2025-06-16 05:09:05
13366,739302,8,45392499,94,Tidiam Gomis (France U20) Yellow Card at 53',Tidiam Gomis Yellow Card,2,3180,53',12062,0,0,1980-01-01,0.0,0.0,0.0,0.0,0.0,0.0,366911.0,Tidiam Gomis,2025-06-16 05:09:05
13366,739302,9,45392504,94,Abdulrahman Al Obaid (Saudi Arabia U23) Yellow Card at 55',Abdulrahman Al Obaid Yellow Card,2,3300,55',20950,0,0,1980-01-01,0.0,0.0,0.0,0.0,0.0,0.0,383187.0,Abdulrahman Al Obaid,2025-06-16 05:09:05
13366,739302,10,45392506,94,Mohammed Al Dawsari (Saudi Arabia U23) Yellow Card at 56',Mohammed Al Dawsari Yellow Card,2,3360,56',20950,0,0,1980-01-01,0.0,0.0,0.0,0.0,0.0,0.0,341465.0,Mohammed Al Dawsari,2025-06-16 05:09:05
13366,739302,11,45392522,94,Abdulmalik Al Oyayari (Saudi Arabia U23) Yellow Card at 56',Abdulmalik Al Oyayari Yellow Car,2,3360,56',20950,0,0,1980-01-01,0.0,0.0,0.0,0.0,0.0,0.0,337325.0,Abdulmalik Al Oyayari,2025-06-16 05:09:05
13366,739302,12,45392513,98,Steve Ngoura (France U20) Penalty - Scored at 57',Steve Ngoura Penalty - Scored,2,3420,57',12062,0,0,1980-01-01,0.0,0.0,0.0,0.0,0.0,0.0,346520.0,Steve Ngoura,2025-06-16 05:09:05
13366,739302,13,45392519,76,Yoni Gomis (France U20) Substitution at 59',Yoni Gomis Substitution,2,3540,59',12062,0,0,1980-01-01,0.0,0.0,0.0,0.0,0.0,0.0,345688.0,Yoni Gomis,2025-06-16 05:09:05
13366,739302,14,45392523,76,Rabby Nzingoula (France U20) Substitution at 59',Rabby Nzingoula Substitution,2,3540,59',12062,0,0,1980-01-01,0.0,0.0,0.0,0.0,0.0,0.0,365932.0,Rabby Nzingoula,2025-06-16 05:09:05
13366,739302,13,45392519,76,Yoni Gomis (France U20) Substitution at 59',Yoni Gomis Substitution,2,3540,59',12062,0,0,1980-01-01,0.0,0.0,0.0,0.0,0.0,0.0,363129.0,Dehmaine Assoumani,2025-06-16 05:09:05
13366,739302,14,45392523,76,Rabby Nzingoula (France U20) Substitution at 59',Rabby Nzingoula Substitution,2,3540,59',12062,0,0,1980-01-01,0.0,0.0,0.0,0.0,0.0,0.0,371472.0,Saïmon Bouabré,2025-06-16 05:09:05
13366,739302,15,45392545,94,Elyaz Zidane (France U20) Yellow Card at 65',Elyaz Zidane Yellow Card,2,3900,65',12062,0,0,1980-01-01,0.0,0.0,0.0,0.0,0.0,0.0,387505.0,Elyaz Zidane,2025-06-16 05:09:05
13366,739302,16,45392546,76,Simon Kalambayi (France U20) Substitution at 66',Simon Kalambayi Substitution,2,3960,66',12062,0,0,1980-01-01,0.0,0.0,0.0,0.0,0.0,0.0,387509.0,Simon Kalambayi,2025-06-16 05:09:05
13366,739302,16,45392546,76,Simon Kalambayi (France U20) Substitution at 66',Simon Kalambayi Substitution,2,3960,66',12062,0,0,1980-01-01,0.0,0.0,0.0,0.0,0.0,0.0,346520.0,Steve Ngoura,2025-06-16 05:09:05
13366,739302,17,45392557,76,Majed Abdullah (Saudi Arabia U23) Substitution at 69',Majed Abdullah Substitution,2,4140,69',20950,0,0,1980-01-01,0.0,0.0,0.0,0.0,0.0,0.0,388400.0,Majed Abdullah,2025-06-16 05:09:05
13366,739302,17,45392557,76,Majed Abdullah (Saudi Arabia U23) Substitution at 69',Majed Abdullah Substitution,2,4140,69',20950,0,0,1980-01-01,0.0,0.0,0.0,0.0,0.0,0.0,362969.0,Faisal Al Abdulwahed,2025-06-16 05:09:05
13366,739302,18,45392583,76,Badr Al Omair (Saudi Arabia U23) Substitution at 77',Badr Al Omair Substitution,2,4620,77',20950,0,0,1980-01-01,0.0,0.0,0.0,0.0,0.0,0.0,392499.0,Badr Al Omair,2025-06-16 05:09:05
13366,739302,18,45392583,76,Badr Al Omair (Saudi Arabia U23) Substitution at 77',Badr Al Omair Substitution,2,4620,77',20950,0,0,1980-01-01,0.0,0.0,0.0,0.0,0.0,0.0,337325.0,Abdulmalik Al Oyayari,2025-06-16 05:09:05
13366,739302,19,45392625,70,Mohammed Yousef (Saudi Arabia U23) Goal at 93',Mohammed Yousef Goal,2,5400,90'+3',20950,0,0,1980-01-01,0.0,0.0,0.0,0.0,0.0,0.0,367660.0,Mohammed Yousef,2025-06-16 05:09:05
