seasonType,eventId,playOrder,playId,typeId,text,shortText,period,clockValue,clockDisplayValue,teamId,scoringPlay,shootout,wallclock,goalPositionX,goalPositionY,fieldpositionX,fieldPositionY,fieldPosition2X,fieldPosition2Y,athleteId,participant,updateDateTime
13369,735780,13,45353962,76,Didier Dawson (Panama U20) Substitution at 67',Didier Dawson Substitution,2,4020,67',5195,0,0,1980-01-01,0.0,0.0,0.0,0.0,0.0,0.0,372112.0,Oldemar Castillo,2025-06-07 05:26:13
13369,735780,14,45353963,76,Gustavo Herrera (Panama U20) Substitution at 68',Gustavo Herrera Substitution,2,4080,68',5195,0,0,1980-01-01,0.0,0.0,0.0,0.0,0.0,0.0,141631.0,Gustavo Herrera,2025-06-07 05:26:13
13369,735780,14,45353963,76,Gustavo Herrera (Panama U20) Substitution at 68',Gustavo Herrera Substitution,2,4080,68',5195,0,0,1980-01-01,0.0,0.0,0.0,0.0,0.0,0.0,388906.0,Karlo Kurányi,2025-06-07 05:26:13
13369,735780,15,45353964,76,Abdullah Subayt (Saudi Arabia U23) Substitution at 70',Abdullah Subayt Substitution,2,4200,70',20950,0,0,1980-01-01,0.0,0.0,0.0,0.0,0.0,0.0,373105.0,Abdullah Subayt,2025-06-07 05:26:13
13369,735780,15,45353964,76,Abdullah Subayt (Saudi Arabia U23) Substitution at 70',Abdullah Subayt Substitution,2,4200,70',20950,0,0,1980-01-01,0.0,0.0,0.0,0.0,0.0,0.0,367653.0,Abbas Al Hassan,2025-06-07 05:26:13
13369,735780,16,45353965,76,Giovani Herbert (Panama U20) Substitution at 77',Giovani Herbert Substitution,2,4620,77',5195,0,0,1980-01-01,0.0,0.0,0.0,0.0,0.0,0.0,362943.0,Giovani Herbert,2025-06-07 05:26:13
13369,735780,16,45353965,76,Giovani Herbert (Panama U20) Substitution at 77',Giovani Herbert Substitution,2,4620,77',5195,0,0,1980-01-01,0.0,0.0,0.0,0.0,0.0,0.0,372103.0,Anel Ryce,2025-06-07 05:26:13
13369,735780,17,45353966,76,Faisal Al Abdulwahed (Saudi Arabia U23) Substitution at 83',Faisal Al Abdulwahed Substitutio,2,4980,83',20950,0,0,1980-01-01,0.0,0.0,0.0,0.0,0.0,0.0,362969.0,Faisal Al Abdulwahed,2025-06-07 05:26:13
13369,735780,17,45353966,76,Faisal Al Abdulwahed (Saudi Arabia U23) Substitution at 83',Faisal Al Abdulwahed Substitutio,2,4980,83',20950,0,0,1980-01-01,0.0,0.0,0.0,0.0,0.0,0.0,313423.0,Abdullah Radif,2025-06-07 05:26:13
13369,735780,18,45353967,94,Abdulmalik Al Oyayari (Saudi Arabia U23) Yellow Card at 86',Abdulmalik Al Oyayari Yellow Car,2,5160,86',20950,0,0,1980-01-01,0.0,0.0,0.0,0.0,0.0,0.0,337325.0,Abdulmalik Al Oyayari,2025-06-07 05:26:13
13369,735780,19,45353968,76,Badr Al Omair (Saudi Arabia U23) Substitution at 89',Badr Al Omair Substitution,2,5340,89',20950,0,0,1980-01-01,0.0,0.0,0.0,0.0,0.0,0.0,392499.0,Badr Al Omair,2025-06-07 05:26:13
13369,735780,19,45353968,76,Badr Al Omair (Saudi Arabia U23) Substitution at 89',Badr Al Omair Substitution,2,5340,89',20950,0,0,1980-01-01,0.0,0.0,0.0,0.0,0.0,0.0,337325.0,Abdulmalik Al Oyayari,2025-06-07 05:26:13
13369,735780,20,45353969,76,Rakan Al Ghamdi (Saudi Arabia U23) Substitution at 90',Rakan Al Ghamdi Substitution,2,5400,90',20950,0,0,1980-01-01,0.0,0.0,0.0,0.0,0.0,0.0,404665.0,Rakan Al Ghamdi,2025-06-07 05:26:13
13369,735780,21,45353970,93,Mohammed Yousef (Saudi Arabia U23) Red Card at 92',Mohammed Yousef Red Card,2,5400,90'+2',20950,0,0,1980-01-01,0.0,0.0,0.0,0.0,0.0,0.0,367660.0,Mohammed Yousef,2025-06-07 05:26:13
13369,735780,22,45353971,94,Osama Al Marwash (Saudi Arabia U23) Yellow Card at 96',Osama Al Marwash Yellow Card,2,5400,90'+6',20950,0,0,1980-01-01,0.0,0.0,0.0,0.0,0.0,0.0,341467.0,Osama Al Marwash,2025-06-07 05:26:13
13369,735780,20,45353969,76,Rakan Al Ghamdi (Saudi Arabia U23) Substitution at 90',Rakan Al Ghamdi Substitution,2,5400,90',20950,0,0,1980-01-01,0.0,0.0,0.0,0.0,0.0,0.0,341460.0,Abdulaziz Saud Al Aliwa,2025-06-07 05:26:13
13369,735781,1,45353987,70,Gaoussou Diakité (Mali U20) Goal at 17',Gaoussou Diakité Goal,1,1020,17',17763,0,0,1980-01-01,0.0,0.0,0.0,0.0,0.0,0.0,380383.0,Gaoussou Diakité,2025-06-07 05:26:13
13369,735781,2,45353988,76,Eden Gassama (Mali U20) Substitution at 27',Eden Gassama Substitution,1,1620,27',17763,0,0,1980-01-01,0.0,0.0,0.0,0.0,0.0,0.0,402966.0,Eden Gassama,2025-06-07 05:26:13
13369,735781,2,45353988,76,Eden Gassama (Mali U20) Substitution at 27',Eden Gassama Substitution,1,1620,27',17763,0,0,1980-01-01,0.0,0.0,0.0,0.0,0.0,0.0,276128.0,Ibrahim Diarra,2025-06-07 05:26:13
13369,735781,3,45353989,70,Tidiam Gomis (France U20) Goal at 38',Tidiam Gomis Goal,1,2280,38',12062,0,0,1980-01-01,0.0,0.0,0.0,0.0,0.0,0.0,366911.0,Tidiam Gomis,2025-06-07 05:26:13
13369,735781,4,45353990,94,Abdoul Koné (France U20) Yellow Card at 45',Abdoul Koné Yellow Card,1,2700,45',12062,0,0,1980-01-01,0.0,0.0,0.0,0.0,0.0,0.0,384380.0,Abdoul Koné,2025-06-07 05:26:13
13369,735781,5,45353993,76,Steve Ngoura (France U20) Substitution at 45',Steve Ngoura Substitution,2,2700,45',12062,0,0,1980-01-01,0.0,0.0,0.0,0.0,0.0,0.0,346520.0,Steve Ngoura,2025-06-07 05:26:13
13369,735781,6,45353994,76,Saïmon Bouabré (France U20) Substitution at 45',Saïmon Bouabré Substitution,2,2700,45',12062,0,0,1980-01-01,0.0,0.0,0.0,0.0,0.0,0.0,371472.0,Saïmon Bouabré,2025-06-07 05:26:13
13369,735781,7,45353995,76,Yoni Gomis (France U20) Substitution at 45',Yoni Gomis Substitution,2,2700,45',12062,0,0,1980-01-01,0.0,0.0,0.0,0.0,0.0,0.0,345688.0,Yoni Gomis,2025-06-07 05:26:13
13369,735781,5,45353993,76,Steve Ngoura (France U20) Substitution at 45',Steve Ngoura Substitution,2,2700,45',12062,0,0,1980-01-01,0.0,0.0,0.0,0.0,0.0,0.0,387509.0,Simon Kalambayi,2025-06-07 05:26:13
13369,735781,6,45353994,76,Saïmon Bouabré (France U20) Substitution at 45',Saïmon Bouabré Substitution,2,2700,45',12062,0,0,1980-01-01,0.0,0.0,0.0,0.0,0.0,0.0,396630.0,Aladji Bamba,2025-06-07 05:26:13
13369,735781,7,45353995,76,Yoni Gomis (France U20) Substitution at 45',Yoni Gomis Substitution,2,2700,45',12062,0,0,1980-01-01,0.0,0.0,0.0,0.0,0.0,0.0,356211.0,Emmanuel Biumla,2025-06-07 05:26:13
13369,735781,8,45353997,76,Dehmaine Assoumani (France U20) Substitution at 62',Dehmaine Assoumani Substitution,2,3720,62',12062,0,0,1980-01-01,0.0,0.0,0.0,0.0,0.0,0.0,363129.0,Dehmaine Assoumani,2025-06-07 05:26:13
13369,735781,8,45353997,76,Dehmaine Assoumani (France U20) Substitution at 62',Dehmaine Assoumani Substitution,2,3720,62',12062,0,0,1980-01-01,0.0,0.0,0.0,0.0,0.0,0.0,388522.0,Ibrahim Mbaye,2025-06-07 05:26:13
13369,735781,9,45353998,76,Ibrahim Kanate (Mali U20) Substitution at 69',Ibrahim Kanate Substitution,2,4140,69',17763,0,0,1980-01-01,0.0,0.0,0.0,0.0,0.0,0.0,372078.0,Ibrahim Kanate,2025-06-07 05:26:13
13369,735781,10,45353999,76,Mahamoud Barry (Mali U20) Substitution at 69',Mahamoud Barry Substitution,2,4140,69',17763,0,0,1980-01-01,0.0,0.0,0.0,0.0,0.0,0.0,372072.0,Mahamoud Barry,2025-06-07 05:26:13
13369,735781,9,45353998,76,Ibrahim Kanate (Mali U20) Substitution at 69',Ibrahim Kanate Substitution,2,4140,69',17763,0,0,1980-01-01,0.0,0.0,0.0,0.0,0.0,0.0,380383.0,Gaoussou Diakité,2025-06-07 05:26:13
13369,735781,10,45353999,76,Mahamoud Barry (Mali U20) Substitution at 69',Mahamoud Barry Substitution,2,4140,69',17763,0,0,1980-01-01,0.0,0.0,0.0,0.0,0.0,0.0,355981.0,Wilson Samake,2025-06-07 05:26:13
13369,735781,11,45354014,94,Rabby Nzingoula (France U20) Yellow Card at 80',Rabby Nzingoula Yellow Card,2,4800,80',12062,0,0,1980-01-01,0.0,0.0,0.0,0.0,0.0,0.0,365932.0,Rabby Nzingoula,2025-06-07 05:26:13
13369,735781,12,45354023,76,Mayssam Benama (France U20) Substitution at 85',Mayssam Benama Substitution,2,5100,85',12062,0,0,1980-01-01,0.0,0.0,0.0,0.0,0.0,0.0,362974.0,Mayssam Benama,2025-06-07 05:26:13
13369,735781,12,45354023,76,Mayssam Benama (France U20) Substitution at 85',Mayssam Benama Substitution,2,5100,85',12062,0,0,1980-01-01,0.0,0.0,0.0,0.0,0.0,0.0,365932.0,Rabby Nzingoula,2025-06-07 05:26:13
13369,735781,13,45354024,76,Abdoulaye Niakaté (Mali U20) Substitution at 88',Abdoulaye Niakaté Substitution,2,5280,88',17763,0,0,1980-01-01,0.0,0.0,0.0,0.0,0.0,0.0,388895.0,Abdoulaye Niakaté,2025-06-07 05:26:13
13369,735781,13,45354024,76,Abdoulaye Niakaté (Mali U20) Substitution at 88',Abdoulaye Niakaté Substitution,2,5280,88',17763,0,0,1980-01-01,0.0,0.0,0.0,0.0,0.0,0.0,396766.0,Aboubacar Sidibe,2025-06-07 05:26:13
13369,735781,14,45354049,94,Yoni Gomis (France U20) Yellow Card at 94',Yoni Gomis Yellow Card,2,5400,90'+4',12062,0,0,1980-01-01,0.0,0.0,0.0,0.0,0.0,0.0,345688.0,Yoni Gomis,2025-06-07 05:26:13
13369,735782,1,45358953,94,Luis Navarrete (Mexico U20) Yellow Card at 10',Luis Navarrete Yellow Card,1,600,10',5172,0,0,1980-01-01,0.0,0.0,0.0,0.0,0.0,0.0,128179.0,Luis Navarrete,2025-06-08 05:14:24
13369,735782,2,45358954,70,Motoki Nishihara (Japan U20) Goal at 32',Motoki Nishihara Goal,1,1920,32',5171,0,0,1980-01-01,0.0,0.0,0.0,0.0,0.0,0.0,398419.0,Motoki Nishihara,2025-06-08 05:14:24
13369,735782,3,45358955,94,Rion Ichihara (Japan U20) Yellow Card at 41',Rion Ichihara Yellow Card,1,2460,41',5171,0,0,1980-01-01,0.0,0.0,0.0,0.0,0.0,0.0,362961.0,Rion Ichihara,2025-06-08 05:14:24
13369,735782,4,45358958,76,Tahiel Jiménez (Mexico U20) Substitution at 45',Tahiel Jiménez Substitution,2,2700,45',5172,0,0,1980-01-01,0.0,0.0,0.0,0.0,0.0,0.0,376557.0,Tahiel Jiménez,2025-06-08 05:14:24
13369,735782,5,45358959,76,Bernardo Parra (Mexico U20) Substitution at 45',Bernardo Parra Substitution,2,2700,45',5172,0,0,1980-01-01,0.0,0.0,0.0,0.0,0.0,0.0,362417.0,Bernardo Parra,2025-06-08 05:14:24
13369,735782,6,45358960,76,Jonathan Padilla (Mexico U20) Substitution at 45',Jonathan Padilla Substitution,2,2700,45',5172,0,0,1980-01-01,0.0,0.0,0.0,0.0,0.0,0.0,361264.0,Jonathan Padilla,2025-06-08 05:14:24
13369,735782,7,45358961,76,Hugo Camberos (Mexico U20) Substitution at 45',Hugo Camberos Substitution,2,2700,45',5172,0,0,1980-01-01,0.0,0.0,0.0,0.0,0.0,0.0,387984.0,Hugo Camberos,2025-06-08 05:14:24
13369,735782,4,45358958,76,Tahiel Jiménez (Mexico U20) Substitution at 45',Tahiel Jiménez Substitution,2,2700,45',5172,0,0,1980-01-01,0.0,0.0,0.0,0.0,0.0,0.0,357211.0,Omar Moreno,2025-06-08 05:14:24
13369,735782,5,45358959,76,Bernardo Parra (Mexico U20) Substitution at 45',Bernardo Parra Substitution,2,2700,45',5172,0,0,1980-01-01,0.0,0.0,0.0,0.0,0.0,0.0,128179.0,Luis Navarrete,2025-06-08 05:14:24
13369,735782,6,45358960,76,Jonathan Padilla (Mexico U20) Substitution at 45',Jonathan Padilla Substitution,2,2700,45',5172,0,0,1980-01-01,0.0,0.0,0.0,0.0,0.0,0.0,371478.0,Stephano Carrillo,2025-06-08 05:14:24
13369,735782,7,45358961,76,Hugo Camberos (Mexico U20) Substitution at 45',Hugo Camberos Substitution,2,2700,45',5172,0,0,1980-01-01,0.0,0.0,0.0,0.0,0.0,0.0,178850.0,Juan Uribe,2025-06-08 05:14:24
13369,735782,8,45358992,94,Cesar Garza (Mexico U20) Yellow Card at 55',Cesar Garza Yellow Card,2,3300,55',5172,0,0,1980-01-01,0.0,0.0,0.0,0.0,0.0,0.0,375061.0,Cesar Garza,2025-06-08 05:14:24
13369,735782,9,45359007,94,Kosei Ogura (Japan U20) Yellow Card at 62',Kosei Ogura Yellow Card,2,3720,62',5171,0,0,1980-01-01,0.0,0.0,0.0,0.0,0.0,0.0,384810.0,Kosei Ogura,2025-06-08 05:14:24
13369,735782,10,45359012,76,Sora Hiraga (Japan U20) Substitution at 64',Sora Hiraga Substitution,2,3840,64',5171,0,0,1980-01-01,0.0,0.0,0.0,0.0,0.0,0.0,336497.0,Sora Hiraga,2025-06-08 05:14:24
13369,735782,10,45359012,76,Sora Hiraga (Japan U20) Substitution at 64',Sora Hiraga Substitution,2,3840,64',5171,0,0,1980-01-01,0.0,0.0,0.0,0.0,0.0,0.0,398419.0,Motoki Nishihara,2025-06-08 05:14:24
13369,735782,11,45359026,70,Hugo Camberos (Mexico U20) Goal at 71',Hugo Camberos Goal,2,4260,71',5172,0,0,1980-01-01,0.0,0.0,0.0,0.0,0.0,0.0,387984.0,Hugo Camberos,2025-06-08 05:14:24
13369,735782,12,45359031,76,Nelson Ishiwatari (Japan U20) Substitution at 73',Nelson Ishiwatari Substitution,2,4380,73',5171,0,0,1980-01-01,0.0,0.0,0.0,0.0,0.0,0.0,336494.0,Nelson Ishiwatari,2025-06-08 05:14:24
13369,735782,13,45359032,76,Yutaka Michiwaki (Japan U20) Substitution at 73',Yutaka Michiwaki Substitution,2,4380,73',5171,0,0,1980-01-01,0.0,0.0,0.0,0.0,0.0,0.0,354522.0,Yutaka Michiwaki,2025-06-08 05:14:24
13369,735782,12,45359031,76,Nelson Ishiwatari (Japan U20) Substitution at 73',Nelson Ishiwatari Substitution,2,4380,73',5171,0,0,1980-01-01,0.0,0.0,0.0,0.0,0.0,0.0,359859.0,Hisatsugu Ishii,2025-06-08 05:14:24
13369,735782,13,45359032,76,Yutaka Michiwaki (Japan U20) Substitution at 73',Yutaka Michiwaki Substitution,2,4380,73',5171,0,0,1980-01-01,0.0,0.0,0.0,0.0,0.0,0.0,379758.0,Soma Kanda,2025-06-08 05:14:24
13369,735782,14,45359064,94,Tahiel Jiménez (Mexico U20) Yellow Card at 80',Tahiel Jiménez Yellow Card,2,4800,80',5172,0,0,1980-01-01,0.0,0.0,0.0,0.0,0.0,0.0,376557.0,Tahiel Jiménez,2025-06-08 05:14:24
13369,735782,15,45359068,76,Oswaldo Virgen (Mexico U20) Substitution at 84',Oswaldo Virgen Substitution,2,5040,84',5172,0,0,1980-01-01,0.0,0.0,0.0,0.0,0.0,0.0,398704.0,Oswaldo Virgen,2025-06-08 05:14:24
13369,735782,15,45359068,76,Oswaldo Virgen (Mexico U20) Substitution at 84',Oswaldo Virgen Substitution,2,5040,84',5172,0,0,1980-01-01,0.0,0.0,0.0,0.0,0.0,0.0,365830.0,Amaury Morales,2025-06-08 05:14:24
13369,735782,16,45359071,76,Mihiro Sato (Japan U20) Substitution at 86',Mihiro Sato Substitution,2,5160,86',5171,0,0,1980-01-01,0.0,0.0,0.0,0.0,0.0,0.0,386929.0,Mihiro Sato,2025-06-08 05:14:24
13369,735782,17,45359072,76,Katsuma Fuse (Japan U20) Substitution at 86',Katsuma Fuse Substitution,2,5160,86',5171,0,0,1980-01-01,0.0,0.0,0.0,0.0,0.0,0.0,376450.0,Katsuma Fuse,2025-06-08 05:14:24
13369,735782,16,45359071,76,Mihiro Sato (Japan U20) Substitution at 86',Mihiro Sato Substitution,2,5160,86',5171,0,0,1980-01-01,0.0,0.0,0.0,0.0,0.0,0.0,341714.0,Niko Takahashi,2025-06-08 05:14:24
13369,735782,17,45359072,76,Katsuma Fuse (Japan U20) Substitution at 86',Katsuma Fuse Substitution,2,5160,86',5171,0,0,1980-01-01,0.0,0.0,0.0,0.0,0.0,0.0,365019.0,Hagumu Nakagawa,2025-06-08 05:14:24
13369,735782,18,45359089,94,Karol Velázquez (Mexico U20) Yellow Card at 91',Karol Velázquez Yellow Card,2,5400,90'+1',5172,0,0,1980-01-01,0.0,0.0,0.0,0.0,0.0,0.0,364722.0,Karol Velázquez,2025-06-08 05:14:24
13369,735782,19,45359093,94,Bernardo Parra (Mexico U20) Yellow Card at 96',Bernardo Parra Yellow Card,2,5400,90'+6',5172,0,0,1980-01-01,0.0,0.0,0.0,0.0,0.0,0.0,362417.0,Bernardo Parra,2025-06-08 05:14:24
13369,735783,1,45359229,94,Breyton Fougeu (Congo U20) Yellow Card at 22',Breyton Fougeu Yellow Card,1,1320,22',7785,0,0,1980-01-01,0.0,0.0,0.0,0.0,0.0,0.0,380025.0,Breyton Fougeu,2025-06-08 05:14:24
13369,735783,2,45359230,94,Brad-Hamilton Mantsounga (Congo U20) Yellow Card at 24',Brad-Hamilton Mantsounga Yellow ,1,1440,24',7785,0,0,1980-01-01,0.0,0.0,0.0,0.0,0.0,0.0,404832.0,Brad-Hamilton Mantsounga,2025-06-08 05:14:24
13369,735783,3,45359231,98,Mads Enggård (Denmark U20) Penalty - Scored at 27',Mads Enggård Penalty - Scored,1,1620,27',130879,0,0,1980-01-01,0.0,0.0,0.0,0.0,0.0,0.0,315621.0,Mads Enggård,2025-06-08 05:14:24
13369,735783,4,45359372,76,Gustav Christensen (Denmark U20) Substitution at 45',Gustav Christensen Substitution,2,2700,45',130879,0,0,1980-01-01,0.0,0.0,0.0,0.0,0.0,0.0,353064.0,Gustav Christensen,2025-06-08 05:14:24
13369,735783,4,45359372,76,Gustav Christensen (Denmark U20) Substitution at 45',Gustav Christensen Substitution,2,2700,45',130879,0,0,1980-01-01,0.0,0.0,0.0,0.0,0.0,0.0,380656.0,Michael Opoku,2025-06-08 05:14:24
13369,735783,5,45359414,76,Jason Bemba (Congo U20) Substitution at 59',Jason Bemba Substitution,2,3540,59',7785,0,0,1980-01-01,0.0,0.0,0.0,0.0,0.0,0.0,404833.0,Jason Bemba,2025-06-08 05:14:24
13369,735783,5,45359414,76,Jason Bemba (Congo U20) Substitution at 59',Jason Bemba Substitution,2,3540,59',7785,0,0,1980-01-01,0.0,0.0,0.0,0.0,0.0,0.0,404840.0,Abdallah Mbemba,2025-06-08 05:14:24
13369,735783,6,45359415,94,César Obongo (Congo U20) Yellow Card at 61',César Obongo Yellow Card,2,3660,61',7785,0,0,1980-01-01,0.0,0.0,0.0,0.0,0.0,0.0,404841.0,César Obongo,2025-06-08 05:14:24
13369,735783,7,45359416,76,Jakob Nielsen (Denmark U20) Substitution at 63',Jakob Nielsen Substitution,2,3780,63',130879,0,0,1980-01-01,0.0,0.0,0.0,0.0,0.0,0.0,351245.0,Jakob Nielsen,2025-06-08 05:14:24
13369,735783,8,45359417,76,Pontus Andy Texel (Denmark U20) Substitution at 63',Pontus Andy Texel Substitution,2,3780,63',130879,0,0,1980-01-01,0.0,0.0,0.0,0.0,0.0,0.0,343957.0,Pontus Andy Texel,2025-06-08 05:14:24
13369,735783,9,45359418,76,Chido Obi (Denmark U20) Substitution at 63',Chido Obi Substitution,2,3780,63',130879,0,0,1980-01-01,0.0,0.0,0.0,0.0,0.0,0.0,375738.0,Chido Obi,2025-06-08 05:14:24
13369,735783,7,45359416,76,Jakob Nielsen (Denmark U20) Substitution at 63',Jakob Nielsen Substitution,2,3780,63',130879,0,0,1980-01-01,0.0,0.0,0.0,0.0,0.0,0.0,315621.0,Mads Enggård,2025-06-08 05:14:24
13369,735783,8,45359417,76,Pontus Andy Texel (Denmark U20) Substitution at 63',Pontus Andy Texel Substitution,2,3780,63',130879,0,0,1980-01-01,0.0,0.0,0.0,0.0,0.0,0.0,360259.0,Sabil Hansen,2025-06-08 05:14:24
13369,735783,9,45359418,76,Chido Obi (Denmark U20) Substitution at 63',Chido Obi Substitution,2,3780,63',130879,0,0,1980-01-01,0.0,0.0,0.0,0.0,0.0,0.0,336483.0,Alexander Simmelhack,2025-06-08 05:14:24
13369,735783,10,45359422,76,Lorick Nana (Congo U20) Substitution at 69',Lorick Nana Substitution,2,4140,69',7785,0,0,1980-01-01,0.0,0.0,0.0,0.0,0.0,0.0,404845.0,Lorick Nana,2025-06-08 05:14:24
13369,735783,11,45359423,76,Destin Banzouzi (Congo U20) Substitution at 69',Destin Banzouzi Substitution,2,4140,69',7785,0,0,1980-01-01,0.0,0.0,0.0,0.0,0.0,0.0,404842.0,Destin Banzouzi,2025-06-08 05:14:24
13369,735783,10,45359422,76,Lorick Nana (Congo U20) Substitution at 69',Lorick Nana Substitution,2,4140,69',7785,0,0,1980-01-01,0.0,0.0,0.0,0.0,0.0,0.0,404997.0,Lenny Loussilaho,2025-06-08 05:14:24
13369,735783,11,45359423,76,Destin Banzouzi (Congo U20) Substitution at 69',Destin Banzouzi Substitution,2,4140,69',7785,0,0,1980-01-01,0.0,0.0,0.0,0.0,0.0,0.0,380025.0,Breyton Fougeu,2025-06-08 05:14:24
13369,735783,12,45359439,94,Kimi Gandziri (Congo U20) Yellow Card at 74',Kimi Gandziri Yellow Card,2,4440,74',7785,0,0,1980-01-01,0.0,0.0,0.0,0.0,0.0,0.0,404844.0,Kimi Gandziri,2025-06-08 05:14:24
13369,735783,13,45359482,94,Jakob Nielsen (Denmark U20) Yellow Card at 79',Jakob Nielsen Yellow Card,2,4740,79',130879,0,0,1980-01-01,0.0,0.0,0.0,0.0,0.0,0.0,351245.0,Jakob Nielsen,2025-06-08 05:14:24
13369,735783,14,45359486,76,Lauge Sandgrav (Denmark U20) Substitution at 81',Lauge Sandgrav Substitution,2,4860,81',130879,0,0,1980-01-01,0.0,0.0,0.0,0.0,0.0,0.0,312022.0,Lauge Sandgrav,2025-06-08 05:14:24
13369,735783,14,45359486,76,Lauge Sandgrav (Denmark U20) Substitution at 81',Lauge Sandgrav Substitution,2,4860,81',130879,0,0,1980-01-01,0.0,0.0,0.0,0.0,0.0,0.0,399469.0,Oskar Øhlenschlæger,2025-06-08 05:14:24
13369,735783,15,45359487,76,Alan Bikoumou (Congo U20) Substitution at 82',Alan Bikoumou Substitution,2,4920,82',7785,0,0,1980-01-01,0.0,0.0,0.0,0.0,0.0,0.0,404839.0,Alan Bikoumou,2025-06-08 05:14:24
13369,735783,16,45359499,76,Steed Tchicamboud (Congo U20) Substitution at 82',Steed Tchicamboud Substitution,2,4920,82',7785,0,0,1980-01-01,0.0,0.0,0.0,0.0,0.0,0.0,404848.0,Steed Tchicamboud,2025-06-08 05:14:24
13369,735783,15,45359487,76,Alan Bikoumou (Congo U20) Substitution at 82',Alan Bikoumou Substitution,2,4920,82',7785,0,0,1980-01-01,0.0,0.0,0.0,0.0,0.0,0.0,404847.0,Noah Le Bret,2025-06-08 05:14:24
13369,735783,16,45359499,76,Steed Tchicamboud (Congo U20) Substitution at 82',Steed Tchicamboud Substitution,2,4920,82',7785,0,0,1980-01-01,0.0,0.0,0.0,0.0,0.0,0.0,404844.0,Kimi Gandziri,2025-06-08 05:14:24
13369,735783,17,45359593,94,Gustav Julius Mortensen (Denmark U20) Yellow Card at 94',Gustav Julius Mortensen Yellow C,2,5400,90'+4',130879,0,0,1980-01-01,0.0,0.0,0.0,0.0,0.0,0.0,319386.0,Gustav Julius Mortensen,2025-06-08 05:14:24
13369,735783,18,45359594,70,Chido Obi (Denmark U20) Goal at 96',Chido Obi Goal,2,5400,90'+6',130879,0,0,1980-01-01,0.0,0.0,0.0,0.0,0.0,0.0,375738.0,Chido Obi,2025-06-08 05:14:24
13369,735783,19,45359605,94,Chido Obi (Denmark U20) Yellow Card at 96',Chido Obi Yellow Card,2,5400,90'+6',130879,0,0,1980-01-01,0.0,0.0,0.0,0.0,0.0,0.0,375738.0,Chido Obi,2025-06-08 05:14:24
13369,735784,1,45367062,70,Meshal Alaeli (Saudi Arabia U23) Goal at 15',Meshal Alaeli Goal,1,900,15',20950,0,0,1980-01-01,0.0,0.0,0.0,0.0,0.0,0.0,362869.0,Meshal Alaeli,2025-06-10 04:50:00
13369,735784,2,45367073,94,Abdulmalik Al Oyayari (Saudi Arabia U23) Yellow Card at 34',Abdulmalik Al Oyayari Yellow Car,1,2040,34',20950,0,0,1980-01-01,0.0,0.0,0.0,0.0,0.0,0.0,337325.0,Abdulmalik Al Oyayari,2025-06-10 04:50:00
13369,735784,3,45367075,94,Meshal Alaeli (Saudi Arabia U23) Yellow Card at 43',Meshal Alaeli Yellow Card,1,2580,43',20950,0,0,1980-01-01,0.0,0.0,0.0,0.0,0.0,0.0,362869.0,Meshal Alaeli,2025-06-10 04:50:00
13369,735784,4,45367076,94,Isiaka Soukouna (Mali U20) Yellow Card at 43',Isiaka Soukouna Yellow Card,1,2580,43',17763,0,0,1980-01-01,0.0,0.0,0.0,0.0,0.0,0.0,404780.0,Isiaka Soukouna,2025-06-10 04:50:00
13369,735784,5,45367077,70,Gaoussou Diakité (Mali U20) Goal at 48',Gaoussou Diakité Goal,1,2700,45'+3',17763,0,0,1980-01-01,0.0,0.0,0.0,0.0,0.0,0.0,380383.0,Gaoussou Diakité,2025-06-10 04:50:00
13369,735784,6,45367078,70,Wilson Samake (Mali U20) Goal at 49',Wilson Samake Goal,2,2940,49',17763,0,0,1980-01-01,0.0,0.0,0.0,0.0,0.0,0.0,355981.0,Wilson Samake,2025-06-10 04:50:00
13369,735784,7,45367079,94,Abdullah Radif (Saudi Arabia U23) Yellow Card at 51',Abdullah Radif Yellow Card,2,3060,51',20950,0,0,1980-01-01,0.0,0.0,0.0,0.0,0.0,0.0,313423.0,Abdullah Radif,2025-06-10 04:50:00
13369,735784,8,45367080,76,Abdullah Subayt (Saudi Arabia U23) Substitution at 56',Abdullah Subayt Substitution,2,3360,56',20950,0,0,1980-01-01,0.0,0.0,0.0,0.0,0.0,0.0,373105.0,Abdullah Subayt,2025-06-10 04:50:00
13369,735784,8,45367080,76,Abdullah Subayt (Saudi Arabia U23) Substitution at 56',Abdullah Subayt Substitution,2,3360,56',20950,0,0,1980-01-01,0.0,0.0,0.0,0.0,0.0,0.0,383187.0,Abdulrahman Al Obaid,2025-06-10 04:50:00
13369,735784,9,45367081,70,Abdullah Radif (Saudi Arabia U23) Goal at 66',Abdullah Radif Goal,2,3960,66',20950,0,0,1980-01-01,0.0,0.0,0.0,0.0,0.0,0.0,313423.0,Abdullah Radif,2025-06-10 04:50:00
13369,735784,10,45367082,76,Majed Abdullah (Saudi Arabia U23) Substitution at 71',Majed Abdullah Substitution,2,4260,71',20950,0,0,1980-01-01,0.0,0.0,0.0,0.0,0.0,0.0,388400.0,Majed Abdullah,2025-06-10 04:50:00
13369,735784,11,45367083,76,Badr Al Omair (Saudi Arabia U23) Substitution at 71',Badr Al Omair Substitution,2,4260,71',20950,0,0,1980-01-01,0.0,0.0,0.0,0.0,0.0,0.0,392499.0,Badr Al Omair,2025-06-10 04:50:00
13369,735784,10,45367082,76,Majed Abdullah (Saudi Arabia U23) Substitution at 71',Majed Abdullah Substitution,2,4260,71',20950,0,0,1980-01-01,0.0,0.0,0.0,0.0,0.0,0.0,389695.0,Abdulaziz Al Othman,2025-06-10 04:50:00
13369,735784,11,45367083,76,Badr Al Omair (Saudi Arabia U23) Substitution at 71',Badr Al Omair Substitution,2,4260,71',20950,0,0,1980-01-01,0.0,0.0,0.0,0.0,0.0,0.0,341471.0,Abdulmalik Al Jaber,2025-06-10 04:50:00
13369,735784,12,45367084,76,Mahamoud Barry (Mali U20) Substitution at 73',Mahamoud Barry Substitution,2,4380,73',17763,0,0,1980-01-01,0.0,0.0,0.0,0.0,0.0,0.0,372072.0,Mahamoud Barry,2025-06-10 04:50:00
13369,735784,13,45367085,76,Ousmane Thiero (Mali U20) Substitution at 73',Ousmane Thiero Substitution,2,4380,73',17763,0,0,1980-01-01,0.0,0.0,0.0,0.0,0.0,0.0,372067.0,Ousmane Thiero,2025-06-10 04:50:00
13369,735784,14,45367086,76,Ibrahim Kanate (Mali U20) Substitution at 73',Ibrahim Kanate Substitution,2,4380,73',17763,0,0,1980-01-01,0.0,0.0,0.0,0.0,0.0,0.0,372078.0,Ibrahim Kanate,2025-06-10 04:50:00
13369,735784,12,45367084,76,Mahamoud Barry (Mali U20) Substitution at 73',Mahamoud Barry Substitution,2,4380,73',17763,0,0,1980-01-01,0.0,0.0,0.0,0.0,0.0,0.0,396766.0,Aboubacar Sidibe,2025-06-10 04:50:00
13369,735784,13,45367085,76,Ousmane Thiero (Mali U20) Substitution at 73',Ousmane Thiero Substitution,2,4380,73',17763,0,0,1980-01-01,0.0,0.0,0.0,0.0,0.0,0.0,372068.0,Sékou Koné,2025-06-10 04:50:00
13369,735784,14,45367086,76,Ibrahim Kanate (Mali U20) Substitution at 73',Ibrahim Kanate Substitution,2,4380,73',17763,0,0,1980-01-01,0.0,0.0,0.0,0.0,0.0,0.0,372081.0,Ange Tia,2025-06-10 04:50:00
13369,735784,15,45367087,76,Faisal Al Abdulwahed (Saudi Arabia U23) Substitution at 81',Faisal Al Abdulwahed Substitutio,2,4860,81',20950,0,0,1980-01-01,0.0,0.0,0.0,0.0,0.0,0.0,362969.0,Faisal Al Abdulwahed,2025-06-10 04:50:00
13369,735784,16,45367088,76,Abdullah Al Zaid (Saudi Arabia U23) Substitution at 81',Abdullah Al Zaid Substitution,2,4860,81',20950,0,0,1980-01-01,0.0,0.0,0.0,0.0,0.0,0.0,341475.0,Abdullah Al Zaid,2025-06-10 04:50:00
13369,735784,15,45367087,76,Faisal Al Abdulwahed (Saudi Arabia U23) Substitution at 81',Faisal Al Abdulwahed Substitutio,2,4860,81',20950,0,0,1980-01-01,0.0,0.0,0.0,0.0,0.0,0.0,313423.0,Abdullah Radif,2025-06-10 04:50:00
13369,735784,16,45367088,76,Abdullah Al Zaid (Saudi Arabia U23) Substitution at 81',Abdullah Al Zaid Substitution,2,4860,81',20950,0,0,1980-01-01,0.0,0.0,0.0,0.0,0.0,0.0,341460.0,Abdulaziz Saud Al Aliwa,2025-06-10 04:50:00
13369,735784,17,45367089,94,Wilson Samake (Mali U20) Yellow Card at 89',Wilson Samake Yellow Card,2,5340,89',17763,0,0,1980-01-01,0.0,0.0,0.0,0.0,0.0,0.0,355981.0,Wilson Samake,2025-06-10 04:50:00
13369,735784,18,45367090,76,Abdoulaye Niakaté (Mali U20) Substitution at 90',Abdoulaye Niakaté Substitution,2,5400,90',17763,0,0,1980-01-01,0.0,0.0,0.0,0.0,0.0,0.0,388895.0,Abdoulaye Niakaté,2025-06-10 04:50:00
13369,735784,19,45367100,76,Oumar Pona (Mali U20) Substitution at 96',Oumar Pona Substitution,2,5400,90'+6',17763,0,0,1980-01-01,0.0,0.0,0.0,0.0,0.0,0.0,378976.0,Oumar Pona,2025-06-10 04:50:00
13369,735784,20,45367104,94,Majed Abdullah (Saudi Arabia U23) Yellow Card at 97',Majed Abdullah Yellow Card,2,5400,90'+7',20950,0,0,1980-01-01,0.0,0.0,0.0,0.0,0.0,0.0,388400.0,Majed Abdullah,2025-06-10 04:50:00
13369,735784,18,45367090,76,Abdoulaye Niakaté (Mali U20) Substitution at 90',Abdoulaye Niakaté Substitution,2,5400,90',17763,0,0,1980-01-01,0.0,0.0,0.0,0.0,0.0,0.0,355981.0,Wilson Samake,2025-06-10 04:50:00
