seasonType,eventId,playOrder,playId,typeId,text,shortText,period,clockValue,clockDisplayValue,teamId,scoringPlay,shootout,wallclock,goalPositionX,goalPositionY,fieldpositionX,fieldPositionY,fieldPosition2X,fieldPosition2Y,athleteId,participant,updateDateTime
13450,738016,12,45944484,76,Youssoufa Moukoko (F.C. København) Substitution at 75',Youssoufa Moukoko Substitution,2,4500,75',909,0,0,2025-09-21 15:35:59,0.0,0.0,0.0,0.0,0.0,0.0,363213.0,Robert,2025-09-22 05:11:52
13450,738016,13,45944485,76,William Clem (F.C. København) Substitution at 75',William Clem Substitution,2,4500,75',909,0,0,2025-09-21 15:36:04,0.0,0.0,0.0,0.0,0.0,0.0,151757.0,Thomas Delaney,2025-09-22 05:11:52
13450,738016,14,45944789,94,Mohamed Elyounoussi (F.C. København) Yellow Card at 86',Mohamed Elyounoussi Yellow Card,2,5160,86',909,0,0,2025-09-21 15:47:33,0.0,0.0,0.0,0.0,0.0,0.0,162484.0,Mohamed Elyounoussi,2025-09-22 05:11:52
13450,738016,15,45944790,76,Alexander Simmelhack (Silkeborg IF) Substitution at 87',Alexander Simmelhack Substitutio,2,5220,87',607,0,0,2025-09-21 15:48:25,0.0,0.0,0.0,0.0,0.0,0.0,336483.0,Alexander Simmelhack,2025-09-22 05:11:52
13450,738016,15,45944790,76,Alexander Simmelhack (Silkeborg IF) Substitution at 87',Alexander Simmelhack Substitutio,2,5220,87',607,0,0,2025-09-21 15:48:25,0.0,0.0,0.0,0.0,0.0,0.0,347071.0,Tonni Adamsen,2025-09-22 05:11:52
13450,738016,16,45944879,94,Rodrigo Huescas (F.C. København) Yellow Card at 92',Rodrigo Huescas Yellow Card,2,5400,90'+2',909,0,0,2025-09-21 15:52:58,0.0,0.0,0.0,0.0,0.0,0.0,317453.0,Rodrigo Huescas,2025-09-22 05:11:52
13450,738017,1,45928395,94,Ousmane Diao (FC Midtjylland) Yellow Card at 6',Ousmane Diao Yellow Card,1,360,6',572,0,0,2025-09-20 16:06:38,0.0,0.0,0.0,0.0,0.0,0.0,357804.0,Ousmane Diao,2025-09-21 05:17:24
13450,738017,2,45928506,94,Martin Erlic (FC Midtjylland) Yellow Card at 13',Martin Erlic Yellow Card,1,780,13',572,0,0,2025-09-20 16:13:10,0.0,0.0,0.0,0.0,0.0,0.0,216579.0,Martin Erlic,2025-09-21 05:17:24
13450,738017,3,45928559,94,Daniel Anyembe (Viborg FF) Yellow Card at 17',Daniel Anyembe Yellow Card,1,1020,17',3153,0,0,2025-09-20 16:17:19,0.0,0.0,0.0,0.0,0.0,0.0,236576.0,Daniel Anyembe,2025-09-21 05:17:24
13450,738017,4,45929373,76,Cho Gue-Sung (FC Midtjylland) Substitution at 45',Cho Gue-Sung Substitution,2,2700,45',572,0,0,2025-09-20 17:05:27,0.0,0.0,0.0,0.0,0.0,0.0,303464.0,Cho Gue-Sung,2025-09-21 05:17:24
13450,738017,5,45929374,76,Paulo Victor (FC Midtjylland) Substitution at 45',Paulo Victor Substitution,2,2700,45',572,0,0,2025-09-20 17:05:27,0.0,0.0,0.0,0.0,0.0,0.0,252544.0,Paulo Victor,2025-09-22 05:11:52
13450,738017,6,45929375,76,Kevin Mbabu (FC Midtjylland) Substitution at 45',Kevin Mbabu Substitution,2,2700,45',572,0,0,2025-09-20 17:05:27,0.0,0.0,0.0,0.0,0.0,0.0,176497.0,Kevin Mbabu,2025-09-21 05:17:24
13450,738017,4,45929373,76,Cho Gue-Sung (FC Midtjylland) Substitution at 45',Cho Gue-Sung Substitution,2,2700,45',572,0,0,2025-09-20 17:05:27,0.0,0.0,0.0,0.0,0.0,0.0,303000.0,Aral Simsir,2025-09-21 05:17:24
13450,738017,5,45929374,76,Paulo Victor (FC Midtjylland) Substitution at 45',Paulo Victor Substitution,2,2700,45',572,0,0,2025-09-20 17:05:27,0.0,0.0,0.0,0.0,0.0,0.0,309111.0,Adam Gabriel,2025-09-22 05:11:52
13450,738017,6,45929375,76,Kevin Mbabu (FC Midtjylland) Substitution at 45',Kevin Mbabu Substitution,2,2700,45',572,0,0,2025-09-20 17:05:27,0.0,0.0,0.0,0.0,0.0,0.0,320879.0,Viktor Bak,2025-09-21 05:17:24
13450,738017,7,45929633,76,Asker Bech (Viborg FF) Substitution at 60',Asker Bech Substitution,2,3600,60',3153,0,0,2025-09-20 17:21:02,0.0,0.0,0.0,0.0,0.0,0.0,328578.0,Asker Bech,2025-09-21 05:17:24
13450,738017,8,45929634,76,Dorian Hanza (Viborg FF) Substitution at 60',Dorian Hanza Substitution,2,3600,60',3153,0,0,2025-09-20 17:21:19,0.0,0.0,0.0,0.0,0.0,0.0,333130.0,Dorian Hanza,2025-09-21 05:17:24
13450,738017,7,45929633,76,Asker Bech (Viborg FF) Substitution at 60',Asker Bech Substitution,2,3600,60',3153,0,0,2025-09-20 17:21:02,0.0,0.0,0.0,0.0,0.0,0.0,321067.0,Mads Søndergaard,2025-09-21 05:17:24
13450,738017,8,45929634,76,Dorian Hanza (Viborg FF) Substitution at 60',Dorian Hanza Substitution,2,3600,60',3153,0,0,2025-09-20 17:21:19,0.0,0.0,0.0,0.0,0.0,0.0,272625.0,Tim Freriks,2025-09-21 05:17:24
13450,738017,9,45929751,94,Srdjan Kuzmic (Viborg FF) Yellow Card at 69',Srdjan Kuzmic Yellow Card,2,4140,69',3153,0,0,2025-09-20 17:29:58,0.0,0.0,0.0,0.0,0.0,0.0,344634.0,Srdjan Kuzmic,2025-09-21 05:17:24
13450,738017,10,45929774,76,Hjalte Bidstrup (Viborg FF) Substitution at 71',Hjalte Bidstrup Substitution,2,4260,71',3153,0,0,2025-09-20 17:31:27,0.0,0.0,0.0,0.0,0.0,0.0,387497.0,Hjalte Bidstrup,2025-09-21 05:17:24
13450,738017,11,45929775,76,Brahimi Bilal (Viborg FF) Substitution at 71',Brahimi Bilal Substitution,2,4260,71',3153,0,0,2025-09-20 17:31:34,0.0,0.0,0.0,0.0,0.0,0.0,279137.0,Brahimi Bilal,2025-09-21 05:17:24
13450,738017,10,45929774,76,Hjalte Bidstrup (Viborg FF) Substitution at 71',Hjalte Bidstrup Substitution,2,4260,71',3153,0,0,2025-09-20 17:31:27,0.0,0.0,0.0,0.0,0.0,0.0,344634.0,Srdjan Kuzmic,2025-09-21 05:17:24
13450,738017,11,45929775,76,Brahimi Bilal (Viborg FF) Substitution at 71',Brahimi Bilal Substitution,2,4260,71',3153,0,0,2025-09-20 17:31:34,0.0,0.0,0.0,0.0,0.0,0.0,337147.0,Charly Horneman,2025-09-21 05:17:24
13450,738017,12,45929890,76,Jakob Nielsen (Viborg FF) Substitution at 79',Jakob Nielsen Substitution,2,4740,79',3153,0,0,2025-09-20 17:39:32,0.0,0.0,0.0,0.0,0.0,0.0,351245.0,Jakob Nielsen,2025-09-21 05:17:24
13450,738017,13,45929920,70,Philip Billing (FC Midtjylland) Goal at 79',Philip Billing Goal,2,4740,79',572,0,0,2025-09-20 17:40:27,0.0,0.0,0.0,0.0,0.0,0.0,192660.0,Philip Billing,2025-09-21 05:17:24
13450,738017,12,45929890,76,Jakob Nielsen (Viborg FF) Substitution at 79',Jakob Nielsen Substitution,2,4740,79',3153,0,0,2025-09-20 17:39:32,0.0,0.0,0.0,0.0,0.0,0.0,333130.0,Dorian Hanza,2025-09-21 05:17:24
13450,738017,14,45929940,76,Valdemar Byskov (FC Midtjylland) Substitution at 81',Valdemar Byskov Substitution,2,4860,81',572,0,0,2025-09-20 17:41:59,0.0,0.0,0.0,0.0,0.0,0.0,344870.0,Valdemar Byskov,2025-09-21 05:17:24
13450,738017,15,45929941,76,Edward Chilufya (FC Midtjylland) Substitution at 81',Edward Chilufya Substitution,2,4860,81',572,0,0,2025-09-20 17:42:05,0.0,0.0,0.0,0.0,0.0,0.0,256646.0,Edward Chilufya,2025-09-21 05:17:24
13450,738017,14,45929940,76,Valdemar Byskov (FC Midtjylland) Substitution at 81',Valdemar Byskov Substitution,2,4860,81',572,0,0,2025-09-20 17:41:59,0.0,0.0,0.0,0.0,0.0,0.0,216579.0,Martin Erlic,2025-09-21 05:17:24
13450,738017,15,45929941,76,Edward Chilufya (FC Midtjylland) Substitution at 81',Edward Chilufya Substitution,2,4860,81',572,0,0,2025-09-20 17:42:05,0.0,0.0,0.0,0.0,0.0,0.0,364585.0,Franculino Djú,2025-09-21 05:17:24
13450,738017,16,45930011,94,Júnior Brumado (FC Midtjylland) Yellow Card at 84',Júnior Brumado Yellow Card,2,5040,84',572,0,0,2025-09-20 17:45:21,0.0,0.0,0.0,0.0,0.0,0.0,259691.0,Júnior Brumado,2025-09-21 05:17:24
13450,738017,17,45930256,94,Mads Bech Sørensen (FC Midtjylland) Yellow Card at 94',Mads Bech Sørensen Yellow Card,2,5400,90'+4',572,0,0,2025-09-20 17:55:13,0.0,0.0,0.0,0.0,0.0,0.0,239004.0,Mads Bech Sørensen,2025-09-21 05:17:24
13450,738017,18,45930278,70,Cho Gue-Sung (FC Midtjylland) Goal at 96',Cho Gue-Sung Goal,2,5400,90'+6',572,0,0,2025-09-20 17:57:17,0.0,0.0,0.0,0.0,0.0,0.0,303464.0,Cho Gue-Sung,2025-09-21 05:17:24
13450,738018,1,45954576,70,Daniel Høegh (Randers FC) Goal at 53',Daniel Høegh Goal,2,3180,53',3132,0,0,2025-09-22 18:10:41,0.0,0.0,0.0,0.0,0.0,0.0,182080.0,Daniel Høegh,2025-09-23 05:12:46
13450,738018,2,45954582,70,Daniel Høegh (Randers FC) Goal at 57',Daniel Høegh Goal,2,3420,57',3132,0,0,2025-09-22 18:14:12,0.0,0.0,0.0,0.0,0.0,0.0,182080.0,Daniel Høegh,2025-09-23 05:12:46
13450,738018,3,45954613,76,Runar Norheim (FC Nordsjælland) Substitution at 67',Runar Norheim Substitution,2,4020,67',3101,0,0,2025-09-22 18:24:00,0.0,0.0,0.0,0.0,0.0,0.0,312960.0,Runar Norheim,2025-09-23 05:12:46
13450,738018,4,45954614,76,Villum Berthelsen (FC Nordsjælland) Substitution at 67',Villum Berthelsen Substitution,2,4020,67',3101,0,0,2025-09-22 18:24:04,0.0,0.0,0.0,0.0,0.0,0.0,401465.0,Villum Berthelsen,2025-09-23 05:12:46
13450,738018,3,45954613,76,Runar Norheim (FC Nordsjælland) Substitution at 67',Runar Norheim Substitution,2,4020,67',3101,0,0,2025-09-22 18:24:00,0.0,0.0,0.0,0.0,0.0,0.0,372632.0,Juho Lähteenmäki,2025-09-23 05:12:46
13450,738018,4,45954614,76,Villum Berthelsen (FC Nordsjælland) Substitution at 67',Villum Berthelsen Substitution,2,4020,67',3101,0,0,2025-09-22 18:24:04,0.0,0.0,0.0,0.0,0.0,0.0,269735.0,Ola Solbakken,2025-09-23 05:12:46
13450,738018,5,45954624,76,Stephen Odey (Randers FC) Substitution at 70',Stephen Odey Substitution,2,4200,70',3132,0,0,2025-09-22 18:27:12,0.0,0.0,0.0,0.0,0.0,0.0,257252.0,Stephen Odey,2025-09-23 05:12:46
13450,738018,5,45954624,76,Stephen Odey (Randers FC) Substitution at 70',Stephen Odey Substitution,2,4200,70',3132,0,0,2025-09-22 18:27:12,0.0,0.0,0.0,0.0,0.0,0.0,380839.0,Mike Themsen,2025-09-23 05:12:46
13450,738018,6,45954625,97,Tobias Salquist (FC Nordsjælland) Own Goal at 71',Tobias Salquist Own Goal,2,4260,71',3132,0,0,2025-09-22 18:27:58,0.0,0.0,0.0,0.0,0.0,0.0,,Tobias Salquist,2025-09-23 05:12:46
13450,738018,7,45954634,76,Justin Janssen (FC Nordsjælland) Substitution at 74',Justin Janssen Substitution,2,4440,74',3101,0,0,2025-09-22 18:31:42,0.0,0.0,0.0,0.0,0.0,0.0,387494.0,Justin Janssen,2025-09-23 05:12:46
13450,738018,8,45954638,76,Stephen Acquah (FC Nordsjælland) Substitution at 74',Stephen Acquah Substitution,2,4440,74',3101,0,0,2025-09-22 18:31:45,0.0,0.0,0.0,0.0,0.0,0.0,378549.0,Stephen Acquah,2025-09-23 05:12:46
13450,738018,7,45954634,76,Justin Janssen (FC Nordsjælland) Substitution at 74',Justin Janssen Substitution,2,4440,74',3101,0,0,2025-09-22 18:31:42,0.0,0.0,0.0,0.0,0.0,0.0,146803.0,Peter Ankersen,2025-09-23 05:12:46
13450,738018,8,45954638,76,Stephen Acquah (FC Nordsjælland) Substitution at 74',Stephen Acquah Substitution,2,4440,74',3101,0,0,2025-09-22 18:31:45,0.0,0.0,0.0,0.0,0.0,0.0,238401.0,Mark Brink Christensen,2025-09-23 05:12:46
13450,738018,9,45954641,76,Norman Campbell (Randers FC) Substitution at 77',Norman Campbell Substitution,2,4620,77',3132,0,0,2025-09-22 18:34:27,0.0,0.0,0.0,0.0,0.0,0.0,310351.0,Norman Campbell,2025-09-23 05:12:46
13450,738018,9,45954641,76,Norman Campbell (Randers FC) Substitution at 77',Norman Campbell Substitution,2,4620,77',3132,0,0,2025-09-22 18:34:27,0.0,0.0,0.0,0.0,0.0,0.0,302688.0,Mohamed Toure,2025-09-23 05:12:46
13450,738018,10,45954656,76,Souleymane Alio (FC Nordsjælland) Substitution at 82',Souleymane Alio Substitution,2,4920,82',3101,0,0,2025-09-22 18:39:02,0.0,0.0,0.0,0.0,0.0,0.0,335709.0,Souleymane Alio,2025-09-23 05:12:46
13450,738018,10,45954656,76,Souleymane Alio (FC Nordsjælland) Substitution at 82',Souleymane Alio Substitution,2,4920,82',3101,0,0,2025-09-22 18:39:02,0.0,0.0,0.0,0.0,0.0,0.0,202681.0,Alexander Lind,2025-09-23 05:12:46
13450,738018,11,45954679,76,Sabil Hansen (Randers FC) Substitution at 89',Sabil Hansen Substitution,2,5340,89',3132,0,0,2025-09-22 18:46:31,0.0,0.0,0.0,0.0,0.0,0.0,360259.0,Sabil Hansen,2025-09-23 05:12:46
13450,738018,12,45954683,76,Laurits Pedersen (Randers FC) Substitution at 89',Laurits Pedersen Substitution,2,5340,89',3132,0,0,2025-09-22 18:46:12,0.0,0.0,0.0,0.0,0.0,0.0,362071.0,Laurits Pedersen,2025-09-23 05:12:46
13450,738018,11,45954679,76,Sabil Hansen (Randers FC) Substitution at 89',Sabil Hansen Substitution,2,5340,89',3132,0,0,2025-09-22 18:46:31,0.0,0.0,0.0,0.0,0.0,0.0,304214.0,Elies Mahmoud,2025-09-23 05:12:46
13450,738018,12,45954683,76,Laurits Pedersen (Randers FC) Substitution at 89',Laurits Pedersen Substitution,2,5340,89',3132,0,0,2025-09-22 18:46:12,0.0,0.0,0.0,0.0,0.0,0.0,178241.0,Andre Romer,2025-09-23 05:12:46
13450,738018,13,45954687,94,Nikolas Dyhr (Randers FC) Yellow Card at 90',Nikolas Dyhr Yellow Card,2,5400,90',3132,0,0,2025-09-22 18:47:22,0.0,0.0,0.0,0.0,0.0,0.0,291551.0,Nikolas Dyhr,2025-09-23 05:12:46
13450,738019,1,45941198,94,Igor Vekic (Vejle Boldklub) Yellow Card at 14',Igor Vekic Yellow Card,1,840,14',12498,0,0,2025-09-21 12:15:01,0.0,0.0,0.0,0.0,0.0,0.0,311529.0,Igor Vekic,2025-09-22 05:11:52
13450,738019,2,45941219,70,Maxime Soulas (Sønderjyske Fodbold) Goal at 15',Maxime Soulas Goal,1,900,15',8118,0,0,2025-09-21 12:16:00,0.0,0.0,0.0,0.0,0.0,0.0,263499.0,Maxime Soulas,2025-09-22 05:11:52
13450,738019,3,45941298,94,Christian Gammelgaard (Vejle Boldklub) Yellow Card at 31',Christian Gammelgaard Yellow Car,1,1860,31',12498,0,0,2025-09-21 12:31:45,0.0,0.0,0.0,0.0,0.0,0.0,329740.0,Christian Gammelgaard,2025-09-22 05:11:52
13450,738019,4,45941300,70,Lirim Kjamili (Sønderjyske Fodbold) Goal at 32',Lirim Kjamili Goal,1,1920,32',8118,0,0,2025-09-21 12:32:51,0.0,0.0,0.0,0.0,0.0,0.0,307422.0,Lirim Kjamili,2025-09-22 05:11:52
13450,738019,5,45941322,70,Stefan Velkov (Vejle Boldklub) Goal at 36',Stefan Velkov Goal,1,2160,36',12498,0,0,2025-09-21 12:36:28,0.0,0.0,0.0,0.0,0.0,0.0,237660.0,Stefan Velkov,2025-09-22 05:11:52
13450,738019,6,45941639,94,Thomas Gunderland (Vejle Boldklub) Yellow Card at 48',Thomas Gunderland Yellow Card,2,2880,48',12498,0,0,2025-09-21 13:08:33,0.0,0.0,0.0,0.0,0.0,0.0,274981.0,Thomas Gunderland,2025-09-22 05:11:52
13450,738019,7,45941739,94,Rasmus Hjorth Vinderslev (Sønderjyske Fodbold) Yellow Card at 55',Rasmus Hjorth Vinderslev Yellow ,2,3300,55',8118,0,0,2025-09-21 13:15:18,0.0,0.0,0.0,0.0,0.0,0.0,255314.0,Rasmus Hjorth Vinderslev,2025-09-22 05:11:52
13450,738019,8,45941826,76,Bismark Edjeodji (Vejle Boldklub) Substitution at 61',Bismark Edjeodji Substitution,2,3660,61',12498,0,0,2025-09-21 13:20:55,0.0,0.0,0.0,0.0,0.0,0.0,406546.0,Bismark Edjeodji,2025-09-22 05:11:52
13450,738019,9,45941850,76,Lasse Flö (Vejle Boldklub) Substitution at 61',Lasse Flö Substitution,2,3660,61',12498,0,0,2025-09-21 13:20:42,0.0,0.0,0.0,0.0,0.0,0.0,363429.0,Lasse Flö,2025-09-22 05:11:52
13450,738019,8,45941826,76,Bismark Edjeodji (Vejle Boldklub) Substitution at 61',Bismark Edjeodji Substitution,2,3660,61',12498,0,0,2025-09-21 13:20:55,0.0,0.0,0.0,0.0,0.0,0.0,387488.0,Amin Chiakha,2025-09-22 05:11:52
13450,738019,9,45941850,76,Lasse Flö (Vejle Boldklub) Substitution at 61',Lasse Flö Substitution,2,3660,61',12498,0,0,2025-09-21 13:20:42,0.0,0.0,0.0,0.0,0.0,0.0,320917.0,Valdemar Lund Jensen,2025-09-22 05:11:52
13450,738019,10,45941939,76,Mads Agger (Sønderjyske Fodbold) Substitution at 68',Mads Agger Substitution,2,4080,68',8118,0,0,2025-09-21 13:28:11,0.0,0.0,0.0,0.0,0.0,0.0,386348.0,Mads Agger,2025-09-22 05:11:52
13450,738019,11,45941952,76,Alexander Lyng (Sønderjyske Fodbold) Substitution at 68',Alexander Lyng Substitution,2,4080,68',8118,0,0,2025-09-21 13:28:12,0.0,0.0,0.0,0.0,0.0,0.0,364126.0,Alexander Lyng,2025-09-22 05:11:52
13450,738019,10,45941939,76,Mads Agger (Sønderjyske Fodbold) Substitution at 68',Mads Agger Substitution,2,4080,68',8118,0,0,2025-09-21 13:28:11,0.0,0.0,0.0,0.0,0.0,0.0,307422.0,Lirim Kjamili,2025-09-22 05:11:52
13450,738019,11,45941952,76,Alexander Lyng (Sønderjyske Fodbold) Substitution at 68',Alexander Lyng Substitution,2,4080,68',8118,0,0,2025-09-21 13:28:12,0.0,0.0,0.0,0.0,0.0,0.0,305403.0,Kristall Máni Ingason,2025-09-22 05:11:52
13450,738019,12,45942099,98,Christian Gammelgaard (Vejle Boldklub) Penalty - Scored at 77',Christian Gammelgaard Penalty - ,2,4620,77',12498,0,0,2025-09-21 13:37:17,0.0,0.0,0.0,0.0,0.0,0.0,329740.0,Christian Gammelgaard,2025-09-22 05:11:52
13450,738019,13,45942134,76,Mads Enggård (Vejle Boldklub) Substitution at 79',Mads Enggård Substitution,2,4740,79',12498,0,0,2025-09-21 13:39:18,0.0,0.0,0.0,0.0,0.0,0.0,315621.0,Mads Enggård,2025-09-22 05:11:52
13450,738019,14,45942149,76,Jonathan Amon (Vejle Boldklub) Substitution at 79',Jonathan Amon Substitution,2,4740,79',12498,0,0,2025-09-21 13:39:26,0.0,0.0,0.0,0.0,0.0,0.0,267774.0,Jonathan Amon,2025-09-22 05:11:52
13450,738019,13,45942134,76,Mads Enggård (Vejle Boldklub) Substitution at 79',Mads Enggård Substitution,2,4740,79',12498,0,0,2025-09-21 13:39:18,0.0,0.0,0.0,0.0,0.0,0.0,223138.0,Tobias Lauritsen,2025-09-22 05:11:52
13450,738019,14,45942149,76,Jonathan Amon (Vejle Boldklub) Substitution at 79',Jonathan Amon Substitution,2,4740,79',12498,0,0,2025-09-21 13:39:26,0.0,0.0,0.0,0.0,0.0,0.0,407608.0,Abdoulaye Camara,2025-09-22 05:11:52
13450,738019,15,45942182,76,Simon Wæver (Sønderjyske Fodbold) Substitution at 83',Simon Wæver Substitution,2,4980,83',8118,0,0,2025-09-21 13:42:54,0.0,0.0,0.0,0.0,0.0,0.0,386355.0,Simon Wæver,2025-09-22 05:11:52
13450,738019,16,45942200,76,Albert Rrahmani (Sønderjyske Fodbold) Substitution at 83',Albert Rrahmani Substitution,2,4980,83',8118,0,0,2025-09-21 13:42:48,0.0,0.0,0.0,0.0,0.0,0.0,391099.0,Albert Rrahmani,2025-09-22 05:11:52
13450,738019,15,45942182,76,Simon Wæver (Sønderjyske Fodbold) Substitution at 83',Simon Wæver Substitution,2,4980,83',8118,0,0,2025-09-21 13:42:54,0.0,0.0,0.0,0.0,0.0,0.0,255314.0,Rasmus Hjorth Vinderslev,2025-09-22 05:11:52
13450,738019,16,45942200,76,Albert Rrahmani (Sønderjyske Fodbold) Substitution at 83',Albert Rrahmani Substitution,2,4980,83',8118,0,0,2025-09-21 13:42:48,0.0,0.0,0.0,0.0,0.0,0.0,310964.0,Matthew Hoppe,2025-09-22 05:11:52
13450,738019,17,45942276,94,Bismark Edjeodji (Vejle Boldklub) Yellow Card at 87',Bismark Edjeodji Yellow Card,2,5220,87',12498,0,0,2025-09-21 13:47:21,0.0,0.0,0.0,0.0,0.0,0.0,406546.0,Bismark Edjeodji,2025-09-22 05:11:52
13450,738019,18,45942315,76,Alexi Pitu (Vejle Boldklub) Substitution at 89',Alexi Pitu Substitution,2,5340,89',12498,0,0,2025-09-21 13:49:19,0.0,0.0,0.0,0.0,0.0,0.0,270538.0,Alexi Pitu,2025-09-22 05:11:52
13450,738019,18,45942315,76,Alexi Pitu (Vejle Boldklub) Substitution at 89',Alexi Pitu Substitution,2,5340,89',12498,0,0,2025-09-21 13:49:19,0.0,0.0,0.0,0.0,0.0,0.0,329740.0,Christian Gammelgaard,2025-09-22 05:11:52
13450,738020,1,46007200,70,Gustav Marcussen (FC Fredericia) Goal at 15',Gustav Marcussen Goal,1,900,15',130912,0,0,2025-09-28 12:15:55,0.0,0.0,0.0,0.0,0.0,0.0,248775.0,Gustav Marcussen,2025-09-29 05:23:01
13450,738020,2,46007236,70,Tim Freriks (Viborg FF) Goal at 21',Tim Freriks Goal,1,1260,21',3153,0,0,2025-09-28 12:22:20,0.0,0.0,0.0,0.0,0.0,0.0,272625.0,Tim Freriks,2025-09-29 05:23:01
13450,738020,3,46007680,76,Sofus Johannesen (FC Fredericia) Substitution at 45',Sofus Johannesen Substitution,2,2700,45',130912,0,0,2025-09-28 13:03:15,0.0,0.0,0.0,0.0,0.0,0.0,392978.0,Sofus Johannesen,2025-09-29 05:23:01
13450,738020,4,46007691,76,Adam Andersen (FC Fredericia) Substitution at 45',Adam Andersen Substitution,2,2700,45',130912,0,0,2025-09-28 13:03:15,0.0,0.0,0.0,0.0,0.0,0.0,370488.0,Adam Andersen,2025-09-29 05:23:01
13450,738020,3,46007680,76,Sofus Johannesen (FC Fredericia) Substitution at 45',Sofus Johannesen Substitution,2,2700,45',130912,0,0,2025-09-28 13:03:15,0.0,0.0,0.0,0.0,0.0,0.0,137481.0,Anders Dahl,2025-09-29 05:23:01
13450,738020,4,46007691,76,Adam Andersen (FC Fredericia) Substitution at 45',Adam Andersen Substitution,2,2700,45',130912,0,0,2025-09-28 13:03:15,0.0,0.0,0.0,0.0,0.0,0.0,406534.0,William Madsen,2025-09-29 05:23:01
13450,738020,5,46008035,76,Yonis Njoh (Viborg FF) Substitution at 62',Yonis Njoh Substitution,2,3720,62',3153,0,0,2025-09-28 13:20:10,0.0,0.0,0.0,0.0,0.0,0.0,365129.0,Yonis Njoh,2025-09-29 05:23:01
13450,738020,5,46008035,76,Yonis Njoh (Viborg FF) Substitution at 62',Yonis Njoh Substitution,2,3720,62',3153,0,0,2025-09-28 13:20:10,0.0,0.0,0.0,0.0,0.0,0.0,337147.0,Charly Horneman,2025-09-29 05:23:01
13450,738020,6,46008036,76,Asker Bech (Viborg FF) Substitution at 63',Asker Bech Substitution,2,3780,63',3153,0,0,2025-09-28 13:20:29,0.0,0.0,0.0,0.0,0.0,0.0,328578.0,Asker Bech,2025-09-29 05:23:01
13450,738020,6,46008036,76,Asker Bech (Viborg FF) Substitution at 63',Asker Bech Substitution,2,3780,63',3153,0,0,2025-09-28 13:20:29,0.0,0.0,0.0,0.0,0.0,0.0,261605.0,Mees Hoedemakers,2025-09-29 05:23:01
13450,738020,7,46008242,76,Dorian Hanza (Viborg FF) Substitution at 74',Dorian Hanza Substitution,2,4440,74',3153,0,0,2025-09-28 13:31:35,0.0,0.0,0.0,0.0,0.0,0.0,333130.0,Dorian Hanza,2025-09-29 05:23:01
13450,738020,8,46008243,76,Sami Jalal (Viborg FF) Substitution at 74',Sami Jalal Substitution,2,4440,74',3153,0,0,2025-09-28 13:31:43,0.0,0.0,0.0,0.0,0.0,0.0,404849.0,Sami Jalal,2025-09-29 05:23:01
13450,738020,9,46008253,76,Moses Opondo (FC Fredericia) Substitution at 74',Moses Opondo Substitution,2,4440,74',130912,0,0,2025-09-28 13:32:07,0.0,0.0,0.0,0.0,0.0,0.0,256942.0,Moses Opondo,2025-09-29 05:23:01
13450,738020,10,46008288,76,Kristian Pedersen (FC Fredericia) Substitution at 74',Kristian Pedersen Substitution,2,4440,74',130912,0,0,2025-09-28 13:32:15,0.0,0.0,0.0,0.0,0.0,0.0,232381.0,Kristian Pedersen,2025-09-29 05:23:01
13450,738020,7,46008242,76,Dorian Hanza (Viborg FF) Substitution at 74',Dorian Hanza Substitution,2,4440,74',3153,0,0,2025-09-28 13:31:35,0.0,0.0,0.0,0.0,0.0,0.0,272625.0,Tim Freriks,2025-09-29 05:23:01
13450,738020,8,46008243,76,Sami Jalal (Viborg FF) Substitution at 74',Sami Jalal Substitution,2,4440,74',3153,0,0,2025-09-28 13:31:43,0.0,0.0,0.0,0.0,0.0,0.0,279137.0,Bilal Brahimi,2025-09-29 05:23:01
13450,738020,9,46008253,76,Moses Opondo (FC Fredericia) Substitution at 74',Moses Opondo Substitution,2,4440,74',130912,0,0,2025-09-28 13:32:07,0.0,0.0,0.0,0.0,0.0,0.0,221166.0,Svenn Crone,2025-09-29 05:23:01
13450,738020,10,46008288,76,Kristian Pedersen (FC Fredericia) Substitution at 74',Kristian Pedersen Substitution,2,4440,74',130912,0,0,2025-09-28 13:32:15,0.0,0.0,0.0,0.0,0.0,0.0,311741.0,Andreas Pyndt,2025-09-29 05:23:01
13450,738020,11,46008544,76,Patrick Egelund (FC Fredericia) Substitution at 86',Patrick Egelund Substitution,2,5160,86',130912,0,0,2025-09-28 13:44:16,0.0,0.0,0.0,0.0,0.0,0.0,287371.0,Patrick Egelund,2025-09-29 05:23:01
13450,738020,11,46008544,76,Patrick Egelund (FC Fredericia) Substitution at 86',Patrick Egelund Substitution,2,5160,86',130912,0,0,2025-09-28 13:44:16,0.0,0.0,0.0,0.0,0.0,0.0,276395.0,Agon Mucolii,2025-09-29 05:23:01
13450,738020,12,46008545,76,Jean-Manuel Mbom (Viborg FF) Substitution at 87',Jean-Manuel Mbom Substitution,2,5220,87',3153,0,0,2025-09-28 13:44:35,0.0,0.0,0.0,0.0,0.0,0.0,265924.0,Jean-Manuel Mbom,2025-09-29 05:23:01
13450,738020,12,46008545,76,Jean-Manuel Mbom (Viborg FF) Substitution at 87',Jean-Manuel Mbom Substitution,2,5220,87',3153,0,0,2025-09-28 13:44:35,0.0,0.0,0.0,0.0,0.0,0.0,387497.0,Hjalte Bidstrup,2025-09-29 05:23:01
13450,738020,13,46008597,70,Yonis Njoh (Viborg FF) Goal at 89',Yonis Njoh Goal,2,5340,89',3153,0,0,2025-09-28 13:46:46,0.0,0.0,0.0,0.0,0.0,0.0,365129.0,Yonis Njoh,2025-09-29 05:23:01
13450,738021,1,46012441,94,Markus Solbakken (AGF) Yellow Card at 49',Markus Solbakken Yellow Card,2,2940,49',7853,0,0,2025-09-28 17:07:22,0.0,0.0,0.0,0.0,0.0,0.0,290107.0,Markus Solbakken,2025-09-29 05:23:01
13450,738021,2,46012585,94,Frederik Tingager (AGF) Yellow Card at 57',Frederik Tingager Yellow Card,2,3420,57',7853,0,0,2025-09-28 17:14:45,0.0,0.0,0.0,0.0,0.0,0.0,234684.0,Frederik Tingager,2025-09-29 05:23:01
13450,738021,3,46012723,94,Alexander Lind (FC Nordsjælland) Yellow Card at 67',Alexander Lind Yellow Card,2,4020,67',3101,0,0,2025-09-28 17:25:21,0.0,0.0,0.0,0.0,0.0,0.0,202681.0,Alexander Lind,2025-09-29 05:23:01
13450,738021,4,46012784,174,Kristian Malt Arnstad (AGF) Penalty - Saved at 70',Kristian Malt Arnstad Penalty - ,2,4200,70',7853,0,0,1980-01-01 00:00:00,0.0,0.0,0.0,0.0,0.0,0.0,307481.0,Kristian Malt Arnstad,2025-09-29 05:23:01
13450,738021,5,46012801,76,Villum Berthelsen (FC Nordsjælland) Substitution at 73',Villum Berthelsen Substitution,2,4380,73',3101,0,0,2025-09-28 17:31:07,0.0,0.0,0.0,0.0,0.0,0.0,401465.0,Villum Berthelsen,2025-09-29 05:23:01
13450,738021,5,46012801,76,Villum Berthelsen (FC Nordsjælland) Substitution at 73',Villum Berthelsen Substitution,2,4380,73',3101,0,0,2025-09-28 17:31:07,0.0,0.0,0.0,0.0,0.0,0.0,269735.0,Ola Solbakken,2025-09-29 05:23:01
13450,738021,6,46012837,70,Alexander Lind (FC Nordsjælland) Goal at 78',Alexander Lind Goal,2,4680,78',3101,0,0,2025-09-28 17:36:11,0.0,0.0,0.0,0.0,0.0,0.0,202681.0,Alexander Lind,2025-09-29 05:23:01
13450,738021,7,46012853,70,Felix Beijmo (AGF) Goal at 81',Felix Beijmo Goal,2,4860,81',7853,0,0,2025-09-28 17:38:39,0.0,0.0,0.0,0.0,0.0,0.0,255253.0,Felix Beijmo,2025-09-29 05:23:01
13450,738021,8,46012872,76,Justin Janssen (FC Nordsjælland) Substitution at 82',Justin Janssen Substitution,2,4920,82',3101,0,0,2025-09-28 17:39:41,0.0,0.0,0.0,0.0,0.0,0.0,387494.0,Justin Janssen,2025-09-29 05:23:01
13450,738021,9,46012873,76,Issaka Seidu (FC Nordsjælland) Substitution at 82',Issaka Seidu Substitution,2,4920,82',3101,0,0,2025-09-28 17:39:46,0.0,0.0,0.0,0.0,0.0,0.0,387470.0,Issaka Seidu,2025-09-29 05:23:01
13450,738021,8,46012872,76,Justin Janssen (FC Nordsjælland) Substitution at 82',Justin Janssen Substitution,2,4920,82',3101,0,0,2025-09-28 17:39:41,0.0,0.0,0.0,0.0,0.0,0.0,238401.0,Mark Brink Christensen,2025-09-29 05:23:01
13450,738021,9,46012873,76,Issaka Seidu (FC Nordsjælland) Substitution at 82',Issaka Seidu Substitution,2,4920,82',3101,0,0,2025-09-28 17:39:46,0.0,0.0,0.0,0.0,0.0,0.0,362789.0,Prince Amoako,2025-09-29 05:23:01
13450,738021,10,46012888,70,Markus Solbakken (AGF) Goal at 83',Markus Solbakken Goal,2,4980,83',7853,0,0,2025-09-28 17:40:45,0.0,0.0,0.0,0.0,0.0,0.0,290107.0,Markus Solbakken,2025-09-29 05:23:01
13450,738021,11,46012928,76,Levy Nene (FC Nordsjælland) Substitution at 88',Levy Nene Substitution,2,5280,88',3101,0,0,2025-09-28 17:46:14,0.0,0.0,0.0,0.0,0.0,0.0,386364.0,Levy Nene,2025-09-29 05:23:01
13450,738021,11,46012928,76,Levy Nene (FC Nordsjælland) Substitution at 88',Levy Nene Substitution,2,5280,88',3101,0,0,2025-09-28 17:46:14,0.0,0.0,0.0,0.0,0.0,0.0,372632.0,Juho Lähteenmäki,2025-09-29 05:23:01
