seasonType,eventId,playOrder,playId,typeId,text,shortText,period,clockValue,clockDisplayValue,teamId,scoringPlay,shootout,wallclock,goalPositionX,goalPositionY,fieldpositionX,fieldPositionY,fieldPosition2X,fieldPosition2Y,athleteId,participant,updateDateTime
13450,738042,9,46248031,76,Jean-Manuel Mbom (Viborg FF) Substitution at 87',Jean-Manuel Mbom Substitution,2,5220,87',3153,0,0,2025-10-26 18:46:25,0.0,0.0,0.0,0.0,0.0,0.0,265924.0,Jean-Manuel Mbom,2025-10-27 05:18:31
13450,738042,10,46248032,76,Frederik Damkjer (Viborg FF) Substitution at 87',Frederik Damkjer Substitution,2,5220,87',3153,0,0,2025-10-26 18:46:29,0.0,0.0,0.0,0.0,0.0,0.0,374072.0,Frederik Damkjer,2025-10-27 05:18:31
13450,738042,9,46248031,76,Jean-Manuel Mbom (Viborg FF) Substitution at 87',Jean-Manuel Mbom Substitution,2,5220,87',3153,0,0,2025-10-26 18:46:25,0.0,0.0,0.0,0.0,0.0,0.0,387497.0,Hjalte Bidstrup,2025-10-27 05:18:31
13450,738042,10,46248032,76,Frederik Damkjer (Viborg FF) Substitution at 87',Frederik Damkjer Substitution,2,5220,87',3153,0,0,2025-10-26 18:46:29,0.0,0.0,0.0,0.0,0.0,0.0,362777.0,Thomas Jørgensen,2025-10-27 05:18:31
13450,738043,1,46220874,93,Mark Brink Christensen (FC Nordsjælland) Red Card at 54',Mark Brink Christensen Red Card,2,3240,54',3101,0,0,2025-10-24 18:13:43,0.0,0.0,0.0,0.0,0.0,0.0,238401.0,Mark Brink Christensen,2025-10-25 05:18:06
13450,738043,2,46220896,76,Kevin Yakob (AGF) Substitution at 57',Kevin Yakob Substitution,2,3420,57',7853,0,0,2025-10-24 18:16:43,0.0,0.0,0.0,0.0,0.0,0.0,274173.0,Kevin Yakob,2025-10-25 05:18:06
13450,738043,2,46220896,76,Kevin Yakob (AGF) Substitution at 57',Kevin Yakob Substitution,2,3420,57',7853,0,0,2025-10-24 18:16:43,0.0,0.0,0.0,0.0,0.0,0.0,290107.0,Markus Solbakken,2025-10-25 05:18:06
13450,738043,3,46220904,76,Stephen Acquah (FC Nordsjælland) Substitution at 59',Stephen Acquah Substitution,2,3540,59',3101,0,0,2025-10-24 18:18:50,0.0,0.0,0.0,0.0,0.0,0.0,378549.0,Stephen Acquah,2025-10-25 05:18:06
13450,738043,3,46220904,76,Stephen Acquah (FC Nordsjælland) Substitution at 59',Stephen Acquah Substitution,2,3540,59',3101,0,0,2025-10-24 18:18:50,0.0,0.0,0.0,0.0,0.0,0.0,312960.0,Runar Norheim,2025-10-25 05:18:06
13450,738043,4,46220962,94,Ola Solbakken (FC Nordsjælland) Yellow Card at 65',Ola Solbakken Yellow Card,2,3900,65',3101,0,0,2025-10-24 18:25:27,0.0,0.0,0.0,0.0,0.0,0.0,269735.0,Ola Solbakken,2025-10-25 05:18:06
13450,738043,5,46220985,76,Sebastian Jorgensen (AGF) Substitution at 71',Sebastian Jorgensen Substitution,2,4260,71',7853,0,0,2025-10-24 18:30:50,0.0,0.0,0.0,0.0,0.0,0.0,290034.0,Sebastian Jorgensen,2025-10-25 05:18:06
13450,738043,6,46220989,76,Frederik Emmery (AGF) Substitution at 71',Frederik Emmery Substitution,2,4260,71',7853,0,0,2025-10-24 18:30:53,0.0,0.0,0.0,0.0,0.0,0.0,384470.0,Frederik Emmery,2025-10-25 05:18:06
13450,738043,5,46220985,76,Sebastian Jorgensen (AGF) Substitution at 71',Sebastian Jorgensen Substitution,2,4260,71',7853,0,0,2025-10-24 18:30:50,0.0,0.0,0.0,0.0,0.0,0.0,191167.0,Nicolai Poulsen,2025-10-25 05:18:06
13450,738043,6,46220989,76,Frederik Emmery (AGF) Substitution at 71',Frederik Emmery Substitution,2,4260,71',7853,0,0,2025-10-24 18:30:53,0.0,0.0,0.0,0.0,0.0,0.0,290035.0,Rasmus Carstensen,2025-10-25 05:18:06
13450,738043,7,46221008,76,Malte Heyde (FC Nordsjælland) Substitution at 74',Malte Heyde Substitution,2,4440,74',3101,0,0,2025-10-24 18:34:13,0.0,0.0,0.0,0.0,0.0,0.0,406537.0,Malte Heyde,2025-10-25 05:18:06
13450,738043,7,46221008,76,Malte Heyde (FC Nordsjælland) Substitution at 74',Malte Heyde Substitution,2,4440,74',3101,0,0,2025-10-24 18:34:13,0.0,0.0,0.0,0.0,0.0,0.0,269735.0,Ola Solbakken,2025-10-25 05:18:06
13450,738043,8,46221098,76,Youssouph Badji (AGF) Substitution at 84',Youssouph Badji Substitution,2,5040,84',7853,0,0,2025-10-24 18:44:04,0.0,0.0,0.0,0.0,0.0,0.0,287476.0,Youssouph Badji,2025-10-25 05:18:06
13450,738043,9,46221099,76,Stefen Tchamche (AGF) Substitution at 84',Stefen Tchamche Substitution,2,5040,84',7853,0,0,2025-10-24 18:44:09,0.0,0.0,0.0,0.0,0.0,0.0,403062.0,Stefen Tchamche,2025-10-25 05:18:06
13450,738043,8,46221098,76,Youssouph Badji (AGF) Substitution at 84',Youssouph Badji Substitution,2,5040,84',7853,0,0,2025-10-24 18:44:04,0.0,0.0,0.0,0.0,0.0,0.0,118411.0,Patrick Mortensen,2025-10-25 05:18:06
13450,738043,9,46221099,76,Stefen Tchamche (AGF) Substitution at 84',Stefen Tchamche Substitution,2,5040,84',7853,0,0,2025-10-24 18:44:09,0.0,0.0,0.0,0.0,0.0,0.0,265366.0,Gift Links,2025-10-25 05:18:06
13450,738043,10,46221132,76,Villum Berthelsen (FC Nordsjælland) Substitution at 87',Villum Berthelsen Substitution,2,5220,87',3101,0,0,2025-10-24 18:47:06,0.0,0.0,0.0,0.0,0.0,0.0,401465.0,Villum Berthelsen,2025-10-25 05:18:06
13450,738043,10,46221132,76,Villum Berthelsen (FC Nordsjælland) Substitution at 87',Villum Berthelsen Substitution,2,5220,87',3101,0,0,2025-10-24 18:47:06,0.0,0.0,0.0,0.0,0.0,0.0,387494.0,Justin Janssen,2025-10-25 05:18:06
13450,738043,11,46221165,70,Frederik Emmery (AGF) Goal at 89',Frederik Emmery Goal,2,5340,89',7853,0,0,2025-10-24 18:49:22,0.0,0.0,0.0,0.0,0.0,0.0,384470.0,Frederik Emmery,2025-10-26 05:22:31
13450,738044,1,46295760,70,Viktor Claesson (F.C. København) Goal at 21',Viktor Claesson Goal,1,1260,21',909,0,0,2025-11-01 17:23:31,0.0,0.0,0.0,0.0,0.0,0.0,172864.0,Viktor Claesson,2025-11-02 05:17:11
13450,738044,2,46296820,98,Gustav Marcussen (FC Fredericia) Penalty - Scored at 49',Gustav Marcussen Penalty - Score,2,2940,49',130912,0,0,2025-11-01 18:10:16,0.0,0.0,0.0,0.0,0.0,0.0,248775.0,Gustav Marcussen,2025-11-02 05:17:11
13450,738044,3,46296911,94,Moses Opondo (FC Fredericia) Yellow Card at 54',Moses Opondo Yellow Card,2,3240,54',130912,0,0,2025-11-01 18:14:32,0.0,0.0,0.0,0.0,0.0,0.0,256942.0,Moses Opondo,2025-11-02 05:17:11
13450,738044,4,46296931,98,Youssoufa Moukoko (F.C. København) Penalty - Scored at 55',Youssoufa Moukoko Penalty - Scor,2,3300,55',909,0,0,2025-11-01 18:15:30,0.0,0.0,0.0,0.0,0.0,0.0,305554.0,Youssoufa Moukoko,2025-11-02 05:17:11
13450,738044,5,46297060,94,Mohamed Elyounoussi (F.C. København) Yellow Card at 59',Mohamed Elyounoussi Yellow Card,2,3540,59',909,0,0,2025-11-01 18:20:19,0.0,0.0,0.0,0.0,0.0,0.0,162484.0,Mohamed Elyounoussi,2025-11-02 05:17:11
13450,738044,6,46297061,76,Jordan Larsson (F.C. København) Substitution at 61',Jordan Larsson Substitution,2,3660,61',909,0,0,2025-11-01 18:21:42,0.0,0.0,0.0,0.0,0.0,0.0,206530.0,Jordan Larsson,2025-11-02 05:17:11
13450,738044,6,46297061,76,Jordan Larsson (F.C. København) Substitution at 61',Jordan Larsson Substitution,2,3660,61',909,0,0,2025-11-01 18:21:42,0.0,0.0,0.0,0.0,0.0,0.0,363213.0,Robert,2025-11-02 05:17:11
13450,738044,7,46297183,76,Agon Mucolii (FC Fredericia) Substitution at 67',Agon Mucolii Substitution,2,4020,67',130912,0,0,2025-11-01 18:27:54,0.0,0.0,0.0,0.0,0.0,0.0,276395.0,Agon Mucolii,2025-11-02 05:17:11
13450,738044,8,46297184,76,Daníel Kristjánsson (FC Fredericia) Substitution at 67',Daníel Kristjánsson Substitution,2,4020,67',130912,0,0,2025-11-01 18:27:53,0.0,0.0,0.0,0.0,0.0,0.0,364652.0,Daníel Kristjánsson,2025-11-02 05:17:11
13450,738044,7,46297183,76,Agon Mucolii (FC Fredericia) Substitution at 67',Agon Mucolii Substitution,2,4020,67',130912,0,0,2025-11-01 18:27:54,0.0,0.0,0.0,0.0,0.0,0.0,311741.0,Andreas Pyndt,2025-11-02 05:17:11
13450,738044,8,46297184,76,Daníel Kristjánsson (FC Fredericia) Substitution at 67',Daníel Kristjánsson Substitution,2,4020,67',130912,0,0,2025-11-01 18:27:53,0.0,0.0,0.0,0.0,0.0,0.0,262923.0,Emilio Simonsen,2025-11-02 05:17:11
13450,738044,9,46297185,76,William Clem (F.C. København) Substitution at 69',William Clem Substitution,2,4140,69',909,0,0,2025-11-01 18:29:33,0.0,0.0,0.0,0.0,0.0,0.0,332428.0,William Clem,2025-11-02 05:17:11
13450,738044,10,46297203,76,Viktor Dadason (F.C. København) Substitution at 69',Viktor Dadason Substitution,2,4140,69',909,0,0,2025-11-01 18:29:29,0.0,0.0,0.0,0.0,0.0,0.0,411168.0,Viktor Dadason,2025-11-02 05:17:11
13450,738044,9,46297185,76,William Clem (F.C. København) Substitution at 69',William Clem Substitution,2,4140,69',909,0,0,2025-11-01 18:29:33,0.0,0.0,0.0,0.0,0.0,0.0,324510.0,Elias Achouri,2025-11-02 05:17:11
13450,738044,10,46297203,76,Viktor Dadason (F.C. København) Substitution at 69',Viktor Dadason Substitution,2,4140,69',909,0,0,2025-11-01 18:29:29,0.0,0.0,0.0,0.0,0.0,0.0,305554.0,Youssoufa Moukoko,2025-11-02 05:17:11
13450,738044,11,46297302,76,Mads Emil Madsen (F.C. København) Substitution at 76',Mads Emil Madsen Substitution,2,4560,76',909,0,0,2025-11-01 18:37:02,0.0,0.0,0.0,0.0,0.0,0.0,242850.0,Mads Emil Madsen,2025-11-02 05:17:11
13450,738044,12,46297317,76,Andreas Cornelius (F.C. København) Substitution at 76',Andreas Cornelius Substitution,2,4560,76',909,0,0,2025-11-01 18:37:14,0.0,0.0,0.0,0.0,0.0,0.0,176668.0,Andreas Cornelius,2025-11-02 05:17:11
13450,738044,11,46297302,76,Mads Emil Madsen (F.C. København) Substitution at 76',Mads Emil Madsen Substitution,2,4560,76',909,0,0,2025-11-01 18:37:02,0.0,0.0,0.0,0.0,0.0,0.0,151053.0,Marcos López,2025-11-02 05:17:11
13450,738044,12,46297317,76,Andreas Cornelius (F.C. København) Substitution at 76',Andreas Cornelius Substitution,2,4560,76',909,0,0,2025-11-01 18:37:14,0.0,0.0,0.0,0.0,0.0,0.0,172864.0,Viktor Claesson,2025-11-02 05:17:11
13450,738044,13,46297318,70,Junnosuke Suzuki (F.C. København) Goal at 77',Junnosuke Suzuki Goal,2,4620,77',909,0,0,2025-11-01 18:38:17,0.0,0.0,0.0,0.0,0.0,0.0,333663.0,Junnosuke Suzuki,2025-11-02 05:17:11
13450,738044,14,46297360,76,Eskild Munk Dall (FC Fredericia) Substitution at 79',Eskild Munk Dall Substitution,2,4740,79',130912,0,0,2025-11-01 18:40:09,0.0,0.0,0.0,0.0,0.0,0.0,304009.0,Eskild Munk Dall,2025-11-02 05:17:11
13450,738044,15,46297361,76,Sofus Johannesen (FC Fredericia) Substitution at 79',Sofus Johannesen Substitution,2,4740,79',130912,0,0,2025-11-01 18:40:17,0.0,0.0,0.0,0.0,0.0,0.0,392978.0,Sofus Johannesen,2025-11-02 05:17:11
13450,738044,14,46297360,76,Eskild Munk Dall (FC Fredericia) Substitution at 79',Eskild Munk Dall Substitution,2,4740,79',130912,0,0,2025-11-01 18:40:09,0.0,0.0,0.0,0.0,0.0,0.0,256942.0,Moses Opondo,2025-11-02 05:17:11
13450,738044,15,46297361,76,Sofus Johannesen (FC Fredericia) Substitution at 79',Sofus Johannesen Substitution,2,4740,79',130912,0,0,2025-11-01 18:40:17,0.0,0.0,0.0,0.0,0.0,0.0,248775.0,Gustav Marcussen,2025-11-02 05:17:11
13450,738044,16,46297419,70,Oscar Buch (FC Fredericia) Goal at 83',Oscar Buch Goal,2,4980,83',130912,0,0,2025-11-01 18:44:24,0.0,0.0,0.0,0.0,0.0,0.0,406533.0,Oscar Buch,2025-11-02 05:17:11
13450,738044,17,46297512,76,Adam Andersen (FC Fredericia) Substitution at 88',Adam Andersen Substitution,2,5280,88',130912,0,0,2025-11-01 18:49:23,0.0,0.0,0.0,0.0,0.0,0.0,370488.0,Adam Andersen,2025-11-02 05:17:11
13450,738044,17,46297512,76,Adam Andersen (FC Fredericia) Substitution at 88',Adam Andersen Substitution,2,5280,88',130912,0,0,2025-11-01 18:49:23,0.0,0.0,0.0,0.0,0.0,0.0,406539.0,Jakob Jessen,2025-11-02 05:17:11
13450,738045,1,46310651,70,Nicklas Rojkjaer (FC Nordsjælland) Goal at 16',Nicklas Rojkjaer Goal,1,960,16',3101,0,0,2025-11-02 17:15:13,0.0,0.0,0.0,0.0,0.0,0.0,249171.0,Nicklas Rojkjaer,2025-11-03 06:16:15
13450,738045,2,46310976,94,Adam Sorensen (Odense Boldklub) Yellow Card at 30',Adam Sorensen Yellow Card,1,1800,30',11550,0,0,2025-11-02 17:29:25,0.0,0.0,0.0,0.0,0.0,0.0,270885.0,Adam Sorensen,2025-11-03 06:16:15
13450,738045,3,46311677,94,Juho Lähteenmäki (FC Nordsjælland) Yellow Card at 48',Juho Lähteenmäki Yellow Card,2,2880,48',3101,0,0,2025-11-02 18:04:51,0.0,0.0,0.0,0.0,0.0,0.0,372632.0,Juho Lähteenmäki,2025-11-03 06:16:15
13450,738045,4,46311701,70,Jay-Roy Grot (Odense Boldklub) Goal at 49',Jay-Roy Grot Goal,2,2940,49',11550,0,0,2025-11-02 18:05:59,0.0,0.0,0.0,0.0,0.0,0.0,224115.0,Jay-Roy Grot,2025-11-03 06:16:15
13450,738045,5,46311782,70,Leeroy Owusu (Odense Boldklub) Goal at 53',Leeroy Owusu Goal,2,3180,53',11550,0,0,2025-11-02 18:10:30,0.0,0.0,0.0,0.0,0.0,0.0,207430.0,Leeroy Owusu,2025-11-03 06:16:15
13450,738045,6,46311946,70,Prince Amoako (FC Nordsjælland) Goal at 64',Prince Amoako Goal,2,3840,64',3101,0,0,2025-11-02 18:20:42,0.0,0.0,0.0,0.0,0.0,0.0,362789.0,Prince Amoako,2025-11-03 06:16:15
13450,738045,7,46311976,76,Marcus Mccoy (Odense Boldklub) Substitution at 64',Marcus Mccoy Substitution,2,3840,64',11550,0,0,2025-11-02 18:21:36,0.0,0.0,0.0,0.0,0.0,0.0,353462.0,Marcus Mccoy,2025-11-03 06:16:15
13450,738045,8,46311977,76,Jona Niemiec (Odense Boldklub) Substitution at 64',Jona Niemiec Substitution,2,3840,64',11550,0,0,2025-11-02 18:21:36,0.0,0.0,0.0,0.0,0.0,0.0,358728.0,Jona Niemiec,2025-11-03 06:16:15
13450,738045,7,46311976,76,Marcus Mccoy (Odense Boldklub) Substitution at 64',Marcus Mccoy Substitution,2,3840,64',11550,0,0,2025-11-02 18:21:36,0.0,0.0,0.0,0.0,0.0,0.0,270885.0,Adam Sorensen,2025-11-03 06:16:15
13450,738045,8,46311977,76,Jona Niemiec (Odense Boldklub) Substitution at 64',Jona Niemiec Substitution,2,3840,64',11550,0,0,2025-11-02 18:21:36,0.0,0.0,0.0,0.0,0.0,0.0,365729.0,Noah Ganaus,2025-11-03 06:16:15
13450,738045,9,46312009,76,Villum Berthelsen (FC Nordsjælland) Substitution at 68',Villum Berthelsen Substitution,2,4080,68',3101,0,0,2025-11-02 18:25:37,0.0,0.0,0.0,0.0,0.0,0.0,401465.0,Villum Berthelsen,2025-11-03 06:16:15
13450,738045,9,46312009,76,Villum Berthelsen (FC Nordsjælland) Substitution at 68',Villum Berthelsen Substitution,2,4080,68',3101,0,0,2025-11-02 18:25:37,0.0,0.0,0.0,0.0,0.0,0.0,269735.0,Ola Solbakken,2025-11-03 06:16:15
13450,738045,10,46312028,76,Runar Norheim (FC Nordsjælland) Substitution at 69',Runar Norheim Substitution,2,4140,69',3101,0,0,2025-11-02 18:25:52,0.0,0.0,0.0,0.0,0.0,0.0,312960.0,Runar Norheim,2025-11-03 06:16:15
13450,738045,10,46312028,76,Runar Norheim (FC Nordsjælland) Substitution at 69',Runar Norheim Substitution,2,4140,69',3101,0,0,2025-11-02 18:25:52,0.0,0.0,0.0,0.0,0.0,0.0,372632.0,Juho Lähteenmäki,2025-11-03 06:16:15
13450,738045,11,46312057,76,James Gomez (Odense Boldklub) Substitution at 72',James Gomez Substitution,2,4320,72',11550,0,0,2025-11-02 18:28:59,0.0,0.0,0.0,0.0,0.0,0.0,301019.0,James Gomez,2025-11-03 06:16:15
13450,738045,11,46312057,76,James Gomez (Odense Boldklub) Substitution at 72',James Gomez Substitution,2,4320,72',11550,0,0,2025-11-02 18:28:59,0.0,0.0,0.0,0.0,0.0,0.0,261164.0,Jann-Fiete Arp,2025-11-03 06:16:15
13450,738045,12,46312107,70,Jay-Roy Grot (Odense Boldklub) Goal at 78',Jay-Roy Grot Goal,2,4680,78',11550,0,0,2025-11-02 18:35:24,0.0,0.0,0.0,0.0,0.0,0.0,224115.0,Jay-Roy Grot,2025-11-03 06:16:15
13450,738045,13,46312135,76,Markus Walker (FC Nordsjælland) Substitution at 81',Markus Walker Substitution,2,4860,81',3101,0,0,2025-11-02 18:37:52,0.0,0.0,0.0,0.0,0.0,0.0,400779.0,Markus Walker,2025-11-03 06:16:15
13450,738045,14,46312140,76,Levy Nene (FC Nordsjælland) Substitution at 81',Levy Nene Substitution,2,4860,81',3101,0,0,2025-11-02 18:37:52,0.0,0.0,0.0,0.0,0.0,0.0,386364.0,Levy Nene,2025-11-03 06:16:15
13450,738045,13,46312135,76,Markus Walker (FC Nordsjælland) Substitution at 81',Markus Walker Substitution,2,4860,81',3101,0,0,2025-11-02 18:37:52,0.0,0.0,0.0,0.0,0.0,0.0,146803.0,Peter Ankersen,2025-11-03 06:16:15
13450,738045,14,46312140,76,Levy Nene (FC Nordsjælland) Substitution at 81',Levy Nene Substitution,2,4860,81',3101,0,0,2025-11-02 18:37:52,0.0,0.0,0.0,0.0,0.0,0.0,387494.0,Justin Janssen,2025-11-03 06:16:15
13450,738045,15,46312154,76,Gustav Grubbe Madsen (Odense Boldklub) Substitution at 83',Gustav Grubbe Madsen Substitutio,2,4980,83',11550,0,0,2025-11-02 18:40:19,0.0,0.0,0.0,0.0,0.0,0.0,287765.0,Gustav Grubbe Madsen,2025-11-03 06:16:15
13450,738045,15,46312154,76,Gustav Grubbe Madsen (Odense Boldklub) Substitution at 83',Gustav Grubbe Madsen Substitutio,2,4980,83',11550,0,0,2025-11-02 18:40:19,0.0,0.0,0.0,0.0,0.0,0.0,346525.0,Max Ejdum,2025-11-03 06:16:15
13450,738045,16,46312217,70,Jay-Roy Grot (Odense Boldklub) Goal at 89',Jay-Roy Grot Goal,2,5340,89',11550,0,0,2025-11-02 18:46:07,0.0,0.0,0.0,0.0,0.0,0.0,224115.0,Jay-Roy Grot,2025-11-03 06:16:15
13450,738046,1,46305889,70,Thomas Jørgensen (Viborg FF) Goal at 8',Thomas Jørgensen Goal,1,480,8',3153,0,0,2025-11-02 13:09:09,0.0,0.0,0.0,0.0,0.0,0.0,362777.0,Thomas Jørgensen,2025-11-03 06:16:15
13450,738046,2,46305932,70,Mohamed Toure (Randers FC) Goal at 12',Mohamed Toure Goal,1,720,12',3132,0,0,2025-11-02 13:13:27,0.0,0.0,0.0,0.0,0.0,0.0,302688.0,Mohamed Toure,2025-11-03 06:16:15
13450,738046,3,46306002,70,Srdjan Kuzmic (Viborg FF) Goal at 15',Srdjan Kuzmic Goal,1,900,15',3153,0,0,2025-11-02 13:16:36,0.0,0.0,0.0,0.0,0.0,0.0,344634.0,Srdjan Kuzmic,2025-11-03 06:16:15
13450,738046,4,46306432,70,Mohamed Toure (Randers FC) Goal at 41',Mohamed Toure Goal,1,2460,41',3132,0,0,2025-11-02 13:42:23,0.0,0.0,0.0,0.0,0.0,0.0,302688.0,Mohamed Toure,2025-11-03 06:16:15
13450,738046,5,46306523,94,Daniel Høegh (Randers FC) Yellow Card at 44',Daniel Høegh Yellow Card,1,2640,44',3132,0,0,2025-11-02 13:45:39,0.0,0.0,0.0,0.0,0.0,0.0,182080.0,Daniel Høegh,2025-11-03 06:16:15
13450,738046,6,46306524,94,Daniel Anyembe (Viborg FF) Yellow Card at 45',Daniel Anyembe Yellow Card,1,2700,45',3153,0,0,2025-11-02 13:46:30,0.0,0.0,0.0,0.0,0.0,0.0,236576.0,Daniel Anyembe,2025-11-03 06:16:15
13450,738046,7,46307034,94,Oliver Olsen (Randers FC) Yellow Card at 51',Oliver Olsen Yellow Card,2,3060,51',3132,0,0,2025-11-02 14:10:00,0.0,0.0,0.0,0.0,0.0,0.0,275238.0,Oliver Olsen,2025-11-03 06:16:15
13450,738046,8,46307185,94,Mohamed Toure (Randers FC) Yellow Card at 60',Mohamed Toure Yellow Card,2,3600,60',3132,0,0,2025-11-02 14:19:11,0.0,0.0,0.0,0.0,0.0,0.0,302688.0,Mohamed Toure,2025-11-03 06:16:15
13450,738046,9,46307237,76,Sami Jalal (Viborg FF) Substitution at 64',Sami Jalal Substitution,2,3840,64',3153,0,0,2025-11-02 14:22:16,0.0,0.0,0.0,0.0,0.0,0.0,404849.0,Sami Jalal,2025-11-03 06:16:15
13450,738046,10,46307238,76,Charly Horneman (Viborg FF) Substitution at 64',Charly Horneman Substitution,2,3840,64',3153,0,0,2025-11-02 14:22:22,0.0,0.0,0.0,0.0,0.0,0.0,337147.0,Charly Horneman,2025-11-03 06:16:15
13450,738046,11,46307239,76,Ousseynou Seck (Randers FC) Substitution at 64',Ousseynou Seck Substitution,2,3840,64',3132,0,0,2025-11-02 14:22:30,0.0,0.0,0.0,0.0,0.0,0.0,407729.0,Ousseynou Seck,2025-11-03 06:16:15
13450,738046,12,46307240,76,Laurits Pedersen (Randers FC) Substitution at 64',Laurits Pedersen Substitution,2,3840,64',3132,0,0,2025-11-02 14:22:40,0.0,0.0,0.0,0.0,0.0,0.0,362071.0,Laurits Pedersen,2025-11-03 06:16:15
13450,738046,9,46307237,76,Sami Jalal (Viborg FF) Substitution at 64',Sami Jalal Substitution,2,3840,64',3153,0,0,2025-11-02 14:22:16,0.0,0.0,0.0,0.0,0.0,0.0,279137.0,Bilal Brahimi,2025-11-03 06:16:15
13450,738046,10,46307238,76,Charly Horneman (Viborg FF) Substitution at 64',Charly Horneman Substitution,2,3840,64',3153,0,0,2025-11-02 14:22:22,0.0,0.0,0.0,0.0,0.0,0.0,365129.0,Yonis Njoh,2025-11-03 06:16:15
13450,738046,11,46307239,76,Ousseynou Seck (Randers FC) Substitution at 64',Ousseynou Seck Substitution,2,3840,64',3132,0,0,2025-11-02 14:22:30,0.0,0.0,0.0,0.0,0.0,0.0,343835.0,Amin Al Hamawi,2025-11-03 06:16:15
13450,738046,12,46307240,76,Laurits Pedersen (Randers FC) Substitution at 64',Laurits Pedersen Substitution,2,3840,64',3132,0,0,2025-11-02 14:22:40,0.0,0.0,0.0,0.0,0.0,0.0,178241.0,Andre Romer,2025-11-03 06:16:15
13450,738046,13,46307354,94,Elies Mahmoud (Randers FC) Yellow Card at 70',Elies Mahmoud Yellow Card,2,4200,70',3132,0,0,2025-11-02 14:28:45,0.0,0.0,0.0,0.0,0.0,0.0,304214.0,Elies Mahmoud,2025-11-03 06:16:15
13450,738046,14,46307355,76,Frederik Damkjer (Viborg FF) Substitution at 71',Frederik Damkjer Substitution,2,4260,71',3153,0,0,2025-11-02 14:29:27,0.0,0.0,0.0,0.0,0.0,0.0,374072.0,Frederik Damkjer,2025-11-03 06:16:15
13450,738046,15,46307356,76,Asker Bech (Viborg FF) Substitution at 71',Asker Bech Substitution,2,4260,71',3153,0,0,2025-11-02 14:29:17,0.0,0.0,0.0,0.0,0.0,0.0,328578.0,Asker Bech,2025-11-03 06:16:15
13450,738046,14,46307355,76,Frederik Damkjer (Viborg FF) Substitution at 71',Frederik Damkjer Substitution,2,4260,71',3153,0,0,2025-11-02 14:29:27,0.0,0.0,0.0,0.0,0.0,0.0,351245.0,Jakob Nielsen,2025-11-03 06:16:15
13450,738046,15,46307356,76,Asker Bech (Viborg FF) Substitution at 71',Asker Bech Substitution,2,4260,71',3153,0,0,2025-11-02 14:29:17,0.0,0.0,0.0,0.0,0.0,0.0,362777.0,Thomas Jørgensen,2025-11-03 06:16:15
13450,738046,16,46307461,76,Norman Campbell (Randers FC) Substitution at 76',Norman Campbell Substitution,2,4560,76',3132,0,0,2025-11-02 14:34:31,0.0,0.0,0.0,0.0,0.0,0.0,310351.0,Norman Campbell,2025-11-03 06:16:15
13450,738046,17,46307475,76,Frederik Lauenborg (Randers FC) Substitution at 76',Frederik Lauenborg Substitution,2,4560,76',3132,0,0,2025-11-02 14:34:18,0.0,0.0,0.0,0.0,0.0,0.0,222533.0,Frederik Lauenborg,2025-11-03 06:16:15
13450,738046,16,46307461,76,Norman Campbell (Randers FC) Substitution at 76',Norman Campbell Substitution,2,4560,76',3132,0,0,2025-11-02 14:34:31,0.0,0.0,0.0,0.0,0.0,0.0,380839.0,Mike Themsen,2025-11-03 06:16:15
13450,738046,17,46307475,76,Frederik Lauenborg (Randers FC) Substitution at 76',Frederik Lauenborg Substitution,2,4560,76',3132,0,0,2025-11-02 14:34:18,0.0,0.0,0.0,0.0,0.0,0.0,304214.0,Elies Mahmoud,2025-11-03 06:16:15
13450,738046,18,46307687,76,Dorian Hanza (Viborg FF) Substitution at 86',Dorian Hanza Substitution,2,5160,86',3153,0,0,2025-11-02 14:44:58,0.0,0.0,0.0,0.0,0.0,0.0,333130.0,Dorian Hanza,2025-11-03 06:16:15
13450,738046,18,46307687,76,Dorian Hanza (Viborg FF) Substitution at 86',Dorian Hanza Substitution,2,5160,86',3153,0,0,2025-11-02 14:44:58,0.0,0.0,0.0,0.0,0.0,0.0,344634.0,Srdjan Kuzmic,2025-11-03 06:16:15
13450,738046,19,46307701,76,Sabil Hansen (Randers FC) Substitution at 87',Sabil Hansen Substitution,2,5220,87',3132,0,0,2025-11-02 14:45:49,0.0,0.0,0.0,0.0,0.0,0.0,360259.0,Sabil Hansen,2025-11-03 06:16:15
13450,738046,19,46307701,76,Sabil Hansen (Randers FC) Substitution at 87',Sabil Hansen Substitution,2,5220,87',3132,0,0,2025-11-02 14:45:49,0.0,0.0,0.0,0.0,0.0,0.0,302688.0,Mohamed Toure,2025-11-03 06:16:15
13450,738046,20,46307803,94,Laurits Pedersen (Randers FC) Yellow Card at 92',Laurits Pedersen Yellow Card,2,5400,90'+2',3132,0,0,2025-11-02 14:50:43,0.0,0.0,0.0,0.0,0.0,0.0,362071.0,Laurits Pedersen,2025-11-03 06:16:15
13450,738046,21,46307820,97,Wessel Dammers (Randers FC) Own Goal at 94',Wessel Dammers Own Goal,2,5400,90'+4',3153,0,0,2025-11-02 14:53:00,0.0,0.0,0.0,0.0,0.0,0.0,,Wessel Dammers,2025-11-03 06:16:15
13450,738047,1,46321206,94,Philip Billing (FC Midtjylland) Yellow Card at 2',Philip Billing Yellow Card,1,120,2',572,0,0,2025-11-03 18:02:27,0.0,0.0,0.0,0.0,0.0,0.0,192660.0,Philip Billing,2025-11-04 06:15:29
13450,738047,2,46321272,94,Franculino Djú (FC Midtjylland) Yellow Card at 27',Franculino Djú Yellow Card,1,1620,27',572,0,0,2025-11-03 18:27:36,0.0,0.0,0.0,0.0,0.0,0.0,364585.0,Franculino Djú,2025-11-04 06:15:29
13450,738047,3,46321303,70,Tobias Bech (AGF) Goal at 35',Tobias Bech Goal,1,2100,35',7853,0,0,2025-11-03 18:35:25,0.0,0.0,0.0,0.0,0.0,0.0,288813.0,Tobias Bech,2025-11-04 06:15:29
13450,738047,4,46321700,76,Mikel Gogorza (FC Midtjylland) Substitution at 45',Mikel Gogorza Substitution,2,2700,45',572,0,0,2025-11-03 19:02:36,0.0,0.0,0.0,0.0,0.0,0.0,368628.0,Mikel Gogorza,2025-11-04 06:15:29
13450,738047,5,46321706,76,Kevin Mbabu (FC Midtjylland) Substitution at 45',Kevin Mbabu Substitution,2,2700,45',572,0,0,2025-11-03 19:02:36,0.0,0.0,0.0,0.0,0.0,0.0,176497.0,Kevin Mbabu,2025-11-04 06:15:29
13450,738047,4,46321700,76,Mikel Gogorza (FC Midtjylland) Substitution at 45',Mikel Gogorza Substitution,2,2700,45',572,0,0,2025-11-03 19:02:36,0.0,0.0,0.0,0.0,0.0,0.0,259691.0,Júnior Brumado,2025-11-04 06:15:29
13450,738047,5,46321706,76,Kevin Mbabu (FC Midtjylland) Substitution at 45',Kevin Mbabu Substitution,2,2700,45',572,0,0,2025-11-03 19:02:36,0.0,0.0,0.0,0.0,0.0,0.0,303000.0,Aral Simsir,2025-11-04 06:15:29
13450,738047,6,46321721,94,Martin Erlic (FC Midtjylland) Yellow Card at 47',Martin Erlic Yellow Card,2,2820,47',572,0,0,2025-11-03 19:05:54,0.0,0.0,0.0,0.0,0.0,0.0,216579.0,Martin Erlic,2025-11-04 06:15:29
13450,738047,7,46321735,94,Denil Castillo (FC Midtjylland) Yellow Card at 50',Denil Castillo Yellow Card,2,3000,50',572,0,0,2025-11-03 19:08:37,0.0,0.0,0.0,0.0,0.0,0.0,328742.0,Denil Castillo,2025-11-04 06:15:29
13450,738047,8,46321764,94,Patrick Mortensen (AGF) Yellow Card at 58',Patrick Mortensen Yellow Card,2,3480,58',7853,0,0,2025-11-03 19:16:18,0.0,0.0,0.0,0.0,0.0,0.0,118411.0,Patrick Mortensen,2025-11-04 06:15:29
13450,738047,9,46321942,94,Rasmus Carstensen (AGF) Yellow Card at 66',Rasmus Carstensen Yellow Card,2,3960,66',7853,0,0,2025-11-03 19:24:04,0.0,0.0,0.0,0.0,0.0,0.0,290035.0,Rasmus Carstensen,2025-11-04 06:15:29
13450,738047,10,46321959,76,Cho Gue-Sung (FC Midtjylland) Substitution at 69',Cho Gue-Sung Substitution,2,4140,69',572,0,0,2025-11-03 19:27:53,0.0,0.0,0.0,0.0,0.0,0.0,303464.0,Cho Gue-Sung,2025-11-04 06:15:29
13450,738047,10,46321959,76,Cho Gue-Sung (FC Midtjylland) Substitution at 69',Cho Gue-Sung Substitution,2,4140,69',572,0,0,2025-11-03 19:27:53,0.0,0.0,0.0,0.0,0.0,0.0,216579.0,Martin Erlic,2025-11-04 06:15:29
13450,738047,11,46321985,76,Jonas Jensen-Abbew (AGF) Substitution at 78',Jonas Jensen-Abbew Substitution,2,4680,78',7853,0,0,2025-11-03 19:36:28,0.0,0.0,0.0,0.0,0.0,0.0,317405.0,Jonas Jensen-Abbew,2025-11-04 06:15:29
13450,738047,12,46321986,76,Stefen Tchamche (AGF) Substitution at 78',Stefen Tchamche Substitution,2,4680,78',7853,0,0,2025-11-03 19:36:36,0.0,0.0,0.0,0.0,0.0,0.0,403062.0,Stefen Tchamche,2025-11-04 06:15:29
13450,738047,11,46321985,76,Jonas Jensen-Abbew (AGF) Substitution at 78',Jonas Jensen-Abbew Substitution,2,4680,78',7853,0,0,2025-11-03 19:36:28,0.0,0.0,0.0,0.0,0.0,0.0,191167.0,Nicolai Poulsen,2025-11-04 06:15:29
