seasonType,eventId,playOrder,playId,typeId,text,shortText,period,clockValue,clockDisplayValue,teamId,scoringPlay,shootout,wallclock,goalPositionX,goalPositionY,fieldpositionX,fieldPositionY,fieldPosition2X,fieldPosition2Y,athleteId,participant,updateDateTime
13655,755254,16,45791673,94,Sandile Mthethwa (Amazulu) Yellow Card at 90',Sandile Mthethwa Yellow Card,2,5400,90',7079,0,0,2025-08-30 14:52:00,0.0,0.0,0.0,0.0,0.0,0.0,256689.0,Sandile Mthethwa,2025-08-31 05:07:20
13655,755254,17,45791684,70,John Mokone (Magesi FC) Goal at 90',John Mokone Goal,2,5400,90',18611,0,0,2025-08-30 14:52:46,0.0,0.0,0.0,0.0,0.0,0.0,390424.0,John Mokone,2025-09-03 05:10:59
13655,755254,18,45791740,94,Mondli Mbanjwa (Amazulu) Yellow Card at 93',Mondli Mbanjwa Yellow Card,2,5400,90'+3',7079,0,0,2025-08-30 14:55:01,0.0,0.0,0.0,0.0,0.0,0.0,313697.0,Mondli Mbanjwa,2025-08-31 05:07:20
13655,755255,1,45819405,94,Thabo Moloisane (Stellenbosch) Yellow Card at 18',Thabo Moloisane Yellow Card,1,1080,18',18615,0,0,2025-08-30 13:19:32,0.0,0.0,0.0,0.0,0.0,0.0,287490.0,Thabo Moloisane,2025-09-02 05:10:44
13655,755255,2,45789963,98,Peter Shalulile (Mamelodi Sundowns) Penalty - Scored at 47',Peter Shalulile Penalty - Scored,1,2700,45'+2',7084,0,0,2025-08-30 13:48:39,0.0,0.0,0.0,0.0,0.0,0.0,230158.0,Peter Shalulile,2025-09-02 05:10:44
13655,755255,3,45790202,76,Iqraam Rayners (Mamelodi Sundowns) Substitution at 45',Iqraam Rayners Substitution,2,2700,45',7084,0,0,2025-08-30 14:05:47,0.0,0.0,0.0,0.0,0.0,0.0,291141.0,Iqraam Rayners,2025-09-02 05:10:44
13655,755255,3,45790202,76,Iqraam Rayners (Mamelodi Sundowns) Substitution at 45',Iqraam Rayners Substitution,2,2700,45',7084,0,0,2025-08-30 14:05:47,0.0,0.0,0.0,0.0,0.0,0.0,314861.0,Arthur,2025-09-02 05:10:44
13655,755255,4,45790309,94,Kazie Godswill (Stellenbosch) Yellow Card at 48',Kazie Godswill Yellow Card,2,2880,48',18615,0,0,2025-08-30 14:08:54,0.0,0.0,0.0,0.0,0.0,0.0,359081.0,Kazie Godswill,2025-09-02 05:10:44
13655,755255,5,45790477,76,Lehlohonolo Mojela (Stellenbosch) Substitution at 55',Lehlohonolo Mojela Substitution,2,3300,55',18615,0,0,2025-08-30 14:15:36,0.0,0.0,0.0,0.0,0.0,0.0,313565.0,Lehlohonolo Mojela,2025-09-02 05:10:44
13655,755255,5,45790477,76,Lehlohonolo Mojela (Stellenbosch) Substitution at 55',Lehlohonolo Mojela Substitution,2,3300,55',18615,0,0,2025-08-30 14:15:36,0.0,0.0,0.0,0.0,0.0,0.0,325172.0,Thato Khiba,2025-09-02 05:10:44
13655,755255,6,45790654,94,Bathusi Jurry Aubaas (Mamelodi Sundowns) Yellow Card at 58',Bathusi Jurry Aubaas Yellow Card,2,3480,58',7084,0,0,2025-08-30 14:18:48,0.0,0.0,0.0,0.0,0.0,0.0,268949.0,Bathusi Jurry Aubaas,2025-09-02 05:10:44
13655,755255,7,45790822,76,Langelihle Phili (Stellenbosch) Substitution at 65',Langelihle Phili Substitution,2,3900,65',18615,0,0,2025-08-30 14:25:27,0.0,0.0,0.0,0.0,0.0,0.0,383923.0,Langelihle Phili,2025-09-02 05:10:44
13655,755255,8,45790823,76,Thapelo Mokobodi (Stellenbosch) Substitution at 65',Thapelo Mokobodi Substitution,2,3900,65',18615,0,0,2025-08-30 14:25:41,0.0,0.0,0.0,0.0,0.0,0.0,391769.0,Thapelo Mokobodi,2025-09-02 05:10:44
13655,755255,7,45790822,76,Langelihle Phili (Stellenbosch) Substitution at 65',Langelihle Phili Substitution,2,3900,65',18615,0,0,2025-08-30 14:25:27,0.0,0.0,0.0,0.0,0.0,0.0,313690.0,Khomotjo Lekoloane,2025-09-02 05:10:44
13655,755255,8,45790823,76,Thapelo Mokobodi (Stellenbosch) Substitution at 65',Thapelo Mokobodi Substitution,2,3900,65',18615,0,0,2025-08-30 14:25:41,0.0,0.0,0.0,0.0,0.0,0.0,359081.0,Kazie Godswill,2025-09-02 05:10:44
13655,755255,9,45790824,76,Jayden Adams (Mamelodi Sundowns) Substitution at 66',Jayden Adams Substitution,2,3960,66',7084,0,0,2025-08-30 14:26:05,0.0,0.0,0.0,0.0,0.0,0.0,304736.0,Jayden Adams,2025-09-02 05:10:44
13655,755255,9,45790824,76,Jayden Adams (Mamelodi Sundowns) Substitution at 66',Jayden Adams Substitution,2,3960,66',7084,0,0,2025-08-30 14:26:05,0.0,0.0,0.0,0.0,0.0,0.0,230158.0,Peter Shalulile,2025-09-02 05:10:44
13655,755255,10,45791077,94,Keanu Cupido (Mamelodi Sundowns) Yellow Card at 75',Keanu Cupido Yellow Card,2,4500,75',7084,0,0,2025-08-30 14:35:41,0.0,0.0,0.0,0.0,0.0,0.0,228597.0,Keanu Cupido,2025-09-02 05:10:44
13655,755255,11,45791113,76,Chumani Butsaka (Stellenbosch) Substitution at 76',Chumani Butsaka Substitution,2,4560,76',18615,0,0,2025-08-30 14:36:49,0.0,0.0,0.0,0.0,0.0,0.0,313775.0,Chumani Butsaka,2025-09-02 05:10:44
13655,755255,11,45791113,76,Chumani Butsaka (Stellenbosch) Substitution at 76',Chumani Butsaka Substitution,2,4560,76',18615,0,0,2025-08-30 14:36:49,0.0,0.0,0.0,0.0,0.0,0.0,297317.0,Ibraheem Jabaar,2025-09-02 05:10:44
13655,755255,12,45791180,76,Lesiba Nku (Stellenbosch) Substitution at 77',Lesiba Nku Substitution,2,4620,77',18615,0,0,2025-08-30 14:36:59,0.0,0.0,0.0,0.0,0.0,0.0,291351.0,Lesiba Nku,2025-09-02 05:10:44
13655,755255,12,45791180,76,Lesiba Nku (Stellenbosch) Substitution at 77',Lesiba Nku Substitution,2,4620,77',18615,0,0,2025-08-30 14:36:59,0.0,0.0,0.0,0.0,0.0,0.0,194737.0,Andre De Jong,2025-09-02 05:10:44
13655,755255,13,45791320,76,Teboho Mokoena (Mamelodi Sundowns) Substitution at 81',Teboho Mokoena Substitution,2,4860,81',7084,0,0,2025-08-30 14:41:00,0.0,0.0,0.0,0.0,0.0,0.0,256691.0,Teboho Mokoena,2025-09-02 05:10:44
13655,755255,14,45791321,76,Divine Lunga (Mamelodi Sundowns) Substitution at 81',Divine Lunga Substitution,2,4860,81',7084,0,0,2025-08-30 14:41:05,0.0,0.0,0.0,0.0,0.0,0.0,274421.0,Divine Lunga,2025-09-02 05:10:44
13655,755255,13,45791320,76,Teboho Mokoena (Mamelodi Sundowns) Substitution at 81',Teboho Mokoena Substitution,2,4860,81',7084,0,0,2025-08-30 14:41:00,0.0,0.0,0.0,0.0,0.0,0.0,268949.0,Bathusi Jurry Aubaas,2025-09-02 05:10:44
13655,755255,14,45791321,76,Divine Lunga (Mamelodi Sundowns) Substitution at 81',Divine Lunga Substitution,2,4860,81',7084,0,0,2025-08-30 14:41:05,0.0,0.0,0.0,0.0,0.0,0.0,283344.0,Tashreeq Matthews,2025-09-02 05:10:44
13655,755255,15,45791605,76,Mosa Lebusa (Mamelodi Sundowns) Substitution at 89',Mosa Lebusa Substitution,2,5340,89',7084,0,0,2025-08-30 14:49:45,0.0,0.0,0.0,0.0,0.0,0.0,177921.0,Mosa Lebusa,2025-09-02 05:10:44
13655,755255,15,45791605,76,Mosa Lebusa (Mamelodi Sundowns) Substitution at 89',Mosa Lebusa Substitution,2,5340,89',7084,0,0,2025-08-30 14:49:45,0.0,0.0,0.0,0.0,0.0,0.0,381802.0,Kutlwano Letlhaku,2025-09-02 05:10:44
13655,755256,1,45794051,94,Sibongiseni Mthethwa (Kaizer Chiefs) Yellow Card at 5',Sibongiseni Mthethwa Yellow Card,1,300,5',7081,0,0,2025-08-30 15:49:26,0.0,0.0,0.0,0.0,0.0,0.0,309103.0,Sibongiseni Mthethwa,2025-08-31 05:07:20
13655,755256,2,45794850,76,Nhlanhla Zwane (Golden Arrows) Substitution at 45',Nhlanhla Zwane Substitution,2,2700,45',7077,0,0,2025-08-30 16:47:33,0.0,0.0,0.0,0.0,0.0,0.0,108527.0,Nhlanhla Zwane,2025-08-31 05:07:20
13655,755256,2,45794850,76,Nhlanhla Zwane (Golden Arrows) Substitution at 45',Nhlanhla Zwane Substitution,2,2700,45',7077,0,0,2025-08-30 16:47:33,0.0,0.0,0.0,0.0,0.0,0.0,287480.0,Keenan Phillips,2025-08-31 05:07:20
13655,755256,3,45795005,76,Flávio Silva (Kaizer Chiefs) Substitution at 58',Flávio Silva Substitution,2,3480,58',7081,0,0,2025-08-30 17:00:30,0.0,0.0,0.0,0.0,0.0,0.0,408396.0,Flávio Silva,2025-09-04 05:11:51
13655,755256,4,45795006,76,Mfundo Vilakazi (Kaizer Chiefs) Substitution at 58',Mfundo Vilakazi Substitution,2,3480,58',7081,0,0,2025-08-30 17:00:33,0.0,0.0,0.0,0.0,0.0,0.0,380673.0,Mfundo Vilakazi,2025-09-04 05:11:51
13655,755256,3,45795005,76,Flávio Silva (Kaizer Chiefs) Substitution at 58',Flávio Silva Substitution,2,3480,58',7081,0,0,2025-08-30 17:00:30,0.0,0.0,0.0,0.0,0.0,0.0,291123.0,Ashley Du Preez,2025-09-04 05:11:51
13655,755256,4,45795006,76,Mfundo Vilakazi (Kaizer Chiefs) Substitution at 58',Mfundo Vilakazi Substitution,2,3480,58',7081,0,0,2025-08-30 17:00:33,0.0,0.0,0.0,0.0,0.0,0.0,309039.0,Pule Sydney Mmodi,2025-09-04 05:11:51
13655,755256,5,45795023,76,Leandro Sirino (Kaizer Chiefs) Substitution at 59',Leandro Sirino Substitution,2,3540,59',7081,0,0,2025-08-30 17:00:41,0.0,0.0,0.0,0.0,0.0,0.0,204806.0,Leandro Sirino,2025-09-04 05:11:51
13655,755256,5,45795023,76,Leandro Sirino (Kaizer Chiefs) Substitution at 59',Leandro Sirino Substitution,2,3540,59',7081,0,0,2025-08-30 17:00:41,0.0,0.0,0.0,0.0,0.0,0.0,332564.0,Mduduzi Shabalala,2025-09-04 05:11:51
13655,755256,6,45795116,76,Sbonelo Cele (Golden Arrows) Substitution at 64',Sbonelo Cele Substitution,2,3840,64',7077,0,0,2025-08-30 17:05:36,0.0,0.0,0.0,0.0,0.0,0.0,313541.0,Sbonelo Cele,2025-09-04 05:11:51
13655,755256,7,45795117,76,Alwande Booysen (Golden Arrows) Substitution at 64',Alwande Booysen Substitution,2,3840,64',7077,0,0,2025-08-30 17:05:46,0.0,0.0,0.0,0.0,0.0,0.0,408452.0,Alwande Booysen,2025-08-31 05:07:20
13655,755256,6,45795116,76,Sbonelo Cele (Golden Arrows) Substitution at 64',Sbonelo Cele Substitution,2,3840,64',7077,0,0,2025-08-30 17:05:36,0.0,0.0,0.0,0.0,0.0,0.0,408455.0,Ntandoyenkosi Mabaso,2025-09-04 05:11:51
13655,755256,7,45795117,76,Alwande Booysen (Golden Arrows) Substitution at 64',Alwande Booysen Substitution,2,3840,64',7077,0,0,2025-08-30 17:05:46,0.0,0.0,0.0,0.0,0.0,0.0,367165.0,Siyanda Mthanti,2025-08-31 05:07:20
13655,755256,8,45795244,70,Flávio Silva (Kaizer Chiefs) Goal at 69',Flávio Silva Goal,2,4140,69',7081,0,0,2025-08-30 17:11:03,0.0,0.0,0.0,0.0,0.0,0.0,408396.0,Flávio Silva,2025-08-31 05:07:20
13655,755256,9,45795356,94,Flávio Silva (Kaizer Chiefs) Yellow Card at 70',Flávio Silva Yellow Card,2,4200,70',7081,0,0,2025-08-30 17:12:20,0.0,0.0,0.0,0.0,0.0,0.0,408396.0,Flávio Silva,2025-08-31 05:07:20
13655,755256,10,45795422,76,Nduduzo Sibiya (Golden Arrows) Substitution at 70',Nduduzo Sibiya Substitution,2,4200,70',7077,0,0,2025-08-30 17:12:16,0.0,0.0,0.0,0.0,0.0,0.0,204667.0,Nduduzo Sibiya,2025-08-31 05:07:20
13655,755256,10,45795422,76,Nduduzo Sibiya (Golden Arrows) Substitution at 70',Nduduzo Sibiya Substitution,2,4200,70',7077,0,0,2025-08-30 17:12:16,0.0,0.0,0.0,0.0,0.0,0.0,367185.0,Sabelo Sithole,2025-08-31 05:07:20
13655,755256,11,45795592,76,Philani Kumalo (Golden Arrows) Substitution at 80',Philani Kumalo Substitution,2,4800,80',7077,0,0,2025-08-30 17:22:19,0.0,0.0,0.0,0.0,0.0,0.0,325155.0,Philani Kumalo,2025-09-04 05:11:51
13655,755256,11,45795592,76,Philani Kumalo (Golden Arrows) Substitution at 80',Philani Kumalo Substitution,2,4800,80',7077,0,0,2025-08-30 17:22:19,0.0,0.0,0.0,0.0,0.0,0.0,313548.0,Nqobeko Siphelele Dlamini,2025-09-04 05:11:51
13655,755256,12,45795635,76,Bradley Cross (Kaizer Chiefs) Substitution at 85',Bradley Cross Substitution,2,5100,85',7081,0,0,2025-08-30 17:26:58,0.0,0.0,0.0,0.0,0.0,0.0,310593.0,Bradley Cross,2025-08-31 05:07:20
13655,755256,13,45795636,94,Inácio Santos (Kaizer Chiefs) Yellow Card at 85',Inácio Santos Yellow Card,2,5100,85',7081,0,0,2025-08-30 17:27:17,0.0,0.0,0.0,0.0,0.0,0.0,208363.0,Inácio Santos,2025-09-04 05:11:51
13655,755256,12,45795635,76,Bradley Cross (Kaizer Chiefs) Substitution at 85',Bradley Cross Substitution,2,5100,85',7081,0,0,2025-08-30 17:26:58,0.0,0.0,0.0,0.0,0.0,0.0,312790.0,Makabi Lilepo,2025-08-31 05:07:20
13655,755256,14,45795733,76,Lehlogonolo Matlou (Kaizer Chiefs) Substitution at 92',Lehlogonolo Matlou Substitution,2,5400,90'+2',7081,0,0,2025-08-30 17:33:54,0.0,0.0,0.0,0.0,0.0,0.0,324943.0,Lehlogonolo Matlou,2025-08-31 05:07:20
13655,755256,14,45795733,76,Lehlogonolo Matlou (Kaizer Chiefs) Substitution at 92',Lehlogonolo Matlou Substitution,2,5400,90'+2',7081,0,0,2025-08-30 17:33:54,0.0,0.0,0.0,0.0,0.0,0.0,262589.0,Siphesihle Ndlovu,2025-08-31 05:07:20
13655,755257,1,45793741,70,Bradley Grobler (Sekhukhune United) Goal at 10',Bradley Grobler Goal,1,600,10',20814,0,0,2025-08-30 15:42:56,0.0,0.0,0.0,0.0,0.0,0.0,111946.0,Bradley Grobler,2025-08-31 05:07:20
13655,755257,2,45793959,70,Thabang Monare (Sekhukhune United) Goal at 15',Thabang Monare Goal,1,900,15',20814,0,0,2025-08-30 15:47:13,0.0,0.0,0.0,0.0,0.0,0.0,225486.0,Thabang Monare,2025-08-31 05:07:20
13655,755257,3,45794676,76,Sikhosonke Langa (Sekhukhune United) Substitution at 45',Sikhosonke Langa Substitution,2,2700,45',20814,0,0,2025-08-30 16:35:04,0.0,0.0,0.0,0.0,0.0,0.0,390437.0,Sikhosonke Langa,2025-08-31 05:07:20
13655,755257,4,45794704,76,Brooklyn Poggenpoel (Durban City) Substitution at 45',Brooklyn Poggenpoel Substitution,2,2700,45',22348,0,0,2025-08-30 16:35:04,0.0,0.0,0.0,0.0,0.0,0.0,313700.0,Brooklyn Poggenpoel,2025-08-31 05:07:20
13655,755257,5,45794705,76,Joslin Kamatuka (Durban City) Substitution at 45',Joslin Kamatuka Substitution,2,2700,45',22348,0,0,2025-08-30 16:35:04,0.0,0.0,0.0,0.0,0.0,0.0,247855.0,Joslin Kamatuka,2025-08-31 05:07:20
13655,755257,6,45794706,76,Thabo Nodada (Durban City) Substitution at 45',Thabo Nodada Substitution,2,2700,45',22348,0,0,2025-08-30 16:35:04,0.0,0.0,0.0,0.0,0.0,0.0,225135.0,Thabo Nodada,2025-08-31 05:07:20
13655,755257,3,45794676,76,Sikhosonke Langa (Sekhukhune United) Substitution at 45',Sikhosonke Langa Substitution,2,2700,45',20814,0,0,2025-08-30 16:35:04,0.0,0.0,0.0,0.0,0.0,0.0,390445.0,Vuyo Letlapa,2025-08-31 05:07:20
13655,755257,4,45794704,76,Brooklyn Poggenpoel (Durban City) Substitution at 45',Brooklyn Poggenpoel Substitution,2,2700,45',22348,0,0,2025-08-30 16:35:04,0.0,0.0,0.0,0.0,0.0,0.0,302665.0,Athini Jodwana,2025-08-31 05:07:20
13655,755257,5,45794705,76,Joslin Kamatuka (Durban City) Substitution at 45',Joslin Kamatuka Substitution,2,2700,45',22348,0,0,2025-08-30 16:35:04,0.0,0.0,0.0,0.0,0.0,0.0,347403.0,Kyle Jurgens,2025-08-31 05:07:20
13655,755257,6,45794706,76,Thabo Nodada (Durban City) Substitution at 45',Thabo Nodada Substitution,2,2700,45',22348,0,0,2025-08-30 16:35:04,0.0,0.0,0.0,0.0,0.0,0.0,408660.0,Jean Lwamba,2025-08-31 05:07:20
13655,755257,7,45794897,76,Saziso Magawana (Durban City) Substitution at 62',Saziso Magawana Substitution,2,3720,62',22348,0,0,2025-08-30 16:51:47,0.0,0.0,0.0,0.0,0.0,0.0,313534.0,Saziso Magawana,2025-08-31 05:07:20
13655,755257,7,45794897,76,Saziso Magawana (Durban City) Substitution at 62',Saziso Magawana Substitution,2,3720,62',22348,0,0,2025-08-30 16:51:47,0.0,0.0,0.0,0.0,0.0,0.0,408659.0,Bokang Mokwena,2025-08-31 05:07:20
13655,755257,8,45795007,76,Tshepo Mokoane (Sekhukhune United) Substitution at 71',Tshepo Mokoane Substitution,2,4260,71',20814,0,0,2025-08-30 17:00:59,0.0,0.0,0.0,0.0,0.0,0.0,392338.0,Tshepo Mokoane,2025-08-31 05:07:20
13655,755257,9,45795024,76,Miguel Timm (Sekhukhune United) Substitution at 71',Miguel Timm Substitution,2,4260,71',20814,0,0,2025-08-30 17:01:04,0.0,0.0,0.0,0.0,0.0,0.0,165135.0,Miguel Timm,2025-08-31 05:07:20
13655,755257,8,45795007,76,Tshepo Mokoane (Sekhukhune United) Substitution at 71',Tshepo Mokoane Substitution,2,4260,71',20814,0,0,2025-08-30 17:00:59,0.0,0.0,0.0,0.0,0.0,0.0,266118.0,Vusumuzi Mncube,2025-08-31 05:07:20
13655,755257,9,45795024,76,Miguel Timm (Sekhukhune United) Substitution at 71',Miguel Timm Substitution,2,4260,71',20814,0,0,2025-08-30 17:01:04,0.0,0.0,0.0,0.0,0.0,0.0,225486.0,Thabang Monare,2025-08-31 05:07:20
13655,755257,10,45795086,76,Taahir Goedeman (Durban City) Substitution at 75',Taahir Goedeman Substitution,2,4500,75',22348,0,0,2025-08-30 17:04:43,0.0,0.0,0.0,0.0,0.0,0.0,305612.0,Taahir Goedeman,2025-08-31 05:07:20
13655,755257,10,45795086,76,Taahir Goedeman (Durban City) Substitution at 75',Taahir Goedeman Substitution,2,4500,75',22348,0,0,2025-08-30 17:04:43,0.0,0.0,0.0,0.0,0.0,0.0,263331.0,Haashim Domingo,2025-08-31 05:07:20
13655,755257,11,45795476,76,Samkele Sihlali (Sekhukhune United) Substitution at 87',Samkele Sihlali Substitution,2,5220,87',20814,0,0,2025-08-30 17:16:19,0.0,0.0,0.0,0.0,0.0,0.0,397116.0,Samkele Sihlali,2025-08-31 05:07:20
13655,755257,12,45795495,76,Karabo Tlaka (Sekhukhune United) Substitution at 87',Karabo Tlaka Substitution,2,5220,87',20814,0,0,2025-08-30 17:16:20,0.0,0.0,0.0,0.0,0.0,0.0,403112.0,Karabo Tlaka,2025-08-31 05:07:20
13655,755257,11,45795476,76,Samkele Sihlali (Sekhukhune United) Substitution at 87',Samkele Sihlali Substitution,2,5220,87',20814,0,0,2025-08-30 17:16:19,0.0,0.0,0.0,0.0,0.0,0.0,256698.0,Matlala Keletso Makgalwa,2025-08-31 05:07:20
13655,755257,12,45795495,76,Karabo Tlaka (Sekhukhune United) Substitution at 87',Karabo Tlaka Substitution,2,5220,87',20814,0,0,2025-08-30 17:16:20,0.0,0.0,0.0,0.0,0.0,0.0,111946.0,Bradley Grobler,2025-08-31 05:07:20
13655,755257,13,45795537,94,Tsepo Matsimbi (Sekhukhune United) Yellow Card at 88',Tsepo Matsimbi Yellow Card,2,5280,88',20814,0,0,2025-08-30 17:17:41,0.0,0.0,0.0,0.0,0.0,0.0,309102.0,Tsepo Matsimbi,2025-08-31 05:07:20
13655,755258,1,45796380,70,Seluleko Mahlambi (TS Galaxy) Goal at 1',Seluleko Mahlambi Goal,1,60,1',19298,0,0,2025-08-30 18:02:33,0.0,0.0,0.0,0.0,0.0,0.0,403550.0,Seluleko Mahlambi,2025-08-31 05:07:20
13655,755258,2,45796757,94,Lentswe Motaung (TS Galaxy) Yellow Card at 15',Lentswe Motaung Yellow Card,1,900,15',19298,0,0,2025-08-30 18:16:27,0.0,0.0,0.0,0.0,0.0,0.0,390453.0,Lentswe Motaung,2025-08-31 05:07:20
13655,755258,3,45796820,174,Puso Dithejane (TS Galaxy) Penalty - Saved at 18',Puso Dithejane Penalty - Saved,1,1080,18',19298,0,0,1980-01-01 00:00:00,0.0,0.0,0.0,0.0,0.0,0.0,365549.0,Puso Dithejane,2025-08-31 05:07:20
13655,755258,4,45797086,94,Lucky Malatsi (Orbit College) Yellow Card at 27',Lucky Malatsi Yellow Card,1,1620,27',19000,0,0,2025-08-30 18:28:48,0.0,0.0,0.0,0.0,0.0,0.0,408570.0,Lucky Malatsi,2025-09-03 05:10:59
13655,755258,5,45797087,76,Qobolwakhe Sibande (TS Galaxy) Substitution at 28',Qobolwakhe Sibande Substitution,1,1680,28',19298,0,0,2025-08-30 18:29:27,0.0,0.0,0.0,0.0,0.0,0.0,347404.0,Qobolwakhe Sibande,2025-09-03 05:10:59
13655,755258,5,45797087,76,Qobolwakhe Sibande (TS Galaxy) Substitution at 28',Qobolwakhe Sibande Substitution,1,1680,28',19298,0,0,2025-08-30 18:29:27,0.0,0.0,0.0,0.0,0.0,0.0,313703.0,Solomon Letsoenyo,2025-09-03 05:10:59
13655,755258,6,45797340,94,Thulani Jingana (Orbit College) Yellow Card at 39',Thulani Jingana Yellow Card,1,2340,39',19000,0,0,2025-08-30 18:40:46,0.0,0.0,0.0,0.0,0.0,0.0,408440.0,Thulani Jingana,2025-08-31 05:07:20
13655,755258,7,45798114,76,Gomolemo Khoto (Orbit College) Substitution at 58',Gomolemo Khoto Substitution,2,3480,58',19000,0,0,2025-08-30 19:18:34,0.0,0.0,0.0,0.0,0.0,0.0,408432.0,Gomolemo Khoto,2025-09-03 05:10:59
13655,755258,7,45798114,76,Gomolemo Khoto (Orbit College) Substitution at 58',Gomolemo Khoto Substitution,2,3480,58',19000,0,0,2025-08-30 19:18:34,0.0,0.0,0.0,0.0,0.0,0.0,313692.0,Monnapule Saleng,2025-09-03 05:10:59
13655,755258,8,45798183,70,Sphesihle Maduna (TS Galaxy) Goal at 63',Sphesihle Maduna Goal,2,3780,63',19298,0,0,2025-08-30 19:24:14,0.0,0.0,0.0,0.0,0.0,0.0,270820.0,Sphesihle Maduna,2025-09-03 05:10:59
13655,755258,9,45798234,76,Lethabo Modimoeng (Orbit College) Substitution at 66',Lethabo Modimoeng Substitution,2,3960,66',19000,0,0,2025-08-30 19:27:28,0.0,0.0,0.0,0.0,0.0,0.0,408434.0,Lethabo Modimoeng,2025-09-03 05:10:59
13655,755258,9,45798234,76,Lethabo Modimoeng (Orbit College) Substitution at 66',Lethabo Modimoeng Substitution,2,3960,66',19000,0,0,2025-08-30 19:27:28,0.0,0.0,0.0,0.0,0.0,0.0,408570.0,Lucky Malatsi,2025-09-03 05:10:59
13655,755258,10,45798263,76,Ayanda Lukhele (Orbit College) Substitution at 67',Ayanda Lukhele Substitution,2,4020,67',19000,0,0,2025-08-30 19:27:41,0.0,0.0,0.0,0.0,0.0,0.0,408428.0,Ayanda Lukhele,2025-09-03 05:10:59
13655,755258,11,45798278,70,Mpho Mvelase (TS Galaxy) Goal at 67',Mpho Mvelase Goal,2,4020,67',19298,0,0,2025-08-30 19:28:02,0.0,0.0,0.0,0.0,0.0,0.0,207557.0,Mpho Mvelase,2025-08-31 05:07:20
13655,755258,10,45798263,76,Ayanda Lukhele (Orbit College) Substitution at 67',Ayanda Lukhele Substitution,2,4020,67',19000,0,0,2025-08-30 19:27:41,0.0,0.0,0.0,0.0,0.0,0.0,409728.0,Ikaneng Ramosala,2025-09-03 05:10:59
13655,755258,12,45798327,94,Kobamelo Setlhodi (Orbit College) Yellow Card at 71',Kobamelo Setlhodi Yellow Card,2,4260,71',19000,0,0,2025-08-30 19:31:41,0.0,0.0,0.0,0.0,0.0,0.0,408433.0,Kobamelo Setlhodi,2025-09-03 05:10:59
13655,755258,13,45798360,94,Qobolwakhe Sibande (TS Galaxy) Yellow Card at 73',Qobolwakhe Sibande Yellow Card,2,4380,73',19298,0,0,2025-08-30 19:33:34,0.0,0.0,0.0,0.0,0.0,0.0,347404.0,Qobolwakhe Sibande,2025-08-31 05:07:20
13655,755258,14,45798408,76,Katlego Mkhabela (Orbit College) Substitution at 74',Katlego Mkhabela Substitution,2,4440,74',19000,0,0,2025-08-30 19:35:19,0.0,0.0,0.0,0.0,0.0,0.0,346368.0,Katlego Mkhabela,2025-09-03 05:10:59
13655,755258,15,45798439,76,Cameron Chweu (Orbit College) Substitution at 74',Cameron Chweu Substitution,2,4440,74',19000,0,0,2025-08-30 19:35:19,0.0,0.0,0.0,0.0,0.0,0.0,409830.0,Cameron Chweu,2025-09-03 05:10:59
13655,755258,14,45798408,76,Katlego Mkhabela (Orbit College) Substitution at 74',Katlego Mkhabela Substitution,2,4440,74',19000,0,0,2025-08-30 19:35:19,0.0,0.0,0.0,0.0,0.0,0.0,408433.0,Kobamelo Setlhodi,2025-09-03 05:10:59
13655,755258,15,45798439,76,Cameron Chweu (Orbit College) Substitution at 74',Cameron Chweu Substitution,2,4440,74',19000,0,0,2025-08-30 19:35:19,0.0,0.0,0.0,0.0,0.0,0.0,261020.0,Tshepo Brian Matsemela,2025-09-03 05:10:59
13655,755258,16,45798409,76,Junior Zindoga (TS Galaxy) Substitution at 75',Junior Zindoga Substitution,2,4500,75',19298,0,0,2025-08-30 19:35:54,0.0,0.0,0.0,0.0,0.0,0.0,277076.0,Junior Zindoga,2025-09-03 05:10:59
13655,755258,16,45798409,76,Junior Zindoga (TS Galaxy) Substitution at 75',Junior Zindoga Substitution,2,4500,75',19298,0,0,2025-08-30 19:35:54,0.0,0.0,0.0,0.0,0.0,0.0,403550.0,Seluleko Mahlambi,2025-09-03 05:10:59
13655,755258,17,45798558,76,Onke Moletshe (TS Galaxy) Substitution at 81',Onke Moletshe Substitution,2,4860,81',19298,0,0,2025-08-30 19:41:51,0.0,0.0,0.0,0.0,0.0,0.0,408399.0,Onke Moletshe,2025-09-03 05:10:59
13655,755258,18,45798559,76,Ntandoyenkosi Nkosi (TS Galaxy) Substitution at 81',Ntandoyenkosi Nkosi Substitution,2,4860,81',19298,0,0,2025-08-30 19:42:00,0.0,0.0,0.0,0.0,0.0,0.0,354723.0,Ntandoyenkosi Nkosi,2025-09-03 05:10:59
13655,755258,17,45798558,76,Onke Moletshe (TS Galaxy) Substitution at 81',Onke Moletshe Substitution,2,4860,81',19298,0,0,2025-08-30 19:41:51,0.0,0.0,0.0,0.0,0.0,0.0,365549.0,Puso Dithejane,2025-09-03 05:10:59
13655,755258,18,45798559,76,Ntandoyenkosi Nkosi (TS Galaxy) Substitution at 81',Ntandoyenkosi Nkosi Substitution,2,4860,81',19298,0,0,2025-08-30 19:42:00,0.0,0.0,0.0,0.0,0.0,0.0,301579.0,Nhlanhla Mgaga,2025-09-03 05:10:59
13655,755258,19,45798635,70,Ayanda Lukhele (Orbit College) Goal at 85',Ayanda Lukhele Goal,2,5100,85',19000,0,0,2025-08-30 19:46:19,0.0,0.0,0.0,0.0,0.0,0.0,408428.0,Ayanda Lukhele,2025-08-31 05:07:20
13655,755258,20,45798668,93,Lentswe Motaung (TS Galaxy) Red Card at 88',Lentswe Motaung Red Card,2,5280,88',19298,0,0,2025-08-30 19:48:36,0.0,0.0,0.0,0.0,0.0,0.0,390453.0,Lentswe Motaung,2025-08-31 05:07:20
13655,755259,1,45807379,76,Puleng Dennis Tlolane (Polokwane City) Substitution at 45',Puleng Dennis Tlolane Substituti,2,2700,45',7099,0,0,2025-08-31 14:05:01,0.0,0.0,0.0,0.0,0.0,0.0,191528.0,Puleng Dennis Tlolane,2025-09-01 05:10:30
13655,755259,1,45807379,76,Puleng Dennis Tlolane (Polokwane City) Substitution at 45',Puleng Dennis Tlolane Substituti,2,2700,45',7099,0,0,2025-08-31 14:05:01,0.0,0.0,0.0,0.0,0.0,0.0,409543.0,Banele Mnguni,2025-09-01 05:10:30
13655,755259,2,45807402,70,Bheki Mabuza (Marumo Gallants) Goal at 48',Bheki Mabuza Goal,2,2880,48',13317,0,0,2025-08-31 14:07:31,0.0,0.0,0.0,0.0,0.0,0.0,408755.0,Bheki Mabuza,2025-09-01 05:10:30
13655,755259,3,45807531,76,Levy Mashiane (Polokwane City) Substitution at 59',Levy Mashiane Substitution,2,3540,59',7099,0,0,2025-08-31 14:18:28,0.0,0.0,0.0,0.0,0.0,0.0,313432.0,Levy Mashiane,2025-09-03 05:10:59
13655,755259,3,45807531,76,Levy Mashiane (Polokwane City) Substitution at 59',Levy Mashiane Substitution,2,3540,59',7099,0,0,2025-08-31 14:18:28,0.0,0.0,0.0,0.0,0.0,0.0,380605.0,Tshabalala Sibusiso,2025-09-03 05:10:59
13655,755259,4,45807540,76,Ndabayithethwa Ndlondlo (Marumo Gallants) Substitution at 60',Ndabayithethwa Ndlondlo Substitu,2,3600,60',13317,0,0,2025-08-31 14:20:03,0.0,0.0,0.0,0.0,0.0,0.0,309034.0,Ndabayithethwa Ndlondlo,2025-09-03 05:10:59
13655,755259,4,45807540,76,Ndabayithethwa Ndlondlo (Marumo Gallants) Substitution at 60',Ndabayithethwa Ndlondlo Substitu,2,3600,60',13317,0,0,2025-08-31 14:20:03,0.0,0.0,0.0,0.0,0.0,0.0,325169.0,Christopher Sekela,2025-09-03 05:10:59
13655,755259,5,45807575,70,Bonginkosi Dlamini (Polokwane City) Goal at 62',Bonginkosi Dlamini Goal,2,3720,62',7099,0,0,2025-08-31 14:21:58,0.0,0.0,0.0,0.0,0.0,0.0,271640.0,Bonginkosi Dlamini,2025-09-01 05:10:30
13655,755259,6,45807685,94,Teboho Motloung (Marumo Gallants) Yellow Card at 70',Teboho Motloung Yellow Card,2,4200,70',13317,0,0,2025-08-31 14:29:38,0.0,0.0,0.0,0.0,0.0,0.0,366537.0,Teboho Motloung,2025-09-03 05:10:59
13655,755259,7,45807710,94,Manuel Kambala (Polokwane City) Yellow Card at 71',Manuel Kambala Yellow Card,2,4260,71',7099,0,0,2025-08-31 14:30:28,0.0,0.0,0.0,0.0,0.0,0.0,255652.0,Manuel Kambala,2025-09-03 05:10:59
13655,755259,8,45807767,76,Mlungisi Khumalo (Marumo Gallants) Substitution at 77',Mlungisi Khumalo Substitution,2,4620,77',13317,0,0,2025-08-31 14:37:01,0.0,0.0,0.0,0.0,0.0,0.0,391760.0,Mlungisi Khumalo,2025-09-03 05:10:59
13655,755259,9,45807790,76,Jaisen Jaren Clifford (Marumo Gallants) Substitution at 77',Jaisen Jaren Clifford Substituti,2,4620,77',13317,0,0,2025-08-31 14:37:10,0.0,0.0,0.0,0.0,0.0,0.0,275313.0,Jaisen Jaren Clifford,2025-09-03 05:10:59
13655,755259,8,45807767,76,Mlungisi Khumalo (Marumo Gallants) Substitution at 77',Mlungisi Khumalo Substitution,2,4620,77',13317,0,0,2025-08-31 14:37:01,0.0,0.0,0.0,0.0,0.0,0.0,366537.0,Teboho Motloung,2025-09-03 05:10:59
13655,755259,9,45807790,76,Jaisen Jaren Clifford (Marumo Gallants) Substitution at 77',Jaisen Jaren Clifford Substituti,2,4620,77',13317,0,0,2025-08-31 14:37:10,0.0,0.0,0.0,0.0,0.0,0.0,283113.0,Monde Mpambaniso,2025-09-03 05:10:59
13655,755259,10,45807791,76,Tlou Nkwe (Polokwane City) Substitution at 79',Tlou Nkwe Substitution,2,4740,79',7099,0,0,2025-08-31 14:38:28,0.0,0.0,0.0,0.0,0.0,0.0,365605.0,Tlou Nkwe,2025-09-03 05:10:59
