seasonType,eventId,playOrder,playId,typeId,text,shortText,period,clockValue,clockDisplayValue,teamId,scoringPlay,shootout,wallclock,goalPositionX,goalPositionY,fieldpositionX,fieldPositionY,fieldPosition2X,fieldPosition2Y,athleteId,participant,updateDateTime
13495,742168,7,45665307,94,Daniel Devine (Inverness Caledonian Thistle) Yellow Card at 56',Daniel Devine Yellow Card,2,3360,56',253,0,0,2025-08-16 15:13:03,0.0,0.0,0.0,0.0,0.0,0.0,157563,Daniel Devine,2025-08-17 04:58:02
13495,742168,8,45665408,76,Alfie Bavidge (Inverness Caledonian Thistle) Substitution at 59',Alfie Bavidge Substitution,2,3540,59',253,0,0,2025-08-16 15:16:09,0.0,0.0,0.0,0.0,0.0,0.0,324735,Alfie Bavidge,2025-08-17 04:58:02
13495,742168,8,45665408,76,Alfie Bavidge (Inverness Caledonian Thistle) Substitution at 59',Alfie Bavidge Substitution,2,3540,59',253,0,0,2025-08-16 15:16:09,0.0,0.0,0.0,0.0,0.0,0.0,31873,Paul Allan,2025-08-17 04:58:02
13495,742168,9,45665495,94,Ewan O'Reilly (Stenhousemuir) Yellow Card at 61',Ewan O'Reilly Yellow Card,2,3660,61',405,0,0,2025-08-16 15:17:47,0.0,0.0,0.0,0.0,0.0,0.0,240728,Ewan O'Reilly,2025-08-17 04:58:02
13495,742168,10,45665969,76,Ross Taylor (Stenhousemuir) Substitution at 70',Ross Taylor Substitution,2,4200,70',405,0,0,2025-08-16 15:27:31,0.0,0.0,0.0,0.0,0.0,0.0,12821,Ross Taylor,2025-08-17 04:58:02
13495,742168,10,45665969,76,Ross Taylor (Stenhousemuir) Substitution at 70',Ross Taylor Substitution,2,4200,70',405,0,0,2025-08-16 15:27:31,0.0,0.0,0.0,0.0,0.0,0.0,212362,Matthew Aitken,2025-08-17 04:58:02
13495,742168,11,45666206,76,Liam Sole (Inverness Caledonian Thistle) Substitution at 75',Liam Sole Substitution,2,4500,75',253,0,0,2025-08-16 15:31:56,0.0,0.0,0.0,0.0,0.0,0.0,267334,Liam Sole,2025-08-17 04:58:02
13495,742168,12,45666289,76,Jordan Alonge (Inverness Caledonian Thistle) Substitution at 75',Jordan Alonge Substitution,2,4500,75',253,0,0,2025-08-16 15:32:13,0.0,0.0,0.0,0.0,0.0,0.0,392184,Jordan Alonge,2025-08-17 04:58:02
13495,742168,11,45666206,76,Liam Sole (Inverness Caledonian Thistle) Substitution at 75',Liam Sole Substitution,2,4500,75',253,0,0,2025-08-16 15:31:56,0.0,0.0,0.0,0.0,0.0,0.0,291645,Luis Longstaff,2025-08-17 04:58:02
13495,742168,12,45666289,76,Jordan Alonge (Inverness Caledonian Thistle) Substitution at 75',Jordan Alonge Substitution,2,4500,75',253,0,0,2025-08-16 15:32:13,0.0,0.0,0.0,0.0,0.0,0.0,137726,David Wotherspoon,2025-08-17 04:58:02
13495,742168,13,45666376,76,Chanka Zimba (Inverness Caledonian Thistle) Substitution at 79',Chanka Zimba Substitution,2,4740,79',253,0,0,2025-08-16 15:35:37,0.0,0.0,0.0,0.0,0.0,0.0,312007,Chanka Zimba,2025-08-17 04:58:02
13495,742168,13,45666376,76,Chanka Zimba (Inverness Caledonian Thistle) Substitution at 79',Chanka Zimba Substitution,2,4740,79',253,0,0,2025-08-16 15:35:37,0.0,0.0,0.0,0.0,0.0,0.0,138377,Billy McKay,2025-08-17 04:58:02
13495,742168,14,45666435,94,Scott McGill (Stenhousemuir) Yellow Card at 80',Scott McGill Yellow Card,2,4800,80',405,0,0,2025-08-16 15:36:51,0.0,0.0,0.0,0.0,0.0,0.0,290707,Scott McGill,2025-08-17 04:58:02
13495,742168,15,45666504,70,Ross Taylor (Stenhousemuir) Goal at 81',Ross Taylor Goal,2,4860,81',405,0,0,2025-08-16 15:37:42,0.0,0.0,0.0,0.0,0.0,0.0,12821,Ross Taylor,2025-08-17 04:58:02
13495,742168,16,45666671,76,Nicky Jamieson (Stenhousemuir) Substitution at 84',Nicky Jamieson Substitution,2,5040,84',405,0,0,2025-08-16 15:41:33,0.0,0.0,0.0,0.0,0.0,0.0,190512,Nicky Jamieson,2025-08-17 04:58:02
13495,742168,16,45666671,76,Nicky Jamieson (Stenhousemuir) Substitution at 84',Nicky Jamieson Substitution,2,5040,84',405,0,0,2025-08-16 15:41:33,0.0,0.0,0.0,0.0,0.0,0.0,176836,Dale Carrick,2025-08-17 04:58:02
13495,742170,1,45663281,76,Caleb Goldie (Peterhead) Substitution at 15',Caleb Goldie Substitution,1,900,15',416,0,0,2025-08-16 14:14:26,0.0,0.0,0.0,0.0,0.0,0.0,365994,Caleb Goldie,2025-08-17 04:58:02
13495,742170,1,45663281,76,Caleb Goldie (Peterhead) Substitution at 15',Caleb Goldie Substitution,1,900,15',416,0,0,2025-08-16 14:14:26,0.0,0.0,0.0,0.0,0.0,0.0,4903,Jason Brown,2025-08-17 04:58:02
13495,742170,2,45664069,70,Kurtis Guthrie (Queen of the South) Goal at 34',Kurtis Guthrie Goal,1,2040,34',406,0,0,2025-08-16 14:33:42,0.0,0.0,0.0,0.0,0.0,0.0,164474,Kurtis Guthrie,2025-08-17 04:58:02
13495,742170,3,45664189,94,Kai Kennedy (Queen of the South) Yellow Card at 37',Kai Kennedy Yellow Card,1,2220,37',406,0,0,2025-08-16 14:36:39,0.0,0.0,0.0,0.0,0.0,0.0,277529,Kai Kennedy,2025-08-17 04:58:02
13495,742170,4,45664493,94,Taylor Charters (Queen of the South) Yellow Card at 45',Taylor Charters Yellow Card,1,2700,45',406,0,0,2025-08-16 14:44:30,0.0,0.0,0.0,0.0,0.0,0.0,293873,Taylor Charters,2025-08-17 04:58:02
13495,742170,5,45665171,70,Benjamin Luissint (Queen of the South) Goal at 47',Benjamin Luissint Goal,2,2820,47',406,0,0,2025-08-16 15:10:26,0.0,0.0,0.0,0.0,0.0,0.0,292911,Benjamin Luissint,2025-08-17 04:58:02
13495,742170,6,45665344,70,Kai Kennedy (Queen of the South) Goal at 51',Kai Kennedy Goal,2,3060,51',406,0,0,2025-08-16 15:14:48,0.0,0.0,0.0,0.0,0.0,0.0,277529,Kai Kennedy,2025-08-17 04:58:02
13495,742170,7,45665450,94,Benjamin Luissint (Queen of the South) Yellow Card at 53',Benjamin Luissint Yellow Card,2,3180,53',406,0,0,2025-08-16 15:16:48,0.0,0.0,0.0,0.0,0.0,0.0,292911,Benjamin Luissint,2025-08-17 04:58:02
13495,742170,8,45665737,76,Oliver Colloty (Peterhead) Substitution at 57',Oliver Colloty Substitution,2,3420,57',416,0,0,2025-08-16 15:20:51,0.0,0.0,0.0,0.0,0.0,0.0,362626,Oliver Colloty,2025-08-17 04:58:02
13495,742170,9,45665738,76,Jack Brown (Peterhead) Substitution at 57',Jack Brown Substitution,2,3420,57',416,0,0,2025-08-16 15:20:52,0.0,0.0,0.0,0.0,0.0,0.0,255732,Jack Brown,2025-08-17 04:58:02
13495,742170,8,45665737,76,Oliver Colloty (Peterhead) Substitution at 57',Oliver Colloty Substitution,2,3420,57',416,0,0,2025-08-16 15:20:51,0.0,0.0,0.0,0.0,0.0,0.0,291446,Max Barry,2025-08-17 04:58:02
13495,742170,9,45665738,76,Jack Brown (Peterhead) Substitution at 57',Jack Brown Substitution,2,3420,57',416,0,0,2025-08-16 15:20:52,0.0,0.0,0.0,0.0,0.0,0.0,311111,Flynn Duffy,2025-08-17 04:58:02
13495,742170,10,45665739,76,Niall McGinn (Peterhead) Substitution at 58',Niall McGinn Substitution,2,3480,58',416,0,0,2025-08-16 15:20:53,0.0,0.0,0.0,0.0,0.0,0.0,82925,Niall McGinn,2025-08-17 04:58:02
13495,742170,11,45665740,76,Cameron Smith (Peterhead) Substitution at 58',Cameron Smith Substitution,2,3480,58',416,0,0,2025-08-16 15:20:54,0.0,0.0,0.0,0.0,0.0,0.0,173126,Cameron Smith,2025-08-17 04:58:02
13495,742170,10,45665739,76,Niall McGinn (Peterhead) Substitution at 58',Niall McGinn Substitution,2,3480,58',416,0,0,2025-08-16 15:20:53,0.0,0.0,0.0,0.0,0.0,0.0,239223,Sebastian Ross,2025-08-17 04:58:02
13495,742170,11,45665740,76,Cameron Smith (Peterhead) Substitution at 58',Cameron Smith Substitution,2,3480,58',416,0,0,2025-08-16 15:20:54,0.0,0.0,0.0,0.0,0.0,0.0,206454,Craig McGuffie,2025-08-17 04:58:02
13495,742170,12,45666761,70,Taylor Charters (Queen of the South) Goal at 72',Taylor Charters Goal,2,4320,72',406,0,0,2025-08-16 15:35:35,0.0,0.0,0.0,0.0,0.0,0.0,293873,Taylor Charters,2025-08-17 04:58:02
13495,742170,13,45666506,76,Ben Johnstone (Queen of the South) Substitution at 75',Ben Johnstone Substitution,2,4500,75',406,0,0,2025-08-16 15:38:13,0.0,0.0,0.0,0.0,0.0,0.0,260598,Ben Johnstone,2025-08-17 04:58:02
13495,742170,14,45666507,76,Michael Hewitt (Queen of the South) Substitution at 75',Michael Hewitt Substitution,2,4500,75',406,0,0,2025-08-16 15:38:14,0.0,0.0,0.0,0.0,0.0,0.0,271185,Michael Hewitt,2025-08-17 04:58:02
13495,742170,13,45666506,76,Ben Johnstone (Queen of the South) Substitution at 75',Ben Johnstone Substitution,2,4500,75',406,0,0,2025-08-16 15:38:13,0.0,0.0,0.0,0.0,0.0,0.0,277539,Reece Lyon,2025-08-17 04:58:02
13495,742170,14,45666507,76,Michael Hewitt (Queen of the South) Substitution at 75',Michael Hewitt Substitution,2,4500,75',406,0,0,2025-08-16 15:38:14,0.0,0.0,0.0,0.0,0.0,0.0,388665,Jack Hannah,2025-08-17 04:58:02
13495,742170,15,45666557,113,Kieran Shanks (Peterhead) Penalty - Missed at 76',Kieran Shanks Penalty - Missed,2,4560,76',416,0,0,1980-01-01 00:00:00,0.0,0.0,0.0,0.0,0.0,0.0,291447,Kieran Shanks,2025-08-17 04:58:02
13495,742170,16,45666666,94,Caleb Goldie (Peterhead) Yellow Card at 78',Caleb Goldie Yellow Card,2,4680,78',416,0,0,2025-08-16 15:41:05,0.0,0.0,0.0,0.0,0.0,0.0,365994,Caleb Goldie,2025-08-17 04:58:02
13495,742170,17,45666667,94,David Wilson (Peterhead) Yellow Card at 79',David Wilson Yellow Card,2,4740,79',416,0,0,2025-08-16 15:42:03,0.0,0.0,0.0,0.0,0.0,0.0,259587,David Wilson,2025-08-17 04:58:02
13495,742170,18,45666997,94,Andrew McCarthy (Peterhead) Yellow Card at 85',Andrew McCarthy Yellow Card,2,5100,85',416,0,0,2025-08-16 15:47:56,0.0,0.0,0.0,0.0,0.0,0.0,239269,Andrew McCarthy,2025-08-17 04:58:02
13495,742170,19,45667091,76,Euan Ross (Queen of the South) Substitution at 88',Euan Ross Substitution,2,5280,88',406,0,0,2025-08-16 15:51:09,0.0,0.0,0.0,0.0,0.0,0.0,379454,Euan Ross,2025-08-17 04:58:02
13495,742170,20,45667092,76,Freddie O'Donoghue (Queen of the South) Substitution at 88',Freddie O'Donoghue Substitution,2,5280,88',406,0,0,2025-08-16 15:51:10,0.0,0.0,0.0,0.0,0.0,0.0,390647,Freddie O'Donoghue,2025-08-17 04:58:02
13495,742170,19,45667091,76,Euan Ross (Queen of the South) Substitution at 88',Euan Ross Substitution,2,5280,88',406,0,0,2025-08-16 15:51:09,0.0,0.0,0.0,0.0,0.0,0.0,164474,Kurtis Guthrie,2025-08-17 04:58:02
13495,742170,20,45667092,76,Freddie O'Donoghue (Queen of the South) Substitution at 88',Freddie O'Donoghue Substitution,2,5280,88',406,0,0,2025-08-16 15:51:10,0.0,0.0,0.0,0.0,0.0,0.0,277529,Kai Kennedy,2025-08-17 04:58:02
13495,742171,1,45731801,70,David Devine (Alloa Athletic) Goal at 54',David Devine Goal,2,3240,54',403,0,0,2025-08-23 15:08:33,0.0,0.0,0.0,0.0,0.0,0.0,288582,David Devine,2025-08-24 04:57:23
13495,742171,2,45731863,76,Michael Stone (Hamilton Academical) Substitution at 55',Michael Stone Substitution,2,3300,55',409,0,0,2025-08-23 15:09:46,0.0,0.0,0.0,0.0,0.0,0.0,4474,Michael Stone,2025-08-24 04:57:23
13495,742171,2,45731863,76,Michael Stone (Hamilton Academical) Substitution at 55',Michael Stone Substitution,2,3300,55',409,0,0,2025-08-23 15:09:46,0.0,0.0,0.0,0.0,0.0,0.0,284083,Stuart Mckinstry,2025-08-24 04:57:23
13495,742171,3,45732401,76,Conor Sammon (Alloa Athletic) Substitution at 66',Conor Sammon Substitution,2,3960,66',403,0,0,2025-08-23 15:20:48,0.0,0.0,0.0,0.0,0.0,0.0,121832,Conor Sammon,2025-08-24 04:57:23
13495,742171,3,45732401,76,Conor Sammon (Alloa Athletic) Substitution at 66',Conor Sammon Substitution,2,3960,66',403,0,0,2025-08-23 15:20:48,0.0,0.0,0.0,0.0,0.0,0.0,347933,Luke Rankin,2025-08-24 04:57:23
13495,742171,4,45732782,94,Michael Stone (Hamilton Academical) Yellow Card at 75',Michael Stone Yellow Card,2,4500,75',409,0,0,2025-08-23 15:29:11,0.0,0.0,0.0,0.0,0.0,0.0,4474,Michael Stone,2025-08-24 04:57:23
13495,742171,5,45732827,76,Cameron O'Donnel (Alloa Athletic) Substitution at 75',Cameron O'Donnel Substitution,2,4500,75',403,0,0,2025-08-23 15:29:39,0.0,0.0,0.0,0.0,0.0,0.0,290169,Cameron O'Donnel,2025-08-24 04:57:23
13495,742171,6,45732868,76,Tony Gallacher (Hamilton Academical) Substitution at 75',Tony Gallacher Substitution,2,4500,75',409,0,0,2025-08-23 15:29:43,0.0,0.0,0.0,0.0,0.0,0.0,223057,Tony Gallacher,2025-08-24 04:57:23
13495,742171,7,45732945,76,Ewan Simpson (Hamilton Academical) Substitution at 75',Ewan Simpson Substitution,2,4500,75',409,0,0,2025-08-23 15:29:44,0.0,0.0,0.0,0.0,0.0,0.0,390678,Ewan Simpson,2025-08-24 04:57:23
13495,742171,5,45732827,76,Cameron O'Donnel (Alloa Athletic) Substitution at 75',Cameron O'Donnel Substitution,2,4500,75',403,0,0,2025-08-23 15:29:39,0.0,0.0,0.0,0.0,0.0,0.0,275634,Kurtis Roberts,2025-08-24 04:57:23
13495,742171,6,45732868,76,Tony Gallacher (Hamilton Academical) Substitution at 75',Tony Gallacher Substitution,2,4500,75',409,0,0,2025-08-23 15:29:43,0.0,0.0,0.0,0.0,0.0,0.0,157908,Stephen Hendrie,2025-08-24 04:57:23
13495,742171,7,45732945,76,Ewan Simpson (Hamilton Academical) Substitution at 75',Ewan Simpson Substitution,2,4500,75',409,0,0,2025-08-23 15:29:44,0.0,0.0,0.0,0.0,0.0,0.0,261410,Connot Smith,2025-08-24 04:57:23
13495,742171,8,45733245,76,David Mckay (Alloa Athletic) Substitution at 85',David Mckay Substitution,2,5100,85',403,0,0,2025-08-23 15:39:58,0.0,0.0,0.0,0.0,0.0,0.0,6857,David Mckay,2025-08-24 04:57:23
13495,742171,8,45733245,76,David Mckay (Alloa Athletic) Substitution at 85',David Mckay Substitution,2,5100,85',403,0,0,2025-08-23 15:39:58,0.0,0.0,0.0,0.0,0.0,0.0,288582,David Devine,2025-08-24 04:57:23
13495,742171,9,45733282,76,Luke Donnelly (Alloa Athletic) Substitution at 86',Luke Donnelly Substitution,2,5160,86',403,0,0,2025-08-23 15:40:03,0.0,0.0,0.0,0.0,0.0,0.0,213517,Luke Donnelly,2025-08-24 04:57:23
13495,742171,9,45733282,76,Luke Donnelly (Alloa Athletic) Substitution at 86',Luke Donnelly Substitution,2,5160,86',403,0,0,2025-08-23 15:40:03,0.0,0.0,0.0,0.0,0.0,0.0,153015,Stefan Scougall,2025-08-24 04:57:23
13495,742172,1,45731032,94,Ewan Mcleod (East Fife) Yellow Card at 38',Ewan Mcleod Yellow Card,1,2280,38',421,0,0,2025-08-23 14:38:02,0.0,0.0,0.0,0.0,0.0,0.0,370588,Ewan Mcleod,2025-08-24 04:57:23
13495,742172,2,45731053,70,Andrew Munro (East Fife) Goal at 40',Andrew Munro Goal,1,2400,40',421,0,0,2025-08-23 14:39:53,0.0,0.0,0.0,0.0,0.0,0.0,194882,Andrew Munro,2025-08-24 04:57:23
13495,742172,3,45731256,70,James Graham (Kelty Hearts) Goal at 45',James Graham Goal,1,2700,45',18018,0,0,2025-08-23 14:45:22,0.0,0.0,0.0,0.0,0.0,0.0,347341,James Graham,2025-08-24 04:57:23
13495,742172,4,45731796,70,Andrew Munro (East Fife) Goal at 52',Andrew Munro Goal,2,3120,52',421,0,0,2025-08-23 15:08:34,0.0,0.0,0.0,0.0,0.0,0.0,194882,Andrew Munro,2025-08-24 04:57:23
13495,742172,5,45732282,76,Scott Mercer (Kelty Hearts) Substitution at 62',Scott Mercer Substitution,2,3720,62',18018,0,0,2025-08-23 15:18:54,0.0,0.0,0.0,0.0,0.0,0.0,179655,Scott Mercer,2025-08-24 04:57:23
13495,742172,6,45732283,76,Joseph Teasdale (Kelty Hearts) Substitution at 62',Joseph Teasdale Substitution,2,3720,62',18018,0,0,2025-08-23 15:18:55,0.0,0.0,0.0,0.0,0.0,0.0,366765,Joseph Teasdale,2025-08-24 04:57:23
13495,742172,5,45732282,76,Scott Mercer (Kelty Hearts) Substitution at 62',Scott Mercer Substitution,2,3720,62',18018,0,0,2025-08-23 15:18:54,0.0,0.0,0.0,0.0,0.0,0.0,266967,Murray Thomas,2025-08-24 04:57:23
13495,742172,6,45732283,76,Joseph Teasdale (Kelty Hearts) Substitution at 62',Joseph Teasdale Substitution,2,3720,62',18018,0,0,2025-08-23 15:18:55,0.0,0.0,0.0,0.0,0.0,0.0,296138,Alexander Ferguson,2025-08-24 04:57:23
13495,742172,7,45732459,76,Tommy Goss (East Fife) Substitution at 65',Tommy Goss Substitution,2,3900,65',421,0,0,2025-08-23 15:21:50,0.0,0.0,0.0,0.0,0.0,0.0,306142,Tommy Goss,2025-08-24 04:57:23
13495,742172,7,45732459,76,Tommy Goss (East Fife) Substitution at 65',Tommy Goss Substitution,2,3900,65',421,0,0,2025-08-23 15:21:50,0.0,0.0,0.0,0.0,0.0,0.0,26883,Rob Jones,2025-08-24 04:57:23
13495,742172,8,45732574,76,Lewis Latona (East Fife) Substitution at 69',Lewis Latona Substitution,2,4140,69',421,0,0,2025-08-23 15:25:02,0.0,0.0,0.0,0.0,0.0,0.0,353387,Lewis Latona,2025-08-24 04:57:23
13495,742172,8,45732574,76,Lewis Latona (East Fife) Substitution at 69',Lewis Latona Substitution,2,4140,69',421,0,0,2025-08-23 15:25:02,0.0,0.0,0.0,0.0,0.0,0.0,158096,Kieran Millar,2025-08-24 04:57:23
13495,742172,9,45732917,76,Reis Peggie (East Fife) Substitution at 75',Reis Peggie Substitution,2,4500,75',421,0,0,2025-08-23 15:31:26,0.0,0.0,0.0,0.0,0.0,0.0,260603,Reis Peggie,2025-08-24 04:57:23
13495,742172,10,45732918,76,Jess Norey (East Fife) Substitution at 75',Jess Norey Substitution,2,4500,75',421,0,0,2025-08-23 15:31:27,0.0,0.0,0.0,0.0,0.0,0.0,365402,Jess Norey,2025-08-24 04:57:23
13495,742172,9,45732917,76,Reis Peggie (East Fife) Substitution at 75',Reis Peggie Substitution,2,4500,75',421,0,0,2025-08-23 15:31:26,0.0,0.0,0.0,0.0,0.0,0.0,299920,Liam Newton,2025-08-24 04:57:23
13495,742172,10,45732918,76,Jess Norey (East Fife) Substitution at 75',Jess Norey Substitution,2,4500,75',421,0,0,2025-08-23 15:31:27,0.0,0.0,0.0,0.0,0.0,0.0,370588,Ewan Mcleod,2025-08-24 04:57:23
13495,742172,11,45733693,93,Brian Easton (East Fife) Red Card at 95',Brian Easton Red Card,2,5400,90'+5',421,0,0,2025-08-23 15:51:17,0.0,0.0,0.0,0.0,0.0,0.0,84408,Brian Easton,2025-08-24 04:57:23
13495,742172,12,45733721,94,Michael McKenna (East Fife) Yellow Card at 95',Michael McKenna Yellow Card,2,5400,90'+5',421,0,0,2025-08-23 15:51:40,0.0,0.0,0.0,0.0,0.0,0.0,206336,Michael McKenna,2025-08-24 04:57:23
13495,742172,13,45733726,94,Innes Murray (Kelty Hearts) Yellow Card at 95',Innes Murray Yellow Card,2,5400,90'+5',18018,0,0,2025-08-23 15:51:40,0.0,0.0,0.0,0.0,0.0,0.0,239235,Innes Murray,2025-08-24 04:57:23
13495,742172,14,45733762,76,Lewis Carrol (Kelty Hearts) Substitution at 95',Lewis Carrol Substitution,2,5400,90'+5',18018,0,0,2025-08-23 15:51:50,0.0,0.0,0.0,0.0,0.0,0.0,366766,Lewis Carrol,2025-08-24 04:57:23
13495,742172,15,45733794,94,Tommy Goss (East Fife) Yellow Card at 97',Tommy Goss Yellow Card,2,5400,90'+7',421,0,0,2025-08-23 15:53:50,0.0,0.0,0.0,0.0,0.0,0.0,306142,Tommy Goss,2025-08-24 04:57:23
13495,742172,14,45733762,76,Lewis Carrol (Kelty Hearts) Substitution at 95',Lewis Carrol Substitution,2,5400,90'+5',18018,0,0,2025-08-23 15:51:50,0.0,0.0,0.0,0.0,0.0,0.0,347341,James Graham,2025-08-24 04:57:23
13495,742173,1,45730111,70,Alfie Bavidge (Inverness Caledonian Thistle) Goal at 4',Alfie Bavidge Goal,1,240,4',253,0,0,2025-08-23 14:04:24,0.0,0.0,0.0,0.0,0.0,0.0,324735,Alfie Bavidge,2025-08-24 04:57:23
13495,742173,2,45730905,70,Calum Macleod (Inverness Caledonian Thistle) Goal at 33',Calum Macleod Goal,1,1980,33',253,0,0,2025-08-23 14:32:51,0.0,0.0,0.0,0.0,0.0,0.0,355495,Calum Macleod,2025-08-24 04:57:23
13495,742173,3,45731576,76,Michael Tidser (Montrose) Substitution at 45',Michael Tidser Substitution,2,2700,45',414,0,0,2025-08-23 14:59:07,0.0,0.0,0.0,0.0,0.0,0.0,144362,Michael Tidser,2025-08-24 04:57:23
13495,742173,3,45731576,76,Michael Tidser (Montrose) Substitution at 45',Michael Tidser Substitution,2,2700,45',414,0,0,2025-08-23 14:59:07,0.0,0.0,0.0,0.0,0.0,0.0,388261,Ross Clark,2025-08-24 04:57:23
13495,742173,4,45732378,94,Ewan Loudon (Montrose) Yellow Card at 64',Ewan Loudon Yellow Card,2,3840,64',414,0,0,2025-08-23 15:20:19,0.0,0.0,0.0,0.0,0.0,0.0,324917,Ewan Loudon,2025-08-24 04:57:23
13495,742173,5,45732654,76,Liam Sole (Inverness Caledonian Thistle) Substitution at 69',Liam Sole Substitution,2,4140,69',253,0,0,2025-08-23 15:26:09,0.0,0.0,0.0,0.0,0.0,0.0,267334,Liam Sole,2025-08-24 04:57:23
13495,742173,5,45732654,76,Liam Sole (Inverness Caledonian Thistle) Substitution at 69',Liam Sole Substitution,2,4140,69',253,0,0,2025-08-23 15:26:09,0.0,0.0,0.0,0.0,0.0,0.0,291645,Luis Longstaff,2025-08-24 04:57:23
13495,742173,6,45733006,76,Robbie Thompson (Inverness Caledonian Thistle) Substitution at 75',Robbie Thompson Substitution,2,4500,75',253,0,0,2025-08-23 15:32:16,0.0,0.0,0.0,0.0,0.0,0.0,176966,Robbie Thompson,2025-08-24 04:57:23
13495,742173,6,45733006,76,Robbie Thompson (Inverness Caledonian Thistle) Substitution at 75',Robbie Thompson Substitution,2,4500,75',253,0,0,2025-08-23 15:32:16,0.0,0.0,0.0,0.0,0.0,0.0,138377,Billy McKay,2025-08-24 04:57:23
13495,742173,7,45733007,76,Chanka Zimba (Inverness Caledonian Thistle) Substitution at 76',Chanka Zimba Substitution,2,4560,76',253,0,0,2025-08-23 15:32:17,0.0,0.0,0.0,0.0,0.0,0.0,312007,Chanka Zimba,2025-08-24 04:57:23
13495,742173,8,45733037,76,Graham Webster (Montrose) Substitution at 76',Graham Webster Substitution,2,4560,76',414,0,0,2025-08-23 15:32:21,0.0,0.0,0.0,0.0,0.0,0.0,153164,Graham Webster,2025-08-24 04:57:23
13495,742173,9,45733038,76,Kyle Mcclenents (Montrose) Substitution at 76',Kyle Mcclenents Substitution,2,4560,76',414,0,0,2025-08-23 15:32:22,0.0,0.0,0.0,0.0,0.0,0.0,408760,Kyle Mcclenents,2025-08-24 04:57:23
13495,742173,10,45733039,76,Harry Craig (Montrose) Substitution at 76',Harry Craig Substitution,2,4560,76',414,0,0,2025-08-23 15:32:23,0.0,0.0,0.0,0.0,0.0,0.0,376256,Harry Craig,2025-08-24 04:57:23
13495,742173,7,45733007,76,Chanka Zimba (Inverness Caledonian Thistle) Substitution at 76',Chanka Zimba Substitution,2,4560,76',253,0,0,2025-08-23 15:32:17,0.0,0.0,0.0,0.0,0.0,0.0,324735,Alfie Bavidge,2025-08-24 04:57:23
13495,742173,8,45733037,76,Graham Webster (Montrose) Substitution at 76',Graham Webster Substitution,2,4560,76',414,0,0,2025-08-23 15:32:21,0.0,0.0,0.0,0.0,0.0,0.0,250578,Blair Lyons,2025-08-24 04:57:23
13495,742173,9,45733038,76,Kyle Mcclenents (Montrose) Substitution at 76',Kyle Mcclenents Substitution,2,4560,76',414,0,0,2025-08-23 15:32:22,0.0,0.0,0.0,0.0,0.0,0.0,287071,Matheus Machado,2025-08-24 04:57:23
13495,742173,10,45733039,76,Harry Craig (Montrose) Substitution at 76',Harry Craig Substitution,2,4560,76',414,0,0,2025-08-23 15:32:23,0.0,0.0,0.0,0.0,0.0,0.0,77584,Terry Masson,2025-08-24 04:57:23
13495,742173,11,45733278,76,Craig Brown (Montrose) Substitution at 84',Craig Brown Substitution,2,5040,84',414,0,0,2025-08-23 15:40:22,0.0,0.0,0.0,0.0,0.0,0.0,6213,Craig Brown,2025-08-24 04:57:23
13495,742173,11,45733278,76,Craig Brown (Montrose) Substitution at 84',Craig Brown Substitution,2,5040,84',414,0,0,2025-08-23 15:40:22,0.0,0.0,0.0,0.0,0.0,0.0,302082,Aidan Quinn,2025-08-24 04:57:23
13495,742173,12,45733495,76,Jordan Alonge (Inverness Caledonian Thistle) Substitution at 90',Jordan Alonge Substitution,2,5400,90',253,0,0,2025-08-23 15:46:18,0.0,0.0,0.0,0.0,0.0,0.0,392184,Jordan Alonge,2025-08-24 04:57:23
13495,742173,12,45733495,76,Jordan Alonge (Inverness Caledonian Thistle) Substitution at 90',Jordan Alonge Substitution,2,5400,90',253,0,0,2025-08-23 15:46:18,0.0,0.0,0.0,0.0,0.0,0.0,26027,Alfie Stewart,2025-08-24 04:57:23
13495,742174,1,45730375,70,Max Barry (Peterhead) Goal at 10',Max Barry Goal,1,600,10',416,0,0,2025-08-23 14:12:39,0.0,0.0,0.0,0.0,0.0,0.0,291446,Max Barry,2025-08-24 04:57:23
13495,742174,2,45730464,94,Michael Doyle (Cove Rangers) Yellow Card at 13',Michael Doyle Yellow Card,1,780,13',2613,0,0,2025-08-23 14:15:17,0.0,0.0,0.0,0.0,0.0,0.0,197106,Michael Doyle,2025-08-24 04:57:23
13495,742174,3,45730786,70,Kieran Shanks (Peterhead) Goal at 26',Kieran Shanks Goal,1,1560,26',416,0,0,2025-08-23 14:29:01,0.0,0.0,0.0,0.0,0.0,0.0,291447,Kieran Shanks,2025-08-24 04:57:23
13495,742174,4,45731991,94,Layton Bisland (Cove Rangers) Yellow Card at 52',Layton Bisland Yellow Card,2,3120,52',2613,0,0,2025-08-23 15:12:01,0.0,0.0,0.0,0.0,0.0,0.0,317304,Layton Bisland,2025-08-24 04:57:23
13495,742174,5,45732458,70,David Eguaibor (Cove Rangers) Goal at 62',David Eguaibor Goal,2,3720,62',2613,0,0,2025-08-23 15:22:21,0.0,0.0,0.0,0.0,0.0,0.0,406313,David Eguaibor,2025-08-24 04:57:23
13495,742174,6,45732576,76,Sebastian Ross (Peterhead) Substitution at 64',Sebastian Ross Substitution,2,3840,64',416,0,0,2025-08-23 15:24:20,0.0,0.0,0.0,0.0,0.0,0.0,239223,Sebastian Ross,2025-08-24 04:57:23
13495,742174,6,45732576,76,Sebastian Ross (Peterhead) Substitution at 64',Sebastian Ross Substitution,2,3840,64',416,0,0,2025-08-23 15:24:20,0.0,0.0,0.0,0.0,0.0,0.0,206454,Craig McGuffie,2025-08-24 04:57:23
13495,742174,7,45732748,94,Blair Yule (Cove Rangers) Yellow Card at 67',Blair Yule Yellow Card,2,4020,67',2613,0,0,2025-08-23 15:27:22,0.0,0.0,0.0,0.0,0.0,0.0,153146,Blair Yule,2025-08-24 04:57:23
13495,742174,8,45732951,93,Blair Yule (Cove Rangers) Red Card at 71',Blair Yule Red Card,2,4260,71',2613,0,0,2025-08-23 15:31:37,0.0,0.0,0.0,0.0,0.0,0.0,153146,Blair Yule,2025-08-24 04:57:23
13495,742174,9,45732952,94,Cameron Smith (Peterhead) Yellow Card at 72',Cameron Smith Yellow Card,2,4320,72',416,0,0,2025-08-23 15:32:10,0.0,0.0,0.0,0.0,0.0,0.0,173126,Cameron Smith,2025-08-24 04:57:23
13495,742174,10,45732953,94,Mitchel Megginson (Cove Rangers) Yellow Card at 72',Mitchel Megginson Yellow Card,2,4320,72',2613,0,0,2025-08-23 15:32:22,0.0,0.0,0.0,0.0,0.0,0.0,137801,Mitchel Megginson,2025-08-24 04:57:23
13495,742174,11,45733040,76,Jack Brown (Peterhead) Substitution at 74',Jack Brown Substitution,2,4440,74',416,0,0,2025-08-23 15:34:20,0.0,0.0,0.0,0.0,0.0,0.0,255732,Jack Brown,2025-08-24 04:57:23
13495,742174,11,45733040,76,Jack Brown (Peterhead) Substitution at 74',Jack Brown Substitution,2,4440,74',416,0,0,2025-08-23 15:34:20,0.0,0.0,0.0,0.0,0.0,0.0,173126,Cameron Smith,2025-08-24 04:57:23
13495,742174,12,45733223,70,Jack Brown (Peterhead) Goal at 79',Jack Brown Goal,2,4740,79',416,0,0,2025-08-23 15:39:06,0.0,0.0,0.0,0.0,0.0,0.0,255732,Jack Brown,2025-08-24 04:57:23
13495,742174,13,45733320,76,Niall McGinn (Peterhead) Substitution at 81',Niall McGinn Substitution,2,4860,81',416,0,0,2025-08-23 15:41:37,0.0,0.0,0.0,0.0,0.0,0.0,82925,Niall McGinn,2025-08-24 04:57:23
13495,742174,14,45733349,76,Oliver Colloty (Peterhead) Substitution at 81',Oliver Colloty Substitution,2,4860,81',416,0,0,2025-08-23 15:41:53,0.0,0.0,0.0,0.0,0.0,0.0,362626,Oliver Colloty,2025-08-24 04:57:23
13495,742174,13,45733320,76,Niall McGinn (Peterhead) Substitution at 81',Niall McGinn Substitution,2,4860,81',416,0,0,2025-08-23 15:41:37,0.0,0.0,0.0,0.0,0.0,0.0,291446,Max Barry,2025-08-24 04:57:23
13495,742174,14,45733349,76,Oliver Colloty (Peterhead) Substitution at 81',Oliver Colloty Substitution,2,4860,81',416,0,0,2025-08-23 15:41:53,0.0,0.0,0.0,0.0,0.0,0.0,291447,Kieran Shanks,2025-08-24 04:57:23
13495,742174,15,45733548,94,Dylan Forrest (Peterhead) Yellow Card at 86',Dylan Forrest Yellow Card,2,5160,86',416,0,0,2025-08-23 15:46:16,0.0,0.0,0.0,0.0,0.0,0.0,291656,Dylan Forrest,2025-08-24 04:57:23
13495,742175,1,45730717,94,Gregor Buchanan (Stenhousemuir) Yellow Card at 26',Gregor Buchanan Yellow Card,1,1560,26',405,0,0,2025-08-23 14:25:49,0.0,0.0,0.0,0.0,0.0,0.0,176462,Gregor Buchanan,2025-08-24 04:57:23
