seasonType,eventId,playOrder,playId,typeId,text,shortText,period,clockValue,clockDisplayValue,teamId,scoringPlay,shootout,wallclock,goalPositionX,goalPositionY,fieldpositionX,fieldPositionY,fieldPosition2X,fieldPosition2Y,athleteId,participant,updateDateTime
13369,735784,19,45367100,76,Oumar Pona (Mali U20) Substitution at 96',Oumar Pona Substitution,2,5400,90'+6',17763,0,0,1980-01-01,0.0,0.0,0.0,0.0,0.0,0.0,397409.0,Mayame Sissoko,2025-06-10 04:50:00
13369,735784,21,45367130,94,Oumar Pona (Mali U20) Yellow Card at 94',Oumar Pona Yellow Card,5,5640,94',17763,0,0,1980-01-01,0.0,0.0,0.0,0.0,0.0,0.0,378976.0,Oumar Pona,2025-06-10 04:50:00
13369,735785,1,45367287,70,Steve Ngoura (France U20) Goal at 16',Steve Ngoura Goal,1,960,16',12062,0,0,1980-01-01,0.0,0.0,0.0,0.0,0.0,0.0,346520.0,Steve Ngoura,2025-06-10 04:50:00
13369,735785,2,45367335,94,Raheen Cuello (Panama U20) Yellow Card at 30',Raheen Cuello Yellow Card,1,1800,30',5195,0,0,1980-01-01,0.0,0.0,0.0,0.0,0.0,0.0,399618.0,Raheen Cuello,2025-06-10 04:50:00
13369,735785,3,45367343,70,Gustavo Herrera (Panama U20) Goal at 34',Gustavo Herrera Goal,1,2040,34',5195,0,0,1980-01-01,0.0,0.0,0.0,0.0,0.0,0.0,141631.0,Gustavo Herrera,2025-06-10 04:50:00
13369,735785,4,45367349,70,Lucas Michel (France U20) Goal at 36',Lucas Michel Goal,1,2160,36',12062,0,0,1980-01-01,0.0,0.0,0.0,0.0,0.0,0.0,356651.0,Lucas Michel,2025-06-10 04:50:00
13369,735785,5,45367396,76,Yoni Gomis (France U20) Substitution at 45',Yoni Gomis Substitution,2,2700,45',12062,0,0,1980-01-01,0.0,0.0,0.0,0.0,0.0,0.0,345688.0,Yoni Gomis,2025-06-10 04:50:00
13369,735785,6,45367397,76,Mayssam Benama (France U20) Substitution at 45',Mayssam Benama Substitution,2,2700,45',12062,0,0,1980-01-01,0.0,0.0,0.0,0.0,0.0,0.0,362974.0,Mayssam Benama,2025-06-10 04:50:00
13369,735785,5,45367396,76,Yoni Gomis (France U20) Substitution at 45',Yoni Gomis Substitution,2,2700,45',12062,0,0,1980-01-01,0.0,0.0,0.0,0.0,0.0,0.0,364697.0,Steven Baseya,2025-06-10 04:50:00
13369,735785,6,45367397,76,Mayssam Benama (France U20) Substitution at 45',Mayssam Benama Substitution,2,2700,45',12062,0,0,1980-01-01,0.0,0.0,0.0,0.0,0.0,0.0,388558.0,Louis Leroux,2025-06-10 04:50:00
13369,735785,7,45367412,76,Aladji Bamba (France U20) Substitution at 60',Aladji Bamba Substitution,2,3600,60',12062,0,0,1980-01-01,0.0,0.0,0.0,0.0,0.0,0.0,396630.0,Aladji Bamba,2025-06-10 04:50:00
13369,735785,8,45367413,76,Saïmon Bouabré (France U20) Substitution at 60',Saïmon Bouabré Substitution,2,3600,60',12062,0,0,1980-01-01,0.0,0.0,0.0,0.0,0.0,0.0,371472.0,Saïmon Bouabré,2025-06-10 04:50:00
13369,735785,7,45367412,76,Aladji Bamba (France U20) Substitution at 60',Aladji Bamba Substitution,2,3600,60',12062,0,0,1980-01-01,0.0,0.0,0.0,0.0,0.0,0.0,356211.0,Emmanuel Biumla,2025-06-10 04:50:00
13369,735785,8,45367413,76,Saïmon Bouabré (France U20) Substitution at 60',Saïmon Bouabré Substitution,2,3600,60',12062,0,0,1980-01-01,0.0,0.0,0.0,0.0,0.0,0.0,356651.0,Lucas Michel,2025-06-10 04:50:00
13369,735785,9,45367418,76,Oldemar Castillo (Panama U20) Substitution at 71',Oldemar Castillo Substitution,2,4260,71',5195,0,0,1980-01-01,0.0,0.0,0.0,0.0,0.0,0.0,372112.0,Oldemar Castillo,2025-06-10 04:50:00
13369,735785,10,45367419,76,Kevin Bernal (Panama U20) Substitution at 71',Kevin Bernal Substitution,2,4260,71',5195,0,0,1980-01-01,0.0,0.0,0.0,0.0,0.0,0.0,404782.0,Kevin Bernal,2025-06-10 04:50:00
13369,735785,9,45367418,76,Oldemar Castillo (Panama U20) Substitution at 71',Oldemar Castillo Substitution,2,4260,71',5195,0,0,1980-01-01,0.0,0.0,0.0,0.0,0.0,0.0,399618.0,Raheen Cuello,2025-06-10 04:50:00
13369,735785,10,45367419,76,Kevin Bernal (Panama U20) Substitution at 71',Kevin Bernal Substitution,2,4260,71',5195,0,0,1980-01-01,0.0,0.0,0.0,0.0,0.0,0.0,362943.0,Giovani Herbert,2025-06-10 04:50:00
13369,735785,11,45367427,76,Tidiam Gomis (France U20) Substitution at 74',Tidiam Gomis Substitution,2,4440,74',12062,0,0,1980-01-01,0.0,0.0,0.0,0.0,0.0,0.0,366911.0,Tidiam Gomis,2025-06-10 04:50:00
13369,735785,11,45367427,76,Tidiam Gomis (France U20) Substitution at 74',Tidiam Gomis Substitution,2,4440,74',12062,0,0,1980-01-01,0.0,0.0,0.0,0.0,0.0,0.0,388522.0,Ibrahim Mbaye,2025-06-10 04:50:00
13369,735785,12,45367448,76,Carlos Hernández (Panama U20) Substitution at 82',Carlos Hernández Substitution,2,4920,82',5195,0,0,1980-01-01,0.0,0.0,0.0,0.0,0.0,0.0,401003.0,Carlos Hernández,2025-06-10 04:50:00
13369,735785,13,45367449,76,Karlo Kurányi (Panama U20) Substitution at 82',Karlo Kurányi Substitution,2,4920,82',5195,0,0,1980-01-01,0.0,0.0,0.0,0.0,0.0,0.0,388906.0,Karlo Kurányi,2025-06-10 04:50:00
13369,735785,12,45367448,76,Carlos Hernández (Panama U20) Substitution at 82',Carlos Hernández Substitution,2,4920,82',5195,0,0,1980-01-01,0.0,0.0,0.0,0.0,0.0,0.0,400210.0,Didier Dawson,2025-06-10 04:50:00
13369,735785,13,45367449,76,Karlo Kurányi (Panama U20) Substitution at 82',Karlo Kurányi Substitution,2,4920,82',5195,0,0,1980-01-01,0.0,0.0,0.0,0.0,0.0,0.0,372103.0,Anel Ryce,2025-06-10 04:50:00
13369,735785,14,45367460,76,Daivis Murillo (Panama U20) Substitution at 86',Daivis Murillo Substitution,2,5160,86',5195,0,0,1980-01-01,0.0,0.0,0.0,0.0,0.0,0.0,404779.0,Daivis Murillo,2025-06-10 04:50:00
13369,735785,14,45367460,76,Daivis Murillo (Panama U20) Substitution at 86',Daivis Murillo Substitution,2,5160,86',5195,0,0,1980-01-01,0.0,0.0,0.0,0.0,0.0,0.0,404776.0,Abdul Morales,2025-06-10 04:50:00
13369,735786,1,45369204,70,Chido Obi (Denmark U20) Goal at 5',Chido Obi Goal,1,300,5',130879,0,0,1980-01-01,0.0,0.0,0.0,0.0,0.0,0.0,375738.0,Chido Obi,2025-06-11 04:58:12
13369,735786,2,45369224,94,Nelson Ishiwatari (Japan U20) Yellow Card at 38',Nelson Ishiwatari Yellow Card,1,2280,38',5171,0,0,1980-01-01,0.0,0.0,0.0,0.0,0.0,0.0,336494.0,Nelson Ishiwatari,2025-06-11 04:58:12
13369,735786,3,45369229,94,William Clem (Denmark U20) Yellow Card at 42',William Clem Yellow Card,1,2520,42',130879,0,0,1980-01-01,0.0,0.0,0.0,0.0,0.0,0.0,332428.0,William Clem,2025-06-11 04:58:12
13369,735786,4,45369234,76,Yumeki Yokoyama (Japan U20) Substitution at 45',Yumeki Yokoyama Substitution,2,2700,45',5171,0,0,1980-01-01,0.0,0.0,0.0,0.0,0.0,0.0,404834.0,Yumeki Yokoyama,2025-06-11 04:58:12
13369,735786,5,45369235,76,Sora Hiraga (Japan U20) Substitution at 45',Sora Hiraga Substitution,2,2700,45',5171,0,0,1980-01-01,0.0,0.0,0.0,0.0,0.0,0.0,336497.0,Sora Hiraga,2025-06-11 04:58:12
13369,735786,4,45369234,76,Yumeki Yokoyama (Japan U20) Substitution at 45',Yumeki Yokoyama Substitution,2,2700,45',5171,0,0,1980-01-01,0.0,0.0,0.0,0.0,0.0,0.0,336494.0,Nelson Ishiwatari,2025-06-11 04:58:12
13369,735786,5,45369235,76,Sora Hiraga (Japan U20) Substitution at 45',Sora Hiraga Substitution,2,2700,45',5171,0,0,1980-01-01,0.0,0.0,0.0,0.0,0.0,0.0,398419.0,Motoki Nishihara,2025-06-11 04:58:12
13369,735786,6,45369236,76,Lauge Sandgrav (Denmark U20) Substitution at 63',Lauge Sandgrav Substitution,2,3780,63',130879,0,0,1980-01-01,0.0,0.0,0.0,0.0,0.0,0.0,312022.0,Lauge Sandgrav,2025-06-11 04:58:12
13369,735786,7,45369237,76,Emil Schlichting (Denmark U20) Substitution at 63',Emil Schlichting Substitution,2,3780,63',130879,0,0,1980-01-01,0.0,0.0,0.0,0.0,0.0,0.0,366229.0,Emil Schlichting,2025-06-11 04:58:12
13369,735786,6,45369236,76,Lauge Sandgrav (Denmark U20) Substitution at 63',Lauge Sandgrav Substitution,2,3780,63',130879,0,0,1980-01-01,0.0,0.0,0.0,0.0,0.0,0.0,351245.0,Jakob Nielsen,2025-06-11 04:58:12
13369,735786,7,45369237,76,Emil Schlichting (Denmark U20) Substitution at 63',Emil Schlichting Substitution,2,3780,63',130879,0,0,1980-01-01,0.0,0.0,0.0,0.0,0.0,0.0,375738.0,Chido Obi,2025-06-11 04:58:12
13369,735786,8,45369238,76,Niko Takahashi (Japan U20) Substitution at 70',Niko Takahashi Substitution,2,4200,70',5171,0,0,1980-01-01,0.0,0.0,0.0,0.0,0.0,0.0,341714.0,Niko Takahashi,2025-06-11 04:58:12
13369,735786,8,45369238,76,Niko Takahashi (Japan U20) Substitution at 70',Niko Takahashi Substitution,2,4200,70',5171,0,0,1980-01-01,0.0,0.0,0.0,0.0,0.0,0.0,386929.0,Mihiro Sato,2025-06-11 04:58:12
13369,735786,9,45369239,76,Sabil Hansen (Denmark U20) Substitution at 73',Sabil Hansen Substitution,2,4380,73',130879,0,0,1980-01-01,0.0,0.0,0.0,0.0,0.0,0.0,360259.0,Sabil Hansen,2025-06-11 04:58:12
13369,735786,10,45369240,76,Alexander Simmelhack (Denmark U20) Substitution at 73',Alexander Simmelhack Substitutio,2,4380,73',130879,0,0,1980-01-01,0.0,0.0,0.0,0.0,0.0,0.0,336483.0,Alexander Simmelhack,2025-06-11 04:58:12
13369,735786,9,45369239,76,Sabil Hansen (Denmark U20) Substitution at 73',Sabil Hansen Substitution,2,4380,73',130879,0,0,1980-01-01,0.0,0.0,0.0,0.0,0.0,0.0,343957.0,Pontus Andy Texel,2025-06-11 04:58:12
13369,735786,10,45369240,76,Alexander Simmelhack (Denmark U20) Substitution at 73',Alexander Simmelhack Substitutio,2,4380,73',130879,0,0,1980-01-01,0.0,0.0,0.0,0.0,0.0,0.0,364126.0,Alexander Lyng,2025-06-11 04:58:12
13369,735786,11,45369241,97,Keisuke Nakamura (Japan U20) Own Goal at 78',Keisuke Nakamura Own Goal,2,4680,78',130879,0,0,1980-01-01,0.0,0.0,0.0,0.0,0.0,0.0,,Keisuke Nakamura,2025-06-11 04:58:12
13369,735786,12,45369242,76,Aren Inoue (Japan U20) Substitution at 79',Aren Inoue Substitution,2,4740,79',5171,0,0,1980-01-01,0.0,0.0,0.0,0.0,0.0,0.0,376451.0,Aren Inoue,2025-06-11 04:58:12
13369,735786,13,45369243,76,Rento Takaoka (Japan U20) Substitution at 79',Rento Takaoka Substitution,2,4740,79',5171,0,0,1980-01-01,0.0,0.0,0.0,0.0,0.0,0.0,371598.0,Rento Takaoka,2025-06-11 04:58:12
13369,735786,12,45369242,76,Aren Inoue (Japan U20) Substitution at 79',Aren Inoue Substitution,2,4740,79',5171,0,0,1980-01-01,0.0,0.0,0.0,0.0,0.0,0.0,359859.0,Hisatsugu Ishii,2025-06-11 04:58:12
13369,735786,13,45369243,76,Rento Takaoka (Japan U20) Substitution at 79',Rento Takaoka Substitution,2,4740,79',5171,0,0,1980-01-01,0.0,0.0,0.0,0.0,0.0,0.0,379758.0,Soma Kanda,2025-06-11 04:58:12
13369,735786,14,45369244,76,Mads Enggård (Denmark U20) Substitution at 83',Mads Enggård Substitution,2,4980,83',130879,0,0,1980-01-01,0.0,0.0,0.0,0.0,0.0,0.0,315621.0,Mads Enggård,2025-06-11 04:58:12
13369,735786,14,45369244,76,Mads Enggård (Denmark U20) Substitution at 83',Mads Enggård Substitution,2,4980,83',130879,0,0,1980-01-01,0.0,0.0,0.0,0.0,0.0,0.0,332428.0,William Clem,2025-06-11 04:58:12
13369,735786,15,45369246,70,Alexander Simmelhack (Denmark U20) Goal at 85',Alexander Simmelhack Goal,2,5100,85',130879,0,0,1980-01-01,0.0,0.0,0.0,0.0,0.0,0.0,336483.0,Alexander Simmelhack,2025-06-11 04:58:12
13369,735787,1,45369283,70,Oswaldo Virgen (Mexico U20) Goal at 21',Oswaldo Virgen Goal,1,1260,21',5172,0,0,1980-01-01,0.0,0.0,0.0,0.0,0.0,0.0,398704.0,Oswaldo Virgen,2025-06-11 04:58:12
13369,735787,2,45369284,174,Jonathan Padilla (Mexico U20) Penalty - Saved at 21',Jonathan Padilla Penalty - Saved,1,1260,21',5172,0,0,1980-01-01,0.0,0.0,0.0,0.0,0.0,0.0,361264.0,Jonathan Padilla,2025-06-11 04:58:12
13369,735787,3,45369285,70,Breyton Fougeu (Congo U20) Goal at 25',Breyton Fougeu Goal,1,1500,25',7785,0,0,1980-01-01,0.0,0.0,0.0,0.0,0.0,0.0,380025.0,Breyton Fougeu,2025-06-11 04:58:12
13369,735787,4,45369287,70,Tahiel Jiménez (Mexico U20) Goal at 30',Tahiel Jiménez Goal,1,1800,30',5172,0,0,1980-01-01,0.0,0.0,0.0,0.0,0.0,0.0,376557.0,Tahiel Jiménez,2025-06-11 04:58:12
13369,735787,5,45369353,76,Jason Bemba (Congo U20) Substitution at 45',Jason Bemba Substitution,2,2700,45',7785,0,0,1980-01-01,0.0,0.0,0.0,0.0,0.0,0.0,404833.0,Jason Bemba,2025-06-11 04:58:12
13369,735787,6,45369360,76,Heriberto De Jesus (Mexico U20) Substitution at 45',Heriberto De Jesus Substitution,2,2700,45',5172,0,0,1980-01-01,0.0,0.0,0.0,0.0,0.0,0.0,329916.0,Heriberto De Jesus,2025-06-11 04:58:12
13369,735787,7,45369361,76,Omar Moreno (Mexico U20) Substitution at 45',Omar Moreno Substitution,2,2700,45',5172,0,0,1980-01-01,0.0,0.0,0.0,0.0,0.0,0.0,357211.0,Omar Moreno,2025-06-11 04:58:12
13369,735787,5,45369353,76,Jason Bemba (Congo U20) Substitution at 45',Jason Bemba Substitution,2,2700,45',7785,0,0,1980-01-01,0.0,0.0,0.0,0.0,0.0,0.0,404840.0,Abdallah Mbemba,2025-06-11 04:58:12
13369,735787,6,45369360,76,Heriberto De Jesus (Mexico U20) Substitution at 45',Heriberto De Jesus Substitution,2,2700,45',5172,0,0,1980-01-01,0.0,0.0,0.0,0.0,0.0,0.0,361264.0,Jonathan Padilla,2025-06-11 04:58:12
13369,735787,7,45369361,76,Omar Moreno (Mexico U20) Substitution at 45',Omar Moreno Substitution,2,2700,45',5172,0,0,1980-01-01,0.0,0.0,0.0,0.0,0.0,0.0,365830.0,Amaury Morales,2025-06-11 04:58:12
13369,735787,8,45369416,70,Omar Moreno (Mexico U20) Goal at 61',Omar Moreno Goal,2,3660,61',5172,0,0,1980-01-01,0.0,0.0,0.0,0.0,0.0,0.0,357211.0,Omar Moreno,2025-06-11 04:58:12
13369,735787,9,45369421,76,Stephano Carrillo (Mexico U20) Substitution at 62',Stephano Carrillo Substitution,2,3720,62',5172,0,0,1980-01-01,0.0,0.0,0.0,0.0,0.0,0.0,371478.0,Stephano Carrillo,2025-06-11 04:58:12
13369,735787,9,45369421,76,Stephano Carrillo (Mexico U20) Substitution at 62',Stephano Carrillo Substitution,2,3720,62',5172,0,0,1980-01-01,0.0,0.0,0.0,0.0,0.0,0.0,398704.0,Oswaldo Virgen,2025-06-11 04:58:12
13369,735787,10,45369422,94,Angel Chávez (Mexico U20) Yellow Card at 66',Angel Chávez Yellow Card,2,3960,66',5172,0,0,1980-01-01,0.0,0.0,0.0,0.0,0.0,0.0,361206.0,Angel Chavez,2025-06-11 04:58:12
13369,735787,11,45369423,76,Ángel Rico (Mexico U20) Substitution at 66',Ángel Rico Substitution,2,3960,66',5172,0,0,1980-01-01,0.0,0.0,0.0,0.0,0.0,0.0,386920.0,Ángel Rico,2025-06-11 04:58:12
13369,735787,12,45369424,76,Juan Uribe (Mexico U20) Substitution at 66',Juan Uribe Substitution,2,3960,66',5172,0,0,1980-01-01,0.0,0.0,0.0,0.0,0.0,0.0,178850.0,Juan Uribe,2025-06-11 04:58:12
13369,735787,11,45369423,76,Ángel Rico (Mexico U20) Substitution at 66',Ángel Rico Substitution,2,3960,66',5172,0,0,1980-01-01,0.0,0.0,0.0,0.0,0.0,0.0,375061.0,Cesar Garza,2025-06-11 04:58:12
13369,735787,12,45369424,76,Juan Uribe (Mexico U20) Substitution at 66',Juan Uribe Substitution,2,3960,66',5172,0,0,1980-01-01,0.0,0.0,0.0,0.0,0.0,0.0,380171.0,Diego Sánchez,2025-06-11 04:58:12
13369,735787,13,45369430,94,Kimi Gandziri (Congo U20) Yellow Card at 69',Kimi Gandziri Yellow Card,2,4140,69',7785,0,0,1980-01-01,0.0,0.0,0.0,0.0,0.0,0.0,404844.0,Kimi Gandziri,2025-06-11 04:58:12
13369,735787,14,45369434,76,Steevy Mazikou (Congo U20) Substitution at 71',Steevy Mazikou Substitution,2,4260,71',7785,0,0,1980-01-01,0.0,0.0,0.0,0.0,0.0,0.0,379059.0,Steevy Mazikou,2025-06-11 04:58:12
13369,735787,14,45369434,76,Steevy Mazikou (Congo U20) Substitution at 71',Steevy Mazikou Substitution,2,4260,71',7785,0,0,1980-01-01,0.0,0.0,0.0,0.0,0.0,0.0,404831.0,Aaron Maniongui,2025-06-11 04:58:12
13369,735787,15,45369455,76,Keviriel Massoumou (Congo U20) Substitution at 72',Keviriel Massoumou Substitution,2,4320,72',7785,0,0,1980-01-01,0.0,0.0,0.0,0.0,0.0,0.0,404837.0,Keviriel Massoumou,2025-06-11 04:58:12
13369,735787,15,45369455,76,Keviriel Massoumou (Congo U20) Substitution at 72',Keviriel Massoumou Substitution,2,4320,72',7785,0,0,1980-01-01,0.0,0.0,0.0,0.0,0.0,0.0,404839.0,Alan Bikoumou,2025-06-11 04:58:12
13369,735787,16,45369464,94,Brad-Hamilton Mantsounga (Congo U20) Yellow Card at 75',Brad-Hamilton Mantsounga Yellow ,2,4500,75',7785,0,0,1980-01-01,0.0,0.0,0.0,0.0,0.0,0.0,404832.0,Brad-Hamilton Mantsounga,2025-06-11 04:58:12
13369,735787,17,45369524,76,Jean Nyindong Tsamouna (Congo U20) Substitution at 82',Jean Nyindong Tsamouna Substitut,2,4920,82',7785,0,0,1980-01-01,0.0,0.0,0.0,0.0,0.0,0.0,404843.0,Jean Nyindong Tsamouna,2025-06-11 04:58:12
13369,735787,17,45369524,76,Jean Nyindong Tsamouna (Congo U20) Substitution at 82',Jean Nyindong Tsamouna Substitut,2,4920,82',7785,0,0,1980-01-01,0.0,0.0,0.0,0.0,0.0,0.0,380025.0,Breyton Fougeu,2025-06-11 04:58:12
13369,735787,18,45369568,76,Destin Banzouzi (Congo U20) Substitution at 86',Destin Banzouzi Substitution,2,5160,86',7785,0,0,1980-01-01,0.0,0.0,0.0,0.0,0.0,0.0,404842.0,Destin Banzouzi,2025-06-11 04:58:12
13369,735787,18,45369568,76,Destin Banzouzi (Congo U20) Substitution at 86',Destin Banzouzi Substitution,2,5160,86',7785,0,0,1980-01-01,0.0,0.0,0.0,0.0,0.0,0.0,404847.0,Noah Le Bret,2025-06-11 04:58:12
13369,735787,19,45369596,93,Angel Chávez (Mexico U20) Red Card at 88',Angel Chávez Red Card,2,5280,88',5172,0,0,1980-01-01,0.0,0.0,0.0,0.0,0.0,0.0,361206.0,Angel Chavez,2025-06-11 04:58:12
13369,735787,20,45369597,98,Jean Nyindong Tsamouna (Congo U20) Penalty - Scored at 89',Jean Nyindong Tsamouna Penalty -,2,5340,89',7785,0,0,1980-01-01,0.0,0.0,0.0,0.0,0.0,0.0,404843.0,Jean Nyindong Tsamouna,2025-06-11 04:58:12
13369,735787,21,45369653,93,Stephano Carrillo (Mexico U20) Red Card at 94',Stephano Carrillo Red Card,2,5400,90'+4',5172,0,0,1980-01-01,0.0,0.0,0.0,0.0,0.0,0.0,371478.0,Stephano Carrillo,2025-06-11 04:58:12
13369,735787,22,45369687,70,Jason Bemba (Congo U20) Goal at 97',Jason Bemba Goal,2,5400,90'+7',7785,0,0,1980-01-01,0.0,0.0,0.0,0.0,0.0,0.0,404833.0,Jason Bemba,2025-06-11 04:58:12
13369,735787,23,45369707,93,Jason Bemba (Congo U20) Red Card at 98',Jason Bemba Red Card,2,5400,90'+8',7785,0,0,1980-01-01,0.0,0.0,0.0,0.0,0.0,0.0,404833.0,Jason Bemba,2025-06-11 04:58:12
13369,735787,24,45369708,94,Jason Bemba (Congo U20) Yellow Card at 98',Jason Bemba Yellow Card,2,5400,90'+8',7785,0,0,1980-01-01,0.0,0.0,0.0,0.0,0.0,0.0,404833.0,Jason Bemba,2025-06-11 04:58:12
13451,738500,1,45385601,70,Abdulmalik Al Jaber (Saudi Arabia U23) Goal at 3',Abdulmalik Al Jaber Goal,1,180,3',20950,0,0,1980-01-01,0.0,0.0,-0.02,-0.01,0.0,0.0,341471.0,Abdulmalik Al Jaber,2025-06-15 05:11:08
13451,738500,2,45385603,70,Abdullah Radif (Saudi Arabia U23) Goal at 11',Abdullah Radif Goal,1,660,11',20950,0,0,1980-01-01,0.0,0.0,-0.02,-0.01,0.0,0.0,313423.0,Abdullah Radif,2025-06-15 05:11:08
13451,738500,3,45385604,70,Gustav Christensen (Denmark U20) Goal at 20',Gustav Christensen Goal,1,1200,20',130879,0,0,1980-01-01,0.0,0.0,-0.02,-0.01,0.0,0.0,353064.0,Gustav Christensen,2025-06-15 05:11:08
13451,738500,4,45385607,94,Abdulmalik Al Jaber (Saudi Arabia U23) Yellow Card at 33',Abdulmalik Al Jaber Yellow Card,1,1980,33',20950,0,0,1980-01-01,0.0,0.0,-0.02,-0.01,0.0,0.0,341471.0,Abdulmalik Al Jaber,2025-06-15 05:11:08
13451,738500,5,45385608,76,Majed Abdullah (Saudi Arabia U23) Substitution at 34',Majed Abdullah Substitution,1,2040,34',20950,0,0,1980-01-01,0.0,0.0,-0.02,-0.01,0.0,0.0,388400.0,Majed Abdullah,2025-06-15 05:11:08
13451,738500,5,45385608,76,Majed Abdullah (Saudi Arabia U23) Substitution at 34',Majed Abdullah Substitution,1,2040,34',20950,0,0,1980-01-01,0.0,0.0,-0.02,-0.01,0.0,0.0,389695.0,Abdulaziz Al Othman,2025-06-15 05:11:08
13451,738500,6,45385610,70,Meshal Alaeli (Saudi Arabia U23) Goal at 45',Meshal Alaeli Goal,1,2700,45',20950,0,0,1980-01-01,0.0,0.0,-0.02,-0.01,0.0,0.0,362869.0,Meshal Alaeli,2025-06-15 05:11:08
13451,738500,7,45385618,76,Abbas Al Hassan (Saudi Arabia U23) Substitution at 45',Abbas Al Hassan Substitution,2,2700,45',20950,0,0,1980-01-01,0.0,0.0,-0.02,-0.01,0.0,0.0,367653.0,Abbas Al Hassan,2025-06-15 05:11:08
13451,738500,8,45385619,76,Sabil Hansen (Denmark U20) Substitution at 45',Sabil Hansen Substitution,2,2700,45',130879,0,0,1980-01-01,0.0,0.0,-0.02,-0.01,0.0,0.0,360259.0,Sabil Hansen,2025-06-15 05:11:08
13451,738500,9,45385620,76,Alexander Lyng (Denmark U20) Substitution at 45',Alexander Lyng Substitution,2,2700,45',130879,0,0,1980-01-01,0.0,0.0,-0.02,-0.01,0.0,0.0,364126.0,Alexander Lyng,2025-06-15 05:11:08
13451,738500,10,45385621,76,Michael Opoku (Denmark U20) Substitution at 45',Michael Opoku Substitution,2,2700,45',130879,0,0,1980-01-01,0.0,0.0,-0.02,-0.01,0.0,0.0,380656.0,Michael Opoku,2025-06-15 05:11:08
13451,738500,7,45385618,76,Abbas Al Hassan (Saudi Arabia U23) Substitution at 45',Abbas Al Hassan Substitution,2,2700,45',20950,0,0,1980-01-01,0.0,0.0,-0.02,-0.01,0.0,0.0,392499.0,Badr Al Omair,2025-06-15 05:11:08
13451,738500,8,45385619,76,Sabil Hansen (Denmark U20) Substitution at 45',Sabil Hansen Substitution,2,2700,45',130879,0,0,1980-01-01,0.0,0.0,-0.02,-0.01,0.0,0.0,343957.0,Pontus Andy Texel,2025-06-15 05:11:08
13451,738500,9,45385620,76,Alexander Lyng (Denmark U20) Substitution at 45',Alexander Lyng Substitution,2,2700,45',130879,0,0,1980-01-01,0.0,0.0,-0.02,-0.01,0.0,0.0,375738.0,Chido Obi,2025-06-15 05:11:08
13451,738500,10,45385621,76,Michael Opoku (Denmark U20) Substitution at 45',Michael Opoku Substitution,2,2700,45',130879,0,0,1980-01-01,0.0,0.0,-0.02,-0.01,0.0,0.0,353064.0,Gustav Christensen,2025-06-15 05:11:08
13451,738500,11,45385622,94,Meshal Alaeli (Saudi Arabia U23) Yellow Card at 50',Meshal Alaeli Yellow Card,2,3000,50',20950,0,0,1980-01-01,0.0,0.0,-0.02,-0.01,0.0,0.0,362869.0,Meshal Alaeli,2025-06-15 05:11:08
13451,738500,12,45387592,70,Abdulmalik Al Jaber (Saudi Arabia U23) Goal at 53',Abdulmalik Al Jaber Goal,2,3180,53',20950,0,0,1980-01-01,0.0,0.0,-0.02,-0.01,0.0,0.0,341471.0,Abdulmalik Al Jaber,2025-06-15 05:11:08
13451,738500,13,45385627,76,Julius Beck (Denmark U20) Substitution at 60',Julius Beck Substitution,2,3600,60',130879,0,0,1980-01-01,0.0,0.0,-0.02,-0.01,0.0,0.0,319174.0,Julius Beck,2025-06-15 05:11:08
13451,738500,13,45385627,76,Julius Beck (Denmark U20) Substitution at 60',Julius Beck Substitution,2,3600,60',130879,0,0,1980-01-01,0.0,0.0,-0.02,-0.01,0.0,0.0,332428.0,William Clem,2025-06-15 05:11:08
13451,738500,14,45385629,70,Julius Beck (Denmark U20) Goal at 63',Julius Beck Goal,2,3780,63',130879,0,0,1980-01-01,0.0,0.0,-0.02,-0.01,0.0,0.0,319174.0,Julius Beck,2025-06-15 05:11:08
13451,738500,16,45385635,76,Kaare Barslund (Denmark U20) Substitution at 71',Kaare Barslund Substitution,2,4260,71',130879,0,0,1980-01-01,0.0,0.0,-0.02,-0.01,0.0,0.0,347458.0,Kaare Barslund,2025-06-15 05:11:08
13451,738500,15,45385633,76,Mohammed Ali Barnawi (Saudi Arabia U23) Substitution at 71',Mohammed Ali Barnawi Substitutio,2,4260,71',20950,0,0,1980-01-01,0.0,0.0,-0.02,-0.01,0.0,0.0,341469.0,Mohammed Ali Barnawi,2025-06-15 05:11:08
13451,738500,16,45385635,76,Kaare Barslund (Denmark U20) Substitution at 71',Kaare Barslund Substitution,2,4260,71',130879,0,0,1980-01-01,0.0,0.0,-0.02,-0.01,0.0,0.0,404829.0,Jonathan Foss,2025-06-15 05:11:08
13451,738500,15,45385633,76,Mohammed Ali Barnawi (Saudi Arabia U23) Substitution at 71',Mohammed Ali Barnawi Substitutio,2,4260,71',20950,0,0,1980-01-01,0.0,0.0,-0.02,-0.01,0.0,0.0,313423.0,Abdullah Radif,2025-06-15 05:11:08
13451,738500,17,45385639,94,Mohammed Yousef (Saudi Arabia U23) Yellow Card at 79',Mohammed Yousef Yellow Card,2,4740,79',20950,0,0,1980-01-01,0.0,0.0,-0.02,-0.01,0.0,0.0,367660.0,Mohammed Yousef,2025-06-15 05:11:08
13451,738500,18,45385640,76,Hussain Al Zarie (Saudi Arabia U23) Substitution at 85',Hussain Al Zarie Substitution,2,5100,85',20950,0,0,1980-01-01,0.0,0.0,-0.02,-0.01,0.0,0.0,390038.0,Hussain Al Zarie,2025-06-15 05:11:08
13451,738500,19,45385641,76,Zaid Al Enezi (Saudi Arabia U23) Substitution at 85',Zaid Al Enezi Substitution,2,5100,85',20950,0,0,1980-01-01,0.0,0.0,-0.02,-0.01,0.0,0.0,384809.0,Zaid Al Enezi,2025-06-15 05:11:08
13451,738500,18,45385640,76,Hussain Al Zarie (Saudi Arabia U23) Substitution at 85',Hussain Al Zarie Substitution,2,5100,85',20950,0,0,1980-01-01,0.0,0.0,-0.02,-0.01,0.0,0.0,341460.0,Abdulaziz Saud Al Aliwa,2025-06-15 05:11:08
13451,738500,19,45385641,76,Zaid Al Enezi (Saudi Arabia U23) Substitution at 85',Zaid Al Enezi Substitution,2,5100,85',20950,0,0,1980-01-01,0.0,0.0,-0.02,-0.01,0.0,0.0,341471.0,Abdulmalik Al Jaber,2025-06-15 05:11:08
13451,738500,20,45385642,94,Turki Baaljawsh (Saudi Arabia U23) Yellow Card at 86',Turki Baaljawsh Yellow Card,2,5160,86',20950,0,0,1980-01-01,0.0,0.0,-0.02,-0.01,0.0,0.0,357536.0,Turki Baaljawsh,2025-06-15 05:11:08
13451,738500,21,45385785,98,Alexander Lyng (Denmark U20) Penalty - Scored at 94',Alexander Lyng Penalty - Scored,2,5400,90'+4',130879,0,0,1980-01-01,0.0,0.0,-0.02,-0.01,0.0,0.0,364126.0,Alexander Lyng,2025-06-15 05:11:08
13451,738501,1,45385952,70,Louis Leroux (France U20) Goal at 14',Louis Leroux Goal,1,840,14',12062,0,0,1980-01-01,0.0,0.0,0.0,0.0,0.0,0.0,388558.0,Louis Leroux,2025-06-14 05:26:25
13451,738501,2,45385983,76,Saïmon Bouabré (France U20) Substitution at 45',Saïmon Bouabré Substitution,2,2700,45',12062,0,0,1980-01-01,0.0,0.0,0.0,0.0,0.0,0.0,371472.0,Saïmon Bouabré,2025-06-14 05:26:25
13451,738501,2,45385983,76,Saïmon Bouabré (France U20) Substitution at 45',Saïmon Bouabré Substitution,2,2700,45',12062,0,0,1980-01-01,0.0,0.0,0.0,0.0,0.0,0.0,388558.0,Louis Leroux,2025-06-14 05:26:25
13451,738501,3,45385985,70,Karol Velázquez (Mexico U20) Goal at 48',Karol Velázquez Goal,2,2880,48',5172,0,0,1980-01-01,0.0,0.0,0.0,0.0,0.0,0.0,364722.0,Karol Velázquez,2025-06-14 05:26:25
13451,738501,8,45385995,76,Abdoul Koné (France U20) Substitution at 61',Abdoul Koné Substitution,2,3660,61',12062,0,0,1980-01-01,0.0,0.0,0.0,0.0,0.0,0.0,384380.0,Abdoul Koné,2025-06-14 05:26:25
13451,738501,7,45385994,94,Oswaldo Virgen (Mexico U20) Yellow Card at 61',Oswaldo Virgen Yellow Card,2,3660,61',5172,0,0,1980-01-01,0.0,0.0,0.0,0.0,0.0,0.0,398704.0,Oswaldo Virgen,2025-06-14 05:26:25
13451,738501,5,45385992,94,Rabby Nzingoula (France U20) Yellow Card at 61',Rabby Nzingoula Yellow Card,2,3660,61',12062,0,0,1980-01-01,0.0,0.0,0.0,0.0,0.0,0.0,365932.0,Rabby Nzingoula,2025-06-14 05:26:25
13451,738501,4,45385991,94,Jonathan Padilla (Mexico U20) Yellow Card at 61',Jonathan Padilla Yellow Card,2,3660,61',5172,0,0,1980-01-01,0.0,0.0,0.0,0.0,0.0,0.0,361264.0,Jonathan Padilla,2025-06-14 05:26:25
13451,738501,6,45385993,94,Jaydee Canvot (France U20) Yellow Card at 61',Jaydee Canvot Yellow Card,2,3660,61',12062,0,0,1980-01-01,0.0,0.0,0.0,0.0,0.0,0.0,386252.0,Jaydee Canvot,2025-06-14 05:26:25
13451,738501,8,45385995,76,Abdoul Koné (France U20) Substitution at 61',Abdoul Koné Substitution,2,3660,61',12062,0,0,1980-01-01,0.0,0.0,0.0,0.0,0.0,0.0,345688.0,Yoni Gomis,2025-06-14 05:26:25
