seasonType,eventId,playOrder,playId,typeId,text,shortText,period,clockValue,clockDisplayValue,teamId,scoringPlay,shootout,wallclock,goalPositionX,goalPositionY,fieldpositionX,fieldPositionY,fieldPosition2X,fieldPosition2Y,athleteId,participant,updateDateTime
13655,755278,7,45964482,76,Jerome Karlese (Golden Arrows) Substitution at 70',Jerome Karlese Substitution,2,4200,70',7077,0,0,2025-09-24 14:28:05,0.0,0.0,0.0,0.0,0.0,0.0,354727.0,Jerome Karlese,2025-09-25 05:17:01
13655,755278,8,45964483,76,Sabelo Sithole (Golden Arrows) Substitution at 70',Sabelo Sithole Substitution,2,4200,70',7077,0,0,2025-09-24 14:28:13,0.0,0.0,0.0,0.0,0.0,0.0,367185.0,Sabelo Sithole,2025-09-25 05:17:01
13655,755278,9,45964484,76,Isaac Cissé (Golden Arrows) Substitution at 70',Isaac Cissé Substitution,2,4200,70',7077,0,0,2025-09-24 14:28:20,0.0,0.0,0.0,0.0,0.0,0.0,204673.0,Isaac Cissé,2025-09-25 05:17:01
13655,755278,7,45964482,76,Jerome Karlese (Golden Arrows) Substitution at 70',Jerome Karlese Substitution,2,4200,70',7077,0,0,2025-09-24 14:28:05,0.0,0.0,0.0,0.0,0.0,0.0,325532.0,Sede Junior Dion,2025-09-25 05:17:01
13655,755278,8,45964483,76,Sabelo Sithole (Golden Arrows) Substitution at 70',Sabelo Sithole Substitution,2,4200,70',7077,0,0,2025-09-24 14:28:13,0.0,0.0,0.0,0.0,0.0,0.0,367165.0,Siyanda Mthanti,2025-09-25 05:17:01
13655,755278,9,45964484,76,Isaac Cissé (Golden Arrows) Substitution at 70',Isaac Cissé Substitution,2,4200,70',7077,0,0,2025-09-24 14:28:20,0.0,0.0,0.0,0.0,0.0,0.0,325155.0,Philani Kumalo,2025-09-25 05:17:01
13655,755278,10,45964668,94,Teboho Mokoena (Mamelodi Sundowns) Yellow Card at 73',Teboho Mokoena Yellow Card,2,4380,73',7084,0,0,2025-09-24 14:30:58,0.0,0.0,0.0,0.0,0.0,0.0,256691.0,Teboho Mokoena,2025-09-25 05:17:01
13655,755278,11,45965069,94,Oumar Comara (Golden Arrows) Yellow Card at 75',Oumar Comara Yellow Card,2,4500,75',7077,0,0,2025-09-24 14:32:38,0.0,0.0,0.0,0.0,0.0,0.0,408594.0,Oumar Comara,2025-09-25 05:17:01
13655,755278,12,45965070,76,Tsiki Ntsabeleng (Mamelodi Sundowns) Substitution at 78',Tsiki Ntsabeleng Substitution,2,4680,78',7084,0,0,2025-09-24 14:36:02,0.0,0.0,0.0,0.0,0.0,0.0,280931.0,Tsiki Ntsabeleng,2025-09-25 05:17:01
13655,755278,12,45965070,76,Tsiki Ntsabeleng (Mamelodi Sundowns) Substitution at 78',Tsiki Ntsabeleng Substitution,2,4680,78',7084,0,0,2025-09-24 14:36:02,0.0,0.0,0.0,0.0,0.0,0.0,283344.0,Tashreeq Matthews,2025-09-25 05:17:01
13655,755278,13,45965071,76,Thabo Matlaba (Golden Arrows) Substitution at 80',Thabo Matlaba Substitution,2,4800,80',7077,0,0,2025-09-24 14:38:20,0.0,0.0,0.0,0.0,0.0,0.0,151870.0,Thabo Matlaba,2025-09-25 05:17:01
13655,755278,13,45965071,76,Thabo Matlaba (Golden Arrows) Substitution at 80',Thabo Matlaba Substitution,2,4800,80',7077,0,0,2025-09-24 14:38:20,0.0,0.0,0.0,0.0,0.0,0.0,287480.0,Keenan Phillips,2025-09-25 05:17:01
13655,755278,14,45965072,76,Gladwin Shitolo (Golden Arrows) Substitution at 92',Gladwin Shitolo Substitution,2,5400,90'+2',7077,0,0,2025-09-24 14:49:57,0.0,0.0,0.0,0.0,0.0,0.0,139425.0,Gladwin Shitolo,2025-09-25 05:17:01
13655,755278,15,45965073,94,Thabo Matlaba (Golden Arrows) Yellow Card at 92',Thabo Matlaba Yellow Card,2,5400,90'+2',7077,0,0,2025-09-24 14:50:04,0.0,0.0,0.0,0.0,0.0,0.0,151870.0,Thabo Matlaba,2025-09-25 05:17:01
13655,755278,14,45965072,76,Gladwin Shitolo (Golden Arrows) Substitution at 92',Gladwin Shitolo Substitution,2,5400,90'+2',7077,0,0,2025-09-24 14:49:57,0.0,0.0,0.0,0.0,0.0,0.0,325162.0,Ayabulela Maxwele,2025-09-25 05:17:01
13655,755280,1,45967020,76,Nkanyiso Zungu (Magesi FC) Substitution at 68',Nkanyiso Zungu Substitution,2,4080,68',18611,0,0,2025-09-24 18:55:18,0.0,0.0,0.0,0.0,0.0,0.0,262529.0,Nkanyiso Zungu,2025-09-27 05:18:25
13655,755280,1,45967020,76,Nkanyiso Zungu (Magesi FC) Substitution at 68',Nkanyiso Zungu Substitution,2,4080,68',18611,0,0,2025-09-24 18:55:18,0.0,0.0,0.0,0.0,0.0,0.0,316171.0,Kgomotso Mosadi,2025-09-27 05:18:25
13655,755280,2,45967147,70,Lindokuhle Zikhali (Richards Bay) Goal at 76',Lindokuhle Zikhali Goal,2,4560,76',18825,0,0,2025-09-24 19:03:38,0.0,0.0,0.0,0.0,0.0,0.0,395857.0,Lindokuhle Zikhali,2025-09-25 05:17:01
13655,755280,3,45967460,94,Delano Abrahams (Magesi FC) Yellow Card at 82',Delano Abrahams Yellow Card,2,4920,82',18611,0,0,2025-09-24 19:09:31,0.0,0.0,0.0,0.0,0.0,0.0,390436.0,Delano Abrahams,2025-09-25 05:17:01
13655,755280,4,45967461,76,Abbey Junior Seseane (Magesi FC) Substitution at 83',Abbey Junior Seseane Substitutio,2,4980,83',18611,0,0,2025-09-24 19:10:20,0.0,0.0,0.0,0.0,0.0,0.0,390413.0,Abbey Junior Seseane,2025-09-25 05:17:01
13655,755280,4,45967461,76,Abbey Junior Seseane (Magesi FC) Substitution at 83',Abbey Junior Seseane Substitutio,2,4980,83',18611,0,0,2025-09-24 19:10:20,0.0,0.0,0.0,0.0,0.0,0.0,264835.0,Mzwandile Buthelezi,2025-09-25 05:17:01
13655,755280,5,45967534,76,Edmore Chirambadare (Magesi FC) Substitution at 86',Edmore Chirambadare Substitution,2,5160,86',18611,0,0,2025-09-24 19:13:17,0.0,0.0,0.0,0.0,0.0,0.0,232778.0,Edmore Chirambadare,2025-09-25 05:17:01
13655,755280,5,45967534,76,Edmore Chirambadare (Magesi FC) Substitution at 86',Edmore Chirambadare Substitution,2,5160,86',18611,0,0,2025-09-24 19:13:17,0.0,0.0,0.0,0.0,0.0,0.0,277077.0,Tlou Tholang Masegela,2025-09-25 05:17:01
13655,755280,6,45967649,76,Lundi Mahala (Richards Bay) Substitution at 90',Lundi Mahala Substitution,2,5400,90',18825,0,0,2025-09-24 19:17:47,0.0,0.0,0.0,0.0,0.0,0.0,408447.0,Lundi Mahala,2025-09-25 05:17:01
13655,755280,6,45967649,76,Lundi Mahala (Richards Bay) Substitution at 90',Lundi Mahala Substitution,2,5400,90',18825,0,0,2025-09-24 19:17:47,0.0,0.0,0.0,0.0,0.0,0.0,185268.0,Frank Mhango,2025-09-25 05:17:01
13655,755281,1,45966296,94,Thato Khiba (Stellenbosch) Yellow Card at 36',Thato Khiba Yellow Card,1,2160,36',18615,0,0,2025-09-24 18:06:33,0.0,0.0,0.0,0.0,0.0,0.0,325172.0,Thato Khiba,2025-09-25 05:17:01
13655,755281,2,45966606,94,Henri Stanic (Stellenbosch) Yellow Card at 47',Henri Stanic Yellow Card,2,2820,47',18615,0,0,2025-09-24 18:33:31,0.0,0.0,0.0,0.0,0.0,0.0,408408.0,Henri Stanic,2025-09-25 05:17:01
13655,755281,3,45966965,76,Andre De Jong (Stellenbosch) Substitution at 62',Andre De Jong Substitution,2,3720,62',18615,0,0,2025-09-24 18:49:13,0.0,0.0,0.0,0.0,0.0,0.0,194737.0,Andre De Jong,2025-09-25 05:17:01
13655,755281,4,45966966,76,Ashley Cupido (Stellenbosch) Substitution at 62',Ashley Cupido Substitution,2,3720,62',18615,0,0,2025-09-24 18:49:12,0.0,0.0,0.0,0.0,0.0,0.0,313773.0,Ashley Cupido,2025-09-25 05:17:01
13655,755281,5,45966975,76,Genino Palace (Stellenbosch) Substitution at 62',Genino Palace Substitution,2,3720,62',18615,0,0,2025-09-24 18:49:09,0.0,0.0,0.0,0.0,0.0,0.0,335321.0,Genino Palace,2025-09-25 05:17:01
13655,755281,3,45966965,76,Andre De Jong (Stellenbosch) Substitution at 62',Andre De Jong Substitution,2,3720,62',18615,0,0,2025-09-24 18:49:13,0.0,0.0,0.0,0.0,0.0,0.0,313775.0,Chumani Butsaka,2025-09-25 05:17:01
13655,755281,4,45966966,76,Ashley Cupido (Stellenbosch) Substitution at 62',Ashley Cupido Substitution,2,3720,62',18615,0,0,2025-09-24 18:49:12,0.0,0.0,0.0,0.0,0.0,0.0,309019.0,Sanele Barns,2025-09-25 05:17:01
13655,755281,5,45966975,76,Genino Palace (Stellenbosch) Substitution at 62',Genino Palace Substitution,2,3720,62',18615,0,0,2025-09-24 18:49:09,0.0,0.0,0.0,0.0,0.0,0.0,325172.0,Thato Khiba,2025-09-25 05:17:01
13655,755281,6,45966976,76,Joslin Kamatuka (Durban City) Substitution at 64',Joslin Kamatuka Substitution,2,3840,64',22348,0,0,2025-09-24 18:50:28,0.0,0.0,0.0,0.0,0.0,0.0,247855.0,Joslin Kamatuka,2025-09-25 05:17:01
13655,755281,6,45966976,76,Joslin Kamatuka (Durban City) Substitution at 64',Joslin Kamatuka Substitution,2,3840,64',22348,0,0,2025-09-24 18:50:28,0.0,0.0,0.0,0.0,0.0,0.0,408424.0,Samkelo Maseko,2025-09-25 05:17:01
13655,755281,7,45967043,76,Thabo Nodada (Durban City) Substitution at 68',Thabo Nodada Substitution,2,4080,68',22348,0,0,2025-09-24 18:55:17,0.0,0.0,0.0,0.0,0.0,0.0,225135.0,Thabo Nodada,2025-09-25 05:17:01
13655,755281,7,45967043,76,Thabo Nodada (Durban City) Substitution at 68',Thabo Nodada Substitution,2,4080,68',22348,0,0,2025-09-24 18:55:17,0.0,0.0,0.0,0.0,0.0,0.0,408659.0,Bokang Mokwena,2025-09-25 05:17:01
13655,755281,8,45967093,94,Fezile Gcaba (Durban City) Yellow Card at 74',Fezile Gcaba Yellow Card,2,4440,74',22348,0,0,2025-09-24 19:01:00,0.0,0.0,0.0,0.0,0.0,0.0,287488.0,Fezile Gcaba,2025-09-25 05:17:01
13655,755281,9,45967384,76,Khomotjo Lekoloane (Stellenbosch) Substitution at 80',Khomotjo Lekoloane Substitution,2,4800,80',18615,0,0,2025-09-24 19:07:07,0.0,0.0,0.0,0.0,0.0,0.0,313690.0,Khomotjo Lekoloane,2025-09-25 05:17:01
13655,755281,9,45967384,76,Khomotjo Lekoloane (Stellenbosch) Substitution at 80',Khomotjo Lekoloane Substitution,2,4800,80',18615,0,0,2025-09-24 19:07:07,0.0,0.0,0.0,0.0,0.0,0.0,313565.0,Lehlohonolo Mojela,2025-09-25 05:17:01
13655,755281,10,45967440,76,Saziso Magawana (Durban City) Substitution at 84',Saziso Magawana Substitution,2,5040,84',22348,0,0,2025-09-24 19:10:34,0.0,0.0,0.0,0.0,0.0,0.0,313534.0,Saziso Magawana,2025-09-27 05:18:25
13655,755281,11,45967499,76,Jean Lwamba (Durban City) Substitution at 84',Jean Lwamba Substitution,2,5040,84',22348,0,0,2025-09-24 19:10:49,0.0,0.0,0.0,0.0,0.0,0.0,408660.0,Jean Lwamba,2025-09-25 05:17:01
13655,755281,10,45967440,76,Saziso Magawana (Durban City) Substitution at 84',Saziso Magawana Substitution,2,5040,84',22348,0,0,2025-09-24 19:10:34,0.0,0.0,0.0,0.0,0.0,0.0,263331.0,Haashim Domingo,2025-09-27 05:18:25
13655,755281,11,45967499,76,Jean Lwamba (Durban City) Substitution at 84',Jean Lwamba Substitution,2,5040,84',22348,0,0,2025-09-24 19:10:49,0.0,0.0,0.0,0.0,0.0,0.0,262583.0,Letsie Koapeng,2025-09-25 05:17:01
13655,755281,12,45967679,94,Devon Titus (Stellenbosch) Yellow Card at 92',Devon Titus Yellow Card,2,5400,90'+2',18615,0,0,2025-09-24 19:18:27,0.0,0.0,0.0,0.0,0.0,0.0,312371.0,Devon Titus,2025-09-25 05:17:01
13655,755282,1,45966607,76,Ngoanamello Rammala (Sekhukhune United) Substitution at 45',Ngoanamello Rammala Substitution,2,2700,45',20814,0,0,2025-09-24 18:34:11,0.0,0.0,0.0,0.0,0.0,0.0,367687.0,Ngoanamello Rammala,2025-09-25 05:17:01
13655,755282,1,45966607,76,Ngoanamello Rammala (Sekhukhune United) Substitution at 45',Ngoanamello Rammala Substitution,2,2700,45',20814,0,0,2025-09-24 18:34:11,0.0,0.0,0.0,0.0,0.0,0.0,292141.0,Ronaldo Maarman,2025-09-25 05:17:01
13655,755282,2,45966879,70,Boy Madingwane (Chippa United) Goal at 53',Boy Madingwane Goal,2,3180,53',11913,0,0,2025-09-24 18:42:42,0.0,0.0,0.0,0.0,0.0,0.0,390446.0,Boy Madingwane,2025-09-27 05:18:25
13655,755282,3,45966973,76,Bienvenu Eva Nga (Chippa United) Substitution at 60',Bienvenu Eva Nga Substitution,2,3600,60',11913,0,0,2025-09-24 18:49:41,0.0,0.0,0.0,0.0,0.0,0.0,301492.0,Bienvenu Eva Nga,2025-09-25 05:17:01
13655,755282,3,45966973,76,Bienvenu Eva Nga (Chippa United) Substitution at 60',Bienvenu Eva Nga Substitution,2,3600,60',11913,0,0,2025-09-24 18:49:41,0.0,0.0,0.0,0.0,0.0,0.0,264763.0,Ayabulela Konqobe,2025-09-25 05:17:01
13655,755282,4,45967018,76,Sikhosonke Langa (Sekhukhune United) Substitution at 66',Sikhosonke Langa Substitution,2,3960,66',20814,0,0,2025-09-24 18:55:01,0.0,0.0,0.0,0.0,0.0,0.0,390437.0,Sikhosonke Langa,2025-09-25 05:17:01
13655,755282,5,45967035,76,Tshepo Mokoane (Sekhukhune United) Substitution at 66',Tshepo Mokoane Substitution,2,3960,66',20814,0,0,2025-09-24 18:55:20,0.0,0.0,0.0,0.0,0.0,0.0,392338.0,Tshepo Mokoane,2025-09-27 05:18:25
13655,755282,6,45967036,76,Miguel Timm (Sekhukhune United) Substitution at 66',Miguel Timm Substitution,2,3960,66',20814,0,0,2025-09-24 18:55:21,0.0,0.0,0.0,0.0,0.0,0.0,165135.0,Miguel Timm,2025-09-27 05:18:25
13655,755282,4,45967018,76,Sikhosonke Langa (Sekhukhune United) Substitution at 66',Sikhosonke Langa Substitution,2,3960,66',20814,0,0,2025-09-24 18:55:01,0.0,0.0,0.0,0.0,0.0,0.0,390445.0,Vuyo Letlapa,2025-09-25 05:17:01
13655,755282,5,45967035,76,Tshepo Mokoane (Sekhukhune United) Substitution at 66',Tshepo Mokoane Substitution,2,3960,66',20814,0,0,2025-09-24 18:55:20,0.0,0.0,0.0,0.0,0.0,0.0,256698.0,Matlala Keletso Makgalwa,2025-09-27 05:18:25
13655,755282,6,45967036,76,Miguel Timm (Sekhukhune United) Substitution at 66',Miguel Timm Substitution,2,3960,66',20814,0,0,2025-09-24 18:55:21,0.0,0.0,0.0,0.0,0.0,0.0,225486.0,Thabang Monare,2025-09-27 05:18:25
13655,755282,7,45967126,76,Samkele Sihlali (Sekhukhune United) Substitution at 73',Samkele Sihlali Substitution,2,4380,73',20814,0,0,2025-09-24 19:02:25,0.0,0.0,0.0,0.0,0.0,0.0,397116.0,Samkele Sihlali,2025-09-25 05:17:01
13655,755282,7,45967126,76,Samkele Sihlali (Sekhukhune United) Substitution at 73',Samkele Sihlali Substitution,2,4380,73',20814,0,0,2025-09-24 19:02:25,0.0,0.0,0.0,0.0,0.0,0.0,283901.0,Mokete Mogaila,2025-09-25 05:17:01
13655,755282,8,45967156,76,Giovanni Philander (Chippa United) Substitution at 76',Giovanni Philander Substitution,2,4560,76',11913,0,0,2025-09-24 19:04:51,0.0,0.0,0.0,0.0,0.0,0.0,313372.0,Giovanni Philander,2025-09-27 05:18:25
13655,755282,9,45967174,76,Xolani Sithole (Chippa United) Substitution at 76',Xolani Sithole Substitution,2,4560,76',11913,0,0,2025-09-24 19:05:12,0.0,0.0,0.0,0.0,0.0,0.0,390415.0,Xolani Sithole,2025-09-27 05:18:25
13655,755282,8,45967156,76,Giovanni Philander (Chippa United) Substitution at 76',Giovanni Philander Substitution,2,4560,76',11913,0,0,2025-09-24 19:04:51,0.0,0.0,0.0,0.0,0.0,0.0,319926.0,Kerwin Peters,2025-09-27 05:18:25
13655,755282,9,45967174,76,Xolani Sithole (Chippa United) Substitution at 76',Xolani Sithole Substitution,2,4560,76',11913,0,0,2025-09-24 19:05:12,0.0,0.0,0.0,0.0,0.0,0.0,390446.0,Boy Madingwane,2025-09-27 05:18:25
13655,755282,10,45967366,94,Seun Ndlovu (Chippa United) Yellow Card at 77',Seun Ndlovu Yellow Card,2,4620,77',11913,0,0,2025-09-24 19:06:14,0.0,0.0,0.0,0.0,0.0,0.0,390410.0,Seun Ndlovu,2025-09-25 05:17:01
13655,755282,10,45977101,94,Bienvenu Eva Nga (Chippa United) Yellow Card at 78',Bienvenu Eva Nga Yellow Card,2,4680,78',11913,0,0,2025-09-24 19:07:26,0.0,0.0,0.0,0.0,0.0,0.0,301492.0,Bienvenu Eva Nga,2025-09-26 05:19:16
13655,755282,11,45967379,98,Bradley Grobler (Sekhukhune United) Penalty - Scored at 79',Bradley Grobler Penalty - Scored,2,4740,79',20814,0,0,2025-09-24 19:08:07,0.0,0.0,0.0,0.0,0.0,0.0,111946.0,Bradley Grobler,2025-09-27 05:18:25
13655,755282,12,45967496,94,Sirgio Kammies (Chippa United) Yellow Card at 81',Sirgio Kammies Yellow Card,2,4860,81',11913,0,0,2025-09-24 19:10:14,0.0,0.0,0.0,0.0,0.0,0.0,256696.0,Sirgio Kammies,2025-09-25 05:17:01
13655,755282,13,45967667,76,Thabang Molaoa (Chippa United) Substitution at 89',Thabang Molaoa Substitution,2,5340,89',11913,0,0,2025-09-24 19:18:32,0.0,0.0,0.0,0.0,0.0,0.0,335864.0,Thabang Molaoa,2025-09-25 05:17:01
13655,755282,13,45967667,76,Thabang Molaoa (Chippa United) Substitution at 89',Thabang Molaoa Substitution,2,5340,89',11913,0,0,2025-09-24 19:18:32,0.0,0.0,0.0,0.0,0.0,0.0,279173.0,Justice Figuareido,2025-09-25 05:17:01
13655,755282,14,45967760,174,Bradley Grobler (Sekhukhune United) Penalty - Saved at 92',Bradley Grobler Penalty - Saved,2,5400,90'+2',20814,0,0,1980-01-01 00:00:00,0.0,0.0,0.0,0.0,0.0,0.0,111946.0,Bradley Grobler,2025-09-25 05:17:01
13655,755283,1,45966626,76,Puleng Dennis Tlolane (Polokwane City) Substitution at 45',Puleng Dennis Tlolane Substituti,2,2700,45',7099,0,0,2025-09-24 18:34:20,0.0,0.0,0.0,0.0,0.0,0.0,191528.0,Puleng Dennis Tlolane,2025-09-25 05:17:01
13655,755283,2,45966627,76,Mokibelo Ramabu (Polokwane City) Substitution at 45',Mokibelo Ramabu Substitution,2,2700,45',7099,0,0,2025-09-24 18:34:20,0.0,0.0,0.0,0.0,0.0,0.0,365616.0,Mokibelo Ramabu,2025-09-25 05:17:01
13655,755283,1,45966626,76,Puleng Dennis Tlolane (Polokwane City) Substitution at 45',Puleng Dennis Tlolane Substituti,2,2700,45',7099,0,0,2025-09-24 18:34:20,0.0,0.0,0.0,0.0,0.0,0.0,380605.0,Tshabalala Sibusiso,2025-09-25 05:17:01
13655,755283,2,45966627,76,Mokibelo Ramabu (Polokwane City) Substitution at 45',Mokibelo Ramabu Substitution,2,2700,45',7099,0,0,2025-09-24 18:34:20,0.0,0.0,0.0,0.0,0.0,0.0,395578.0,Thato Letshedi,2025-09-25 05:17:01
13655,755283,3,45966989,70,Mbulelo Wagaba (Orbit College) Goal at 62',Mbulelo Wagaba Goal,2,3720,62',19000,0,0,2025-09-24 18:50:37,0.0,0.0,0.0,0.0,0.0,0.0,277136.0,Mbulelo Wagaba,2025-09-25 05:17:01
13655,755283,4,45967016,76,Tshepo Brian Matsemela (Orbit College) Substitution at 66',Tshepo Brian Matsemela Substitut,2,3960,66',19000,0,0,2025-09-24 18:54:31,0.0,0.0,0.0,0.0,0.0,0.0,261020.0,Tshepo Brian Matsemela,2025-09-25 05:17:01
13655,755283,4,45967016,76,Tshepo Brian Matsemela (Orbit College) Substitution at 66',Tshepo Brian Matsemela Substitut,2,3960,66',19000,0,0,2025-09-24 18:54:31,0.0,0.0,0.0,0.0,0.0,0.0,390451.0,Siyabulela Mabele,2025-09-25 05:17:01
13655,755283,5,45967044,76,Saketso Moremi (Polokwane City) Substitution at 67',Saketso Moremi Substitution,2,4020,67',7099,0,0,2025-09-24 18:56:10,0.0,0.0,0.0,0.0,0.0,0.0,408405.0,Saketso Moremi,2025-09-25 05:17:01
13655,755283,5,45967044,76,Saketso Moremi (Polokwane City) Substitution at 67',Saketso Moremi Substitution,2,4020,67',7099,0,0,2025-09-24 18:56:10,0.0,0.0,0.0,0.0,0.0,0.0,365575.0,Ndamulelo Maphangule,2025-09-25 05:17:01
13655,755283,6,45967435,76,Lethabo Modimoeng (Orbit College) Substitution at 81',Lethabo Modimoeng Substitution,2,4860,81',19000,0,0,2025-09-24 19:10:15,0.0,0.0,0.0,0.0,0.0,0.0,408434.0,Lethabo Modimoeng,2025-09-25 05:17:01
13655,755283,7,45967478,76,Monty Batlhabane (Polokwane City) Substitution at 81',Monty Batlhabane Substitution,2,4860,81',7099,0,0,2025-09-24 19:10:00,0.0,0.0,0.0,0.0,0.0,0.0,395879.0,Monty Batlhabane,2025-09-25 05:17:01
13655,755283,8,45967479,76,Ayanda Lukhele (Orbit College) Substitution at 81',Ayanda Lukhele Substitution,2,4860,81',19000,0,0,2025-09-24 19:10:20,0.0,0.0,0.0,0.0,0.0,0.0,408428.0,Ayanda Lukhele,2025-09-25 05:17:01
13655,755283,6,45967435,76,Lethabo Modimoeng (Orbit College) Substitution at 81',Lethabo Modimoeng Substitution,2,4860,81',19000,0,0,2025-09-24 19:10:15,0.0,0.0,0.0,0.0,0.0,0.0,277136.0,Mbulelo Wagaba,2025-09-25 05:17:01
13655,755283,7,45967478,76,Monty Batlhabane (Polokwane City) Substitution at 81',Monty Batlhabane Substitution,2,4860,81',7099,0,0,2025-09-24 19:10:00,0.0,0.0,0.0,0.0,0.0,0.0,255652.0,Manuel Kambala,2025-09-25 05:17:01
13655,755283,8,45967479,76,Ayanda Lukhele (Orbit College) Substitution at 81',Ayanda Lukhele Substitution,2,4860,81',19000,0,0,2025-09-24 19:10:20,0.0,0.0,0.0,0.0,0.0,0.0,390414.0,Thuso Moleleki,2025-09-25 05:17:01
13655,755284,1,45965979,70,Seluleko Mahlambi (TS Galaxy) Goal at 12',Seluleko Mahlambi Goal,1,720,12',19298,0,0,2025-09-24 17:43:27,0.0,0.0,0.0,0.0,0.0,0.0,403550.0,Seluleko Mahlambi,2025-09-25 05:17:01
13655,755284,2,45966187,94,Mondli Mbanjwa (Amazulu) Yellow Card at 26',Mondli Mbanjwa Yellow Card,1,1560,26',7079,0,0,2025-09-24 17:56:55,0.0,0.0,0.0,0.0,0.0,0.0,313697.0,Mondli Mbanjwa,2025-09-27 05:18:25
13655,755284,3,45966655,97,Keegan Allan (Amazulu) Own Goal at 49',Keegan Allan Own Goal,2,2940,49',19298,0,0,2025-09-24 18:37:02,0.0,0.0,0.0,0.0,0.0,0.0,,Keegan Allan,2025-09-25 05:17:01
13655,755284,4,45966866,94,Siyanda Hlangabeza (Amazulu) Yellow Card at 52',Siyanda Hlangabeza Yellow Card,2,3120,52',7079,0,0,2025-09-24 18:40:37,0.0,0.0,0.0,0.0,0.0,0.0,367487.0,Siyanda Hlangabeza,2025-09-25 05:17:01
13655,755284,5,45966971,76,Bayanda Thabede (Amazulu) Substitution at 60',Bayanda Thabede Substitution,2,3600,60',7079,0,0,2025-09-24 18:49:02,0.0,0.0,0.0,0.0,0.0,0.0,402469.0,Bayanda Thabede,2025-09-25 05:17:01
13655,755284,5,45966971,76,Bayanda Thabede (Amazulu) Substitution at 60',Bayanda Thabede Substitution,2,3600,60',7079,0,0,2025-09-24 18:49:02,0.0,0.0,0.0,0.0,0.0,0.0,241489.0,Thabiso Kutumela,2025-09-25 05:17:01
13655,755284,6,45966960,76,Athini Maqokola (Amazulu) Substitution at 61',Athini Maqokola Substitution,2,3660,61',7079,0,0,2025-09-24 18:49:12,0.0,0.0,0.0,0.0,0.0,0.0,411000.0,Athini Maqokola,2025-09-25 05:17:01
13655,755284,6,45966960,76,Athini Maqokola (Amazulu) Substitution at 61',Athini Maqokola Substitution,2,3660,61',7079,0,0,2025-09-24 18:49:12,0.0,0.0,0.0,0.0,0.0,0.0,339181.0,Nkosikhona Radebe,2025-09-25 05:17:01
13655,755284,7,45967012,93,Siyanda Hlangabeza (Amazulu) Red Card at 65',Siyanda Hlangabeza Red Card,2,3900,65',7079,0,0,2025-09-24 18:53:53,0.0,0.0,0.0,0.0,0.0,0.0,367487.0,Siyanda Hlangabeza,2025-09-25 05:17:01
13655,755284,8,45967059,94,McBeth Mahlangu (TS Galaxy) Yellow Card at 69',McBeth Mahlangu Yellow Card,2,4140,69',19298,0,0,2025-09-24 18:57:43,0.0,0.0,0.0,0.0,0.0,0.0,309017.0,McBeth Mahlangu,2025-09-25 05:17:01
13655,755284,9,45967060,76,Junior Zindoga (TS Galaxy) Substitution at 69',Junior Zindoga Substitution,2,4140,69',19298,0,0,2025-09-24 18:58:00,0.0,0.0,0.0,0.0,0.0,0.0,277076.0,Junior Zindoga,2025-09-25 05:17:01
13655,755284,9,45967060,76,Junior Zindoga (TS Galaxy) Substitution at 69',Junior Zindoga Substitution,2,4140,69',19298,0,0,2025-09-24 18:58:00,0.0,0.0,0.0,0.0,0.0,0.0,301579.0,Nhlanhla Mgaga,2025-09-25 05:17:01
13655,755284,10,45967061,70,Thandolwenkosi Ngwenya (Amazulu) Goal at 70',Thandolwenkosi Ngwenya Goal,2,4200,70',7079,0,0,2025-09-24 18:58:07,0.0,0.0,0.0,0.0,0.0,0.0,404936.0,Thandolwenkosi Ngwenya,2025-09-25 05:17:01
13655,755284,11,45967143,76,Mory Cheick Keita (TS Galaxy) Substitution at 76',Mory Cheick Keita Substitution,2,4560,76',19298,0,0,2025-09-24 19:04:28,0.0,0.0,0.0,0.0,0.0,0.0,320952.0,Mory Cheick Keita,2025-09-25 05:17:01
13655,755284,12,45967161,76,Jeffrey Mzwandile Dlamini (TS Galaxy) Substitution at 76',Jeffrey Mzwandile Dlamini Substi,2,4560,76',19298,0,0,2025-09-24 19:04:38,0.0,0.0,0.0,0.0,0.0,0.0,313428.0,Jeffrey Mzwandile Dlamini,2025-09-25 05:17:01
13655,755284,11,45967143,76,Mory Cheick Keita (TS Galaxy) Substitution at 76',Mory Cheick Keita Substitution,2,4560,76',19298,0,0,2025-09-24 19:04:28,0.0,0.0,0.0,0.0,0.0,0.0,207557.0,Mpho Mvelase,2025-09-25 05:17:01
13655,755284,12,45967161,76,Jeffrey Mzwandile Dlamini (TS Galaxy) Substitution at 76',Jeffrey Mzwandile Dlamini Substi,2,4560,76',19298,0,0,2025-09-24 19:04:38,0.0,0.0,0.0,0.0,0.0,0.0,270820.0,Sphesihle Maduna,2025-09-25 05:17:01
13655,755284,13,45967395,70,Mory Cheick Keita (TS Galaxy) Goal at 80',Mory Cheick Keita Goal,2,4800,80',19298,0,0,2025-09-24 19:08:20,0.0,0.0,0.0,0.0,0.0,0.0,320952.0,Mory Cheick Keita,2025-09-25 05:17:01
13655,755284,14,45967518,94,Mpho Mvelase (TS Galaxy) Yellow Card at 81',Mpho Mvelase Yellow Card,2,4860,81',19298,0,0,2025-09-24 19:09:46,0.0,0.0,0.0,0.0,0.0,0.0,207557.0,Mpho Mvelase,2025-09-25 05:17:01
13655,755284,15,45967545,76,Andiswa Sithole (Amazulu) Substitution at 85',Andiswa Sithole Substitution,2,5100,85',7079,0,0,2025-09-24 19:13:50,0.0,0.0,0.0,0.0,0.0,0.0,391916.0,Andiswa Sithole,2025-09-27 05:18:25
13655,755284,16,45967546,76,Mehdi Ouamri (TS Galaxy) Substitution at 85',Mehdi Ouamri Substitution,2,5100,85',19298,0,0,2025-09-24 19:13:48,0.0,0.0,0.0,0.0,0.0,0.0,292447.0,Mehdi Ouamri,2025-09-27 05:18:25
13655,755284,17,45967547,76,Onke Moletshe (TS Galaxy) Substitution at 85',Onke Moletshe Substitution,2,5100,85',19298,0,0,2025-09-24 19:13:53,0.0,0.0,0.0,0.0,0.0,0.0,408399.0,Onke Moletshe,2025-09-27 05:18:25
13655,755284,18,45967582,76,Thapelo Matlhoko (Amazulu) Substitution at 85',Thapelo Matlhoko Substitution,2,5100,85',7079,0,0,2025-09-24 19:13:54,0.0,0.0,0.0,0.0,0.0,0.0,408426.0,Thapelo Matlhoko,2025-09-27 05:18:25
13655,755284,15,45967545,76,Andiswa Sithole (Amazulu) Substitution at 85',Andiswa Sithole Substitution,2,5100,85',7079,0,0,2025-09-24 19:13:50,0.0,0.0,0.0,0.0,0.0,0.0,207898.0,Hendrick Ekstein,2025-09-27 05:18:25
13655,755284,16,45967546,76,Mehdi Ouamri (TS Galaxy) Substitution at 85',Mehdi Ouamri Substitution,2,5100,85',19298,0,0,2025-09-24 19:13:48,0.0,0.0,0.0,0.0,0.0,0.0,365549.0,Puso Dithejane,2025-09-27 05:18:25
13655,755284,17,45967547,76,Onke Moletshe (TS Galaxy) Substitution at 85',Onke Moletshe Substitution,2,5100,85',19298,0,0,2025-09-24 19:13:53,0.0,0.0,0.0,0.0,0.0,0.0,403550.0,Seluleko Mahlambi,2025-09-27 05:18:25
13655,755284,18,45967582,76,Thapelo Matlhoko (Amazulu) Substitution at 85',Thapelo Matlhoko Substitution,2,5100,85',7079,0,0,2025-09-24 19:13:54,0.0,0.0,0.0,0.0,0.0,0.0,404936.0,Thandolwenkosi Ngwenya,2025-09-27 05:18:25
13655,755285,1,45992865,94,Tshabalala Sibusiso (Polokwane City) Yellow Card at 26',Tshabalala Sibusiso Yellow Card,1,1560,26',7099,0,0,2025-09-27 15:55:37,0.0,0.0,0.0,0.0,0.0,0.0,380605.0,Tshabalala Sibusiso,2025-09-28 05:16:52
13655,755285,2,45992981,70,Mokibelo Ramabu (Polokwane City) Goal at 32',Mokibelo Ramabu Goal,1,1920,32',7099,0,0,2025-09-27 16:01:36,0.0,0.0,0.0,0.0,0.0,0.0,365616.0,Mokibelo Ramabu,2025-09-28 05:16:52
13655,755285,3,45993663,94,Vusumuzi Mncube (Sekhukhune United) Yellow Card at 54',Vusumuzi Mncube Yellow Card,2,3240,54',20814,0,0,2025-09-27 16:43:04,0.0,0.0,0.0,0.0,0.0,0.0,266118.0,Vusumuzi Mncube,2025-09-28 05:16:52
13655,755285,4,45993878,76,Karabo Tlaka (Sekhukhune United) Substitution at 69',Karabo Tlaka Substitution,2,4140,69',20814,0,0,2025-09-27 16:58:17,0.0,0.0,0.0,0.0,0.0,0.0,403112.0,Karabo Tlaka,2025-09-30 05:15:01
13655,755285,5,45993893,76,Tshepo Mokoane (Sekhukhune United) Substitution at 69',Tshepo Mokoane Substitution,2,4140,69',20814,0,0,2025-09-27 16:58:18,0.0,0.0,0.0,0.0,0.0,0.0,392338.0,Tshepo Mokoane,2025-09-30 05:15:01
13655,755285,6,45993894,76,Vuyo Letlapa (Sekhukhune United) Substitution at 69',Vuyo Letlapa Substitution,2,4140,69',20814,0,0,2025-09-27 16:58:14,0.0,0.0,0.0,0.0,0.0,0.0,390445.0,Vuyo Letlapa,2025-09-30 05:15:01
13655,755285,4,45993878,76,Karabo Tlaka (Sekhukhune United) Substitution at 69',Karabo Tlaka Substitution,2,4140,69',20814,0,0,2025-09-27 16:58:17,0.0,0.0,0.0,0.0,0.0,0.0,225486.0,Thabang Monare,2025-09-30 05:15:01
13655,755285,5,45993893,76,Tshepo Mokoane (Sekhukhune United) Substitution at 69',Tshepo Mokoane Substitution,2,4140,69',20814,0,0,2025-09-27 16:58:18,0.0,0.0,0.0,0.0,0.0,0.0,266118.0,Vusumuzi Mncube,2025-09-30 05:15:01
