seasonType,eventId,playOrder,playId,typeId,text,shortText,period,clockValue,clockDisplayValue,teamId,scoringPlay,shootout,wallclock,goalPositionX,goalPositionY,fieldpositionX,fieldPositionY,fieldPosition2X,fieldPosition2Y,athleteId,participant,updateDateTime
13041,724278,7,44986441,76,Antonina Shopska (Bulgaria) Substitution at 62',Antonina Shopska Substitution,2,3720,62',20974,0,0,1980-01-01 00:00:00,0.0,0.0,0.0,0.0,0.0,0.0,339335.0,Polina Rasina,2025-04-06 04:56:57
13041,724278,8,44986457,76,Nikol Dimanova (Bulgaria) Substitution at 72',Nikol Dimanova Substitution,2,4320,72',20974,0,0,1980-01-01 00:00:00,0.0,0.0,0.0,0.0,0.0,0.0,398215.0,Nikol Dimanova,2025-04-06 04:56:57
13041,724278,8,44986457,76,Nikol Dimanova (Bulgaria) Substitution at 72',Nikol Dimanova Substitution,2,4320,72',20974,0,0,1980-01-01 00:00:00,0.0,0.0,0.0,0.0,0.0,0.0,396215.0,Aleksandra Yaneva,2025-04-06 04:56:57
13041,724278,9,44986459,94,Nikol Dimanova (Bulgaria) Yellow Card at 74',Nikol Dimanova Yellow Card,2,4440,74',20974,0,0,1980-01-01 00:00:00,0.0,0.0,0.0,0.0,0.0,0.0,398215.0,Nikol Dimanova,2025-04-06 04:56:57
13041,724278,10,44986463,76,Katriin Saulus (Estonia) Substitution at 74',Katriin Saulus Substitution,2,4440,74',20698,0,0,1980-01-01 00:00:00,0.0,0.0,0.0,0.0,0.0,0.0,343789.0,Katriin Saulus,2025-04-06 04:56:57
13041,724278,10,44986463,76,Katriin Saulus (Estonia) Substitution at 74',Katriin Saulus Substitution,2,4440,74',20698,0,0,1980-01-01 00:00:00,0.0,0.0,0.0,0.0,0.0,0.0,400762.0,Liselle Palts,2025-04-06 04:56:57
13041,724278,11,44986473,94,Ivana Naydenova (Bulgaria) Yellow Card at 78',Ivana Naydenova Yellow Card,2,4680,78',20974,0,0,1980-01-01 00:00:00,0.0,0.0,0.0,0.0,0.0,0.0,339331.0,Ivana Naydenova,2025-04-08 05:18:33
13041,724278,12,44986477,94,Kristiana Karaivanova (Bulgaria) Yellow Card at 81',Kristiana Karaivanova Yellow Car,2,4860,81',20974,0,0,1980-01-01 00:00:00,0.0,0.0,0.0,0.0,0.0,0.0,339763.0,Kristiana Karaivanova,2025-04-06 04:56:57
13041,724278,13,44986490,76,Leonora Zheleva (Bulgaria) Substitution at 82',Leonora Zheleva Substitution,2,4920,82',20974,0,0,1980-01-01 00:00:00,0.0,0.0,0.0,0.0,0.0,0.0,339761.0,Leonora Zheleva,2025-04-06 04:56:57
13041,724278,14,44986491,76,Ivana Chalakova (Bulgaria) Substitution at 82',Ivana Chalakova Substitution,2,4920,82',20974,0,0,1980-01-01 00:00:00,0.0,0.0,0.0,0.0,0.0,0.0,402765.0,Ivana Chalakova,2025-04-06 04:56:57
13041,724278,13,44986490,76,Leonora Zheleva (Bulgaria) Substitution at 82',Leonora Zheleva Substitution,2,4920,82',20974,0,0,1980-01-01 00:00:00,0.0,0.0,0.0,0.0,0.0,0.0,339324.0,Yanitsa Ivanova,2025-04-06 04:56:57
13041,724278,14,44986491,76,Ivana Chalakova (Bulgaria) Substitution at 82',Ivana Chalakova Substitution,2,4920,82',20974,0,0,1980-01-01 00:00:00,0.0,0.0,0.0,0.0,0.0,0.0,349049.0,Silviya Kefalova,2025-04-06 04:56:57
13041,724278,15,44986512,76,Vlada Kubassova (Estonia) Substitution at 91',Vlada Kubassova Substitution,2,5400,90'+1',20698,0,0,1980-01-01 00:00:00,0.0,0.0,0.0,0.0,0.0,0.0,339383.0,Vlada Kubassova,2025-04-06 04:56:57
13041,724278,15,44986512,76,Vlada Kubassova (Estonia) Substitution at 91',Vlada Kubassova Substitution,2,5400,90'+1',20698,0,0,1980-01-01 00:00:00,0.0,0.0,0.0,0.0,0.0,0.0,396280.0,Katrin Kirpu,2025-04-06 04:56:57
13041,724279,1,44986403,70,Durita Hummeland (Faroe Islands) Goal at 47',Durita Hummeland Goal,2,2820,47',21395,0,0,1980-01-01 00:00:00,0.0,0.0,0.0,0.0,0.0,0.0,396173.0,Durita Hummeland,2025-04-05 08:41:37
13041,724279,2,44986412,76,Veronica Cojuhari (Moldova) Substitution at 53',Veronica Cojuhari Substitution,2,3180,53',21482,0,0,1980-01-01 00:00:00,0.0,0.0,0.0,0.0,0.0,0.0,339567.0,Veronica Cojuhari,2025-04-05 08:41:37
13041,724279,2,44986412,76,Veronica Cojuhari (Moldova) Substitution at 53',Veronica Cojuhari Substitution,2,3180,53',21482,0,0,1980-01-01 00:00:00,0.0,0.0,0.0,0.0,0.0,0.0,396291.0,Valeria Vîrlan,2025-04-05 08:41:37
13041,724279,3,44986431,76,Eydvør Klakstein (Faroe Islands) Substitution at 60',Eydvør Klakstein Substitution,2,3600,60',21395,0,0,1980-01-01 00:00:00,0.0,0.0,0.0,0.0,0.0,0.0,334295.0,Eydvør Klakstein,2025-04-05 08:41:37
13041,724279,3,44986431,76,Eydvør Klakstein (Faroe Islands) Substitution at 60',Eydvør Klakstein Substitution,2,3600,60',21395,0,0,1980-01-01 00:00:00,0.0,0.0,0.0,0.0,0.0,0.0,334291.0,Jensa Kannuberg Tórolvsdóttir,2025-04-05 08:41:37
13041,724279,4,44986432,76,Victoria Rubanovici (Moldova) Substitution at 61',Victoria Rubanovici Substitution,2,3660,61',21482,0,0,1980-01-01 00:00:00,0.0,0.0,0.0,0.0,0.0,0.0,400523.0,Victoria Rubanovici,2025-04-05 08:41:37
13041,724279,5,44986433,76,Mihaela Gamart (Moldova) Substitution at 61',Mihaela Gamart Substitution,2,3660,61',21482,0,0,1980-01-01 00:00:00,0.0,0.0,0.0,0.0,0.0,0.0,339866.0,Mihaela Gamart,2025-04-05 08:41:37
13041,724279,4,44986432,76,Victoria Rubanovici (Moldova) Substitution at 61',Victoria Rubanovici Substitution,2,3660,61',21482,0,0,1980-01-01 00:00:00,0.0,0.0,0.0,0.0,0.0,0.0,339566.0,Iuliana Colnic,2025-04-05 08:41:37
13041,724279,5,44986433,76,Mihaela Gamart (Moldova) Substitution at 61',Mihaela Gamart Substitution,2,3660,61',21482,0,0,1980-01-01 00:00:00,0.0,0.0,0.0,0.0,0.0,0.0,402760.0,Vanessa Manoil,2025-04-05 08:41:37
13041,724279,6,44986454,70,Heidi Sevdal (Faroe Islands) Goal at 74',Heidi Sevdal Goal,2,4440,74',21395,0,0,1980-01-01 00:00:00,0.0,0.0,0.0,0.0,0.0,0.0,334305.0,Heidi Sevdal,2025-04-05 08:41:37
13041,724279,7,44986467,76,Petra Hoydal (Faroe Islands) Substitution at 79',Petra Hoydal Substitution,2,4740,79',21395,0,0,1980-01-01 00:00:00,0.0,0.0,0.0,0.0,0.0,0.0,398219.0,Petra Hoydal,2025-04-05 08:41:37
13041,724279,8,44986471,76,Anna Braendstrup (Faroe Islands) Substitution at 79',Anna Braendstrup Substitution,2,4740,79',21395,0,0,1980-01-01 00:00:00,0.0,0.0,0.0,0.0,0.0,0.0,398216.0,Anna Braendstrup,2025-04-05 08:41:37
13041,724279,7,44986467,76,Petra Hoydal (Faroe Islands) Substitution at 79',Petra Hoydal Substitution,2,4740,79',21395,0,0,1980-01-01 00:00:00,0.0,0.0,0.0,0.0,0.0,0.0,334297.0,Sanna Svarvadal,2025-04-05 08:41:37
13041,724279,8,44986471,76,Anna Braendstrup (Faroe Islands) Substitution at 79',Anna Braendstrup Substitution,2,4740,79',21395,0,0,1980-01-01 00:00:00,0.0,0.0,0.0,0.0,0.0,0.0,396301.0,Fridrikka Clementsen,2025-04-05 08:41:37
13041,724279,9,44986494,76,Jancy Mohr (Faroe Islands) Substitution at 87',Jancy Mohr Substitution,2,5220,87',21395,0,0,1980-01-01 00:00:00,0.0,0.0,0.0,0.0,0.0,0.0,400565.0,Jancy Mohr,2025-04-05 08:41:37
13041,724279,10,44986495,76,Rúna Jacobsen (Faroe Islands) Substitution at 87',Rúna Jacobsen Substitution,2,5220,87',21395,0,0,1980-01-01 00:00:00,0.0,0.0,0.0,0.0,0.0,0.0,336093.0,Rúna Jacobsen,2025-04-05 08:41:37
13041,724279,9,44986494,76,Jancy Mohr (Faroe Islands) Substitution at 87',Jancy Mohr Substitution,2,5220,87',21395,0,0,1980-01-01 00:00:00,0.0,0.0,0.0,0.0,0.0,0.0,334305.0,Heidi Sevdal,2025-04-05 08:41:37
13041,724279,10,44986495,76,Rúna Jacobsen (Faroe Islands) Substitution at 87',Rúna Jacobsen Substitution,2,5220,87',21395,0,0,1980-01-01 00:00:00,0.0,0.0,0.0,0.0,0.0,0.0,396177.0,Sara Lamhauge,2025-04-05 08:41:37
13041,724279,11,44986511,76,Natalia Tutunaru (Moldova) Substitution at 93',Natalia Tutunaru Substitution,2,5400,90'+3',21482,0,0,1980-01-01 00:00:00,0.0,0.0,0.0,0.0,0.0,0.0,400667.0,Natalia Tutunaru,2025-04-05 08:41:37
13041,724279,11,44986511,76,Natalia Tutunaru (Moldova) Substitution at 93',Natalia Tutunaru Substitution,2,5400,90'+3',21482,0,0,1980-01-01 00:00:00,0.0,0.0,0.0,0.0,0.0,0.0,339564.0,Claudia Chiper,2025-04-05 08:41:37
13041,724280,1,44986270,94,Anastasia Shlapakova (Belarus) Yellow Card at 13',Anastasia Shlapakova Yellow Card,1,780,13',20909,0,0,1980-01-01 00:00:00,0.0,0.0,0.0,0.0,0.0,0.0,339285.0,Anastasia Shlapakova,2025-04-05 08:41:37
13041,724280,2,44986295,94,Emma Koivisto (Finland) Yellow Card at 41',Emma Koivisto Yellow Card,1,2460,41',7536,0,0,1980-01-01 00:00:00,0.0,0.0,0.0,0.0,0.0,0.0,211616.0,Emma Koivisto,2025-04-05 08:41:37
13041,724280,3,44986331,113,Eveliina Summanen (Finland) Penalty - Missed at 54',Eveliina Summanen Penalty - Miss,2,3240,54',7536,0,0,1980-01-01 00:00:00,0.0,0.0,0.0,0.0,0.0,0.0,267666.0,Eveliina Summanen,2025-04-05 08:41:37
13041,724280,4,44986346,76,Melana Surovtseva (Belarus) Substitution at 62',Melana Surovtseva Substitution,2,3720,62',20909,0,0,1980-01-01 00:00:00,0.0,0.0,0.0,0.0,0.0,0.0,339279.0,Melana Surovtseva,2025-04-05 08:41:37
13041,724280,5,44986347,76,Karolina Zhitko (Belarus) Substitution at 62',Karolina Zhitko Substitution,2,3720,62',20909,0,0,1980-01-01 00:00:00,0.0,0.0,0.0,0.0,0.0,0.0,402749.0,Karolina Zhitko,2025-04-05 08:41:37
13041,724280,4,44986346,76,Melana Surovtseva (Belarus) Substitution at 62',Melana Surovtseva Substitution,2,3720,62',20909,0,0,1980-01-01 00:00:00,0.0,0.0,0.0,0.0,0.0,0.0,366621.0,Anastasia Shuppo,2025-04-05 08:41:37
13041,724280,5,44986347,76,Karolina Zhitko (Belarus) Substitution at 62',Karolina Zhitko Substitution,2,3720,62',20909,0,0,1980-01-01 00:00:00,0.0,0.0,0.0,0.0,0.0,0.0,366290.0,Valeryia Belaya,2025-04-05 08:41:37
13041,724280,6,44986358,76,Sanni Franssi (Finland) Substitution at 70',Sanni Franssi Substitution,2,4200,70',7536,0,0,1980-01-01 00:00:00,0.0,0.0,0.0,0.0,0.0,0.0,267669.0,Sanni Franssi,2025-04-05 08:41:37
13041,724280,7,44986359,76,Anastasia Mager (Belarus) Substitution at 70',Anastasia Mager Substitution,2,4200,70',20909,0,0,1980-01-01 00:00:00,0.0,0.0,0.0,0.0,0.0,0.0,396253.0,Anastasia Mager,2025-04-05 08:41:37
13041,724280,6,44986358,76,Sanni Franssi (Finland) Substitution at 70',Sanni Franssi Substitution,2,4200,70',7536,0,0,1980-01-01 00:00:00,0.0,0.0,0.0,0.0,0.0,0.0,402434.0,Aino Kröger,2025-04-05 08:41:37
13041,724280,7,44986359,76,Anastasia Mager (Belarus) Substitution at 70',Anastasia Mager Substitution,2,4200,70',20909,0,0,1980-01-01 00:00:00,0.0,0.0,0.0,0.0,0.0,0.0,339294.0,Anastasia Linnik,2025-04-05 08:41:37
13041,724280,8,44986371,76,Lilli Halttunen (Finland) Substitution at 82',Lilli Halttunen Substitution,2,4920,82',7536,0,0,1980-01-01 00:00:00,0.0,0.0,0.0,0.0,0.0,0.0,398148.0,Lilli Halttunen,2025-04-05 08:41:37
13041,724280,8,44986371,76,Lilli Halttunen (Finland) Substitution at 82',Lilli Halttunen Substitution,2,4920,82',7536,0,0,1980-01-01 00:00:00,0.0,0.0,0.0,0.0,0.0,0.0,267678.0,Linda Sällström,2025-04-05 08:41:37
13041,724280,9,44986374,76,Valeria Bogdan (Belarus) Substitution at 87',Valeria Bogdan Substitution,2,5220,87',20909,0,0,1980-01-01 00:00:00,0.0,0.0,0.0,0.0,0.0,0.0,339286.0,Valeria Bogdan,2025-04-05 08:41:37
13041,724280,10,44986375,76,Zarina Kapustina (Belarus) Substitution at 87',Zarina Kapustina Substitution,2,5220,87',20909,0,0,1980-01-01 00:00:00,0.0,0.0,0.0,0.0,0.0,0.0,396175.0,Zarina Kapustina,2025-04-05 08:41:37
13041,724280,9,44986374,76,Valeria Bogdan (Belarus) Substitution at 87',Valeria Bogdan Substitution,2,5220,87',20909,0,0,1980-01-01 00:00:00,0.0,0.0,0.0,0.0,0.0,0.0,339289.0,Karina Olkhovik,2025-04-05 08:41:37
13041,724280,10,44986375,76,Zarina Kapustina (Belarus) Substitution at 87',Zarina Kapustina Substitution,2,5220,87',20909,0,0,1980-01-01 00:00:00,0.0,0.0,0.0,0.0,0.0,0.0,339285.0,Anastasia Shlapakova,2025-04-05 08:41:37
13041,724280,11,44990783,94,Valeria Bogdan (Belarus) Yellow Card at 93',Valeria Bogdan Yellow Card,2,5400,90'+3',20909,0,0,1980-01-01 00:00:00,0.0,0.0,0.0,0.0,0.0,0.0,339286.0,Valeria Bogdan,2025-04-05 08:41:37
13041,724281,1,44986282,70,Maria Farrugia (Malta) Goal at 27',Maria Farrugia Goal,1,1620,27',20864,0,0,1980-01-01 00:00:00,0.0,0.0,0.0,0.0,0.0,0.0,314505.0,Maria Farrugia,2025-04-05 08:41:37
13041,724281,2,44986284,70,Haley Bugeja (Malta) Goal at 30',Haley Bugeja Goal,1,1800,30',20864,0,0,1980-01-01 00:00:00,0.0,0.0,0.0,0.0,0.0,0.0,339556.0,Haley Bugeja,2025-04-05 08:41:37
13041,724281,3,44986293,94,Tinatin Ambalia (Georgia) Yellow Card at 38',Tinatin Ambalia Yellow Card,1,2280,38',20971,0,0,1980-01-01 00:00:00,0.0,0.0,0.0,0.0,0.0,0.0,396278.0,Tinatin Ambalia,2025-04-05 08:41:37
13041,724281,4,44986301,70,Maria Farrugia (Malta) Goal at 44',Maria Farrugia Goal,1,2640,44',20864,0,0,1980-01-01 00:00:00,0.0,0.0,0.0,0.0,0.0,0.0,314505.0,Maria Farrugia,2025-04-05 08:41:37
13041,724281,5,44986326,76,Maiko Bebia (Georgia) Substitution at 45',Maiko Bebia Substitution,2,2700,45',20971,0,0,1980-01-01 00:00:00,0.0,0.0,0.0,0.0,0.0,0.0,349041.0,Maiko Bebia,2025-04-05 08:41:37
13041,724281,5,44986326,76,Maiko Bebia (Georgia) Substitution at 45',Maiko Bebia Substitution,2,2700,45',20971,0,0,1980-01-01 00:00:00,0.0,0.0,0.0,0.0,0.0,0.0,396223.0,Nino Bukhrikidze,2025-04-05 08:41:37
13041,724281,6,44986342,76,Irina Khaburdzania (Georgia) Substitution at 54',Irina Khaburdzania Substitution,2,3240,54',20971,0,0,1980-01-01 00:00:00,0.0,0.0,0.0,0.0,0.0,0.0,339411.0,Irina Khaburdzania,2025-04-05 08:41:37
13041,724281,6,44986342,76,Irina Khaburdzania (Georgia) Substitution at 54',Irina Khaburdzania Substitution,2,3240,54',20971,0,0,1980-01-01 00:00:00,0.0,0.0,0.0,0.0,0.0,0.0,396278.0,Tinatin Ambalia,2025-04-05 08:41:37
13041,724281,7,44986351,70,Teona Bakradze (Georgia) Goal at 59',Teona Bakradze Goal,2,3540,59',20971,0,0,1980-01-01 00:00:00,0.0,0.0,0.0,0.0,0.0,0.0,343722.0,Teona Bakradze,2025-04-05 08:41:37
13041,724281,8,44986360,76,Sopiko Narsia (Georgia) Substitution at 69',Sopiko Narsia Substitution,2,4140,69',20971,0,0,1980-01-01 00:00:00,0.0,0.0,0.0,0.0,0.0,0.0,339417.0,Sopiko Narsia,2025-04-05 08:41:37
13041,724281,8,44986360,76,Sopiko Narsia (Georgia) Substitution at 69',Sopiko Narsia Substitution,2,4140,69',20971,0,0,1980-01-01 00:00:00,0.0,0.0,0.0,0.0,0.0,0.0,339415.0,Nino Chkhartishvili,2025-04-05 08:41:37
13041,724281,9,44986361,94,Emma Lipman (Malta) Yellow Card at 71',Emma Lipman Yellow Card,2,4260,71',20864,0,0,1980-01-01 00:00:00,0.0,0.0,0.0,0.0,0.0,0.0,314497.0,Emma Lipman,2025-04-05 08:41:37
13041,724281,10,44986362,94,Kailey Willis (Malta) Yellow Card at 73',Kailey Willis Yellow Card,2,4380,73',20864,0,0,1980-01-01 00:00:00,0.0,0.0,0.0,0.0,0.0,0.0,314512.0,Kailey Willis,2025-04-05 08:41:37
13041,724281,11,44986381,76,Jana Barbara (Malta) Substitution at 88',Jana Barbara Substitution,2,5280,88',20864,0,0,1980-01-01 00:00:00,0.0,0.0,0.0,0.0,0.0,0.0,400562.0,Jana Barbara,2025-04-05 08:41:37
13041,724281,12,44986382,76,Lexine Farrugia (Malta) Substitution at 88',Lexine Farrugia Substitution,2,5280,88',20864,0,0,1980-01-01 00:00:00,0.0,0.0,0.0,0.0,0.0,0.0,392800.0,Lexine Farrugia,2025-04-05 08:41:37
13041,724281,13,44986383,76,Lizi Mtskerashvili (Georgia) Substitution at 88',Lizi Mtskerashvili Substitution,2,5280,88',20971,0,0,1980-01-01 00:00:00,0.0,0.0,0.0,0.0,0.0,0.0,396180.0,Lizi Mtskerashvili,2025-04-05 08:41:37
13041,724281,11,44986381,76,Jana Barbara (Malta) Substitution at 88',Jana Barbara Substitution,2,5280,88',20864,0,0,1980-01-01 00:00:00,0.0,0.0,0.0,0.0,0.0,0.0,314495.0,Shona Zammit,2025-04-05 08:41:37
13041,724281,12,44986382,76,Lexine Farrugia (Malta) Substitution at 88',Lexine Farrugia Substitution,2,5280,88',20864,0,0,1980-01-01 00:00:00,0.0,0.0,0.0,0.0,0.0,0.0,314512.0,Kailey Willis,2025-04-05 08:41:37
13041,724281,13,44986383,76,Lizi Mtskerashvili (Georgia) Substitution at 88',Lizi Mtskerashvili Substitution,2,5280,88',20971,0,0,1980-01-01 00:00:00,0.0,0.0,0.0,0.0,0.0,0.0,339413.0,Tatiana Matveeva,2025-04-05 08:41:37
13041,724281,14,44986386,76,Yulya Carella (Malta) Substitution at 93',Yulya Carella Substitution,2,5400,90'+3',20864,0,0,1980-01-01 00:00:00,0.0,0.0,0.0,0.0,0.0,0.0,394677.0,Yulya Carella,2025-04-05 08:41:37
13041,724281,15,44986387,76,Fiona Buttigieg (Malta) Substitution at 93',Fiona Buttigieg Substitution,2,5400,90'+3',20864,0,0,1980-01-01 00:00:00,0.0,0.0,0.0,0.0,0.0,0.0,378577.0,Fiona Buttigieg,2025-04-05 08:41:37
13041,724281,16,44986393,98,Natia Danelia (Georgia) Penalty - Scored at 96',Natia Danelia Penalty - Scored,2,5400,90'+6',20971,0,0,1980-01-01 00:00:00,0.0,0.0,0.0,0.0,0.0,0.0,339402.0,Natia Danelia,2025-04-05 08:41:37
13041,724281,14,44986386,76,Yulya Carella (Malta) Substitution at 93',Yulya Carella Substitution,2,5400,90'+3',20864,0,0,1980-01-01 00:00:00,0.0,0.0,0.0,0.0,0.0,0.0,339556.0,Haley Bugeja,2025-04-05 08:41:37
13041,724281,15,44986387,76,Fiona Buttigieg (Malta) Substitution at 93',Fiona Buttigieg Substitution,2,5400,90'+3',20864,0,0,1980-01-01 00:00:00,0.0,0.0,0.0,0.0,0.0,0.0,314511.0,Emma Xuereb,2025-04-05 08:41:37
13041,724282,1,44986260,76,Katie McCabe (Republic of Ireland) Substitution at 45',Katie McCabe Substitution,2,2700,45',4178,0,0,1980-01-01 00:00:00,0.0,0.0,0.0,0.0,0.0,0.0,219079.0,Katie McCabe,2025-04-05 08:41:37
13041,724282,2,44986261,76,Marissa Sheva (Republic of Ireland) Substitution at 45',Marissa Sheva Substitution,2,2700,45',4178,0,0,1980-01-01 00:00:00,0.0,0.0,0.0,0.0,0.0,0.0,226079.0,Marissa Sheva,2025-04-05 08:41:37
13041,724282,1,44986260,76,Katie McCabe (Republic of Ireland) Substitution at 45',Katie McCabe Substitution,2,2700,45',4178,0,0,1980-01-01 00:00:00,0.0,0.0,0.0,0.0,0.0,0.0,211618.0,Megan Campbell,2025-04-05 08:41:37
13041,724282,2,44986261,76,Marissa Sheva (Republic of Ireland) Substitution at 45',Marissa Sheva Substitution,2,2700,45',4178,0,0,1980-01-01 00:00:00,0.0,0.0,0.0,0.0,0.0,0.0,287522.0,Tyler Toland,2025-04-05 08:41:37
13041,724282,3,44986263,70,Marissa Sheva (Republic of Ireland) Goal at 49',Marissa Sheva Goal,2,2940,49',4178,0,0,1980-01-01 00:00:00,0.0,0.0,0.0,0.0,0.0,0.0,226079.0,Marissa Sheva,2025-04-05 08:41:37
13041,724282,4,44986268,94,Katie McCabe (Republic of Ireland) Yellow Card at 55',Katie McCabe Yellow Card,2,3300,55',4178,0,0,1980-01-01 00:00:00,0.0,0.0,0.0,0.0,0.0,0.0,219079.0,Katie McCabe,2025-04-05 08:41:37
13041,724282,5,44986269,94,Stamatia Ntarzanou (Greece) Yellow Card at 56',Stamatia Ntarzanou Yellow Card,2,3360,56',2976,0,0,1980-01-01 00:00:00,0.0,0.0,0.0,0.0,0.0,0.0,400677.0,Stamatia Ntarzanou,2025-04-05 08:41:37
13041,724282,6,44986272,76,Maria Paterna (Greece) Substitution at 57',Maria Paterna Substitution,2,3420,57',2976,0,0,1980-01-01 00:00:00,0.0,0.0,0.0,0.0,0.0,0.0,339440.0,Maria Paterna,2025-04-05 08:41:37
13041,724282,7,44986273,76,Anastasia Gkatsou (Greece) Substitution at 57',Anastasia Gkatsou Substitution,2,3420,57',2976,0,0,1980-01-01 00:00:00,0.0,0.0,0.0,0.0,0.0,0.0,367952.0,Anastasia Gkatsou,2025-04-05 08:41:37
13041,724282,6,44986272,76,Maria Paterna (Greece) Substitution at 57',Maria Paterna Substitution,2,3420,57',2976,0,0,1980-01-01 00:00:00,0.0,0.0,0.0,0.0,0.0,0.0,400677.0,Stamatia Ntarzanou,2025-04-05 08:41:37
13041,724282,7,44986273,76,Anastasia Gkatsou (Greece) Substitution at 57',Anastasia Gkatsou Substitution,2,3420,57',2976,0,0,1980-01-01 00:00:00,0.0,0.0,0.0,0.0,0.0,0.0,398208.0,Maria Papaioannou,2025-04-05 08:41:37
13041,724282,8,44986276,70,Kyra Carusa (Republic of Ireland) Goal at 61',Kyra Carusa Goal,2,3660,61',4178,0,0,1980-01-01 00:00:00,0.0,0.0,0.0,0.0,0.0,0.0,230968.0,Kyra Carusa,2025-04-05 08:41:37
13041,724282,9,44986278,76,Abbie Larkin (Republic of Ireland) Substitution at 61',Abbie Larkin Substitution,2,3660,61',4178,0,0,1980-01-01 00:00:00,0.0,0.0,0.0,0.0,0.0,0.0,336368.0,Abbie Larkin,2025-04-05 08:41:37
13041,724282,9,44986278,76,Abbie Larkin (Republic of Ireland) Substitution at 61',Abbie Larkin Substitution,2,3660,61',4178,0,0,1980-01-01 00:00:00,0.0,0.0,0.0,0.0,0.0,0.0,287518.0,Leanne Kiernan,2025-04-05 08:41:37
13041,724282,10,44986279,76,Eleni Kakambouki (Greece) Substitution at 72',Eleni Kakambouki Substitution,2,4320,72',2976,0,0,1980-01-01 00:00:00,0.0,0.0,0.0,0.0,0.0,0.0,339433.0,Eleni Kakambouki,2025-04-05 08:41:37
13041,724282,11,44986280,76,Sophia Koggouli (Greece) Substitution at 72',Sophia Koggouli Substitution,2,4320,72',2976,0,0,1980-01-01 00:00:00,0.0,0.0,0.0,0.0,0.0,0.0,339437.0,Sophia Koggouli,2025-04-05 08:41:37
13041,724282,10,44986279,76,Eleni Kakambouki (Greece) Substitution at 72',Eleni Kakambouki Substitution,2,4320,72',2976,0,0,1980-01-01 00:00:00,0.0,0.0,0.0,0.0,0.0,0.0,295614.0,Athanasia Moraitou,2025-04-05 08:41:37
13041,724282,11,44986280,76,Sophia Koggouli (Greece) Substitution at 72',Sophia Koggouli Substitution,2,4320,72',2976,0,0,1980-01-01 00:00:00,0.0,0.0,0.0,0.0,0.0,0.0,339441.0,Anastasia Spyridonidou,2025-04-05 08:41:37
13041,724282,12,44986281,70,Jessie Stapleton (Republic of Ireland) Goal at 74',Jessie Stapleton Goal,2,4440,74',4178,0,0,1980-01-01 00:00:00,0.0,0.0,0.0,0.0,0.0,0.0,331326.0,Jessie Stapleton,2025-04-05 08:41:37
13041,724282,13,44986283,76,Ioanna Chamalidou (Greece) Substitution at 77',Ioanna Chamalidou Substitution,2,4620,77',2976,0,0,1980-01-01 00:00:00,0.0,0.0,0.0,0.0,0.0,0.0,339729.0,Ioanna Chamalidou,2025-04-05 08:41:37
13041,724282,13,44986283,76,Ioanna Chamalidou (Greece) Substitution at 77',Ioanna Chamalidou Substitution,2,4620,77',2976,0,0,1980-01-01 00:00:00,0.0,0.0,0.0,0.0,0.0,0.0,339428.0,Eleni Markou,2025-04-05 08:41:37
13041,724282,14,44986287,76,Amber Barrett (Republic of Ireland) Substitution at 79',Amber Barrett Substitution,2,4740,79',4178,0,0,1980-01-01 00:00:00,0.0,0.0,0.0,0.0,0.0,0.0,287526.0,Amber Barrett,2025-04-05 08:41:37
13041,724282,14,44986287,76,Amber Barrett (Republic of Ireland) Substitution at 79',Amber Barrett Substitution,2,4740,79',4178,0,0,1980-01-01 00:00:00,0.0,0.0,0.0,0.0,0.0,0.0,230968.0,Kyra Carusa,2025-04-05 08:41:37
13041,724282,15,44986298,76,Emily Murphy (Republic of Ireland) Substitution at 85',Emily Murphy Substitution,2,5100,85',4178,0,0,1980-01-01 00:00:00,0.0,0.0,0.0,0.0,0.0,0.0,299472.0,Emily Murphy,2025-04-05 08:41:37
13041,724282,15,44986298,76,Emily Murphy (Republic of Ireland) Substitution at 85',Emily Murphy Substitution,2,5100,85',4178,0,0,1980-01-01 00:00:00,0.0,0.0,0.0,0.0,0.0,0.0,312493.0,Lucy Quinn,2025-04-05 08:41:37
13041,724282,16,44986302,70,Amber Barrett (Republic of Ireland) Goal at 93',Amber Barrett Goal,2,5400,90'+3',4178,0,0,1980-01-01 00:00:00,0.0,0.0,0.0,0.0,0.0,0.0,287526.0,Amber Barrett,2025-04-05 08:41:37
13041,724283,1,44986992,94,Vesna Milivojevic (Serbia) Yellow Card at 50',Vesna Milivojevic Yellow Card,2,3000,50',20884,0,0,1980-01-01 00:00:00,0.0,0.0,0.0,0.0,0.0,0.0,300515.0,Vesna Milivojevic,2025-04-05 08:41:37
13041,724283,2,44987029,94,Tijana Filipovic (Serbia) Yellow Card at 53',Tijana Filipovic Yellow Card,2,3180,53',20884,0,0,1980-01-01 00:00:00,0.0,0.0,0.0,0.0,0.0,0.0,339630.0,Tijana Filipovic,2025-04-05 08:41:37
13041,724283,3,44987067,76,Miljana Ivanovic (Serbia) Substitution at 56',Miljana Ivanovic Substitution,2,3360,56',20884,0,0,1980-01-01 00:00:00,0.0,0.0,0.0,0.0,0.0,0.0,339635.0,Miljana Ivanovic,2025-04-05 08:41:37
13041,724283,4,44987068,76,Marija Ilic (Serbia) Substitution at 56',Marija Ilic Substitution,2,3360,56',20884,0,0,1980-01-01 00:00:00,0.0,0.0,0.0,0.0,0.0,0.0,315107.0,Marija Ilic,2025-04-05 08:41:37
13041,724283,3,44987067,76,Miljana Ivanovic (Serbia) Substitution at 56',Miljana Ivanovic Substitution,2,3360,56',20884,0,0,1980-01-01 00:00:00,0.0,0.0,0.0,0.0,0.0,0.0,339632.0,Emilija Petrovic,2025-04-05 08:41:37
13041,724283,4,44987068,76,Marija Ilic (Serbia) Substitution at 56',Marija Ilic Substitution,2,3360,56',20884,0,0,1980-01-01 00:00:00,0.0,0.0,0.0,0.0,0.0,0.0,343565.0,Dina Blagojevic,2025-04-05 08:41:37
13041,724283,5,44987217,76,Luca Papp (Hungary) Substitution at 64',Luca Papp Substitution,2,3840,64',20919,0,0,1980-01-01 00:00:00,0.0,0.0,0.0,0.0,0.0,0.0,339740.0,Luca Papp,2025-04-05 08:41:37
13041,724283,6,44987218,76,Emoke Pápai (Hungary) Substitution at 64',Emoke Pápai Substitution,2,3840,64',20919,0,0,1980-01-01 00:00:00,0.0,0.0,0.0,0.0,0.0,0.0,336065.0,Emoke Pápai,2025-04-05 08:41:37
13041,724283,5,44987217,76,Luca Papp (Hungary) Substitution at 64',Luca Papp Substitution,2,3840,64',20919,0,0,1980-01-01 00:00:00,0.0,0.0,0.0,0.0,0.0,0.0,396181.0,Fanni Nagy,2025-04-05 08:41:37
13041,724283,6,44987218,76,Emoke Pápai (Hungary) Substitution at 64',Emoke Pápai Substitution,2,3840,64',20919,0,0,1980-01-01 00:00:00,0.0,0.0,0.0,0.0,0.0,0.0,336063.0,Viktória Szabó,2025-04-05 08:41:37
13041,724283,7,44987276,70,Nina Matejic (Serbia) Goal at 69',Nina Matejic Goal,2,4140,69',20884,0,0,1980-01-01 00:00:00,0.0,0.0,0.0,0.0,0.0,0.0,339639.0,Nina Matejic,2025-04-05 08:41:37
13041,724283,8,44987362,76,Sára Pusztai (Hungary) Substitution at 75',Sára Pusztai Substitution,2,4500,75',20919,0,0,1980-01-01 00:00:00,0.0,0.0,0.0,0.0,0.0,0.0,339739.0,Sára Pusztai,2025-04-05 08:41:37
13041,724283,9,44987363,94,Henrietta Csiszár (Hungary) Yellow Card at 75',Henrietta Csiszár Yellow Card,2,4500,75',20919,0,0,1980-01-01 00:00:00,0.0,0.0,0.0,0.0,0.0,0.0,336062.0,Henrietta Csiszár,2025-04-05 08:41:37
13041,724283,8,44987362,76,Sára Pusztai (Hungary) Substitution at 75',Sára Pusztai Substitution,2,4500,75',20919,0,0,1980-01-01 00:00:00,0.0,0.0,0.0,0.0,0.0,0.0,336066.0,Diana Csányi,2025-04-05 08:41:37
13041,724283,10,44987442,76,Sara Stokic (Serbia) Substitution at 79',Sara Stokic Substitution,2,4740,79',20884,0,0,1980-01-01 00:00:00,0.0,0.0,0.0,0.0,0.0,0.0,398220.0,Sara Stokic,2025-04-05 08:41:37
13041,724283,10,44987442,76,Sara Stokic (Serbia) Substitution at 79',Sara Stokic Substitution,2,4740,79',20884,0,0,1980-01-01 00:00:00,0.0,0.0,0.0,0.0,0.0,0.0,300515.0,Vesna Milivojevic,2025-04-05 08:41:37
13041,724283,11,44987563,76,Virág Nagy (Hungary) Substitution at 86',Virág Nagy Substitution,2,5160,86',20919,0,0,1980-01-01 00:00:00,0.0,0.0,0.0,0.0,0.0,0.0,339743.0,Virág Nagy,2025-04-05 08:41:37
13041,724283,11,44987563,76,Virág Nagy (Hungary) Substitution at 86',Virág Nagy Substitution,2,5160,86',20919,0,0,1980-01-01 00:00:00,0.0,0.0,0.0,0.0,0.0,0.0,311201.0,Anna Csiki,2025-04-05 08:41:37
13041,724283,12,44987638,76,Zivana Stupar (Serbia) Substitution at 90',Zivana Stupar Substitution,2,5400,90',20884,0,0,1980-01-01 00:00:00,0.0,0.0,0.0,0.0,0.0,0.0,339646.0,Zivana Stupar,2025-04-05 08:41:37
13041,724283,13,44987639,76,Milica Mijatovic (Serbia) Substitution at 90',Milica Mijatovic Substitution,2,5400,90',20884,0,0,1980-01-01 00:00:00,0.0,0.0,0.0,0.0,0.0,0.0,300523.0,Milica Mijatovic,2025-04-05 08:41:37
