seasonType,eventId,playOrder,playId,typeId,text,shortText,period,clockValue,clockDisplayValue,teamId,scoringPlay,shootout,wallclock,goalPositionX,goalPositionY,fieldpositionX,fieldPositionY,fieldPosition2X,fieldPosition2Y,athleteId,participant,updateDateTime
13495,742175,2,45731118,94,Ben Johnstone (Queen of the South) Yellow Card at 42',Ben Johnstone Yellow Card,1,2520,42',406,0,0,2025-08-23 14:41:25,0.0,0.0,0.0,0.0,0.0,0.0,260598,Ben Johnstone,2025-08-24 04:57:23
13495,742175,3,45732304,76,Michael Hewitt (Queen of the South) Substitution at 62',Michael Hewitt Substitution,2,3720,62',406,0,0,2025-08-23 15:18:35,0.0,0.0,0.0,0.0,0.0,0.0,271185,Michael Hewitt,2025-08-24 04:57:23
13495,742175,3,45732304,76,Michael Hewitt (Queen of the South) Substitution at 62',Michael Hewitt Substitution,2,3720,62',406,0,0,2025-08-23 15:18:35,0.0,0.0,0.0,0.0,0.0,0.0,365996,Callum Penman,2025-08-24 04:57:23
13495,742175,4,45732485,94,Scott McGill (Stenhousemuir) Yellow Card at 65',Scott McGill Yellow Card,2,3900,65',405,0,0,2025-08-23 15:22:08,0.0,0.0,0.0,0.0,0.0,0.0,290707,Scott McGill,2025-08-24 04:57:23
13495,742175,5,45732749,76,Nicky Jamieson (Stenhousemuir) Substitution at 71',Nicky Jamieson Substitution,2,4260,71',405,0,0,2025-08-23 15:27:45,0.0,0.0,0.0,0.0,0.0,0.0,190512,Nicky Jamieson,2025-08-24 04:57:23
13495,742175,5,45732749,76,Nicky Jamieson (Stenhousemuir) Substitution at 71',Nicky Jamieson Substitution,2,4260,71',405,0,0,2025-08-23 15:27:45,0.0,0.0,0.0,0.0,0.0,0.0,290707,Scott McGill,2025-08-24 04:57:23
13495,742175,6,45732750,76,Matthew Aitken (Stenhousemuir) Substitution at 72',Matthew Aitken Substitution,2,4320,72',405,0,0,2025-08-23 15:28:17,0.0,0.0,0.0,0.0,0.0,0.0,212362,Matthew Aitken,2025-08-24 04:57:23
13495,742175,7,45732751,76,Freddie O'Donoghue (Queen of the South) Substitution at 72',Freddie O'Donoghue Substitution,2,4320,72',406,0,0,2025-08-23 15:28:27,0.0,0.0,0.0,0.0,0.0,0.0,390647,Freddie O'Donoghue,2025-08-24 04:57:23
13495,742175,6,45732750,76,Matthew Aitken (Stenhousemuir) Substitution at 72',Matthew Aitken Substitution,2,4320,72',405,0,0,2025-08-23 15:28:17,0.0,0.0,0.0,0.0,0.0,0.0,12821,Ross Taylor,2025-08-24 04:57:23
13495,742175,7,45732751,76,Freddie O'Donoghue (Queen of the South) Substitution at 72',Freddie O'Donoghue Substitution,2,4320,72',406,0,0,2025-08-23 15:28:27,0.0,0.0,0.0,0.0,0.0,0.0,260598,Ben Johnstone,2025-08-24 04:57:23
13495,742175,8,45733400,76,Kinlay Bilham (Stenhousemuir) Substitution at 86',Kinlay Bilham Substitution,2,5160,86',405,0,0,2025-08-23 15:43:05,0.0,0.0,0.0,0.0,0.0,0.0,322774,Kinlay Bilham,2025-08-24 04:57:23
13495,742175,8,45733400,76,Kinlay Bilham (Stenhousemuir) Substitution at 86',Kinlay Bilham Substitution,2,5160,86',405,0,0,2025-08-23 15:43:05,0.0,0.0,0.0,0.0,0.0,0.0,366706,Olly Whyte,2025-08-24 04:57:23
13495,742175,9,45733472,94,Reece Lyon (Queen of the South) Yellow Card at 88',Reece Lyon Yellow Card,2,5280,88',406,0,0,2025-08-23 15:44:46,0.0,0.0,0.0,0.0,0.0,0.0,277539,Reece Lyon,2025-08-24 04:57:23
13495,742175,10,45733503,94,Matthew Aitken (Stenhousemuir) Yellow Card at 89',Matthew Aitken Yellow Card,2,5340,89',405,0,0,2025-08-23 15:45:45,0.0,0.0,0.0,0.0,0.0,0.0,212362,Matthew Aitken,2025-08-24 04:57:23
13495,742175,11,45733640,94,Kinlay Bilham (Stenhousemuir) Yellow Card at 93',Kinlay Bilham Yellow Card,2,5400,90'+3',405,0,0,2025-08-23 15:49:48,0.0,0.0,0.0,0.0,0.0,0.0,322774,Kinlay Bilham,2025-08-24 04:57:23
13495,742176,1,45796224,76,Stuart Mckinstry (Hamilton Academical) Substitution at 71',Stuart Mckinstry Substitution,2,4260,71',409,0,0,2025-08-30 17:54:40,0.0,0.0,0.0,0.0,0.0,0.0,284083,Stuart Mckinstry,2025-08-31 05:07:20
13495,742176,2,45796225,76,Bobby Mcluckie (Hamilton Academical) Substitution at 71',Bobby Mcluckie Substitution,2,4260,71',409,0,0,2025-08-30 17:54:41,0.0,0.0,0.0,0.0,0.0,0.0,346188,Bobby Mcluckie,2025-08-31 05:07:20
13495,742176,1,45796224,76,Stuart Mckinstry (Hamilton Academical) Substitution at 71',Stuart Mckinstry Substitution,2,4260,71',409,0,0,2025-08-30 17:54:40,0.0,0.0,0.0,0.0,0.0,0.0,157908,Stephen Hendrie,2025-08-31 05:07:20
13495,742176,2,45796225,76,Bobby Mcluckie (Hamilton Academical) Substitution at 71',Bobby Mcluckie Substitution,2,4260,71',409,0,0,2025-08-30 17:54:41,0.0,0.0,0.0,0.0,0.0,0.0,390678,Ewan Simpson,2025-08-31 05:07:20
13495,742176,3,45796284,94,Mitchel Megginson (Cove Rangers) Yellow Card at 73',Mitchel Megginson Yellow Card,2,4380,73',2613,0,0,2025-08-30 17:57:10,0.0,0.0,0.0,0.0,0.0,0.0,137801,Mitchel Megginson,2025-08-31 05:07:20
13495,742176,4,45796526,76,Cole Donaldson (Cove Rangers) Substitution at 86',Cole Donaldson Substitution,2,5160,86',2613,0,0,2025-08-30 18:09:42,0.0,0.0,0.0,0.0,0.0,0.0,387350,Cole Donaldson,2025-08-31 05:07:20
13495,742176,4,45796526,76,Cole Donaldson (Cove Rangers) Substitution at 86',Cole Donaldson Substitution,2,5160,86',2613,0,0,2025-08-30 18:09:42,0.0,0.0,0.0,0.0,0.0,0.0,347007,Jackson Mylchreest,2025-08-31 05:07:20
13495,742176,5,45823963,94,Connot Smith (Hamilton Academical) Yellow Card at 93',Connot Smith Yellow Card,2,5400,90'+3',409,0,0,2025-08-30 18:17:07,0.0,0.0,0.0,0.0,0.0,0.0,261410,Connot Smith,2025-09-05 05:16:29
13495,742177,1,45790599,94,Remi Savage (Inverness Caledonian Thistle) Yellow Card at 16',Remi Savage Yellow Card,1,960,16',253,0,0,2025-08-30 14:18:17,0.0,0.0,0.0,0.0,0.0,0.0,291632,Remi Savage,2025-08-31 05:07:20
13495,742177,2,45791862,76,Calum Adamson (Alloa Athletic) Substitution at 45',Calum Adamson Substitution,2,2700,45',403,0,0,2025-08-30 15:03:10,0.0,0.0,0.0,0.0,0.0,0.0,285387,Calum Adamson,2025-08-31 05:07:20
13495,742177,2,45791862,76,Calum Adamson (Alloa Athletic) Substitution at 45',Calum Adamson Substitution,2,2700,45',403,0,0,2025-08-30 15:03:10,0.0,0.0,0.0,0.0,0.0,0.0,153015,Stefan Scougall,2025-08-31 05:07:20
13495,742177,3,45792659,76,Chanka Zimba (Inverness Caledonian Thistle) Substitution at 62',Chanka Zimba Substitution,2,3720,62',253,0,0,2025-08-30 15:20:24,0.0,0.0,0.0,0.0,0.0,0.0,312007,Chanka Zimba,2025-08-31 05:07:20
13495,742177,3,45792659,76,Chanka Zimba (Inverness Caledonian Thistle) Substitution at 62',Chanka Zimba Substitution,2,3720,62',253,0,0,2025-08-30 15:20:24,0.0,0.0,0.0,0.0,0.0,0.0,137726,David Wotherspoon,2025-08-31 05:07:20
13495,742177,4,45792964,76,Liam Sole (Inverness Caledonian Thistle) Substitution at 68',Liam Sole Substitution,2,4080,68',253,0,0,2025-08-30 15:26:45,0.0,0.0,0.0,0.0,0.0,0.0,267334,Liam Sole,2025-08-31 05:07:20
13495,742177,4,45792964,76,Liam Sole (Inverness Caledonian Thistle) Substitution at 68',Liam Sole Substitution,2,4080,68',253,0,0,2025-08-30 15:26:45,0.0,0.0,0.0,0.0,0.0,0.0,291645,Luis Longstaff,2025-08-31 05:07:20
13495,742177,5,45793166,70,Liam Sole (Inverness Caledonian Thistle) Goal at 72',Liam Sole Goal,2,4320,72',253,0,0,2025-08-30 15:30:55,0.0,0.0,0.0,0.0,0.0,0.0,267334,Liam Sole,2025-08-31 05:07:20
13495,742177,6,45793346,76,Luke Donnelly (Alloa Athletic) Substitution at 76',Luke Donnelly Substitution,2,4560,76',403,0,0,2025-08-30 15:34:23,0.0,0.0,0.0,0.0,0.0,0.0,213517,Luke Donnelly,2025-08-31 05:07:20
13495,742177,6,45793346,76,Luke Donnelly (Alloa Athletic) Substitution at 76',Luke Donnelly Substitution,2,4560,76',403,0,0,2025-08-30 15:34:23,0.0,0.0,0.0,0.0,0.0,0.0,207443,Kalvin Orsi,2025-08-31 05:07:20
13495,742177,7,45793743,94,Steven Buchanan (Alloa Athletic) Yellow Card at 85',Steven Buchanan Yellow Card,2,5100,85',403,0,0,2025-08-30 15:43:17,0.0,0.0,0.0,0.0,0.0,0.0,345183,Steven Buchanan,2025-08-31 05:07:20
13495,742177,8,45793816,76,Robbie Thompson (Inverness Caledonian Thistle) Substitution at 85',Robbie Thompson Substitution,2,5100,85',253,0,0,2025-08-30 15:43:34,0.0,0.0,0.0,0.0,0.0,0.0,176966,Robbie Thompson,2025-08-31 05:07:20
13495,742177,9,45793817,76,Adam Mackinnon (Inverness Caledonian Thistle) Substitution at 85',Adam Mackinnon Substitution,2,5100,85',253,0,0,2025-08-30 15:43:35,0.0,0.0,0.0,0.0,0.0,0.0,291498,Adam Mackinnon,2025-08-31 05:07:20
13495,742177,8,45793816,76,Robbie Thompson (Inverness Caledonian Thistle) Substitution at 85',Robbie Thompson Substitution,2,5100,85',253,0,0,2025-08-30 15:43:34,0.0,0.0,0.0,0.0,0.0,0.0,324735,Alfie Bavidge,2025-08-31 05:07:20
13495,742177,9,45793817,76,Adam Mackinnon (Inverness Caledonian Thistle) Substitution at 85',Adam Mackinnon Substitution,2,5100,85',253,0,0,2025-08-30 15:43:35,0.0,0.0,0.0,0.0,0.0,0.0,138377,Billy McKay,2025-08-31 05:07:20
13495,742177,10,45793823,76,Lewis Bruin (Alloa Athletic) Substitution at 86',Lewis Bruin Substitution,2,5160,86',403,0,0,2025-08-30 15:44:51,0.0,0.0,0.0,0.0,0.0,0.0,397572,Lewis Bruin,2025-08-31 05:07:20
13495,742177,10,45793823,76,Lewis Bruin (Alloa Athletic) Substitution at 86',Lewis Bruin Substitution,2,5160,86',403,0,0,2025-08-30 15:44:51,0.0,0.0,0.0,0.0,0.0,0.0,345183,Steven Buchanan,2025-08-31 05:07:20
13495,742177,11,45794039,94,Robbie Thompson (Inverness Caledonian Thistle) Yellow Card at 90',Robbie Thompson Yellow Card,2,5400,90',253,0,0,2025-08-30 15:48:33,0.0,0.0,0.0,0.0,0.0,0.0,176966,Robbie Thompson,2025-08-31 05:07:20
13495,742178,1,45790401,70,Aidan Quinn (Montrose) Goal at 13',Aidan Quinn Goal,1,780,13',414,0,0,2025-08-30 14:12:40,0.0,0.0,0.0,0.0,0.0,0.0,302082,Aidan Quinn,2025-08-31 05:07:20
13495,742178,2,45790584,76,Adam Carnwath (Peterhead) Substitution at 18',Adam Carnwath Substitution,1,1080,18',416,0,0,2025-08-30 14:17:30,0.0,0.0,0.0,0.0,0.0,0.0,376984,Adam Carnwath,2025-08-31 05:07:20
13495,742178,2,45790584,76,Adam Carnwath (Peterhead) Substitution at 18',Adam Carnwath Substitution,1,1080,18',416,0,0,2025-08-30 14:17:30,0.0,0.0,0.0,0.0,0.0,0.0,292263,Danny Strachan,2025-08-31 05:07:20
13495,742178,3,45790700,70,Blair Lyons (Montrose) Goal at 23',Blair Lyons Goal,1,1380,23',414,0,0,2025-08-30 14:22:07,0.0,0.0,0.0,0.0,0.0,0.0,250578,Blair Lyons,2025-08-31 05:07:20
13495,742178,4,45791008,70,Kieran Shanks (Peterhead) Goal at 34',Kieran Shanks Goal,1,2040,34',416,0,0,2025-08-30 14:33:25,0.0,0.0,0.0,0.0,0.0,0.0,291447,Kieran Shanks,2025-08-31 05:07:20
13495,742178,5,45791860,76,Ross Clark (Montrose) Substitution at 45',Ross Clark Substitution,2,2700,45',414,0,0,2025-08-30 15:03:05,0.0,0.0,0.0,0.0,0.0,0.0,388261,Ross Clark,2025-08-31 05:07:20
13495,742178,5,45791860,76,Ross Clark (Montrose) Substitution at 45',Ross Clark Substitution,2,2700,45',414,0,0,2025-08-30 15:03:05,0.0,0.0,0.0,0.0,0.0,0.0,77584,Terry Masson,2025-08-31 05:07:20
13495,742178,6,45792164,174,Ewan Loudon (Montrose) Penalty - Saved at 51',Ewan Loudon Penalty - Saved,2,3060,51',414,0,0,1980-01-01 00:00:00,0.0,0.0,0.0,0.0,0.0,0.0,324917,Ewan Loudon,2025-08-31 05:07:20
13495,742178,7,45792568,94,Kieran Freeman (Montrose) Yellow Card at 59',Kieran Freeman Yellow Card,2,3540,59',414,0,0,2025-08-30 15:17:45,0.0,0.0,0.0,0.0,0.0,0.0,150839,Kieran Freeman,2025-08-31 05:07:20
13495,742178,8,45792945,76,Lewis Gibson (Montrose) Substitution at 68',Lewis Gibson Substitution,2,4080,68',414,0,0,2025-08-30 15:25:57,0.0,0.0,0.0,0.0,0.0,0.0,347398,Lewis Gibson,2025-08-31 05:07:20
13495,742178,8,45792945,76,Lewis Gibson (Montrose) Substitution at 68',Lewis Gibson Substitution,2,4080,68',414,0,0,2025-08-30 15:25:57,0.0,0.0,0.0,0.0,0.0,0.0,144362,Michael Tidser,2025-08-31 05:07:20
13495,742178,9,45793021,76,Niall McGinn (Peterhead) Substitution at 69',Niall McGinn Substitution,2,4140,69',416,0,0,2025-08-30 15:27:48,0.0,0.0,0.0,0.0,0.0,0.0,82925,Niall McGinn,2025-08-31 05:07:20
13495,742178,10,45793022,76,Sebastian Ross (Peterhead) Substitution at 69',Sebastian Ross Substitution,2,4140,69',416,0,0,2025-08-30 15:27:49,0.0,0.0,0.0,0.0,0.0,0.0,239223,Sebastian Ross,2025-08-31 05:07:20
13495,742178,9,45793021,76,Niall McGinn (Peterhead) Substitution at 69',Niall McGinn Substitution,2,4140,69',416,0,0,2025-08-30 15:27:48,0.0,0.0,0.0,0.0,0.0,0.0,291446,Max Barry,2025-08-31 05:07:20
13495,742178,10,45793022,76,Sebastian Ross (Peterhead) Substitution at 69',Sebastian Ross Substitution,2,4140,69',416,0,0,2025-08-30 15:27:49,0.0,0.0,0.0,0.0,0.0,0.0,206454,Craig McGuffie,2025-08-31 05:07:20
13495,742178,11,45793189,94,Evan Towler (Montrose) Yellow Card at 73',Evan Towler Yellow Card,2,4380,73',414,0,0,2025-08-30 15:31:43,0.0,0.0,0.0,0.0,0.0,0.0,324750,Evan Towler,2025-08-31 05:07:20
13495,742178,12,45793365,94,Lewis Gibson (Montrose) Yellow Card at 76',Lewis Gibson Yellow Card,2,4560,76',414,0,0,2025-08-30 15:34:02,0.0,0.0,0.0,0.0,0.0,0.0,347398,Lewis Gibson,2025-08-31 05:07:20
13495,742178,13,45793593,76,Oliver Colloty (Peterhead) Substitution at 80',Oliver Colloty Substitution,2,4800,80',416,0,0,2025-08-30 15:38:45,0.0,0.0,0.0,0.0,0.0,0.0,362626,Oliver Colloty,2025-08-31 05:07:20
13495,742178,14,45793594,76,Jack Brown (Peterhead) Substitution at 80',Jack Brown Substitution,2,4800,80',416,0,0,2025-08-30 15:38:46,0.0,0.0,0.0,0.0,0.0,0.0,255732,Jack Brown,2025-08-31 05:07:20
13495,742178,13,45793593,76,Oliver Colloty (Peterhead) Substitution at 80',Oliver Colloty Substitution,2,4800,80',416,0,0,2025-08-30 15:38:45,0.0,0.0,0.0,0.0,0.0,0.0,311111,Flynn Duffy,2025-08-31 05:07:20
13495,742178,14,45793594,76,Jack Brown (Peterhead) Substitution at 80',Jack Brown Substitution,2,4800,80',416,0,0,2025-08-30 15:38:46,0.0,0.0,0.0,0.0,0.0,0.0,173126,Cameron Smith,2025-08-31 05:07:20
13495,742178,15,45793891,76,Matheus Machado (Montrose) Substitution at 88',Matheus Machado Substitution,2,5280,88',414,0,0,2025-08-30 15:46:03,0.0,0.0,0.0,0.0,0.0,0.0,287071,Matheus Machado,2025-08-31 05:07:20
13495,742178,16,45793892,76,Harry Craig (Montrose) Substitution at 88',Harry Craig Substitution,2,5280,88',414,0,0,2025-08-30 15:46:04,0.0,0.0,0.0,0.0,0.0,0.0,376256,Harry Craig,2025-08-31 05:07:20
13495,742178,15,45793891,76,Matheus Machado (Montrose) Substitution at 88',Matheus Machado Substitution,2,5280,88',414,0,0,2025-08-30 15:46:03,0.0,0.0,0.0,0.0,0.0,0.0,250578,Blair Lyons,2025-08-31 05:07:20
13495,742178,16,45793892,76,Harry Craig (Montrose) Substitution at 88',Harry Craig Substitution,2,5280,88',414,0,0,2025-08-30 15:46:04,0.0,0.0,0.0,0.0,0.0,0.0,153164,Graham Webster,2025-08-31 05:07:20
13495,742178,17,45794017,94,Ross Clark (Montrose) Yellow Card at 90',Ross Clark Yellow Card,2,5400,90',414,0,0,2025-08-30 15:48:04,0.0,0.0,0.0,0.0,0.0,0.0,388261,Ross Clark,2025-08-31 05:07:20
13495,742179,1,45790675,70,Kurtis Guthrie (Queen of the South) Goal at 21',Kurtis Guthrie Goal,1,1260,21',406,0,0,2025-08-30 14:21:18,0.0,0.0,0.0,0.0,0.0,0.0,164474,Kurtis Guthrie,2025-08-31 05:07:20
13495,742179,2,45790852,94,Brody Paterson (Kelty Hearts) Yellow Card at 26',Brody Paterson Yellow Card,1,1560,26',18018,0,0,2025-08-30 14:26:29,0.0,0.0,0.0,0.0,0.0,0.0,291502,Brody Paterson,2025-08-31 05:07:20
13495,742179,3,45791545,94,Innes Murray (Kelty Hearts) Yellow Card at 46',Innes Murray Yellow Card,1,2700,45'+1',18018,0,0,2025-08-30 14:46:40,0.0,0.0,0.0,0.0,0.0,0.0,239235,Innes Murray,2025-08-31 05:07:20
13495,742179,4,45792219,70,Aaron Arnott (Kelty Hearts) Goal at 53',Aaron Arnott Goal,2,3180,53',18018,0,0,2025-08-30 15:10:40,0.0,0.0,0.0,0.0,0.0,0.0,308681,Aaron Arnott,2025-08-31 05:07:20
13495,742179,5,45792680,76,Benjamin Luissint (Queen of the South) Substitution at 63',Benjamin Luissint Substitution,2,3780,63',406,0,0,2025-08-30 15:20:54,0.0,0.0,0.0,0.0,0.0,0.0,292911,Benjamin Luissint,2025-08-31 05:07:20
13495,742179,5,45792680,76,Benjamin Luissint (Queen of the South) Substitution at 63',Benjamin Luissint Substitution,2,3780,63',406,0,0,2025-08-30 15:20:54,0.0,0.0,0.0,0.0,0.0,0.0,260598,Ben Johnstone,2025-08-31 05:07:20
13495,742179,6,45792923,76,Joseph Teasdale (Kelty Hearts) Substitution at 67',Joseph Teasdale Substitution,2,4020,67',18018,0,0,2025-08-30 15:24:49,0.0,0.0,0.0,0.0,0.0,0.0,366765,Joseph Teasdale,2025-08-31 05:07:20
13495,742179,6,45792923,76,Joseph Teasdale (Kelty Hearts) Substitution at 67',Joseph Teasdale Substitution,2,4020,67',18018,0,0,2025-08-30 15:24:49,0.0,0.0,0.0,0.0,0.0,0.0,296138,Alexander Ferguson,2025-08-31 05:07:20
13495,742179,7,45792979,94,Jack Stott (Queen of the South) Yellow Card at 69',Jack Stott Yellow Card,2,4140,69',406,0,0,2025-08-30 15:26:26,0.0,0.0,0.0,0.0,0.0,0.0,144432,Jack Stott,2025-08-31 05:07:20
13495,742179,8,45793179,94,Kai Kennedy (Queen of the South) Yellow Card at 73',Kai Kennedy Yellow Card,2,4380,73',406,0,0,2025-08-30 15:30:29,0.0,0.0,0.0,0.0,0.0,0.0,277529,Kai Kennedy,2025-08-31 05:07:20
13495,742179,9,45793661,76,Freddie O'Donoghue (Queen of the South) Substitution at 83',Freddie O'Donoghue Substitution,2,4980,83',406,0,0,2025-08-30 15:40:57,0.0,0.0,0.0,0.0,0.0,0.0,390647,Freddie O'Donoghue,2025-08-31 05:07:20
13495,742179,10,45793662,76,Scott Mercer (Kelty Hearts) Substitution at 83',Scott Mercer Substitution,2,4980,83',18018,0,0,2025-08-30 15:41:06,0.0,0.0,0.0,0.0,0.0,0.0,179655,Scott Mercer,2025-08-31 05:07:20
13495,742179,9,45793661,76,Freddie O'Donoghue (Queen of the South) Substitution at 83',Freddie O'Donoghue Substitution,2,4980,83',406,0,0,2025-08-30 15:40:57,0.0,0.0,0.0,0.0,0.0,0.0,41258,Liam Smith,2025-08-31 05:07:20
13495,742179,10,45793662,76,Scott Mercer (Kelty Hearts) Substitution at 83',Scott Mercer Substitution,2,4980,83',18018,0,0,2025-08-30 15:41:06,0.0,0.0,0.0,0.0,0.0,0.0,144039,Craig Clay,2025-08-31 05:07:20
13495,742179,11,45793782,76,Lewis Carrol (Kelty Hearts) Substitution at 86',Lewis Carrol Substitution,2,5160,86',18018,0,0,2025-08-30 15:43:34,0.0,0.0,0.0,0.0,0.0,0.0,366766,Lewis Carrol,2025-08-31 05:07:20
13495,742179,12,45793783,76,Murray Thomas (Kelty Hearts) Substitution at 86',Murray Thomas Substitution,2,5160,86',18018,0,0,2025-08-30 15:43:35,0.0,0.0,0.0,0.0,0.0,0.0,266967,Murray Thomas,2025-08-31 05:07:20
13495,742179,11,45793782,76,Lewis Carrol (Kelty Hearts) Substitution at 86',Lewis Carrol Substitution,2,5160,86',18018,0,0,2025-08-30 15:43:34,0.0,0.0,0.0,0.0,0.0,0.0,397290,Jack Wyllie,2025-08-31 05:07:20
13495,742179,12,45793783,76,Murray Thomas (Kelty Hearts) Substitution at 86',Murray Thomas Substitution,2,5160,86',18018,0,0,2025-08-30 15:43:35,0.0,0.0,0.0,0.0,0.0,0.0,347341,James Graham,2025-08-31 05:07:20
13495,742179,13,45793886,70,Reece Lyon (Queen of the South) Goal at 88',Reece Lyon Goal,2,5280,88',406,0,0,2025-08-30 15:45:51,0.0,0.0,0.0,0.0,0.0,0.0,277539,Reece Lyon,2025-08-31 05:07:20
13495,742179,14,45794093,76,Cole Burke (Queen of the South) Substitution at 92',Cole Burke Substitution,2,5400,90'+2',406,0,0,2025-08-30 15:50:00,0.0,0.0,0.0,0.0,0.0,0.0,388266,Cole Burke,2025-08-31 05:07:20
13495,742179,14,45794093,76,Cole Burke (Queen of the South) Substitution at 92',Cole Burke Substitution,2,5400,90'+2',406,0,0,2025-08-30 15:50:00,0.0,0.0,0.0,0.0,0.0,0.0,144432,Jack Stott,2025-08-31 05:07:20
13495,742180,1,45791049,94,Gregor Buchanan (Stenhousemuir) Yellow Card at 33',Gregor Buchanan Yellow Card,1,1980,33',405,0,0,2025-08-30 14:34:52,0.0,0.0,0.0,0.0,0.0,0.0,176462,Greg Buchan,2025-08-31 05:07:20
13495,742180,2,45791830,76,Kinlay Bilham (Stenhousemuir) Substitution at 45',Kinlay Bilham Substitution,2,2700,45',405,0,0,2025-08-30 15:02:57,0.0,0.0,0.0,0.0,0.0,0.0,322774,Kinlay Bilham,2025-08-31 05:07:20
13495,742180,2,45791830,76,Kinlay Bilham (Stenhousemuir) Substitution at 45',Kinlay Bilham Substitution,2,2700,45',405,0,0,2025-08-30 15:02:57,0.0,0.0,0.0,0.0,0.0,0.0,328053,Kelsey Ewen,2025-08-31 05:07:20
13495,742180,3,45792168,94,Ross Meechan (Stenhousemuir) Yellow Card at 52',Ross Meechan Yellow Card,2,3120,52',405,0,0,2025-08-30 15:09:47,0.0,0.0,0.0,0.0,0.0,0.0,162845,Ross Meechan,2025-08-31 05:07:20
13495,742180,4,45792442,94,Sam Culbert (East Fife) Yellow Card at 58',Sam Culbert Yellow Card,2,3480,58',421,0,0,2025-08-30 15:15:58,0.0,0.0,0.0,0.0,0.0,0.0,347283,Sam Culbert,2025-08-31 05:07:20
13495,742180,5,45792520,94,Conor McManus (East Fife) Yellow Card at 60',Conor McManus Yellow Card,2,3600,60',421,0,0,2025-08-30 15:18:20,0.0,0.0,0.0,0.0,0.0,0.0,221694,Conor McManus,2025-08-31 05:07:20
13495,742180,6,45792699,94,Scott McGill (Stenhousemuir) Yellow Card at 63',Scott McGill Yellow Card,2,3780,63',405,0,0,2025-08-30 15:21:00,0.0,0.0,0.0,0.0,0.0,0.0,290707,Scott McGill,2025-08-31 05:07:20
13495,742180,7,45792700,94,Liam Newton (East Fife) Yellow Card at 63',Liam Newton Yellow Card,2,3780,63',421,0,0,2025-08-30 15:21:14,0.0,0.0,0.0,0.0,0.0,0.0,299920,Liam Newton,2025-08-31 05:07:20
13495,742180,8,45792769,76,Jess Norey (East Fife) Substitution at 65',Jess Norey Substitution,2,3900,65',421,0,0,2025-08-30 15:22:59,0.0,0.0,0.0,0.0,0.0,0.0,365402,Jess Norey,2025-08-31 05:07:20
13495,742180,9,45792770,76,Reis Peggie (East Fife) Substitution at 65',Reis Peggie Substitution,2,3900,65',421,0,0,2025-08-30 15:23:00,0.0,0.0,0.0,0.0,0.0,0.0,260603,Reis Peggie,2025-08-31 05:07:20
13495,742180,8,45792769,76,Jess Norey (East Fife) Substitution at 65',Jess Norey Substitution,2,3900,65',421,0,0,2025-08-30 15:22:59,0.0,0.0,0.0,0.0,0.0,0.0,353387,Lewis Latona,2025-08-31 05:07:20
13495,742180,9,45792770,76,Reis Peggie (East Fife) Substitution at 65',Reis Peggie Substitution,2,3900,65',421,0,0,2025-08-30 15:23:00,0.0,0.0,0.0,0.0,0.0,0.0,347283,Sam Culbert,2025-08-31 05:07:20
13495,742180,10,45792997,76,Michael Anderson (Stenhousemuir) Substitution at 69',Michael Anderson Substitution,2,4140,69',405,0,0,2025-08-30 15:27:45,0.0,0.0,0.0,0.0,0.0,0.0,13199,Michael Anderson,2025-08-31 05:07:20
13495,742180,10,45792997,76,Michael Anderson (Stenhousemuir) Substitution at 69',Michael Anderson Substitution,2,4140,69',405,0,0,2025-08-30 15:27:45,0.0,0.0,0.0,0.0,0.0,0.0,366706,Olly Whyte,2025-08-31 05:07:20
13495,742180,11,45793092,76,Rob Jones (East Fife) Substitution at 71',Rob Jones Substitution,2,4260,71',421,0,0,2025-08-30 15:29:24,0.0,0.0,0.0,0.0,0.0,0.0,26883,Rob Jones,2025-08-31 05:07:20
13495,742180,11,45793092,76,Rob Jones (East Fife) Substitution at 71',Rob Jones Substitution,2,4260,71',421,0,0,2025-08-30 15:29:24,0.0,0.0,0.0,0.0,0.0,0.0,306142,Tommy Goss,2025-08-31 05:07:20
13495,742180,12,45793149,93,Andrew Munro (East Fife) Red Card at 73',Andrew Munro Red Card,2,4380,73',421,0,0,2025-08-30 15:30:47,0.0,0.0,0.0,0.0,0.0,0.0,194882,Andrew Munro,2025-08-31 05:07:20
13495,742180,13,45793170,70,Ewan O'Reilly (Stenhousemuir) Goal at 74',Ewan O'Reilly Goal,2,4440,74',405,0,0,2025-08-30 15:31:52,0.0,0.0,0.0,0.0,0.0,0.0,240728,Ewan O'Reilly,2025-08-31 05:07:20
13495,742180,14,45793252,76,Mamadou Bah (East Fife) Substitution at 74',Mamadou Bah Substitution,2,4440,74',421,0,0,2025-08-30 15:32:28,0.0,0.0,0.0,0.0,0.0,0.0,362297,Mamadou Bah,2025-08-31 05:07:20
13495,742180,14,45793252,76,Mamadou Bah (East Fife) Substitution at 74',Mamadou Bah Substitution,2,4440,74',421,0,0,2025-08-30 15:32:28,0.0,0.0,0.0,0.0,0.0,0.0,299920,Liam Newton,2025-08-31 05:07:20
13495,742180,15,45793257,76,Matthew Aitken (Stenhousemuir) Substitution at 75',Matthew Aitken Substitution,2,4500,75',405,0,0,2025-08-30 15:33:24,0.0,0.0,0.0,0.0,0.0,0.0,212362,Matthew Aitken,2025-08-31 05:07:20
13495,742180,15,45793257,76,Matthew Aitken (Stenhousemuir) Substitution at 75',Matthew Aitken Substitution,2,4500,75',405,0,0,2025-08-30 15:33:24,0.0,0.0,0.0,0.0,0.0,0.0,176836,Dale Carrick,2025-08-31 05:07:20
13495,742180,16,45793658,76,Nicky Jamieson (Stenhousemuir) Substitution at 83',Nicky Jamieson Substitution,2,4980,83',405,0,0,2025-08-30 15:41:31,0.0,0.0,0.0,0.0,0.0,0.0,190512,Nicky Jamieson,2025-08-31 05:07:20
13495,742180,16,45793658,76,Nicky Jamieson (Stenhousemuir) Substitution at 83',Nicky Jamieson Substitution,2,4980,83',405,0,0,2025-08-30 15:41:31,0.0,0.0,0.0,0.0,0.0,0.0,12821,Ross Taylor,2025-08-31 05:07:20
13495,742180,17,45793903,94,Kinlay Bilham (Stenhousemuir) Yellow Card at 88',Kinlay Bilham Yellow Card,2,5280,88',405,0,0,2025-08-30 15:46:33,0.0,0.0,0.0,0.0,0.0,0.0,322774,Kinlay Bilham,2025-08-31 05:07:20
13495,742180,18,45793904,70,Nathan Austin (East Fife) Goal at 89',Nathan Austin Goal,2,5340,89',421,0,0,2025-08-30 15:47:03,0.0,0.0,0.0,0.0,0.0,0.0,190432,Nathan Austin,2025-08-31 05:07:20
13495,742181,1,45869472,94,Cameron Smith (Peterhead) Yellow Card at 29',Cameron Smith Yellow Card,1,1740,29',416,0,0,2025-09-13 14:29:21,0.0,0.0,0.0,0.0,0.0,0.0,173126,Cameron Smith,2025-09-14 05:27:11
13495,742181,2,45869516,70,Craig McGuffie (Peterhead) Goal at 30',Craig McGuffie Goal,1,1800,30',416,0,0,2025-09-13 14:30:55,0.0,0.0,0.0,0.0,0.0,0.0,206454,Craig McGuffie,2025-09-14 05:27:11
13495,742181,3,45870105,70,Oliver Shaw (Hamilton Academical) Goal at 43',Oliver Shaw Goal,1,2580,43',409,0,0,2025-09-13 14:43:26,0.0,0.0,0.0,0.0,0.0,0.0,223407,Oliver Shaw,2025-09-14 05:27:11
13495,742181,4,45871113,94,Stuart Mckinstry (Hamilton Academical) Yellow Card at 55',Stuart Mckinstry Yellow Card,2,3300,55',409,0,0,2025-09-13 15:11:44,0.0,0.0,0.0,0.0,0.0,0.0,284083,Stuart Mckinstry,2025-09-14 05:27:11
13495,742181,5,45871463,70,Cameron Smith (Peterhead) Goal at 62',Cameron Smith Goal,2,3720,62',416,0,0,2025-09-13 15:18:23,0.0,0.0,0.0,0.0,0.0,0.0,173126,Cameron Smith,2025-09-14 05:27:11
13495,742181,6,45871686,76,Jack Brown (Peterhead) Substitution at 66',Jack Brown Substitution,2,3960,66',416,0,0,2025-09-13 15:22:24,0.0,0.0,0.0,0.0,0.0,0.0,255732,Jack Brown,2025-09-14 05:27:11
13495,742181,7,45871687,76,David Wilson (Peterhead) Substitution at 66',David Wilson Substitution,2,3960,66',416,0,0,2025-09-13 15:22:55,0.0,0.0,0.0,0.0,0.0,0.0,259587,David Wilson,2025-09-14 05:27:11
13495,742181,6,45871686,76,Jack Brown (Peterhead) Substitution at 66',Jack Brown Substitution,2,3960,66',416,0,0,2025-09-13 15:22:24,0.0,0.0,0.0,0.0,0.0,0.0,239269,Andrew McCarthy,2025-09-14 05:27:11
13495,742181,7,45871687,76,David Wilson (Peterhead) Substitution at 66',David Wilson Substitution,2,3960,66',416,0,0,2025-09-13 15:22:55,0.0,0.0,0.0,0.0,0.0,0.0,376984,Adam Carnwath,2025-09-14 05:27:11
13495,742181,8,45871968,76,Niall McGinn (Peterhead) Substitution at 71',Niall McGinn Substitution,2,4260,71',416,0,0,2025-09-13 15:27:44,0.0,0.0,0.0,0.0,0.0,0.0,82925,Niall McGinn,2025-09-14 05:27:11
